prediction_covid_topic,title,description,authors,date_download,date_publish,maintext,url,gdelt_article_title,pred_input,model_accuracy,model_kappa,model_f1,model_precision,model_recall,model,sample_size,train_prop_covid,mtry,n_tree,min_node_size,splitrule,model_type,fitted_on,txt_used
1,EUA: Agência de Gestão de Emergências pediu 100 mil sacos para cadáveres,As estimativas mais negras indicam que podem morrer entre 100 mil a 200 mil pessoas nos Estados Unidos por causa da Covid-19.,Fábio Nunes,2020-04-02 20:42:03,2020-04-02 18:38:55,"A Federal Emergency Management Agency (FEMA) pediu 100 mil sacos para cadáveres ao Departamento de Defesa norte-americano, revelou o porta-voz do Pentágono, Michael Andrews. De acordo com a Associated Press, Andrews afirmou ainda que este pedido já está a ser tratado pela Defense Logistics Agency.
O Departamento de Defesa e a Defense Logistics Agency têm um acordo de longa data com a FEMA para fornecerem bens considerados essenciais durante operações de resposta a crises, como é o caso da atual pandemia de Covid-19.
Michael Andrews esclareceu que este pedido da FEMA reflete o planeamento prudente desta agência para responder a contingências em nome dos departamentos de saúde dos estados norte-americanos.
As previsões mais negras apontam para um número de vítimas mortais entre as 100 mil a as 200 mil nos Estados Unidos devido à Covid-19.
Até ao momento, o país regista mais de 216 mil casos de pessoas infetadas e mais de 5.100 mortes. Cerca de 8.700 pessoas recuperaram e tiveram alta hospitalar, segundo os dados do centro de pesquisa da Universidade Johns Hopkins.
Leia Também: AO MINUTO: Russos em casa até fim de abril. Açores fixam cerca sanitária
Recomendados para si",https://www.noticiasaominuto.com/mundo/1448646/eua-agencia-de-gestao-de-emergencias-pediu-100-mil-sacos-para-cadaveres,EUA : Agência de Gestão de Emergências pediu 100 mil sacos para cadáveres,"A Federal Emergency Management Agency (FEMA) pediu 100 mil sacos para cadáveres ao Departamento de Defesa norte-americano, revelou o porta-voz do Pentágono, Michael Andrews. De acordo com a Associated Press, Andrews afirmou ainda que este pedido já está a ser tratado pela Defense Logistics Agency.
O Departamento de Defesa e a Defense Logistics Agency têm um acordo de longa data com a FEMA para fornecerem bens considerados essenciais durante operações de resposta a crises, como é o caso da atual pandemia de Covid-19.
Michael Andrews esclareceu que este pedido da FEMA reflete o planeamento prudente desta agência para responder a contingências em nome dos departamentos de saúde dos estados norte-americanos.
As previsões mais negras apontam para um número de vítimas mortais entre as 100 mil a as 200 mil nos Estados Unidos devido à Covid-19.
Até ao momento, o país regista mais de 216 mil casos de pessoas infetadas e mais de 5.100 mortes. Cerca de 8.700 pessoas recuperaram e tiveram alta hospitalar, segundo os dados do centro de pesquisa da Universidade Johns Hopkins.
Leia Também: AO MINUTO: Russos em casa até fim de abril. Açores fixam cerca sanitária
Recomendados para si",0.946590909090909,0.8515594157125936,0.9650817236255572,0.9622222222222222,0.9679582712369598,"Random Forests
('ranger' package, R 3.5.3.)
Wright MN, Ziegler A (2017). “ranger: A Fast Implementation of Random Forests for High Dimensional Data in C++ and R.” Journal of Statistical Software, 77(1), 1–17. doi: 10.18637/jss.v077.i01.",4110,0.2374787052810903,202,500,20,gini,classification,2020-04-02,A Federal Emergency Management Agency FEMA pediu 100 mil sacos para cadáveres ao Departamento de Defesa norte-americano revelou o porta-voz do Pentágono Michael Andrews De acordo com a Associated Press Andrews afirmou ainda que este pedido já está a ser tratado pela Defense Logistics AgencyO Departamento de Defesa e a Defense Logistics Agency têm um acordo de longa data com a FEMA para fornecerem bens considerados essenciais durante operações de resposta a crises como é o caso da atual pandemia de Covid-19Michael Andrews esclareceu que este pedido da FEMA reflete o planeamento prudente desta agência para responder a contingências em nome dos departamentos de saúde dos estados norte-americanosAs previsões mais negras apontam para um número de vítimas mortais entre as 100 mil a as 200 mil nos Estados Unidos devido à Covid-19Até ao momento o país regista mais de 216 mil casos de pessoas infetadas e mais de 5100 mortes Cerca de 8700 pessoas recuperaram e tiveram alta hospitalar segundo os dados do centro de pesquisa da Universidade Johns HopkinsLeia Também AO MINUTO Russos em casa até fim de abril Açores fixam cerca sanitáriaRecomendados para si
