prediction_covid_topic,title,description,authors,date_download,pred_input,maintext,text,url,gdelt_article_title,date_publish,model_accuracy,model_kappa,model_f1,model_precision,model_recall,model,sample_size,train_prop_covid,mtry,n_tree,min_node_size,splitrule,model_type,fitted_on,txt_used
0,Bloco quer ouvir MAI sobre morte de imigrante no aeroporto,"“Os centros de instalação temporária dos aeroportos têm sido demasiadas vezes offshores de impunidade”, refere o grupo parlamentar bloquista no requerimento entregue esta terça-feira na Assembleia da República.",NA,2020-04-01 06:36:05,"Bloco quer ouvir MAI sobre morte de imigrante no aeroporto “Os centros de instalação temporária dos aeroportos têm sido demasiadas vezes offshores de impunidade”, refere o grupo parlamentar bloquista no requerimento entregue esta terça-feira na Assembleia da República.","“Os centros de instalação temporária dos aeroportos têm sido demasiadas vezes offshores de impunidade”, refere o grupo parlamentar bloquista no requerimento entregue esta terça-feira na Assembleia da República.

Três elementos do Serviço de Estrangeiros e Fronteiras (SEF) são suspeitos de homicídio no dia 12 de março nas instalações de um Centro de Instalação Temporária. Foto de MIGUEL PEREIRA DA SILVA, Lusa.

A morte de um cidadão ucraniano, no passado dia 12 de março, nas instalações do Centro de Instalação Temporária do Aeroporto de Lisboa, “vem lançar um justificado alarme público sobre as condições em que a mesma ocorreu”, avançam as deputadas e os deputados do Bloco.

De acordo com o que tem sido veiculado pelos media, a autópsia levada a cabo terá sido conclusiva quanto ao facto de o cidadão em causa ter sido alvo de agressões que levaram à asfixia e provocaram a sua morte. Para o Bloco de Esquerda, a detenção pela Polícia Judiciária de três inspetores em serviço naquele Centro, bem como a demissão do diretor e subdiretor de fronteiras de Lisboa do Serviço de Estrangeiros e Fronteiras, contribuem para o alarme já instalado.

“Situações anteriores demonstram que os centros de instalação temporária dos aeroportos têm sido demasiadas vezes offshores de impunidade”, refere o grupo parlamentar bloquista, vincando que “este caso, pelas condições de violência extrema relatadas e pelo alegado envolvimento criminoso de quadros do SEF, não pode ser expressão dessa impunidade”.

Neste contexto, o Bloco requereu a audição, com urgência, do Senhor Ministro da Administração Interna, sugerindo que a mesma se realize em regime de videoconferência.

Na sua página no facebook, a deputada bloquista Beatriz Gomes Dias considera de “enorme gravidade” a notícia da morte de um cidadão ucraniano, na sequência da qual foram detidos três inspetores do SEF.

Endereçando solidariedade e condolências à família, Beatriz Gomes Dias escreve que o caso “deve alarmar” toda a gente e aponta “a urgência de uma profunda e rigorosa investigação independente sobre a violência praticada pelas várias forças policiais em Portugal”.",NA,https://www.esquerda.net/artigo/bloco-quer-ouvir-mai-sobre-morte-de-imigrante-no-aeroporto/66715,Bloco quer ouvir MAI sobre morte de imigrante no aeroporto,NA,0.9843554443053817,0.9673482531519765,0.987012987012987,0.977366255144033,0.9968520461699895,"Random Forests
('ranger' package, R 3.5.3.)
Wright MN, Ziegler A (2017). “ranger: A Fast Implementation of Random Forests for High Dimensional Data in C++ and R.” Journal of Statistical Software, 77(1), 1–17. doi: 10.18637/jss.v077.i01.",3731,0.40345280540439105,25,500,25,gini,classification,2020-03-30,Bloco quer ouvir MAI sobre morte de imigrante no aeroporto Os centros de instalação temporária dos aeroportos têm sido demasiadas vezes offshores de impunidade refere o grupo parlamentar bloquista no requerimento entregue esta terça-feira na Assembleia da República
0,Ovar com 277 infetados e 13 mortos,O município está em estado de calamidade pública desde 17 de março. Os números foram anunciados pelo autarca Salvador Malheiro.,Global Media Group,2020-04-01 06:36:05,Ovar com 277 infetados e 13 mortos O município está em estado de calamidade pública desde 17 de março. Os números foram anunciados pelo autarca Salvador Malheiro.,"O Município de Ovar encontra-se cercado desde 17 de março © Global Imagens
Por Lusa 01 Abril, 2020 • 01:10 Partilhar este artigo Facebook
Facebook Twitter
Twitter WhatsApp
WhatsApp E-mail
E-mail Partilhar
O presidente da Câmara de Ovar, município que desde 17 de março está em estado de calamidade pública devido à covid-19, disse na terça-feira que a doença já provocou 277 infetados e 13 mortes entre os 55.400 habitantes.
Salvador Malheiro considera que estes são ""resultados animadores"", pois demonstram a eficácia do cerco sanitário em vigor desde 18 de março no concelho do distrito de Aveiro, que determinou o controlo de entradas e saídas no território e o encerramento de toda a atividade empresarial que não abranja bens de primeira necessidade.
""Apesar deste aumento dos infetados e óbitos, há que ter noção de que a nossa taxa de crescimento é claramente inferior à que se verifica em termos nacionais: se nós estivéssemos a evoluir ao ritmo de Portugal, hoje não teríamos 277 infetados e estaríamos, sim, com um valor na ordem dos 1.700"", explica o social-democrata.
Pela mesma ordem de ideias, os óbitos provocados em Ovar pelo novo coronavírus também não seriam apenas 13 e situar-se-iam antes ""na ordem dos 100"".
Salvador Malheiro atribui a diferença no ritmo de disseminação da doença não apenas às medidas de contenção de contágio implementadas no âmbito do cerco profilático local, mas também ao esforço que toda a população ""está a fazer por se manter em casa"", em isolamento voluntário.
Para que a situação se mantenha controlada, o autarca propõe-se continuar a apostar nos exames para rastreio do novo coronavírus, procedimento que, pelas suas contas, já envolveu ""mais de 850 testes"" realizados por iniciativa da câmara.
Quanto ao hospital de campanha instalado na Arena Dolce Vita, o autarca declarou que o espaço tem as suas questões logísticas ""quase resolvidas"" e no recinto só falta agora ""o corpo médico e de enfermeiros"", que espera ver disponibilizado pelo Governo ""nas próximas horas"".
A recomendação geral continua, no entanto, inalterada: é a de que os habitantes do concelho devem ""manter-se em casa e tentar reduzir completamente o contacto social, para, de uma vez por todas, Ovar poder sair desta crise, dar um exemplo ao país e começar a reerguer a sua economia"", referiu Salvador Malheiro.
O novo coronavírus, responsável pela pandemia da covid-19, já infetou mais de 828 mil pessoas em todo o mundo, das quais morreram mais de 41 mil. Dos casos de infeção, pelo menos 165 mil são considerados curados.
Depois de surgir na China, em dezembro, o surto espalhou-se por todo o mundo, o que levou a Organização Mundial da Saúde a declarar uma situação de pandemia.
Em Portugal, segundo o balanço feito na terça-feira pela Direção-Geral da Saúde, registaram-se 160 mortes, mais 20 do que na véspera (+14,3%), e 7.443 casos de infeções confirmadas, o que representa um aumento de 1.035 em relação a segunda-feira (+16,1%).
Portugal, onde os primeiros casos confirmados foram registados no dia 02 de março, encontra-se em estado de emergência desde as 00:00 de 19 de março e até às 23:59 de quinta-feira.",NA,https://www.tsf.pt/portugal/sociedade/ovar-com-277-infetados-e-13-mortos-12013757.html,Ovar com 277 infetados e 13 mortos,2020-04-01 03:10:00,0.9843554443053817,0.9673482531519765,0.987012987012987,0.977366255144033,0.9968520461699895,"Random Forests
('ranger' package, R 3.5.3.)
Wright MN, Ziegler A (2017). “ranger: A Fast Implementation of Random Forests for High Dimensional Data in C++ and R.” Journal of Statistical Software, 77(1), 1–17. doi: 10.18637/jss.v077.i01.",3731,0.40345280540439105,25,500,25,gini,classification,2020-03-30,Ovar com 277 infetados e 13 mortos O município está em estado de calamidade pública desde 17 de março Os números foram anunciados pelo autarca Salvador Malheiro
1,Os Liberais acordaram intervencionistas,"Com a pandemia do covid-19, os Liberais acordaram Intervencionistas. Em 2008 foi igual e o fim desse episódio não foi muito bom. O debate está lançado: o Estado tem de intervir? Sim. Mas onde e como?",NA,2020-04-01 06:36:07,"Os Liberais acordaram intervencionistas Com a pandemia do covid-19, os Liberais acordaram Intervencionistas. Em 2008 foi igual e o fim desse episódio não foi muito bom. O debate está lançado: o Estado tem de intervir? Sim. Mas onde e como?","Com a pandemia do covid-19, os Liberais acordaram Intervencionistas. Em 2008 foi igual e o fim desse episódio não foi muito bom. O debate está lançado: o Estado tem de intervir? Sim. Mas onde e como?

O Presidente da República Marcelo Rebelo de Sousa garantia, após reunião com o Infarmed, que “estamos todos juntos”. (Estamos?). O sentimento de união é grande, nestes tempos. A população entreajuda-se. O casal mais recente do prédio traz as compras ao vizinho, o filho fica em casa para proteger o pai e o avô e a hora de deitar passou para depois das salvas de palmas em agradecimento aos médicos. É a fotografia de um povo unido contra a Pandemia, em que a única coisa que deseja é a saúde e a vida. Assumiram a intervenção do Estado nesta crise como um objetivo comunitário. Na Política, também se vive uma aparente conversão dos liberais ao Intervencionismo do Estado na Economia.

Os campeões do mercado livre passaram, em menos de uma semana, a intervencionistas do Estado. A fotografia é idêntica à da crise de 2008. As oposições de Direita acusam agora os Governos de não atuar com mais rapidez e até importam alguns exemplos de medidas, tais como: nacionalizações, controlo dos preços dos bens essenciais, requisição civil de privados para os obrigar a participar na emergência social que vivemos. O Ministro da Saúde Irlandês vai nacionalizar os Hospitais Privados. Em França, estudam-se medidas para nacionalizar empresas estratégicas. Um pouco por toda a Europa, acionou-se a requisição civil de serviços privados de saúde. Colocaram-se empresas a produzir consoante as necessidades da população no combate ao surto de covid-19. Algumas destas economias, tantas vezes enunciadas como exemplo pelos liberais, parecem tornar-se um verdadeiro pesadelo para o dogma da iniciativa privada.

Para os mais distraídos, parece existir um consenso sobre o papel do Estado, agora. Mas querem o Estado a garantir exatamente o quê?

Após a quarentena, vem aí a receita da austeridade – os mesmos de sempre a pagar a crise. E, nessa altura, quando nos propuserem a receita, lembrem-se que há cadeias de supermercados e vender 200ml de álcool por 23€, Hospitais privados que recusam tratar doentes com covid-19, patrões que aproveitaram o momento para despedir em massa, laboratórios privados e especular sobre os custos de testes.

A título de exemplo, olhemos para o caso do Hospital SAMS (Lisboa). Enquanto o SNS e os seus profissionais exploravam todas as soluções para dar resposta aos doentes, esta unidade de saúde privada fechava portas e despedia pessoas, dias depois de ter sabido que contava com profissionais infetados sem os proteger. Ou o caso de várias urgências da CUF, que encerraram para não receber doentes com covid-19. Hospital dos Lusíadas cobrou 476 euros a um paciente. por material de proteção. Estão todos, ao mesmo tempo, durante o pico da pandemia em Portugal, a pedir ao Estado pagamento de dívidas. Sem esquecer a UNILABS que, num gole de marketing, avançou com centros de teste ao covid-19 e agora está a cobrar 100€ por teste ao Estado. Não perderei muito tempo com a anedota da Padaria Portuguesa, que alega não ter liquidez para pagar dois meses de salários mas prevê uma receita de 65 milhões de euros entre 2020 e 2022.

Todos os privados querem, agora, que o Estado pague os salários dos seus trabalhadores, injete dinheiro diretamente nas empresas sem contrapartidas e sirva como alavanca para a economia continuar a funcionar. Pires de Lima, ex-Ministro da Economia do Governo de Passos Coelho, veio até defender que as empresas recebessem dinheiro do Estado sem qualquer tipo de contrapartida, sugerindo que pudessem despedir e, ao mesmo tempo, ser premiadas pelo Governo por tal feito. Outros já defendem menos dias de férias e autorização para os patrões gerirem as interrupções dos seus empregados.

A História repete-se. Primeiro como tragédia, depois como farsa. Para evitar outro desastre, aprendamos com a crise de 2008, onde os neoliberais da praça também pediram a intervenção divina do Estado na economia. Ainda hoje estamos a pagar a fatura dessa política. A banca privada, que foi resgatada com dinheiro de todos os contribuintes para pagar os seus desvarios, está a cobrar taxas de juro nos empréstimos com financiamento que recebeu do Banco Central Europeu a juros negativos. O negócio não para, mesmo quando a emergência é de cariz sanitário e público.

Nesta altura, não vai ser só necessário ter o Estado a “pagar”, como parecem todos os agentes políticos defender. É preciso decidir onde e como. São os trabalhadores, os precários, quem vive do seu salário que mais precisa. O banco de Portugal estima que o desemprego atinja os 10% já este ano. Queremos mesmo derreter os nossos recursos em empresas que apresentam milhões de lucros por ano? E estamos dispostos a dar um presente à banca, admitindo o circo já montado em torno das taxas de juro? Não será mais lógico apoiar as pequenas empresas, salvar o emprego, reforçar o investimento nos serviços públicos – com o SNS à cabeça, criando robustez numa economia menos dependente da iniciativa privada e mais alicerçada numa visão coletiva das necessidades reais da nossa população? É preciso o Estado intervir eu arriscaria apontar-lhe um plano: Redistribuição da Riqueza.

Artigo publicado em Comunidade Cultura e Arte a 28 de março de 2020",NA,https://www.esquerda.net/opiniao/os-liberais-acordaram-intervencionistas/66665,Os Liberais acordaram intervencionistas,NA,0.9843554443053817,0.9673482531519765,0.987012987012987,0.977366255144033,0.9968520461699895,"Random Forests
('ranger' package, R 3.5.3.)
Wright MN, Ziegler A (2017). “ranger: A Fast Implementation of Random Forests for High Dimensional Data in C++ and R.” Journal of Statistical Software, 77(1), 1–17. doi: 10.18637/jss.v077.i01.",3731,0.40345280540439105,25,500,25,gini,classification,2020-03-30,Os Liberais acordaram intervencionistas Com a pandemia do covid-19 os Liberais acordaram Intervencionistas Em 2008 foi igual e o fim desse episódio não foi muito bom O debate está lançado o Estado tem de intervir Sim Mas onde e como
0,"Corinthians recorda Golpe Militar no Brasil: ""Estaremos na luta pela democracia no Brasil""","O clube de São Paulo utilizou uma fotografia para recordar a ""Democracia Corinthiana"",",Global Media Group,2020-04-01 06:36:07,"Corinthians recorda Golpe Militar no Brasil: ""Estaremos na luta pela democracia no Brasil"" O clube de São Paulo utilizou uma fotografia para recordar a ""Democracia Corinthiana"",","O clube de São Paulo utilizou uma fotografia para recordar a ""Democracia Corinthiana"",
No mesmo dia em que se assinala o Golpe Miltar no Brasil, a 31 de março de 1964. o Corinthians partilhou no Twitter mais um momento em defesa da democracia naquele país da América do Sul
O clube de São Paulo utilizou uma fotografia para recordar a ""Democracia Corinthiana"", movimento que apoiou as Diretas Já, e escreveu a seguinte mensagem:
""Está na nossa história, é o nosso DNA. O Corinthians é o Time do Povo, e é o povo que construiu o time! Sempre estivemos, estamos e estaremos na luta pela manutenção da democracia no Brasil!""",NA,https://www.ojogo.pt/internacional/noticias/corinthians-recorde-golpe-militar-no-brasil-estaremos-na-luta-pela-da-democracia-no-brasil-12013588.html,Corinthians recorda Golpe Militar no Brasil : ″ Estaremos na luta pela democracia no Brasil ″ ,2020-04-01 01:01:00,0.9843554443053817,0.9673482531519765,0.987012987012987,0.977366255144033,0.9968520461699895,"Random Forests
('ranger' package, R 3.5.3.)
Wright MN, Ziegler A (2017). “ranger: A Fast Implementation of Random Forests for High Dimensional Data in C++ and R.” Journal of Statistical Software, 77(1), 1–17. doi: 10.18637/jss.v077.i01.",3731,0.40345280540439105,25,500,25,gini,classification,2020-03-30,Corinthians recorda Golpe Militar no Brasil Estaremos na luta pela democracia no Brasil O clube de São Paulo utilizou uma fotografia para recordar a Democracia Corinthiana
1,Brasil ultrapassa os 200 mortos e regista 5.717 infetados,"Segundo o executivo brasileiro, liderado pelo Presidente Jair Bolsonaro, a taxa de mortalidade da covid-19 no Brasil é agora de cerca de 3,5%.",Global Media Group,2020-04-01 06:36:08,"Brasil ultrapassa os 200 mortos e regista 5.717 infetados Segundo o executivo brasileiro, liderado pelo Presidente Jair Bolsonaro, a taxa de mortalidade da covid-19 no Brasil é agora de cerca de 3,5%.","Segundo o executivo brasileiro, liderado pelo Presidente Jair Bolsonaro, a taxa de mortalidade da covid-19 no Brasil é agora de cerca de 3,5%.
O Brasil ultrapassou a barreira dos 200 mortos pelo novo coronavírus, tendo registado até ao momento 201 óbitos e 5.717 infetados, anunciou o Governo brasileiro, acrescentando que foram confirmados 1.138 casos positivos nas últimas 24 horas.
Foi batido um novo recorde no número de casos diagnosticados em apenas um dia (1.138), desde o início da pandemia no Brasil, que até agora tinha sido de 502 infetados em 24 horas.
Segundo o executivo brasileiro, liderado pelo Presidente Jair Bolsonaro, a taxa de mortalidade da covid-19 no Brasil é agora de cerca de 3,5%.
De acordo com os dados hoje divulgados pelo Ministério da Saúde, aumentou para 18 o número de unidades federativas do Brasil a registarem óbitos devido ao novo coronavírus: Amazonas, Alagoas, Bahia, Ceará, Pernambuco, Piauí, São Paulo, Rio de Janeiro, Distrito Federal, Minas Gerais, Goiás, Paraná, Mato Grosso do Sul, Rondônia, Maranhão, Santa Catarina, Rio Grande do Norte e Rio Grande do Sul.
Assim, todas as regiões do Brasil têm mortes confirmadas pela covid-19.
São Paulo continua a ser o estado brasileiro mais afetado, totalizando 136 mortos e tendo ultrapassado hoje os dois mil infetados, registando 2.339 casos confirmados.
Segue-se o Rio de Janeiro com 23 óbitos e 708 infetados e o Ceará que, até ao momento, contabilizou sete vítimas mortais e 390 casos positivos da covid-19.
Numa conferência de imprensa interministerial, feita na tarde de hoje, o ministro da Economia brasileiro, Paulo Guedes, informou que as medidas tomadas pelo executivo para reduzir o impacto da crise do novo coronavírus já equivalem a 2,6% do Produto Interno Bruto (PIB).
""Nós já chegámos a 2,6% do PIB neste 'orçamento de guerra', que eu chamo de medidas de emergência. Já tínhamos um défice estrutural de 2,6% e estamos em 5,2% global. Vamos continuar a subir, porque a instrução do Presidente foi clara: não vai ficar nenhum brasileiro para trás"", afirmou o ministro.
O Congresso brasileiro aprovou um subsídio mensal oferecido a trabalhadores independentes e informais - sem contrato de trabalho - atingidos pela crise do novo coronavírus, no valor de 600 reais (104 euros). Contudo, até ao momento, Jair Bolsonaro ainda não sancionou o projeto de lei, que precisa da sua aprovação para entrar em vigor.
Segundo Paulo Guedes, que assegurou que a aprovação ocorrerá a qualquer momento, o auxílio de 600 reais cedidos pelo Brasil é equivalente aos 1.200 dólares (1.087 euros) concedidos pelo Governo norte-americano.
""Estamos a gastar bem mais do que qualquer país da América Latina. Do ponto de vista do apoio que estamos a dar, com essa renda básica de 600 reais, comparada aos nossos rendimentos ""per capita"" é igual à ajuda que os americanos estão a dar, de 1.200 dólares"", disse o governante.
Na mesma conferência de imprensa, o ministro da Justiça, Sergio Moro, defendeu o isolamento de presos como medida de prevenção da pandemia do novo coronavírus.
""Há um ambiente de relativa segurança para o sistema prisional em relação ao coronavírus pela própria condição dos presos de estarem isolados da sociedade"", afirmou Moro.
Em relação à possível libertação de presos que fazem parte de grupos de risco e em regime semiaberto - que lhes permite trabalhar durante o dia e os obriga a dormir na prisão -, Sergio Moro afirmou que essa opção deve ser ""ponderada"", acrescentando ser necessário ""ter cuidado é com a libertação de prisioneiros que possam oferecer risco à população, como o crime organizado"".
O sistema penitenciário brasileiro, considerado um dos piores do mundo, tem um défice de cerca de 350.000 vagas, o que há anos agrava a superlotação nas prisões.
O novo coronavírus, responsável pela pandemia da covid-19, já infetou mais de 828 mil pessoas em todo o mundo, das quais morreram mais de 41 mil.",NA,https://www.ojogo.pt/covid-19/brasil-ultrapassa-os-200-mortos-e-regista-5717-infetados-12013589.html,Brasil ultrapassa os 200 mortos e regista 5 . 717 infetados,2020-04-01 01:10:00,0.9843554443053817,0.9673482531519765,0.987012987012987,0.977366255144033,0.9968520461699895,"Random Forests
('ranger' package, R 3.5.3.)
Wright MN, Ziegler A (2017). “ranger: A Fast Implementation of Random Forests for High Dimensional Data in C++ and R.” Journal of Statistical Software, 77(1), 1–17. doi: 10.18637/jss.v077.i01.",3731,0.40345280540439105,25,500,25,gini,classification,2020-03-30,Brasil ultrapassa os 200 mortos e regista 5717 infetados Segundo o executivo brasileiro liderado pelo Presidente Jair Bolsonaro a taxa de mortalidade da covid-19 no Brasil é agora de cerca de 35
