prediction_covid_topic,title,description,authors,date_download,date_publish,maintext,url,gdelt_article_title,pred_input,model_accuracy,model_kappa,model_f1,model_precision,model_recall,model,sample_size,train_prop_covid,mtry,n_tree,min_node_size,splitrule,model_type,fitted_on,txt_used
1,Novo recorde: Estados Unidos regista mais de mil mortos no último dia,Número de óbitos em solo norte-americano já suplanta a barreira dos cinco mil.,Notícias Ao Minuto,2020-04-02 20:42:20,2020-04-02 18:33:10,"Mais de mil pessoas morreram nas últimas 24 horas nos Estados Unidos da América por causa do surto do novo coronavírus, segundo avança a USA Today, o que a confirmar-se irá corresponder a uma cifra recorde de mortes em apenas um dia (a anterior marca pertencia a Itália, com 969 óbitos contabilizados a 27 de março).
A cifra de 1.040 vítimas mortais faz com que agora a barreira de óbitos neste país suplante a barreira dos cinco mil (5.137), colocando os Estados Unidos na terceira posição no que diz respeito a este parâmetro, apenas superado por Itália (13.155) e Espanha (10.003).
Outro dado relevante são o número de mortos que Nova Iorque contabilizou nas últimas 24 horas - 505 - quase o dobro da cifra total, o que torna este estado no epicentro do novo coronavírus.
Também de acordo com a USA Today estão até ao momento contabilizados 216.722 casos positivos de Covid-19, quase o dobro de Itália (110.574) e Espanha (110.238).
Leia Também: Trump lança operação antidroga no Pacífico e Mar do Caribe
Recomendados para si",https://www.noticiasaominuto.com/mundo/1448669/novo-recorde-estados-unidos-regista-mais-de-mil-mortos-no-ultimo-dia,Novo recorde : Estados Unidos regista mais de mil mortos no último dia,"Mais de mil pessoas morreram nas últimas 24 horas nos Estados Unidos da América por causa do surto do novo coronavírus, segundo avança a USA Today, o que a confirmar-se irá corresponder a uma cifra recorde de mortes em apenas um dia (a anterior marca pertencia a Itália, com 969 óbitos contabilizados a 27 de março).
A cifra de 1.040 vítimas mortais faz com que agora a barreira de óbitos neste país suplante a barreira dos cinco mil (5.137), colocando os Estados Unidos na terceira posição no que diz respeito a este parâmetro, apenas superado por Itália (13.155) e Espanha (10.003).
Outro dado relevante são o número de mortos que Nova Iorque contabilizou nas últimas 24 horas - 505 - quase o dobro da cifra total, o que torna este estado no epicentro do novo coronavírus.
Também de acordo com a USA Today estão até ao momento contabilizados 216.722 casos positivos de Covid-19, quase o dobro de Itália (110.574) e Espanha (110.238).
Leia Também: Trump lança operação antidroga no Pacífico e Mar do Caribe
Recomendados para si",0.946590909090909,0.8515594157125936,0.9650817236255572,0.9622222222222222,0.9679582712369598,"Random Forests
('ranger' package, R 3.5.3.)
Wright MN, Ziegler A (2017). “ranger: A Fast Implementation of Random Forests for High Dimensional Data in C++ and R.” Journal of Statistical Software, 77(1), 1–17. doi: 10.18637/jss.v077.i01.",4110,0.2374787052810903,202,500,20,gini,classification,2020-04-02,Mais de mil pessoas morreram nas últimas 24 horas nos Estados Unidos da América por causa do surto do novo coronavírus segundo avança a USA Today o que a confirmar-se irá corresponder a uma cifra recorde de mortes em apenas um dia a anterior marca pertencia a Itália com 969 óbitos contabilizados a 27 de marçoA cifra de 1040 vítimas mortais faz com que agora a barreira de óbitos neste país suplante a barreira dos cinco mil 5137 colocando os Estados Unidos na terceira posição no que diz respeito a este parâmetro apenas superado por Itália 13155 e Espanha 10003Outro dado relevante são o número de mortos que Nova Iorque contabilizou nas últimas 24 horas - 505 - quase o dobro da cifra total o que torna este estado no epicentro do novo coronavírusTambém de acordo com a USA Today estão até ao momento contabilizados 216722 casos positivos de Covid-19 quase o dobro de Itália 110574 e Espanha 110238Leia Também Trump lança operação antidroga no Pacífico e Mar do CaribeRecomendados para si
