prediction_covid_topic,title,description,authors,date_download,date_publish,pred_input,maintext,url,gdelt_article_title,model_accuracy,model_kappa,model_f1,model_precision,model_recall,model,sample_size,train_prop_covid,mtry,n_tree,min_node_size,splitrule,model_type,fitted_on,txt_used
1,Mais 130 novos casos assintomáticos na China,"A Comissão Nacional de Saúde da China anunciou, esta quarta-feira, que identificou mais 130 portadores assintomáticos do novo coronavírus.",Global Media Group,2020-04-01 13:30:16,2020-04-01 10:40:00,"Mais 130 novos casos assintomáticos na China A Comissão Nacional de Saúde da China anunciou, esta quarta-feira, que identificou mais 130 portadores assintomáticos do novo coronavírus.","JN/Agências Hoje às 08:40, atualizado às 08:44 Facebook
Twitter
Partilhar
A Comissão Nacional de Saúde da China anunciou, esta quarta-feira, que identificou mais 130 portadores assintomáticos do novo coronavírus.
A China - que registou 36 novos casos sintomáticos e sete mortes nas últimas 24 horas - passou hoje, pela primeira vez, a contabilizar também os casos assintomáticos na contagem oficial. Ainda que a proporção de pessoas que contraíram o vírus, mas permanecem sem sintomas, seja atualmente desconhecida, os cientistas dizem que esses portadores ainda podem transmitir a doença.
Na terça-feira, a Comissão Nacional de Saúde tinha informado na terça-feira que, de um total de mais de 1500 casos assintomáticos que estavam a ser isolados e monitorizados, 205 tinham vindo do exterior. Com o surto na China a diminuir significativamente, alguns especialistas questionam se a dificuldade em identificar casos assintomáticos pode levar ao ressurgimento de infeções.
A China, onde o vírus foi detetado pela primeira vez em dezembro, registou até agora mais de 81 mil casos e 3312 mortes desde o início do surto. O SARS-Cov2 já infetou mais de 850 mil pessoas em todo o mundo, das quais morreram mais de 42 mil. Dos casos de infeção, pelo menos mais de 170 mil são considerados curados.",https://www.jn.pt/mundo/mais-130-novos-casos-assintomaticos-na-china-12014251.html,Mais 130 novos casos assintomáticos na China,0.9843554443053817,0.9673482531519765,0.987012987012987,0.977366255144033,0.9968520461699895,"Random Forests
('ranger' package, R 3.5.3.)
Wright MN, Ziegler A (2017). “ranger: A Fast Implementation of Random Forests for High Dimensional Data in C++ and R.” Journal of Statistical Software, 77(1), 1–17. doi: 10.18637/jss.v077.i01.",3731,0.40345280540439105,25,500,25,gini,classification,2020-03-30,Mais 130 novos casos assintomáticos na China A Comissão Nacional de Saúde da China anunciou esta quarta-feira que identificou mais 130 portadores assintomáticos do novo coronavírus
1,Samsung fez um 'leak' acidental de um ecrã infinito!? Será o Note 20?,"Caso a Samsung continue com a sua estratégia de lançamentos dos últimos anos, e claro, o COVID-19 não estrague os planos... O Galaxy Note 20",Nuno Miguel Oliveira,2020-04-01 13:30:17,2020-04-01 11:06:51,"Samsung fez um 'leak' acidental de um ecrã infinito!? Será o Note 20? Caso a Samsung continue com a sua estratégia de lançamentos dos últimos anos, e claro, o COVID-19 não estrague os planos... O Galaxy Note 20","Caso a Samsung continue com a sua estratégia de lançamentos dos últimos anos, e claro, o COVID-19 não estrague os planos… O Galaxy Note 20 deverá ser lançado no próximo mês de Agosto. Contudo, não pense que o medo da Samsung é a falta de hardware pronto a lançar, o problema poderá mesmo ser o poder de comprar dos consumidores! Mas isso é um problema para se analisar mais tarde.
É que pelos vistos, é possível que a Samsung já tenha feito um ‘tease’ ao seu Note 20, um smartphone que poderá finalmente matar umas das características mais odiadas do mundo dos smartphones… O facto da câmera frontal ficar visível numa ‘notch’, ‘orifício’, ou o que quer que seja.
Samsung fez um ‘leak’ acidental de um ecrã infinito!? Será o Note 20?
Portanto, num anúncio ao novo ‘Wind-Free Air Conditioner’, que na verdade não fazemos ideia do que significa, a Samsung mostrou o seu novo Ar Condicionado a ser controlado por um smartphone através do bem conhecido SmartThings. Contudo, em vez de vermos o recente Galaxy S20 ou mais antigo Note 10… Temos um smartphone sem qualquer ‘notch’ ou orifício no ecrã. É um telemóvel com um ecrã infinito real! Ora veja (0:55):
Primeiramente, temos de supor que o aparelho no vídeo não é real, que é apenas uma edição da equipa gráfica para mostrar um futuro patrocinado pela Samsung. No entanto, não faz muito sentido gastar dinheiro numa nova campanha e não aproveitar para meter um dos smartphones atuais da marca.
Ou seja, fica uma leve sensação que tivemos aqui um ‘tease’ bastante sorrateiro daquilo que a fabricante pode estar a preparar para o Verão. Ao fim ao cabo, a própria Samsung confirmou em 2019 que está realmente a trabalhar em ecrãs capazes de esconder a câmera frontal. Por isso, não seria assim tão impressionante quanto isso, ver um Note 20+ ou Note 20 Ultra com este aspeto nas prateleiras dentro de alguns meses.
Ademais, o que pensa sobre tudo isto? Partilhe connosco a sua opinião nos comentários em baixo.
Fonte
Desde muito novo que me interessei por computadores e tecnologia no geral, tive o meu primeiro computador aos 10 anos e aos 15 anos montei a minha primeira torre, desde aí nunca mais parei. Tudo o que seja tecnologia, estou na fila da frente para saber mais.
Ou veja mais notícias de Android Acompanhe ao minuto as últimas noticias de tecnologia . Siga-nos no Facebook Instagram ! Quer falar connosco? Envie um email para geral@leak.pt",https://www.leak.pt/samsung-fez-um-leak-acidental-de-um-ecra-infinito-sera-o-note-20/,Samsung fez um  leak  acidental de um ecrã infinito !? Será o Note 20 ? ,0.9843554443053817,0.9673482531519765,0.987012987012987,0.977366255144033,0.9968520461699895,"Random Forests
('ranger' package, R 3.5.3.)
Wright MN, Ziegler A (2017). “ranger: A Fast Implementation of Random Forests for High Dimensional Data in C++ and R.” Journal of Statistical Software, 77(1), 1–17. doi: 10.18637/jss.v077.i01.",3731,0.40345280540439105,25,500,25,gini,classification,2020-03-30,Samsung fez um leak acidental de um ecrã infinito Será o Note 20 Caso a Samsung continue com a sua estratégia de lançamentos dos últimos anos e claro o COVID-19 não estrague os planos O Galaxy Note 20
1,Burlões levam dinheiro de idosos e prometem vacina contra a Covid-19,Falsos médicos percorrem aldeias e há quem prometa vacina milagrosa.,Global Media Group,2020-04-01 13:30:28,2020-04-01 09:39:00,Burlões levam dinheiro de idosos e prometem vacina contra a Covid-19 Falsos médicos percorrem aldeias e há quem prometa vacina milagrosa.,"Roberto Bessa Moreira Hoje às 07:39 Facebook
Twitter
Partilhar
Falsos médicos percorrem aldeias e há quem prometa vacina milagrosa.
Dois homens, na casa dos 60 anos, chegaram ao concelho de Santarém com batas brancas vestidas, dizendo que eram médicos. Numa das casas que abordaram, o casal residente, ele com 90 anos e ela com 68, acreditou na ladainha de que, por causa da pandemia da Covid-19, todas as notas tinham de ser substituídas. E entregaram cerca de cinco mil euros aos ""senhores doutores"" que, logo que se viram na posse do dinheiro, fugiram sem deixar rasto.
A burla ocorreu no final da semana passada e foi apenas mais um dos crimes que têm sido cometidos a pretexto do novo coronavírus. Também na semana passada, outro falso médico foi detido pela GNR em Ruivães, Vieira do Minho. Com 39 anos, o burlão andava pelas ruas desta localidade a tentar vender exames para diagnóstico da Covid-19.
A Polícia Judiciária lembra que ""os contextos de crise de proporções internacionais são, tradicionalmente, explorados"" para campanhas criminosas levadas a cabo por burlões, acrescentando que ""a atual pandemia associada à propagação do vírus da Covid-19 não tem sido exceção"". E dá um exemplo: ""SMS [mensagens escritas de telemóvel] enviados informando que, de acordo com a lei, estão a ser aplicadas medidas extraordinárias para o combate à Covid-19 e que todos os cidadãos nacionais serão vacinados, sendo garantido um reembolso dos custos pelo Governo. Para tal, bastaria pagar uma determinada quantia indicada no SMS e através do registo no link enviado seriam posteriormente ressarcidos"". Tudo inventado, como é óbvio.
Avisos institucionais
Ao JN, a GNR refere que o número de queixas tem sido diminuto, mas alerta ""para este tipo de fenómeno, sobretudo [entre] os idosos que vivem em zonas isoladas, pois são o principal alvo deste tipo de burla, com o objetivo de furtar ou roubar as poupanças de uma vida"".
Já a PSP garante que não registou qualquer queixa. ""Ainda assim, tanto no que diz respeito à falta de informação que detetámos junto de alguns segmentos da população, como à prevenção e alerta sobre burlas e fraudes, a PSP tem recorrido às redes sociais para fazer chegar essas mensagens a todos"", frisa fonte oficial.
Apesar do reduzido número de denúncias às autoridades, sucedem-se os alertas de diferentes instituições. A Câmara de Caminha, por exemplo, evidenciou a existência de ""irregularidades"" no concelho e avisou os munícipes que ""não está a coordenar, nem a acompanhar nenhuma campanha de recolha de alimentos, nem de angariação de fundos"".
""Qualquer ação deste tipo é estranha à Câmara Municipal, podendo tratar-se de um gesto individual meritório ou configurar uma burla"", sublinha a autarquia.
Em Santarém, foi o hospital local que alertou para a circulação de, ""pelo menos, um email falso com pedido de alimentos e equipamentos para os funcionários"".",https://www.jn.pt/justica/policias-em-alerta-com-burlas-e-ataques-informaticos-12013901.html,Burlões levam dinheiro de idosos e prometem vacina contra a Covid - 19,0.9843554443053817,0.9673482531519765,0.987012987012987,0.977366255144033,0.9968520461699895,"Random Forests
('ranger' package, R 3.5.3.)
Wright MN, Ziegler A (2017). “ranger: A Fast Implementation of Random Forests for High Dimensional Data in C++ and R.” Journal of Statistical Software, 77(1), 1–17. doi: 10.18637/jss.v077.i01.",3731,0.40345280540439105,25,500,25,gini,classification,2020-03-30,Burlões levam dinheiro de idosos e prometem vacina contra a Covid-19 Falsos médicos percorrem aldeias e há quem prometa vacina milagrosa
1,"Trump avisa que próximas duas semanas serão ""muito dolorosas"" nos EUA","O Presidente dos EUA, Donald Trump, alertou hoje que as próximas duas semanas serão ""muito dolorosas"" para a população, uma vez que o número de pessoas contagiadas pela doença provocada pelo SARS-CoV-2 continua a aumentar.",Global Media Group,2020-04-01 13:30:43,2020-04-01 11:06:00,"Trump avisa que próximas duas semanas serão ""muito dolorosas"" nos EUA O Presidente dos EUA, Donald Trump, alertou hoje que as próximas duas semanas serão ""muito dolorosas"" para a população, uma vez que o número de pessoas contagiadas pela doença provocada pelo SARS-CoV-2 continua a aumentar.","Trump antecipa duas semanas ""muito dolorosas"" no combate à pandemia de covid-19 nos EUA
EUA já são o país com mais casos de coronavírus em todo o mundo
Pandemia covid-19 é ""a pior crise"" desde a Segunda Guerra Mundial, diz Guterres
Presidentes da China e dos EUA prometem união no combate ao coronavírus
A anúncio foi feito durante uma conferência de imprensa na Casa Branca, em Washington (capital dos EUA), onde o chefe de Estado norte-americano acrescentou que as últimas duas semanas também foram ""muito difíceis"", citado pela agência France-Presse.
Os Estados Unidos já ultrapassaram as 3.000 mortes devido à doença covid-19.
O SARS-CoV-2, responsável pela pandemia da covid-19, já infetou mais de 828 mil pessoas em todo o mundo, das quais morreram mais de 41 mil.
Fechar Subscreva as newsletters Diário de Notícias e receba as informações em primeira mão. Subscrever
Dos casos de infeção, pelo menos 165 mil são considerados curados.
Depois de surgir na China, em dezembro, o surto espalhou-se por todo o mundo, o que levou a Organização Mundial da Saúde a declarar uma situação de pandemia.",https://www.dn.pt/mundo/trump-avisa-que-proximas-duas-semanas-serao-muito-dolorosas-nos-eua-12013606.html,Trump avisa que próximas duas semanas serão ″ muito dolorosas ″ nos EUA,0.9843554443053817,0.9673482531519765,0.987012987012987,0.977366255144033,0.9968520461699895,"Random Forests
('ranger' package, R 3.5.3.)
Wright MN, Ziegler A (2017). “ranger: A Fast Implementation of Random Forests for High Dimensional Data in C++ and R.” Journal of Statistical Software, 77(1), 1–17. doi: 10.18637/jss.v077.i01.",3731,0.40345280540439105,25,500,25,gini,classification,2020-03-30,Trump avisa que próximas duas semanas serão muito dolorosas nos EUA O Presidente dos EUA Donald Trump alertou hoje que as próximas duas semanas serão muito dolorosas para a população uma vez que o número de pessoas contagiadas pela doença provocada pelo SARS-CoV-2 continua a aumentar
1,Covid-19: Como limpar as superfícies durante a pandemia? DGS ajuda-o,Saiba como limpar corretamente as superfícies de modo a manter-se seguro face ao novo coronavírus.,Notícias Ao Minuto,2020-04-01 13:31:34,2020-04-01 10:00:11,Covid-19: Como limpar as superfícies durante a pandemia? DGS ajuda-o Saiba como limpar corretamente as superfícies de modo a manter-se seguro face ao novo coronavírus.,"A Direção-Geral da Saúde (DGS) partilhou um vídeo em que explica o modo como devemos limpar as superfícies durante a pandemia da Covid-19. Em causa está manter a sua casa ou prédio limpos e, consequentemente, ficar mais protegido.
Nas imagens é explicado que quando tossimos ou espirramos há gotículas que se libertam e depositam nas superfícies. Por isso, prosseguem, ""deve limpá-las ou desinfetá-las com a maior frequência possível"".
E há locais a que deve dar maior importância: Corrimãos, maçanetas, interruptores e botões de elevadores. Antes de limpar, deve ""lavar as mãos, colocar luvas e roupa protetora"", é sublinhado.
Passe pela superfície ""água e detergente"", seguido de água com lixívia"". E a DGS deixa um 'truque' sobre como fazer a mistura - para quatro litros de água, junte cinco colheres de sopa de lixívia.
Depois, ""deixe atuar durante dez minutos, enxague com água quente e deixe secar"". Tire as luvas e lave as mãos novamente.
Veja, na galeria acima, o vídeo com todas as indicações sobre limpeza de superfícies e locais da sua casa para evitar a contaminação por Covid-19.
Leia Também: Dúvidas sobre a Covid-19? Site da DGS ajuda a esclarecer
Recomendados para si",https://www.noticiasaominuto.com/pais/1447207/covid-19-como-limpar-as-superficies-durante-a-pandemia-dgs-ajuda-o,Covid - 19 : Como limpar as superfícies durante a pandemia ? DGS ajuda - o,0.9843554443053817,0.9673482531519765,0.987012987012987,0.977366255144033,0.9968520461699895,"Random Forests
('ranger' package, R 3.5.3.)
Wright MN, Ziegler A (2017). “ranger: A Fast Implementation of Random Forests for High Dimensional Data in C++ and R.” Journal of Statistical Software, 77(1), 1–17. doi: 10.18637/jss.v077.i01.",3731,0.40345280540439105,25,500,25,gini,classification,2020-03-30,Covid-19 Como limpar as superfícies durante a pandemia DGS ajuda-o Saiba como limpar corretamente as superfícies de modo a manter-se seguro face ao novo coronavírus
1,Combate à pandemia já terá evitado cerca de 59 mil mortes em 11 países,"Estudo levado a cabo pelo Imperial College London analisou as medidas adotadas por Áustria, Bélgica, Dinamarca, França, Alemanha, Itália, Noruega, Espanha, Suécia, Suíça e Reino Unido.",Notícias Ao Minuto,2020-04-01 13:31:42,2020-04-01 11:00:14,"Combate à pandemia já terá evitado cerca de 59 mil mortes em 11 países Estudo levado a cabo pelo Imperial College London analisou as medidas adotadas por Áustria, Bélgica, Dinamarca, França, Alemanha, Itália, Noruega, Espanha, Suécia, Suíça e Reino Unido.","O Imperial College London publicou, esta semana, um novo estudo no qual conclui que as medidas colocadas em prática no combate à pandemia do novo coronavírus já terão evitado cerca de 59 mil mortes num total de 11 países europeus.
A instituição teve em conta os casos registados em Áustria, Bélgica, Dinamarca, França, Alemanha, Itália, Noruega, Espanha, Suécia, Suíça e Reino Unido desde que o 'lockdown' foi decretado até esta terça-feira, 31 de março.
""Estimamos que as intervenções impostas em todos os 11 países terão evitado 59 mil mortes até 31 de março"", pode ler-se no documento, que acrescenta, com ""um intervalo credível de 95%"", que o número exato se situará entre as 21 mil e as 120 mil vidas salvas neste período de tempo.
Seguindo o mesmo modelo, o estudo aponta para que, nestes países, ""entre sete a 43 milhões de indivíduos tenham sido infetados com SARS-CoV-2 até 28 de março, representando entre 1,88% e 11,43% da população"".
""A proporção da população infetada até à data - a taxa de ataque - é estimada que tenha sido mais elevada em Espanha, seguida de Itália, e mais reduzida na Alemanha e na Noruegua, refletindo as etapas relativas das epidemias"", acrescenta.
Leia Também: ""Impõe-se manter medidas de contenção"", anuncia Marcelo
Recomendados para si",https://www.noticiasaominuto.com/mundo/1447241/combate-a-pandemia-ja-tera-evitado-cerca-de-59-mil-mortes-em-11-paises,Combate à pandemia já terá evitado cerca de 59 mil mortes em 11 países,0.9843554443053817,0.9673482531519765,0.987012987012987,0.977366255144033,0.9968520461699895,"Random Forests
('ranger' package, R 3.5.3.)
Wright MN, Ziegler A (2017). “ranger: A Fast Implementation of Random Forests for High Dimensional Data in C++ and R.” Journal of Statistical Software, 77(1), 1–17. doi: 10.18637/jss.v077.i01.",3731,0.40345280540439105,25,500,25,gini,classification,2020-03-30,Combate à pandemia já terá evitado cerca de 59 mil mortes em 11 países Estudo levado a cabo pelo Imperial College London analisou as medidas adotadas por Áustria Bélgica Dinamarca França Alemanha Itália Noruega Espanha Suécia Suíça e Reino Unido
1,General Motors decidiu adiar novo Chevrolet elétrico,O surto de Covid-19 volta a fazer ‘estragos’.,Miguel Patinha Dias,2020-04-01 13:31:46,2020-04-01 10:14:41,General Motors decidiu adiar novo Chevrolet elétrico O surto de Covid-19 volta a fazer ‘estragos’.,"A General Motors anunciou que decidiu adiar o lançamento do novo elétrico Chevrolet Bolt. Originalmente previsto para este ano, o novo modelo está agora previsto para 2021, conta o Electrek.
Entre as grandes novidades deste modelo estarão melhorias de design e tecnologia, entre as quais ‘cruise control’ adaptativo e assentos mais confortáveis para os ocupantes do veículo.
A General Motors está longe de ser a única fabricante de automóveis afetada pelo surto de Covid-19, com a Tesla a também ter sido obrigada a encerrar as fábricas de modo a prevenir a disseminação do vírus.
Leia Também: Fabricante chinesa diz ter criado bateria com autonomia para 600km
Recomendados para si",https://www.noticiasaominuto.com/tech/1447223/general-motors-decidir-adiar-novo-chevrolet-eletrico,General Motors decidiu adiar novo Chevrolet elétrico,0.9843554443053817,0.9673482531519765,0.987012987012987,0.977366255144033,0.9968520461699895,"Random Forests
('ranger' package, R 3.5.3.)
Wright MN, Ziegler A (2017). “ranger: A Fast Implementation of Random Forests for High Dimensional Data in C++ and R.” Journal of Statistical Software, 77(1), 1–17. doi: 10.18637/jss.v077.i01.",3731,0.40345280540439105,25,500,25,gini,classification,2020-03-30,General Motors decidiu adiar novo Chevrolet elétrico O surto de Covid-19 volta a fazer estragos
1,"Covid-19. Até ao início de maio, TAP voará apenas para Açores e Madeira","A TAP diz ter sido ""forçada a temporariamente parar quase por completo a sua atividade"", dadas as restrições impostas pelos países para conter o novo coronavírus.",Notícias Ao Minuto,2020-04-01 13:31:48,2020-04-01 10:38:33,"Covid-19. Até ao início de maio, TAP voará apenas para Açores e Madeira A TAP diz ter sido ""forçada a temporariamente parar quase por completo a sua atividade"", dadas as restrições impostas pelos países para conter o novo coronavírus.","A TAP anunciou, esta quarta-feira, uma série de medidas que visam conter o impacto da Covid-19. A companhia aérea diz ter sido ""forçada a temporariamente parar quase por completo a sua atividade"", dadas as restrições impostas pelos países para conter o novo coronavírus. Assim, durante o próximo mês, a TAP voará apenas para os Açores e para a Madeira.
""A partir de 1 de abril de 2020 e, pelo menos, até 4 de maio de 2020, a TAP estima apenas poder operar para a Terceira e Ponta Delgada, nos Açores, e para o Funchal, na Madeira, para assegurar a continuidade territorial, suspendendo todas as demais rotas"", pode ler-se num comunicado enviado, esta quarta-feira, à CMVM.
A companhia aérea confirma também que acedeu ao lay-off, um programa desenvolvido pelo Governo em resposta à Covid-19, de modo a assegurar a ""melhor defesa da manutenção dos postos de trabalho do seu universo de colaboradores e melhor salvaguarda do futuro da empresa"", refere.
A TAP vai assim suspender temporariamente o contrato a cerca de 90% dos trabalhadores, sendo que os restantes 10% verão o seu horário de trabalho ser reduzido em 20%, também ao abrigo do lay-off. Esta medida terá a duração de 30 dias, mas este período pode vir a ser alargado.
""Estas medidas têm por objetivo reduzir os custos fixos da TAP, por forma a compensar parcialmente a perda de receita neste novo cenário. Os custos com pessoal representam o principal custo fixo da TAP, ascendendo a aproximadamente 20% dos custos operacionais totais. A TAP estima que, com base na melhor informação disponível à data de hoje, a implementação das medidas excecionais e temporárias acima descritas tenha como impacto uma redução da rúbrica de custos com pessoal correspondente a cerca de 45%, durante o mencionado período aplicável"", sublinha a companhia aérea.
Leia Também: Covid-19: TAP avança com 'lay-off' para 90% dos trabalhadores
Recomendados para si",https://www.noticiasaominuto.com/economia/1447234/no-proximo-mes-tap-voara-apenas-para-acores-e-madeira,"Covid - 19 . Até ao início de maio , TAP voará apenas para Açores e Madeira",0.9843554443053817,0.9673482531519765,0.987012987012987,0.977366255144033,0.9968520461699895,"Random Forests
('ranger' package, R 3.5.3.)
Wright MN, Ziegler A (2017). “ranger: A Fast Implementation of Random Forests for High Dimensional Data in C++ and R.” Journal of Statistical Software, 77(1), 1–17. doi: 10.18637/jss.v077.i01.",3731,0.40345280540439105,25,500,25,gini,classification,2020-03-30,Covid-19 Até ao início de maio TAP voará apenas para Açores e Madeira A TAP diz ter sido forçada a temporariamente parar quase por completo a sua atividade dadas as restrições impostas pelos países para conter o novo coronavírus
