prediction_covid_topic,title,description,authors,date_download,date_publish,pred_input,maintext,url,gdelt_article_title,model_accuracy,model_kappa,model_f1,model_precision,model_recall,model,sample_size,train_prop_covid,mtry,n_tree,min_node_size,splitrule,model_type,fitted_on,txt_used
1,AO MINUTO: Governo avalia emergência; 30 mil mortos na Europa,No mundo inteiro foram registados 860 mil casos de Covid-19. Cerca de 42.300 pessoas morreram e mais de 178 mil recuperaram da doença. Acompanhe aqui Ao Minuto os últimos desenvolvimentos sobre a Covid-19 em Portugal e no Mundo.,Fábio Nunes,2020-04-01 13:32:06,2020-04-01 09:57:27,AO MINUTO: Governo avalia emergência; 30 mil mortos na Europa No mundo inteiro foram registados 860 mil casos de Covid-19. Cerca de 42.300 pessoas morreram e mais de 178 mil recuperaram da doença. Acompanhe aqui Ao Minuto os últimos desenvolvimentos sobre a Covid-19 em Portugal e no Mundo.,"O Presidente da República, Marcelo Rebelo de Sousa, vai anunciar esta quinta-feira a renovação do Estado de Emergência por mais 15 dias, ou seja, até ao dia 17 de abril. O Chefe de Estado já tinha afirmado ao início da tarde desta terça-feira que se impunha ""manter as medidas de contenção"" em Portugal, declarações que sinalizavam o esperado prolongamento do Estado de Emergência.
Não obstante, esta quarta-feira vai ter lugar no Palácio da Ajuda, às 15h00, um Conselho de Ministros extraordinário para ""apreciação do Projeto de Decreto do Presidente da República de prorrogação do Estado de Emergência"".
O boletim epidemiológico da Direção-Geral da Saúde (DGS) de ontem deu conta de um aumento no número de casos de infeção, que totalizam agora 7.443. Registaram-se mais 20 mortes, subindo para 160 desde o início do surto em Portugal. Recuperaram 43 pessoas.
Esta terça-feira também foi descartada a hipótese de um cerco sanitário no Porto. O secretário de Estado da Saúde, António Lacerda Sales, sublinhou que ""não houve qualquer indicação da autoridade de saúde nesse sentido"".
A Organização Mundial de Saúde (OMS) disse que a pandemia de Covid-19 está a estabilizar na Europa. Ainda assim os números diários de casos de infeção em Itália e Espanha continuam a ser muito elevados. Itália contabiliza mais de 105 mil pessoas infetadas e 12.428 mortos. Já Espanha detetou mais de 94 mil casos e morreram 8.189 pessoas.
Mas o foco da pandemia parece estar a divergir cada vez mais para os Estados Unidos, com mais de 188 mil casos de infeção e 3.873 mortes.
No total, 860 mil pessoas foram diagnosticadas com a Covid-19 no mundo inteiro. A doença causou a morte a 42.300 pessoas e mais de 178 mil recuperaram. Pode consultar aqui a página do centro de pesquisa de coronavírus da Universidade Johns Hopkins, cujos números da pandemia estão em permanente atualização.
Acompanhe aqui Ao Minuto os últimos desenvolvimentos sobre a Covid-19 em Portugal e no Mundo:
10h18 - O ministro da Saúde espanhol, Salvador Illa, advertiu no Twitter que ""chegar ao pico da pandemia não significa resolver o problema"". ""Há que dobrar a curva e vencer o vírus"", destacou.
Llegar al pico de la epidemia no significa resolver el problema.Hay que doblegar la curva y vencer al virus. Entre todos lo conseguiremos. Un día más en casa es un día menos #EsteVirusLoParamosUnidos#COVIDー19 pic.twitter.com/BEnsFe25bS — Salvador Illa Roca/ (@ salvadorilla ) April 1, 2020
10h15 - De forma a apoiar entidades do setor social e solidário que enfrentam a crise espoletada pela pandemia de Covid-19, o Governo anunciou, esta quarta-feira, que criou uma medida de Apoio ao Reforço de Emergência de Equipamentos Sociais e de Saúde. Esta medida promove a integração de desempregados e de trabalhadores com contrato suspenso ou horário de trabalho reduzido em lares e hospitais.
10h10 - O governo italiano vai prolongar as medidas de confinamento obrigatório até ao dia 13 de abril. A decisão foi confirmada esta quarta-feira pelo ministro da Saúde, Roberto Speranza, que compareceu no Senado, adianta a agência Efe.
As medidas de isolamento social e de encerramento das atividades temporárias vigoram até à próxima sexta-feira.
10h04 - Esta quarta-feira 36 pacientes infetados com o coronavírus na região de Paris, e que estavam internados em unidades de cuidados intensivos, vão ser transportados de TGV para hospitais da Bretanha, uma das zonas de França menos afetadas pela pandemia, de acordo com a Associated Press.
9h52 - A qualidade do ar em Portugal registou um ""efetivo aumento"" no período do Estado de Emergência que vivemos. No caso de Lisboa a redução ""é mais significativa, chegando aos 80% em alguns locais da capital"" e no Porto ""a redução atinge os 60% em alguns pontos"".
9h48 - Depois da corrida ao papel higiénico, a pandemia está a gerar uma corrida às bebidas alcoólicas na Austrália. Um estudo levado a cabo pelo Commonwealth Bank estima que o gasto da população em álcool tenha aumentado em 86% em relação período homólogo.
Face a esta elevada procura, algumas superfícies comerciais decidiram impor limites.
9h37 - Os dados mais recentes do Instituto Robert Koch dão conta de mais de 5.400 novos casos de infeção e mais 149 mortes na Alemanha nas últimas 24 horas. O país passa assim a contabilizar um total de 67.366 casos confirmados de Covid-19 e 732 vítimas mortais.
9h27 - A pandemia de Covid-19 já matou mais de 30 mil pessoas na Europa, mais de dois terços em Itália e em Espanha, segundo um balanço da AFP.
9h25 - O Pentágono descartou, para já, evacuar um porta-aviões, em resposta a um pedido feito pelo comandante, que procura conter o surto da Covid-19 no navio.
9h23 - Numa entrevista ao Notícias ao Minuto, o sociológo das Migrações e professor universitário, Rui Pena Pires, salienta que ""Portugal não tem dimensão para enfrentar sozinho esta situação"", e que uma eventual nova crise social no país vai ""depender muito de qual for a reação da União Europeia e das instituições"".
9h18 - As autoridades italianas decidiram alterar uma das regras do confinamento e já permitem que os menores de 18 anos saiam de casa, desde que acompanhados por um adulto. Este passeio deve ser feito sempre, e apenas, nas imediações das suas residências.
9h15 - Um estudo conduzido pelo Imperial College London analisou as medidas adotadas em 11 países europeus e concluiu que as políticas restritivas implementadas para combater a Covid-19 evitaram cerca de 59 mil mortes nestes países.
9h12 - As empresas tecnológicas têm-se adaptado às limitações suscitadas pela pandemia de Covid-19 e muitas são as invenções que surgem relacionadas com a doença e que visam ajudar-nos. É o caso de uma pulseira criada pela Slightly Robot, que apita sempre que o utilizador está prestes a levar as mãos à cara.
9h08 - Saiba como os sintomas da Covid-19 evoluem de forma diária, quer se tratem de casos ligeiros, moderados ou mais agressivos.
9h04 - A partir de hoje e pelo menos até ao dia 4 de maio, a TAP vai voar apenas para a Madeira e para os Açores. A companhia aérea diz ter sido ""forçada a parar temporariamente quase por completo a sua atividade"", dadas as restrições impostas pelos países para conter o novo coronavírus.
8h59 - A Rússia enviou um avião militar com material sanitário para os Estados Unidos, segundo o El País. Vladimir Putin disponibilizou equipas médicas e equipamento de proteção a Donald Trump, que ""aceitou com gratidão a ajuda humanitária"", revelou o Kremlin.
8h45 - A Direção-Geral da Saúde (DGS) partilhou um vídeo em que explica o modo como devemos limpar as superfícies durante a pandemia da Covid-19. Recomendações importantes neste período.
8h32 - Donald Trump está a equacionar restringir as viagens oriundas do Brasil, como fez com a China e a Europa, devido ao aumento de casos da Covid-19 no país sul-americano. ""O Brasil, por exemplo, não teve problemas até muito recentemente e agora começa a tê-lo"", referiu o presidente norte-americano.
O Brasil é o país latino-americano com mais casos confirmados da Covid-19 (5.717) e também com o maior número de mortes (201).
8h25 - A Coordenação das Organizações Indígenas da Bacia Amazónica (COICA), que reúne comunidades dos nove países amazónicos, instou na terça-feira os respetivos governos a adotarem medidas de proteção para enfrentarem a pandemia do novo coronavírus.
8h17 - A Argentina ultrapassou na terça-feira os mil infetados pelo novo coronavírus, que já causou 27 mortes, após terem sido registadas nas últimas 24 horas mais três vítimas fatais, anunciou o Ministério da Saúde argentino.
8h13 - O presidente da Câmara de Ovar, Salvador Malheiro, disse na terça-feira que a Covid-19 já provocou 277 infetados e 13 mortes entre os 55.400 habitantes. O município está desde 17 de março em estado de calamidade pública devido à doença.
O autarca considerou estes ""resultados animadores"", pois demonstram a eficácia do cerco sanitário no concelho, que está em vigor desde o dia 18.
8h09 - A Alemanha está a preparar um estudo para aferir quantas pessoas são imunes ao novo coronavírus. Partindo desse estudo, o governo de Angela Merkel pretende perceber qual a melhor altura para levantar restrições e regressar à normalidade. O governo alemão está a ponderar a possibilidade de passar 'certificados de imunidade' à Covid-19 para libertar de algumas restrições aqueles que não contraem o vírus.
7h55 - A Comissão Nacional de Saúde da China informou esta quarta-feira sobre o registo de 36 novos casos confirmados de infeção pelo novo coronavírus, mantendo-se assim a tendência de redução do número de novos casos no país.
7h49: Jair Bolsonaro adotou um tom mais moderado, mas voltou a insistir na importância de a população manter os empregos durante a pandemia.
""Temos uma missão: salvar vidas, sem deixar para trás os empregos. Por um lado, temos de ter cautela e precaução com todos, principalmente junto aos mais idosos e portadores de doenças preexistentes. Por outro, temos de combater o desemprego que cresce rapidamente, em especial entre os mais pobres. Vamos cumprir essa missão, ao mesmo tempo em que cuidamos da saúde das pessoas"", frisou.
Leia Também: AO MINUTO: Estado de Emergência será renovado. Mais de 41 mil mortos
Recomendados para si",https://www.noticiasaominuto.com/mundo/1447211/ao-minuto-conselho-de-ministros-avalia-emergencia-foco-diverge-para-eua,AO MINUTO : Governo avalia emergência ; 30 mil mortos na Europa,0.9843554443053817,0.9673482531519765,0.987012987012987,0.977366255144033,0.9968520461699895,"Random Forests
('ranger' package, R 3.5.3.)
Wright MN, Ziegler A (2017). “ranger: A Fast Implementation of Random Forests for High Dimensional Data in C++ and R.” Journal of Statistical Software, 77(1), 1–17. doi: 10.18637/jss.v077.i01.",3731,0.40345280540439105,25,500,25,gini,classification,2020-03-30,AO MINUTO Governo avalia emergência 30 mil mortos na Europa No mundo inteiro foram registados 860 mil casos de Covid-19 Cerca de 42300 pessoas morreram e mais de 178 mil recuperaram da doença Acompanhe aqui Ao Minuto os últimos desenvolvimentos sobre a Covid-19 em Portugal e no Mundo
1,"Rastreios em lares? Locais ""não respondem à geopolítica da Covid-19""",Joacine Katar Moreira partilhou o seu projeto de resolução sobre a proteção do idosos em lares perante a Covid-19.,Notícias Ao Minuto,2020-04-01 13:32:10,2020-04-01 10:55:00,"Rastreios em lares? Locais ""não respondem à geopolítica da Covid-19"" Joacine Katar Moreira partilhou o seu projeto de resolução sobre a proteção do idosos em lares perante a Covid-19.","Joacine Katar Moreira partilhou, no Facebook, o seu projeto de resolução que deu entrada na sexta-feira passada sobre a proteção dos idosos do novo coronavírus nos lares do nosso país. Para a deputada não inscrita, ""as escolhas territoriais do Governo"" para implementar a Campanha Nacional de Rastreio em Lares ""não respondem à geopolítica da Covid-19"".
Katar Moreira explica, no documento, que ""foi anunciada agora pelo Governo uma Campanha Nacional de Rastreio em Lares, possibilitada pelo desenvolvimento de um kit de teste à Covid-19 no Instituto de Medicina Molecular, e que testará todos os profissionais de lares e utentes que apresentarem sintomas (para isto, bastará um sintoma).""
A fase piloto ""que inicia esta semana"", prossegue, ""será levada a cabo em Lisboa, Guarda, Évora, Aveiro e Faro"". Estes não são, garante a deputada, os locais em que o projeto deveria ser implementado, uma vez que o novo coronavírus ""apresenta um quadro mais agravado a Norte, o que faz com que esta campanha peque por não se poder traduzir numa maior eficácia no combate à doença.""
No mesmo projeto, Joacine afirma ainda que ""importa lembrar que 20% das vítimas mortais por Covid-19 em Portugal é idosa e encontra-se institucionalizada"", de modo que ""um idoso institucionalizado com sintomas ligeiros ou que tenha sido testado e que se encontra assintomático não pode ter o mesmo tratamento que qualquer cidadão saudável"".
De recordar que Marques Mendes foi quem anunciou, este domingo no seu espaço de comentário semanal na SIC, que ""a partir de amanhã [segunda-feira], vai começar uma campanha nacional de testes nos lares de terceira idade, junto dos idosos e dos profissionais"".
Trata-se de uma campanha ""com objetivo de ter 10 mil testes no espaço de várias semanas, sendo que serão feitos sensivelmente 300 testes por dia"".
Leia Também: ""A partir de amanhã, vai começar campanha nacional de testes nos lares""
Recomendados para si",https://www.noticiasaominuto.com/politica/1447228/rastreios-em-lares-locais-nao-respondem-a-geopolitica-da-covid-19,Rastreios em lares ? Locais  não respondem à geopolítica da Covid - 19  ,0.9843554443053817,0.9673482531519765,0.987012987012987,0.977366255144033,0.9968520461699895,"Random Forests
('ranger' package, R 3.5.3.)
Wright MN, Ziegler A (2017). “ranger: A Fast Implementation of Random Forests for High Dimensional Data in C++ and R.” Journal of Statistical Software, 77(1), 1–17. doi: 10.18637/jss.v077.i01.",3731,0.40345280540439105,25,500,25,gini,classification,2020-03-30,Rastreios em lares Locais não respondem à geopolítica da Covid-19 Joacine Katar Moreira partilhou o seu projeto de resolução sobre a proteção do idosos em lares perante a Covid-19
