prediction_covid_topic,title,description,authors,date_download,pred_input,maintext,text,url,gdelt_article_title,date_publish,model_accuracy,model_kappa,model_f1,model_precision,model_recall,model,sample_size,train_prop_covid,mtry,n_tree,min_node_size,splitrule,model_type,fitted_on,txt_used
0,Galaxy S20 tem um segredo no ecrã! Veja como o ativar!,"Uma nova informação revela que o Galaxy S20 tem um modo escondido de 96Hz no software. Veja como o pode ativar agora mesmo, via App ou ADB.",Bruno Fonseca,2020-04-01 06:37:12,"Galaxy S20 tem um segredo no ecrã! Veja como o ativar! Uma nova informação revela que o Galaxy S20 tem um modo escondido de 96Hz no software. Veja como o pode ativar agora mesmo, via App ou ADB.","Foi em Fevereiro que a Samsung apresentou novos topos-de-gama. Falo, claro, dos Galaxy S20, S20+ e S20 Ultra. Estes equipamentos estão cheio de funcionalidades e características apetecíveis. No entanto, há uma em particular que está a começar a ser um grande ponto de venda e não estou a falar da fotografia. Falo sim do ecrã e dos seus 120Hz. De facto, esta taxa de atualização garante uma experiência muito mais fluída. Estes foram os primeiros equipamentos da Samsung a ultrapassarem a marca dos 60Hz. Um pormenor é que não parece existir um meio termo na taxa de atualização. Ou seja, ou escolhemos 60Hz ou escolhemos 120Hz. No entanto, uma nova informação revela que o Galaxy S20 tem um modo escondido de 96Hz no software.
Galaxy S20 tem um segredo no ecrã! Veja como o ativar!
De acordo com o conhecido site XDA-Developers, este modo pode ser ativado através de ADB. Para quem não quer estar a fazê-lo um elemento deste fórum criou uma aplicação específica que de forma simples ativa o modo de 96Hz. Esta aplicação pode ser descarregada aqui e vai colocar dois botões na barra de status que permite alternar rapidamente entre os 120 e os 96Hz.
Agora apenas uma questão. Isto funciona sem problemas na versão Qualcomm que está disponível lá fora. No entanto, na versão Exynos, vendida por cá, nuns modelos funciona bem, noutros funciona mal. Só experimentando. Atenção que o modo de 96Hz apenas funciona na resolução 1080+.
Existem algumas vantagens que chegam com esta possibilidade de alternar entre os 120Hz e os 96. É que em teoria é consumida menos bateria. Isto ao mesmo tempo que ganhamos mais fluidez comparativamente aos 60Hz. Ou seja, é uma espécie de melhor dos dois mundos.
Uma coisa é certa, este modo dá mais poder ao utilizador para poder escolher a taxa de atualização preferida. Quem sabe se no futuro esta opção será incluída em alguma atualização do One UI.
Veja aqui se vale a pena adquiri os novos topo-de-gama da Samsung.
Fundador da Leak, estreou-se no online em 1999 quando criou a CDRW.co.pt. Deu os primeiros passos no mundo da tecnologia com o Spectrum 48K e nunca mais largou os computadores. É viciado em telemóveis, tablets e gadgets.
Ou veja mais notícias de Android Acompanhe ao minuto as últimas noticias de tecnologia . Siga-nos no Facebook Instagram ! Quer falar connosco? Envie um email para geral@leak.pt",NA,https://www.leak.pt/galaxy-s20-tem-um-segredo-no-ecra-veja-como-o-ativar/,Galaxy S20 tem um segredo no ecrã ! Veja como o ativar ! ,2020-04-01 00:45:07,0.9843554443053817,0.9673482531519765,0.987012987012987,0.977366255144033,0.9968520461699895,"Random Forests
('ranger' package, R 3.5.3.)
Wright MN, Ziegler A (2017). “ranger: A Fast Implementation of Random Forests for High Dimensional Data in C++ and R.” Journal of Statistical Software, 77(1), 1–17. doi: 10.18637/jss.v077.i01.",3731,0.40345280540439105,25,500,25,gini,classification,2020-03-30,Galaxy S20 tem um segredo no ecrã Veja como o ativar Uma nova informação revela que o Galaxy S20 tem um modo escondido de 96Hz no software Veja como o pode ativar agora mesmo via App ou ADB
0,Android 10 no Nokia 7.2 já está disponível! Atualize já!,"Depois deste fabricante ter levado o Nokia 2.2 para o Android 10, a HMD Global resolveu lançar outra atualização. Assim temos o Android 10 no Nokia 7.2!",Bruno Fonseca,2020-04-01 06:37:12,"Android 10 no Nokia 7.2 já está disponível! Atualize já! Depois deste fabricante ter levado o Nokia 2.2 para o Android 10, a HMD Global resolveu lançar outra atualização. Assim temos o Android 10 no Nokia 7.2!","Aos poucos o Android 10 começa a chegar a todo o lado. Isto é sem dúvida uma boa notícia, já que são notórias algumas melhorias no desempenho. No caso da Nokia, depois deste fabricante ter levado o Nokia 2.2 para o Android 10, eis que a HMD Global resolveu lançar outra atualização desde sistema operativo para o Nokia 7.2. São sem dúvida boas notícias o Android 10 no Nokia 7.2!
Android 10 no Nokia 7.2 já está disponível! Atualize já!
Apesar de ter sido forçada a lançar a atualização do Android 10 devido à pandemia do COVID-19, a HMD Global está a seguir religiosamente o cronograma que tinha sido anunciado no início deste mês. Segundo ele, há seis smartphones que deverão receber este sistema operativo já em Abril. Falo, em concreto, do Nokia 2.3, Nokia 3.2, Nokia 4.2, Nokia 6.2, Nokia 3.1 Plus e Nokia 8 Sirocco.
No entanto, estes não são os únicos smartphones que a HMD quer atualizar para o Android 10. De facto, temos outros seis à espera. Ainda assim o novo sistema operativo só deve chegar a meio do segundo trimestre. Os equipamentos que serão brindados são o Nokia 5.1 Plus, Nokia 1 Plus, Nokia 2.1, Nokia 3.1, Nokia 5.1 e Nokia 1.
A disponibilidade destas atualizações será anunciada, como habitualmente, por Juho Sarvikas que é a cara que normalmente associamos à HMD Global, especialmente pelas suas muitas intervenções no Twitter.
A HMD Global tem estado a fazer um excelente trabalho com a marca Nokia. Se durante algum tempo as pessoas olhavam com desconfiança para este renascimento, com o tempo ficou comprovado que os equipamentos deste fabricante estão de boa saúde e é para continuar.
No entanto, nem tudo se resume aos equipamentos. Assim, para além de um bom hardware temos um fabricante preocupado em disponibilizar atualizações de software com muita regularidade. Isso torna esta marca cada vez mais apetecível.
Resta-nos agora esperar pelos outros equipamentos que serão lançados no mercado. Uma coisa é certa. Teremos muitas notícias em breve.
Fundador da Leak, estreou-se no online em 1999 quando criou a CDRW.co.pt. Deu os primeiros passos no mundo da tecnologia com o Spectrum 48K e nunca mais largou os computadores. É viciado em telemóveis, tablets e gadgets.
Ou veja mais notícias de Android Acompanhe ao minuto as últimas noticias de tecnologia . Siga-nos no Facebook Instagram ! Quer falar connosco? Envie um email para geral@leak.pt",NA,https://www.leak.pt/android-10-no-nokia-7-2/,Android 10 no Nokia 7 . 2 já está disponível ! Atualize já ! ,2020-04-01 01:43:42,0.9843554443053817,0.9673482531519765,0.987012987012987,0.977366255144033,0.9968520461699895,"Random Forests
('ranger' package, R 3.5.3.)
Wright MN, Ziegler A (2017). “ranger: A Fast Implementation of Random Forests for High Dimensional Data in C++ and R.” Journal of Statistical Software, 77(1), 1–17. doi: 10.18637/jss.v077.i01.",3731,0.40345280540439105,25,500,25,gini,classification,2020-03-30,Android 10 no Nokia 72 já está disponível Atualize já Depois deste fabricante ter levado o Nokia 22 para o Android 10 a HMD Global resolveu lançar outra atualização Assim temos o Android 10 no Nokia 72
1,Lamborghini já entrou na batalha contra o Coronavírus!,Lamborghini já entrou na batalha contra o Corona Vírus! - A gigante desportiva transformou várias aéreas das fabricas em centros de produção...,Silvio José,2020-04-01 06:37:13,Lamborghini já entrou na batalha contra o Coronavírus! Lamborghini já entrou na batalha contra o Corona Vírus! - A gigante desportiva transformou várias aéreas das fabricas em centros de produção...,"A pandemia mundial que estamos a viver atingiu todo o tipo de mercados, incluindo também o mercado dos grandes desportivos automóveis. Afinal de contas, sem a mão de obra, as fabricantes não conseguem produzir estas jóias da engenharia, e por isso muitas já fecharam portas.
Ainda assim existe quem não queira baixar os braço! Desta vez é a Lamborghini que se juntou à batalha contra o coronavírus!
Antes de mais nada, tenho a dizer que apesar de não ser a primeira grande fabricante a tomar esta iniciativa, todas as ajudas ainda são poucas. Aliás, esta gigante desportiva já transformou várias linhas de produção das fabricas em Sant’Agata Bolognese em autênticos centros de produção para máscaras e viseiras de protecção.
As máscaras da Lamborghini serão doadas ao Hospital Sant’Orsola-Malpihi em Bolonha!
Sim leu mesmo bem, a gigante Lamborghini vai mesmo doar mascaras que serão utilizadas na luta contra a pandemia do novo Coronavírus, o COVID-19. Estamos todos nesta luta e isto trata-se de uma iniciativa solidária que será realizada pelos funcionários que estavam encarregues de criar os interiores e personalizações dos modelos da conhecida marca.
Assim a empresa produzirá cerca de 1000 máscaras diariamente e cerca de 200 viseiras de protecção graças à utilização das impressoras 3D que possui!
Todas estas medidas de apoio ao hospital serão realizadas em parceria com a Universidade de Bolonha. Assim, graças a esta união, os equipamentos produzidos terão a garantia de serem eficazes e seguros. Afinal de contas é o departamento de Ciências Médicas e Cirúrgicas desta Universidade que irá supervisionar a qualidade do material fabricado pela Lamborghini antes deste ser entregue ao hospital.
O presidente e CEO da Lamborghini, Stefano Domenicali também já informou que: “Durante esta emergência, sentimos a necessidade de prestar um contributo concreto. O Hospital em questão, S. Orsola-Malpighi, é um instituição com que mantemos uma relação de colaboração há vários anos...”
De fato, além disto, Stefano Domenicali acrescentou também que como sinal de apoio a Lamborghini irá iluminar todas as noites os edifícios da sede histórica em Sant’Agata Bolognese com as cores da bandeira de italiana. “Venceremos esta batalha trabalhando unidos e apoiando aqueles que lutam diariamente contra a pandemia”.
Em suma, a verdade é que estamos neste momento todos no “mesmo barco” e enfrentamos globalmente a pandemia denominada de COVID-19. Algo que por um lado está a ajudar a unir imensas pessoas e empresas num único objetivo, a luta contra o coronavírus.
Ademais, o que pensa sobre isto? Partilhe connosco a sua opinião nos comentários em baixo.
Sempre gostei de tecnologia, e em tenra idade já sonhava em construir a minha Dream Machine. Alcançado esse sonho agora o objetivo é aprender mais e mais. A minha paixão em todo o tipo de tecnologia faz-me estar sempre alerta a todas as novidades.
Ou veja mais notícias de Auto Acompanhe ao minuto as últimas noticias de tecnologia . Siga-nos no Facebook Instagram ! Quer falar connosco? Envie um email para geral@leak.pt",NA,https://www.leak.pt/lamborghini-ja-entrou-na-batalha-contra-o-coronavirus/,Lamborghini já entrou na batalha contra o Coronavírus ! ,2020-03-31 23:35:09,0.9843554443053817,0.9673482531519765,0.987012987012987,0.977366255144033,0.9968520461699895,"Random Forests
('ranger' package, R 3.5.3.)
Wright MN, Ziegler A (2017). “ranger: A Fast Implementation of Random Forests for High Dimensional Data in C++ and R.” Journal of Statistical Software, 77(1), 1–17. doi: 10.18637/jss.v077.i01.",3731,0.40345280540439105,25,500,25,gini,classification,2020-03-30,Lamborghini já entrou na batalha contra o Coronavírus Lamborghini já entrou na batalha contra o Corona Vírus - A gigante desportiva transformou várias aéreas das fabricas em centros de produção
0,Tigre 3D no Google vira celebridade e todos o querem ver!,"Existem vários animais que foram disponibilizados em 3D pela Google. Ainda assim, as pessoas só querem o Tigre 3D no Google.",Bruno Fonseca,2020-04-01 06:37:13,"Tigre 3D no Google vira celebridade e todos o querem ver! Existem vários animais que foram disponibilizados em 3D pela Google. Ainda assim, as pessoas só querem o Tigre 3D no Google.","O período de quarentena que estamos a viver, está a levar-nos a descobrir coisas novas. De facto, o que eventualmente noutra altura poderia passar mais despercebido, nesta fase torna-se bem mais interessante. Até porque temos mais tempo para explorarmos tudo o que a Internet nos tem para oferecer. É exatamente isso que se está a passar com os animais 3D da Google. De facto, tem sido uma loucura a julgar pelas pesquisas. No entanto, o mais interessante é que de todos os animais disponíveis há um que se está a destacar. Falo em concreto do tigre. É que existem vários animais que foram disponibilizados em 3D pela Google e com possibilidade de utilizarmos a realidade aumentada. Ainda assim, as pessoas só querem o Tigre 3D no Google.
Tigre 3D no Google vira celebridade e todos o querem ver!
Desde que tenha um smartphone ou tablet Android com a versão 7.0 ou superior, ou então um iPad ou um iPhone com iOS 11 ou superior, tem acesso a tudo isto.
A Google coloca os seus animais em 3D e outros objetos de realidade aumentada no topo da pesquisa. Por exemplo, pesquisar por “tigre” mostra um painel de conhecimento de pesquisa da Google. Estes painéis normalmente estão destinados a filmes, celebridades e outros assuntos. No caso de um animal 3D, temos uma visão geral do mesmo, algumas imagens ou uma seção que diz “Conheça um tigre em tamanho real” e um botão de “Visualização em 3D”. Este botão dá início à experiência de realidade aumentada.
Entretanto e como existem mais animais em #D para além do tigre deixamos todas as ligações, para que os possa ver todos. Depois de os ter visto, o tigre continua a ser o seu preferido? Conte-nos tudo nos comentários!
O melhor amigo do homem, o Cão, está disponível em 3D e pode colocá-lo a andar pela sala e fazer muitas outras coisas. Clique aqui. No entanto, existem algumas raças específicas. como os labrador, os pug ou os Rottweiler.
Já se é uma pessoa de gatos encontra-os em 3D aqui. O leopardo está disponível aqui. Também está disponível o Urso, o pato, a águia, pinguim imperador e o panda gigante.
Também encontramos o bode, o ouriço, o cavalo, o leão, a arara e o polvo. No entanto, se acha que a lista já vai longa, fica ainda maior. Assim, temos o guaxinim, o tubarão, pónei, a serpente, o tigre e o lobo.
Fundador da Leak, estreou-se no online em 1999 quando criou a CDRW.co.pt. Deu os primeiros passos no mundo da tecnologia com o Spectrum 48K e nunca mais largou os computadores. É viciado em telemóveis, tablets e gadgets.
Ou veja mais notícias de Android Acompanhe ao minuto as últimas noticias de tecnologia . Siga-nos no Facebook Instagram ! Quer falar connosco? Envie um email para geral@leak.pt",NA,https://www.leak.pt/tigre-3d-no-google/,Tigre 3D no Google vira celebridade e todos o querem ver ! ,2020-04-01 01:31:33,0.9843554443053817,0.9673482531519765,0.987012987012987,0.977366255144033,0.9968520461699895,"Random Forests
('ranger' package, R 3.5.3.)
Wright MN, Ziegler A (2017). “ranger: A Fast Implementation of Random Forests for High Dimensional Data in C++ and R.” Journal of Statistical Software, 77(1), 1–17. doi: 10.18637/jss.v077.i01.",3731,0.40345280540439105,25,500,25,gini,classification,2020-03-30,Tigre 3D no Google vira celebridade e todos o querem ver Existem vários animais que foram disponibilizados em 3D pela Google Ainda assim as pessoas só querem o Tigre 3D no Google
0,Barco da Marinha venezuelana afundou-se após colisão com cruzeiro português,"A colisão ocorreu quando a embarcação da Marinha ″efetuava um procedimento de controlo de tráfego marítimo, o que gerou danos de grande magnitude″ no barco da Guarda Costeira venezuelana.",Global Media Group,2020-04-01 06:37:13,"Barco da Marinha venezuelana afundou-se após colisão com cruzeiro português A colisão ocorreu quando a embarcação da Marinha ″efetuava um procedimento de controlo de tráfego marítimo, o que gerou danos de grande magnitude″ no barco da Guarda Costeira venezuelana.","© AFP (arquivo)
Por Lusa 31 Março, 2020 • 23:56 Partilhar este artigo Facebook
Facebook Twitter
Twitter WhatsApp
WhatsApp E-mail
E-mail Partilhar
Um barco da Marinha venezuelana afundou-se na segunda-feira após uma colisão com o cruzeiro de bandeira portuguesa ""Resolute"", a norte da ilha de La Tortuga (181 quilómetros a nordeste de Caracas).
Segundo o Ministério da Defesa da Venezuela, pelas 00:45 locais de segunda-feira (05:45 em Lisboa), o barco da Guarda Costeira ""Naiguatá GC-23"" realizava ""tarefas de patrulhamento marítimo"" no mar territorial venezuelano quando ""foi atingido pelo navio de passageiros 'Resolute' (122 metros de comprimento e 8300 toneladas de deslocamento), de bandeira portuguesa"".
A colisão ocorreu quando a embarcação da Marinha ""efetuava um procedimento de controlo de tráfego marítimo, o que gerou danos de grande magnitude"" no barco da Guarda Costeira venezuelana.
""A ação do navio 'Resolute' é considerada covarde e criminosa, pois não atendeu ao resgate da tripulação, violando os regulamentos internacionais que regulam o resgate da vida no mar. Atualmente, este navio está no porto de Willemstad, capital de Curaçau, onde atracou na manhã de hoje"", explica o comunicado.
De acordo com o comunicado, as operações de busca e salvamento, juntamente com o desempenho profissional e corajoso do pessoal venezuelano, ""permitiram o resgate na íntegra da tripulação"".
""O Estado venezuelano realiza as ações legais correspondentes"", conclui o documento.
A imprensa local adianta que a tripulação do ""Naiguatá GC-23"" era composta por 44 homens.
O barco foi construído pelo estaleiro Navantia, em São Fernando, Espanha, e entregue às autoridades venezuelanas em 24 de junho de 2009.",NA,https://www.tsf.pt/mundo/barco-da-marinha-venezuelana-afundou-se-apos-colisao-com-cruzeiro-portugues-12013631.html,Barco da Marinha venezuelana afundou - se após colisão com cruzeiro português,2020-04-01 01:56:00,0.9843554443053817,0.9673482531519765,0.987012987012987,0.977366255144033,0.9968520461699895,"Random Forests
('ranger' package, R 3.5.3.)
Wright MN, Ziegler A (2017). “ranger: A Fast Implementation of Random Forests for High Dimensional Data in C++ and R.” Journal of Statistical Software, 77(1), 1–17. doi: 10.18637/jss.v077.i01.",3731,0.40345280540439105,25,500,25,gini,classification,2020-03-30,Barco da Marinha venezuelana afundou-se após colisão com cruzeiro português A colisão ocorreu quando a embarcação da Marinha efetuava um procedimento de controlo de tráfego marítimo o que gerou danos de grande magnitude no barco da Guarda Costeira venezuelana
0,"RS Q8 capaz de bater o pé ao Urus, DBX e Cayenne","Se não imaginava ser possível um SUV da Audi ser capaz de se bater com o Urus da Lamborghini, o DBX da Aston Martin ou o Porsche Cayenne, é porque ain...",Alfredo Lavrador,2020-04-01 06:37:15,"RS Q8 capaz de bater o pé ao Urus, DBX e Cayenne Se não imaginava ser possível um SUV da Audi ser capaz de se bater com o Urus da Lamborghini, o DBX da Aston Martin ou o Porsche Cayenne, é porque ain...","O Q8 é o SUV mais luxuoso e refinado da Audi, com espaço e equipamento capazes de justificar o preço elevado, correspondente ao estatuto de topo de gama. Mas faltava-lhe uma versão capaz de fazer “crescer água na boca” dos condutores para os quais só o luxo não basta e é necessário juntar alguma emoção ao modelo. Foi para isso mesmo que nasceu o RS Q8, o desportivo da família.
O mais dispendioso dos SUV da Audi começa por herdar o chassi dos seus “irmãos” Cayenne e Urus, o que lhe permite exibir um comprimento ligeiramente superior aos 5 metros (5,01 m) e uma imensa distância entre eixos, de 2,99 m, o que lhe garante um habitáculo com espaço de sobra. E se o interior é espaçoso, a mala não lhe fica atrás, disponibilizando em condições normais 605 litros, que depois pode evoluir até aos 1755 com o rebatimento dos assentos traseiros.
Raça e luxo a bordo do mais desportivo dos Q8 4 fotos
O principal trunfo do RS Q8 é o seu motor V8 biturbo com 4 litros, que neste caso fornece 600 cv. E, como se isto não bastasse, 800 Nm de força, logo a partir das 2200 rotações. Na realidade é a mesma unidade que, uma vez montada no SUV da Porsche, debita um máximo de 550 cv, para depois atingir 650 cv no Lamborghini.
Para reduzir os consumos e as emissões, este 4.0 V8 recorre à tecnologia mild hybrid a 48V, bem como à tecnologia cylinder on demand, contando com um motor eléctrico de apenas 16 cv que faz de motor de arranque, de alternador e ainda ajuda nas acelerações, o que facilita o trabalho do motor de combustão a gasolina. Daí que o fabricante anuncie uma redução de 0,8 litros no consumo médio. A caixa tem oito velocidades e é uma transmissão automática convencional, com conversor de binário para maximizar o conforto e a suavidade.
A potência é distribuída pelas quatro rodas através do habitual sistema quattro que, graças aos diversos programas de condução, consegue colocar nas rodas traseiras entre 30% e 85%, ou seja, o necessário para permitir ao modelo evoluir mais facilmente em terrenos mais escorregadios, mas igualmente para garantir que o RS Q8 se comporta como se fosse um desportivo numa estrada sinuosa. Compatível, pois, com os 250 km/h de velocidade máxima, valor que pode ascender a 305 km/h quando o RS Q8 está equipado com o pack Dynamic Plus, com o SUV a ser capaz de ir de 0 a 100 km/h em somente 3,8 segundos.
Distinguir o novo RS dos restantes Q8 é relativamente fácil, bastando atentar na grelha a negro com um “desenho” mais aberto, para facilitar a entrada de ar para refrigerar o motor. A frente exibe ainda maiores entradas inferiores, que servem para manter a mecânica e os travões dentro das temperaturas ideais de funcionamento. Na traseira, o extractor de ar denota uma atitude mais desportiva, reforçada pelas pequenas saídas de ar sob o farolins que, tal como os faróis à frente, são em LED.
O novo RS Q8 já está disponível entre nós, com a Audi a anunciar um preço de 182.733€. Um valor elevado, mas competitivo face aos rivais no segmento dos super SUV.",NA,https://observador.pt/2020/03/31/rs-q8-capaz-de-bater-o-pe-ao-urus-dbx-e-cayenne/,"RS Q8 capaz de bater o pé ao Urus , DBX e Cayenne",2020-03-24 23:57:00,0.9843554443053817,0.9673482531519765,0.987012987012987,0.977366255144033,0.9968520461699895,"Random Forests
('ranger' package, R 3.5.3.)
Wright MN, Ziegler A (2017). “ranger: A Fast Implementation of Random Forests for High Dimensional Data in C++ and R.” Journal of Statistical Software, 77(1), 1–17. doi: 10.18637/jss.v077.i01.",3731,0.40345280540439105,25,500,25,gini,classification,2020-03-30,RS Q8 capaz de bater o pé ao Urus DBX e Cayenne Se não imaginava ser possível um SUV da Audi ser capaz de se bater com o Urus da Lamborghini o DBX da Aston Martin ou o Porsche Cayenne é porque ain
1,Onze casos de Covid-19 nos Sapadores de Braga,"Ao caso de Covid-19 detetado a 29 de março num elemento dos Bombeiros Sapadores de Braga, somaram-se, esta terça-feira, mais dez casos de infeção pelo novo coronavírus nesta corporação.",Global Media Group,2020-04-01 06:37:16,"Onze casos de Covid-19 nos Sapadores de Braga Ao caso de Covid-19 detetado a 29 de março num elemento dos Bombeiros Sapadores de Braga, somaram-se, esta terça-feira, mais dez casos de infeção pelo novo coronavírus nesta corporação.","JN Ontem às 23:34 Facebook
Twitter
Partilhar
Ao caso de Covid-19 detetado a 29 de março num elemento dos Bombeiros Sapadores de Braga, somaram-se, esta terça-feira, mais dez casos de infeção pelo novo coronavírus nesta corporação.
Esta terça-feira os Bombeiros Sapadores de Braga ficaram a conhecer os resultados dos testes de 11 elementos da corporação, dos quais dez testaram positivo para Covid-19 e um foi negativo, apurou o JN.
Um destes novos casos positivos pertence à secção técnica, composta por três elementos, que fizeram testes de despistagem esta terça-feira, assim como o adjunto e o comandante dos Sapadores, estando agora a aguardar os resultados.
O primeiro caso de infeção na corporação foi confirmado a 29 de março.",NA,https://www.jn.pt/local/noticias/braga/braga/sapadores-de-braga-somam-dez-casos-de-covid-19-12013605.html,Onze casos de Covid - 19 nos Sapadores de Braga,2020-04-01 01:34:00,0.9843554443053817,0.9673482531519765,0.987012987012987,0.977366255144033,0.9968520461699895,"Random Forests
('ranger' package, R 3.5.3.)
Wright MN, Ziegler A (2017). “ranger: A Fast Implementation of Random Forests for High Dimensional Data in C++ and R.” Journal of Statistical Software, 77(1), 1–17. doi: 10.18637/jss.v077.i01.",3731,0.40345280540439105,25,500,25,gini,classification,2020-03-30,Onze casos de Covid-19 nos Sapadores de Braga Ao caso de Covid-19 detetado a 29 de março num elemento dos Bombeiros Sapadores de Braga somaram-se esta terça-feira mais dez casos de infeção pelo novo coronavírus nesta corporação
