prediction_covid_topic,title,description,authors,date_download,pred_input,maintext,text,url,gdelt_article_title,date_publish,model_accuracy,model_kappa,model_f1,model_precision,model_recall,model,sample_size,train_prop_covid,mtry,n_tree,min_node_size,splitrule,model_type,fitted_on,txt_used
1,Covid-19: Brasil ultrapassa as 200 vítimas mortais,País sul-americano regista ainda mais de 5.700 casos infetados com o novo coronavírus.,Notícias Ao Minuto,2020-04-01 06:36:38,Covid-19: Brasil ultrapassa as 200 vítimas mortais País sul-americano regista ainda mais de 5.700 casos infetados com o novo coronavírus.,"O Ministério da Saúde do Brasil divulgou, nesta terça-feira, que o número de vítimas mortais pelo novo coronavírus teve o maior salto diário e subiu para 201. Ao todo foram 42 óbitos confirmados nas últimas 24 horas.
Segundo o executivo brasileiro, liderado pelo Presidente Jair Bolsonaro, os casos confirmados do novo coronavírus no país chegaram aos 5.717, mais 1.138 que os 4.579 de segunda-feira.
Foi batido um novo recorde no número de casos diagnosticados em apenas um dia (1.138), desde o início da pandemia no Brasil, que até agora tinha sido de 502 infetados em 24 horas.
A taxa de mortalidade da covid-19 no Brasil é de cerca de 3,5%, de momento.
De acordo com os dados hoje divulgados pelo Ministério da Saúde, aumentou para 18 o número de unidades federativas do Brasil a registarem óbitos devido ao novo coronavírus: Amazonas, Alagoas, Bahia, Ceará, Pernambuco, Piauí, São Paulo, Rio de Janeiro, Distrito Federal, Minas Gerais, Goiás, Paraná, Mato Grosso do Sul, Rondônia, Maranhão, Santa Catarina, Rio Grande do Norte e Rio Grande do Sul.
Assim, todas as regiões do Brasil têm mortes confirmadas pela covid-19.
O sudeste continua a ser a região mais afetada pela pandemia, sendo São Paulo o epicentro. São 3.406 casos na região mais populosa do país. Apenas o estado de São Paulo registou 2.339 novos casos confirmados, contanto também com 136 vítimas mortais. Segue-se o Rio de Janeiro com 23 óbitos e 708 infetados e o Ceará que, até ao momento, contabilizou sete vítimas mortais e 390 casos positivos da covid-19. Minas Gerais conta com 275 novos casos e Espírito Santo com 84. O sudeste concentra 60% de todos os casos do país.
Numa conferência de imprensa interministerial, feita na tarde de hoje, o ministro da Economia brasileiro, Paulo Guedes, informou que as medidas tomadas pelo executivo para reduzir o impacto da crise do novo coronavírus já equivalem a 2,6% do Produto Interno Bruto (PIB).
""Nós já chegámos a 2,6% do PIB neste 'orçamento de guerra', que eu chamo de medidas de emergência. Já tínhamos um défice estrutural de 2,6% e estamos em 5,2% global. Vamos continuar a subir, porque a instrução do Presidente foi clara: não vai ficar nenhum brasileiro para trás"", afirmou o ministro.
O Congresso brasileiro aprovou um subsídio mensal oferecido a trabalhadores independentes e informais - sem contrato de trabalho - atingidos pela crise do novo coronavírus, no valor de 600 reais (104 euros). Contudo, até ao momento, Jair Bolsonaro ainda não sancionou o projeto de lei, que precisa da sua aprovação para entrar em vigor.
Segundo Paulo Guedes, que assegurou que a aprovação ocorrerá a qualquer momento, o auxílio de 600 reais cedidos pelo Brasil é equivalente aos 1.200 dólares (1.087 euros) concedidos pelo Governo norte-americano.
""Estamos a gastar bem mais do que qualquer país da América Latina. Do ponto de vista do apoio que estamos a dar, com essa renda básica de 600 reais, comparada aos nossos rendimentos 'per capita' é igual à ajuda que os americanos estão a dar, de 1.200 dólares"", disse o governante.
Na mesma conferência de imprensa, o ministro da Justiça, Sergio Moro, defendeu o isolamento de presos como medida de prevenção da pandemia do novo coronavírus.
""Há um ambiente de relativa segurança para o sistema prisional em relação ao coronavírus pela própria condição dos presos de estarem isolados da sociedade"", afirmou Moro.
Em relação à possível libertação de presos que fazem parte de grupos de risco e em regime semiaberto - que lhes permite trabalhar durante o dia e os obriga a dormir na prisão -, Sergio Moro afirmou que essa opção deve ser ""ponderada"", acrescentando ser necessário ""ter cuidado é com a libertação de prisioneiros que possam oferecer risco à população, como o crime organizado"".
O sistema penitenciário brasileiro, considerado um dos piores do mundo, tem um défice de cerca de 350.000 vagas, o que há anos agrava a superlotação nas prisões.
O novo coronavírus, responsável pela pandemia da covid-19, já infetou mais de 828 mil pessoas em todo o mundo, das quais morreram mais de 41 mil.
Leia Também: Brasil regista progressão estatística de casos semelhante a Itália
Recomendados para si",NA,https://www.noticiasaominuto.com/mundo/1447137/covid-19-brasil-ultrapassa-as-200-vitimas-mortais,Covid - 19 : Brasil ultrapassa as 200 vítimas mortais,2020-04-01 01:26:00,0.9843554443053817,0.9673482531519765,0.987012987012987,0.977366255144033,0.9968520461699895,"Random Forests
('ranger' package, R 3.5.3.)
Wright MN, Ziegler A (2017). “ranger: A Fast Implementation of Random Forests for High Dimensional Data in C++ and R.” Journal of Statistical Software, 77(1), 1–17. doi: 10.18637/jss.v077.i01.",3731,0.40345280540439105,25,500,25,gini,classification,2020-03-30,Covid-19 Brasil ultrapassa as 200 vítimas mortais País sul-americano regista ainda mais de 5700 casos infetados com o novo coronavírus
1,"Próximas duas semanas serão ""muito dolorosas"" nos EUA","O Presidente norte-amerciano, Donald Trump, avisa que o número de casos da Covid-19 vai continuar a aumentar no país. Os Estados Unidos já ultrapassaram as 3.000 mortes devido à doença covid-19.",Global Media Group,2020-04-01 06:36:39,"Próximas duas semanas serão ""muito dolorosas"" nos EUA O Presidente norte-amerciano, Donald Trump, avisa que o número de casos da Covid-19 vai continuar a aumentar no país. Os Estados Unidos já ultrapassaram as 3.000 mortes devido à doença covid-19.","Donald Trump admite que o número de casos vai continuar a aumentar nos EUA © AFP
Por Lusa 31 Março, 2020 • 23:34 Partilhar este artigo Facebook
Facebook Twitter
Twitter WhatsApp
WhatsApp E-mail
E-mail Partilhar
O Presidente dos Estados Unidos da América (EUA), Donald Trump, alertou esta terça-feira que as próximas duas semanas serão ""muito dolorosas"" para a população, uma vez que o número de pessoas contagiadas pela doença provocada pelo SARS-CoV-2 continua a aumentar.
A anúncio foi feito durante uma conferência de imprensa na Casa Branca, em Washington, onde o chefe de Estado norte-americano acrescentou que as últimas duas semanas também foram ""muito difíceis"", citado pela agência France-Presse.
Os Estados Unidos já ultrapassaram as 3.000 mortes devido à doença covid-19.
O SARS-CoV-2, responsável pela pandemia da covid-19, já infetou mais de 828 mil pessoas em todo o mundo, das quais morreram mais de 41 mil.
Dos casos de infeção, pelo menos 165 mil são considerados curados.
Depois de surgir na China, em dezembro, o surto espalhou-se por todo o mundo, o que levou a Organização Mundial da Saúde a declarar uma situação de pandemia.",NA,https://www.tsf.pt/mundo/covid-19-proximas-duas-semanas-serao-muito-dolorosas-nos-eua-12013607.html,Próximas duas semanas serão ″ muito dolorosas ″ nos EUA,2020-04-01 01:34:00,0.9843554443053817,0.9673482531519765,0.987012987012987,0.977366255144033,0.9968520461699895,"Random Forests
('ranger' package, R 3.5.3.)
Wright MN, Ziegler A (2017). “ranger: A Fast Implementation of Random Forests for High Dimensional Data in C++ and R.” Journal of Statistical Software, 77(1), 1–17. doi: 10.18637/jss.v077.i01.",3731,0.40345280540439105,25,500,25,gini,classification,2020-03-30,Próximas duas semanas serão muito dolorosas nos EUA O Presidente norte-amerciano Donald Trump avisa que o número de casos da Covid-19 vai continuar a aumentar no país Os Estados Unidos já ultrapassaram as 3000 mortes devido à doença covid-19
1,ANA propõe aos trabalhadores licenças sem vencimento,"A ANA - Aeroportos de Portugal propõe aos trabalhadores licenças sem vencimento, redução em 20% do período normal de trabalho durante três meses e o gozo antecipado de férias para reduzir o impacto da crise provocada pelo novo coronavírus.",NA,2020-04-01 06:36:41,"ANA propõe aos trabalhadores licenças sem vencimento A ANA - Aeroportos de Portugal propõe aos trabalhadores licenças sem vencimento, redução em 20% do período normal de trabalho durante três meses e o gozo antecipado de férias para reduzir o impacto da crise provocada pelo novo coronavírus.","Numa carta enviada hoje aos trabalhadores, a que a Lusa teve acesso, o presidente executivo da ANA, Thierry Ligonnière, apela ""à adesão individual a uma ou mais medidas de apoio"", entre as quais constam a atribuição de licenças sem vencimento, redução temporária de 20% do período normal de trabalho durante três meses ou o gozo antecipado de férias relativas a 2020.

A empresa gestora dos aeroportos nacionais anuncia a aplicação de um corte de 20% nos salários da Comissão Executiva, a suspensão da distribuição de prémios durante o período da crise, da revisão da tabela salarial e da atualização do subsídio de refeição até ao final do ano.

Na extensa carta, Thierry Ligonnière informa ainda que ""deverão ser gozados os descansos compensatórios já vencidos e as férias relativas aos anos anteriores, até 30 de abril"" e que está suspensa a realização de trabalho suplementar, salvo autorização expressa da Comissão Executiva"".

Além disso, refere, foram interrompidas as ações de consultoria externa, as contratações e adiadas ações de manutenção preventiva em infraestruturas e equipamentos não críticos.

Assumindo que as medidas já adotadas ""serão provavelmente insuficientes"" para proteger o emprego, caso a recuperação não aconteça no curto prazo, a ANA apela então à ""mobilização voluntária e solidária dos trabalhadores da empresa"", através da adesão a uma ou mais das medidas propostas.

""Os diretores e a equipa de recursos humanos irão, nos próximos dias, fornecer mais detalhes sobre estas opções e sobre a adesão às mesmas"", explica.

O novo coronavírus, responsável pela pandemia da covid-19, já infetou mais de 828 mil pessoas em todo o mundo, das quais morreram mais de 41 mil. Dos casos de infeção, pelo menos 165 mil são considerados curados.

Depois de surgir na China, em dezembro, o surto espalhou-se por todo o mundo, o que levou a Organização Mundial da Saúde (OMS) a declarar uma situação de pandemia.

Em Portugal, segundo o balanço feito hoje pela Direção-Geral da Saúde, registaram-se 160 mortes e 7.443 casos de infeções confirmadas. Dos infetados, 627 estão internados, 188 dos quais em unidades de cuidados intensivos, e há 43 doentes que já recuperaram.

Portugal, onde os primeiros casos confirmados foram registados no dia 2 de março, encontra-se em estado de emergência desde as 00:00 de 19 de março e até às 23:59 de 2 de abril.

Leia Também: Covid-19: TAP avança com 'lay-off' para 90% dos trabalhadores

Recomendados para si",NA,https://www.noticiasaominuto.com/economia/1447134/ana-propoe-aos-trabalhadores-licencas-sem-vencimento,ANA propõe aos trabalhadores licenças sem vencimento,2020-04-01 00:32:27,0.9843554443053817,0.9673482531519765,0.987012987012987,0.977366255144033,0.9968520461699895,"Random Forests
('ranger' package, R 3.5.3.)
Wright MN, Ziegler A (2017). “ranger: A Fast Implementation of Random Forests for High Dimensional Data in C++ and R.” Journal of Statistical Software, 77(1), 1–17. doi: 10.18637/jss.v077.i01.",3731,0.40345280540439105,25,500,25,gini,classification,2020-03-30,ANA propõe aos trabalhadores licenças sem vencimento A ANA - Aeroportos de Portugal propõe aos trabalhadores licenças sem vencimento redução em 20 do período normal de trabalho durante três meses e o gozo antecipado de férias para reduzir o impacto da crise provocada pelo novo coronavírus
0,Rapper confirma fim do namoro com Adele em nova música,"'Mic Check' foi a forma que o músico encontrou para confirmar os rumores, garante a imprensa internacional.",NA,2020-04-01 06:36:43,"Rapper confirma fim do namoro com Adele em nova música 'Mic Check' foi a forma que o músico encontrou para confirmar os rumores, garante a imprensa internacional.","O rapper Skepta confirmou o fim do seu namoro com a cantor Adele através da sua nova música - 'Mic Check'. Esta foi a forma que o músico encontrou para confirmar os rumores, garante a imprensa internacional.

O tema lançado recentemente fala sobre a dificuldade em conseguir gerir relações amorosas entre e com celebridades.

De acordo com o jornal britânico The Sun, o tema não só confirma o fim do namoro como também mostra que este não está a saber lidar da melhor forma com a rutura.

Recorde-se que o romance entre Adele e Skepta tornou-se público em outubro do ano passado. Meses antes desta paixão pela cantora, o rapper tinha mantido um breve relacionamento com a antiga modelo Naomi Campbell e também ela é mencionada no tema.

Siga o link

Leia Também: Samantha Fox e a namorada estão noivas",NA,https://lifestyle.sapo.pt/fama/noticias-fama/artigos/rapper-confirma-fim-do-namoro-com-adele-em-nova-musica,Rapper confirma fim do namoro com Adele em nova música,NA,0.9843554443053817,0.9673482531519765,0.987012987012987,0.977366255144033,0.9968520461699895,"Random Forests
('ranger' package, R 3.5.3.)
Wright MN, Ziegler A (2017). “ranger: A Fast Implementation of Random Forests for High Dimensional Data in C++ and R.” Journal of Statistical Software, 77(1), 1–17. doi: 10.18637/jss.v077.i01.",3731,0.40345280540439105,25,500,25,gini,classification,2020-03-30,Rapper confirma fim do namoro com Adele em nova música Mic Check foi a forma que o músico encontrou para confirmar os rumores garante a imprensa internacional
0,"EUA: Mais de 700 mortos num dia. Trump pede a cidadãos que se ""preparem""","Esta terça-feira, os Estados Unidos ultrapassaram pela primeira vez a barreira das 700 vítimas mortais num dia. No seu briefing diário, Donald Trump disse aos americanos que se aproximam ""duas semanas difíceis"".",Anabela Sousa Dantas,2020-04-01 06:36:43,"EUA: Mais de 700 mortos num dia. Trump pede a cidadãos que se ""preparem"" Esta terça-feira, os Estados Unidos ultrapassaram pela primeira vez a barreira das 700 vítimas mortais num dia. No seu briefing diário, Donald Trump disse aos americanos que se aproximam ""duas semanas difíceis"".","Os Estados Unidos registaram esta terça-feira mais de 700 mortes por causa da doença Covid-19, ligada à pandemia do novo coronavírus, avança a Reuters. É um número recorde desde o eclodir do surto viral no país, onde, até há uns dias, o presidente garantia que tudo estaria a funcionar na normalidade por altura da Páscoa.
Donald Trump, na imagem acima acompanhado pelo seu principal perito em doenças infecciosas, Anthoni Fauci, tem agora um discurso bastante diferente. ""Quero que cada americano esteja preparado para os dias difíceis que se avizinham. Vamos atravessar duas semanas muito difíceis"", disse o governante republicano, em conferência de imprensa, esta terça-feira, a partir de Washington.
O presidente disse ainda que estão a ser recolhidos cerca de 10 mil ventiladores porque ""o aumento [de casos] está a chegar"". ""E depois, com esperança, (...) vamos começar a ver alguma luz ao fundo do túnel, mas estas vão ser duas semanas muito, muito dolorosas"", disse.
O número de mortes relacionadas com a Covid-19 nos Estados Unidos deverá agora ultrapassar as 3.700, aguardando-se a divulgação dos números oficiais. Sublinhe-se que a maior parte das mortes ocorre no estado de Nova Iorque, o epicentro do surto virtal no país.
Os Estados Unidos registam mais de 185 mil casos confirmados de infeção pelo novo coronavírus e 6.000 já recuperaram da doença, segundo a contagem da Universidade Johns Hopkins.
Leia Também: Covid-19: ""Por favor, venham ajudar-nos em Nova Iorque. Agora""
Recomendados para si",NA,https://www.noticiasaominuto.com/mundo/1447131/eua-mais-de-700-mortos-num-dia-trump-pede-a-cidadaos-que-se-preparem,EUA : Mais de 700 mortos num dia . Trump pede a cidadãos que se  preparem  ,2020-04-01 01:30:00,0.9843554443053817,0.9673482531519765,0.987012987012987,0.977366255144033,0.9968520461699895,"Random Forests
('ranger' package, R 3.5.3.)
Wright MN, Ziegler A (2017). “ranger: A Fast Implementation of Random Forests for High Dimensional Data in C++ and R.” Journal of Statistical Software, 77(1), 1–17. doi: 10.18637/jss.v077.i01.",3731,0.40345280540439105,25,500,25,gini,classification,2020-03-30,EUA Mais de 700 mortos num dia Trump pede a cidadãos que se preparem Esta terça-feira os Estados Unidos ultrapassaram pela primeira vez a barreira das 700 vítimas mortais num dia No seu briefing diário Donald Trump disse aos americanos que se aproximam duas semanas difíceis
NA,COMUNICAÇÃO SOCIAL,A par com o mundo.,NA,2020-04-01 06:36:45,COMUNICAÇÃO SOCIAL A par com o mundo.,"Opinião de Pedro Santos Guerreiro

“Sem apoios, há jornais que vão fechar”

31 mar, 2020 - 20:50

A crise do coronavírus agravou os cortes nas receitas publicitárias. Sem apoios estatais há órgãos de comunicação social que vão fechar, alerta Pedro Santos Guerreiro no espaço de comentário na Renascença. O jornalista também analisa a moratória aos créditos e defende que ""os bancos deviam ser solidários e não acrescer juros” em tempo de pandemia.",NA,https://rr.sapo.pt/comunicacao-social/tag/1374/,COMUNICAO SOCIAL - Renascença,NA,0.9843554443053817,0.9673482531519765,0.987012987012987,0.977366255144033,0.9968520461699895,"Random Forests
('ranger' package, R 3.5.3.)
Wright MN, Ziegler A (2017). “ranger: A Fast Implementation of Random Forests for High Dimensional Data in C++ and R.” Journal of Statistical Software, 77(1), 1–17. doi: 10.18637/jss.v077.i01.",3731,0.40345280540439105,25,500,25,gini,classification,2020-03-30,COMUNICAÇÃO SOCIAL A par com o mundo
0,"Ângelo Rodrigues ironiza ao dizer que atores vão tornar-se ""sem-abrigo""","Segundo a estrela da SIC, este será ""o futuro"" da sua profissão ""depois da quarentena"".",NA,2020-04-01 06:36:48,"Ângelo Rodrigues ironiza ao dizer que atores vão tornar-se ""sem-abrigo"" Segundo a estrela da SIC, este será ""o futuro"" da sua profissão ""depois da quarentena"".","Ângelo Rodrigues deu largas à sua veia de humorista esta terça-feira, dia 31, e usou as suas redes sociais para divertir os seus seguidores com uma nova piada sobre os efeitos da pandemia do novo coronavírus.

""O futuro da minha profissão depois da quarentena"", brincou a estrela da SIC ao partilhar na sua conta oficial de Instagram uma fotografia onde se mostra a pedir esmola na rua.

""Mendigo"", ""sem-abrigo"", acrescentou o ator nas hashtags da publicação, prevendo assim os efeitos que terá a pandemia no setor da cultura.

Leia Também: Confirmado: Marco Horácio estreia novo programa na TVI já este domingo",NA,https://lifestyle.sapo.pt/fama/noticias-fama/artigos/angelo-rodrigues-ironiza-ao-dizer-que-atores-vao-tornar-se-sem-abrigo,Ângelo Rodrigues ironiza ao dizer que atores vão tornar - se  sem - abrigo  ,NA,0.9843554443053817,0.9673482531519765,0.987012987012987,0.977366255144033,0.9968520461699895,"Random Forests
('ranger' package, R 3.5.3.)
Wright MN, Ziegler A (2017). “ranger: A Fast Implementation of Random Forests for High Dimensional Data in C++ and R.” Journal of Statistical Software, 77(1), 1–17. doi: 10.18637/jss.v077.i01.",3731,0.40345280540439105,25,500,25,gini,classification,2020-03-30,Ângelo Rodrigues ironiza ao dizer que atores vão tornar-se sem-abrigo Segundo a estrela da SIC este será o futuro da sua profissão depois da quarentena
0,O teor de terylene,"Repugnante, disse António Costa de posição do ministro das finanças holandês em discussão sobre o que a União Europeia deveria fazer contra a pandemia de Corona Vírus. Lembrei-me de Jaime Gama, em último dia de ministro antes da chegada de Pires de Miranda no primeiro governo de Cavaco Silva - falávamos de Timor - ″A política externa holandesa faz-me nojo″. Holandês que me é muito querido e me aconselhara há anos a nunca esquecer que eles eram os heróis de Srebrenica, mais indignado ainda do que Costa, disse-me enojado: isto não é um país é um negócio.",José Cutileiro,2020-04-01 06:36:48,"O teor de terylene Repugnante, disse António Costa de posição do ministro das finanças holandês em discussão sobre o que a União Europeia deveria fazer contra a pandemia de Corona Vírus. Lembrei-me de Jaime Gama, em último dia de ministro antes da chegada de Pires de Miranda no primeiro governo de Cavaco Silva - falávamos de Timor - ″A política externa holandesa faz-me nojo″. Holandês que me é muito querido e me aconselhara há anos a nunca esquecer que eles eram os heróis de Srebrenica, mais indignado ainda do que Costa, disse-me enojado: isto não é um país é um negócio.","Repugnante, disse António Costa de posição do ministro das finanças holandês em discussão sobre o que a União Europeia deveria fazer contra a pandemia de Corona Vírus. Lembrei-me de Jaime Gama, em último dia de ministro antes da chegada de Pires de Miranda no primeiro governo de Cavaco Silva - falávamos de Timor - ""A política externa holandesa faz-me nojo"". Holandês que me é muito querido e me aconselhara há anos a nunca esquecer que eles eram os heróis de Srebrenica, mais indignado ainda do que Costa, disse-me enojado: isto não é um país é um negócio.
Os holandeses têm costas largas - foi a administração de país europeu ocupado pelos nazis que melhor colaborou com estes na caça aos judeus - mas o nosso mais antigo aliado tirara-nos metade da África que considerávamos nossa com ultimatum que sabiam termos de aceitar e nós próprios nos metemos em guerras coloniais nocivas para muitos dos nossos parceiros da NATO (por não sermos uma democracia não havíamos podido entrar para a CEE, mas fomos membro fundador da NATO - com coisas sérias não se brinca). Não há estados santos - nem a Santa Sé.
Porque é que o mito do amor da paz - e de exemplo para o mundo - animou os países que são hoje a União Europeia desde o fim da segunda guerra mundial, em 1945 - depois de terem andado dois mil anos à pancada uns com os outros?. Alemanha, vencida e dividida, estava arrasada; os vencedores (Grã-Bretanha e, graças ao génio e à coragem de De Gaulle, França) não podiam com uma gata pelo rabo; os verdadeiros vencedores (EUA e URSS) tinham dividido entre si a Europa do pós-guerra - exceto a Grécia, que entrou em guerra civil. O Ocidente europeu vivia no terror de Estaline (sem este não teriam havido UE nem NATO) e sabia só se poder defender da Rússia contando com os arsenais nuclear e convencional americanos. Assim o mito foi crescendo, ajudado também pela NATO que, além de nos defender dos russos, nos defendia uns dos outros. Com o fim da União Soviética, acabou-se a papa doce e chegámos ao Corona Vírus que em vez de nos aproximar nos afasta mais uns dos outros. A ilusão do exemplo a dar ao mundo desvaneceu-se, a maldade volta ao de cima e até nós - dos mais decentes nesta crise - não sairemos dela melhores do que nela entrámos.
Há muitos anos, a convite do Professor Ferrer Correia, vim de Princeton ao Convento de Santa Clara em Coimbra para seminário sobre a Europa. Sentei-me na primeira fila e quando a minha vez chegou mudei-me para a mesa, encarando o público. Casa cheia de homens e mulheres novos cujas caras, roupas, jeitos, olhares de manha triste me fizeram, de repente, sentir no Kosovo. Contei ao Bernardo Futscher e ele explicou-me: «É o teor de terylene, Senhor Embaixador».
Passada esta praga, se a Dra. Isabel Mota me convidar para falar sobre a Europa no Convento de Santa Clara, ao enfrentar o público, aposto dobrado contra singelo que me sentirei apanhado outra vez pelo bafo do Kosovo, onde há muito deixei de ir.",NA,https://www.tsf.pt/opiniao/o-teor-de-terylene-12012672.html,O teor de terylene,2020-03-31 21:01:00,0.9843554443053817,0.9673482531519765,0.987012987012987,0.977366255144033,0.9968520461699895,"Random Forests
('ranger' package, R 3.5.3.)
Wright MN, Ziegler A (2017). “ranger: A Fast Implementation of Random Forests for High Dimensional Data in C++ and R.” Journal of Statistical Software, 77(1), 1–17. doi: 10.18637/jss.v077.i01.",3731,0.40345280540439105,25,500,25,gini,classification,2020-03-30,O teor de terylene Repugnante disse António Costa de posição do ministro das finanças holandês em discussão sobre o que a União Europeia deveria fazer contra a pandemia de Corona Vírus Lembrei-me de Jaime Gama em último dia de ministro antes da chegada de Pires de Miranda no primeiro governo de Cavaco Silva - falávamos de Timor - A política externa holandesa faz-me nojo Holandês que me é muito querido e me aconselhara há anos a nunca esquecer que eles eram os heróis de Srebrenica mais indignado ainda do que Costa disse-me enojado isto não é um país é um negócio
