prediction_covid_topic,title,description,authors,date_download,date_publish,maintext,url,gdelt_title,gdelt_url,modeSearch,sourcecountrySearch,termSearch,periodtimeSearch,isOR,countMaximumRecords,urlGDELTV2FTAPI,urlArticleMobile,datetimeArticle,urlImage,domainArticle,languageArticle,countryArticle,pred_input,model_accuracy,model_kappa,model_f1,model_precision,model_recall,model,sample_size,train_prop_covid,mtry,n_tree,min_node_size,splitrule,model_type,fitted_on
1,"Sem direito a despedida por causa da Covid-19, três astronautas partem para a Estação Espacial",NASA mostra o lançamento da Soyuz em direto na internet.,Global Media Group,2020-04-09 13:15:24,2020-04-09 11:01:00,"Chris Cassidy, Anatoly Ivanishin e Ivan Vagner © AFP/Russian space agency Roscosmos/Ivan Tim
Por Carolina Rico 09 Abril, 2020 • 09:01 Partilhar este artigo Facebook
Facebook Twitter
Twitter WhatsApp
WhatsApp E-mail
E-mail Partilhar
Sem família nem amigos na despedida, o norte-americano Chris Cassidy e os russos Anatoli Ivanichin e Ivan Vagner partem esta manhã para a Estação Espacial Internacional.
Chris Cassidy diz que as últimas duas semanas foram ""estranhas"". Os três astronautas sabiam que iam ficar em quarentena antes de partir, medida preventiva que faz parte do protocolo de todas as viagens espaciais, mas não esperavam que toda a restante equipa estivesse também de quarentena devido à Covid-19.
A descolagem do Cosmódromo russo de Baikonur, no Cazaquistão, também não conta com a presença de jornalistas, mas a NASA transmite o lançamento em direto online:
Em conferência de imprensa através de videoconferência antes de entrar para a Soyuz-2.1a, Chris Cassidy, que viaja pela terceira vez para o espaço, lembrou que em condições normais estaria a falar com pessoas, não para câmaras,
A tripulação sente falta da família neste momento, reconhece, mas todos compreendem que ""o mundo inteiro também é afetado pela mesma crise"".
Desta vez, o isolamento foi ""ainda maior"", lamentou também Anatoli Ivanichin.
Chris Cassidy, Anatoli Ivanichin e Ivan Vagner partem para para uma missão de seis meses a bordo da Estação Espacial Internacional a bordo de um fugurtão Soyuz-2.1a, já que a agência russa Roskosmos parou de usar os Soyuz-FGs no ano passado.
Este novo modelo, usado para lançamentos não tripulados desde 2004, possui sistemas de comando digital em vez dos analógicos do modelo anterior, explica a AFP.
Segundo Ivanichin, o novo sistema exigirá menos intervenção manual em caso de emergência. ""O sistema melhorou, mas é muito cedo para saber se será mais fácil de controlar"", comentou.
A Estação Espacial Internacional tem capacidade para seis pessoas, mas a NASA não confirmou ainda se a viagem dos astronautas Oleg Skripochka Andrew Morgan e Jessica Meir se realizará como previsto, a 17 de abril.
LEIA AQUI TUDO SOBRE A COVID-19",https://www.tsf.pt/futuro/sem-publico-na-despedida-por-causa-da-covid-19-tres-astronautas-partem-esta-manha-para-a-eei-12050742.html,"Sem direito a despedida por causa da Covid - 19 , três astronautas partem para a Estao Espacial",https://www.tsf.pt/futuro/sem-publico-na-despedida-por-causa-da-covid-19-tres-astronautas-partem-esta-manha-para-a-eei-12050742.html,artlist,PO,,100 minutes,FALSE,250,https://api.gdeltproject.org/api/v2/doc/doc?query=%20sourcecountry:po&sourcelang:por&mode=artlist&format=json&timespan=100&maxrecords=250&sort=datedesc,https://www.tsf.pt/futuro/amp/sem-publico-na-despedida-por-causa-da-covid-19-tres-astronautas-partem-esta-manha-para-a-eei-12050742.html,2020-04-09T08:45:00Z,https://static.globalnoticias.pt/tsf/image.aspx?brand=TSF&type=generate&guid=7591c525-c72a-4fb9-a8a9-21e1b04756b8&watermark=true&t=20200409090100,tsf.pt,Portuguese,Portugal,"Chris Cassidy, Anatoly Ivanishin e Ivan Vagner © AFP/Russian space agency Roscosmos/Ivan Tim
Por Carolina Rico 09 Abril, 2020 • 09:01 Partilhar este artigo Facebook
Facebook Twitter
Twitter WhatsApp
WhatsApp E-mail
E-mail Partilhar
Sem família nem amigos na despedida, o norte-americano Chris Cassidy e os russos Anatoli Ivanichin e Ivan Vagner partem esta manhã para a Estação Espacial Internacional.
Chris Cassidy diz que as últimas duas semanas foram ""estranhas"". Os três astronautas sabiam que iam ficar em quarentena antes de partir, medida preventiva que faz parte do protocolo de todas as viagens espaciais, mas não esperavam que toda a restante equipa estivesse também de quarentena devido à Covid-19.
A descolagem do Cosmódromo russo de Baikonur, no Cazaquistão, também não conta com a presença de jornalistas, mas a NASA transmite o lançamento em direto online:
Em conferência de imprensa através de videoconferência antes de entrar para a Soyuz-2.1a, Chris Cassidy, que viaja pela terceira vez para o espaço, lembrou que em condições normais estaria a falar com pessoas, não para câmaras,
A tripulação sente falta da família neste momento, reconhece, mas todos compreendem que ""o mundo inteiro também é afetado pela mesma crise"".
Desta vez, o isolamento foi ""ainda maior"", lamentou também Anatoli Ivanichin.
Chris Cassidy, Anatoli Ivanichin e Ivan Vagner partem para para uma missão de seis meses a bordo da Estação Espacial Internacional a bordo de um fugurtão Soyuz-2.1a, já que a agência russa Roskosmos parou de usar os Soyuz-FGs no ano passado.
Este novo modelo, usado para lançamentos não tripulados desde 2004, possui sistemas de comando digital em vez dos analógicos do modelo anterior, explica a AFP.
Segundo Ivanichin, o novo sistema exigirá menos intervenção manual em caso de emergência. ""O sistema melhorou, mas é muito cedo para saber se será mais fácil de controlar"", comentou.
A Estação Espacial Internacional tem capacidade para seis pessoas, mas a NASA não confirmou ainda se a viagem dos astronautas Oleg Skripochka Andrew Morgan e Jessica Meir se realizará como previsto, a 17 de abril.
LEIA AQUI TUDO SOBRE A COVID-19",0.9646357051555177,0.9280809565036006,0.9686674216685542,0.970499243570348,0.9668425018839487,"Random Forests
('ranger' package, R 3.5.3.)
Wright MN, Ziegler A (2017). “ranger: A Fast Implementation of Random Forests for High Dimensional Data in C++ and R.” Journal of Statistical Software, 77(1), 1–17. doi: 10.18637/jss.v077.i01.",5479,0.4347048300536673,204,500,20,gini,classification,2020-04-05
1,Eurogrupo retoma reunião para tentar acordo de resposta comum à Covid-19,Os ministros das Finanças europeus retomam esta quinta-feira a reunião por videoconferência iniciada na terça-feira e interrompida na quarta para tentar chegar a um acordo político sobre a resposta económica da União Europeia à crise provocada pela Covid-19.,Global Media Group,2020-04-09 13:15:25,2020-04-09 11:14:00,"O presidente do Eurogrupo, Mário Centeno © François Walschaerts/AFP
Por Lusa 09 Abril, 2020 • 09:14 Partilhar este artigo Facebook
Facebook Twitter
Twitter WhatsApp
WhatsApp E-mail
E-mail Partilhar
Esta reunião do Eurogrupo, considerada decisiva e conduzida por videoconferência desde Lisboa pelo ministro Mário Centeno, teve início na terça-feira à tarde e foi suspensa ao início da manhã de quarta-feira, após 16 horas de discussões sem que fosse possível chegar a um consenso, que tarda em ser alcançado, embora os responsáveis políticos garantam que já falta pouco.
""Após 16 horas de discussões, chegámos perto de um acordo, mas ainda não estamos lá. Suspendi o Eurogrupo e [a discussão] continua amanhã, quinta-feira"", anunciou após a primeira ronda da 'maratona' negocial o presidente do fórum de ministros das Finanças da zona euro e ministro das Finanças português, acrescentando que os seus objetivos permanecem os mesmos.
Antes da reunião, alargada aos países que não têm a moeda única, Centeno disse esperar um acordo sobre um pacote financeiro de emergência robusto para trabalhadores, empresas e países, no valor total de cerca de 500 mil milhões de euros, bem como um ""compromisso claro"" relativamente a um plano de recuperação (posterior) de grande envergadura.
Dois dos três elementos do pacote, as 'redes de segurança' para trabalhadores e para empresas, parecem pacíficos, dado o consenso em torno do programa de 100 mil milhões de euros proposto pela Comissão Europeia para financiar regimes de proteção de emprego e uma garantia de 200 mil milhões de euros do Banco Europeu de Investimento para apoiar as empresas em dificuldades, especialmente as pequenas e médias empresas.
A questão que continua a dividir os Estados-membros é a forma como apoiar os Estados, já que países como Alemanha e Holanda continuam irredutíveis na sua oposição à solução de emissão conjunta de dívida -- os 'coronabonds' ou 'eurobonds', defendidos por Itália, Espanha e Portugal, entre outros -, e mesmo a solução que parece mais próxima de colher unanimidade, as linhas de crédito do Mecanismo Europeu de Estabilidade (MEE), continua a provocar divergências, designadamente sobre as condições que penderão sobre estes empréstimos, e encontra muita resistência por parte de Itália.
Os ministros das Finanças estão então 'obrigados' a chegar a um compromisso sobre o apoio aos Estados-membros, pois foi essa a missão que lhes foi confiada pelos chefes de Estado e de Governo da UE na última cimeira, por videoconferência, realizada em 26 de março.
No final desse Conselho Europeu também marcado por divergências e fortes tensões, os líderes solicitaram ao Eurogrupo que apresentasse propostas concretas no prazo de duas semanas, prazo esse que 'expira' precisamente hoje.
A videoconferência do Eurogrupo será retomada às 16h00 de Lisboa, 17h00 de Bruxelas.
LEIA TUDO SOBRE A PANDEMIA DE COVID-19",https://www.tsf.pt/mundo/eurogrupo-retoma-reuniao-para-tentar-acordo-para-resposta-comum-a-covid-19-12050561.html,Eurogrupo retoma reunião para tentar acordo de resposta comum à Covid - 19,https://www.tsf.pt/mundo/eurogrupo-retoma-reuniao-para-tentar-acordo-para-resposta-comum-a-covid-19-12050561.html,artlist,PO,,100 minutes,FALSE,250,https://api.gdeltproject.org/api/v2/doc/doc?query=%20sourcecountry:po&sourcelang:por&mode=artlist&format=json&timespan=100&maxrecords=250&sort=datedesc,https://www.tsf.pt/mundo/amp/eurogrupo-retoma-reuniao-para-tentar-acordo-para-resposta-comum-a-covid-19-12050561.html,2020-04-09T08:45:00Z,https://static.globalnoticias.pt/tsf/image.aspx?brand=TSF&type=generate&guid=a8d74989-0810-40a9-8779-663bce9fc4b3&watermark=true&t=20200409091400,tsf.pt,Portuguese,Portugal,"O presidente do Eurogrupo, Mário Centeno © François Walschaerts/AFP
Por Lusa 09 Abril, 2020 • 09:14 Partilhar este artigo Facebook
Facebook Twitter
Twitter WhatsApp
WhatsApp E-mail
E-mail Partilhar
Esta reunião do Eurogrupo, considerada decisiva e conduzida por videoconferência desde Lisboa pelo ministro Mário Centeno, teve início na terça-feira à tarde e foi suspensa ao início da manhã de quarta-feira, após 16 horas de discussões sem que fosse possível chegar a um consenso, que tarda em ser alcançado, embora os responsáveis políticos garantam que já falta pouco.
""Após 16 horas de discussões, chegámos perto de um acordo, mas ainda não estamos lá. Suspendi o Eurogrupo e [a discussão] continua amanhã, quinta-feira"", anunciou após a primeira ronda da 'maratona' negocial o presidente do fórum de ministros das Finanças da zona euro e ministro das Finanças português, acrescentando que os seus objetivos permanecem os mesmos.
Antes da reunião, alargada aos países que não têm a moeda única, Centeno disse esperar um acordo sobre um pacote financeiro de emergência robusto para trabalhadores, empresas e países, no valor total de cerca de 500 mil milhões de euros, bem como um ""compromisso claro"" relativamente a um plano de recuperação (posterior) de grande envergadura.
Dois dos três elementos do pacote, as 'redes de segurança' para trabalhadores e para empresas, parecem pacíficos, dado o consenso em torno do programa de 100 mil milhões de euros proposto pela Comissão Europeia para financiar regimes de proteção de emprego e uma garantia de 200 mil milhões de euros do Banco Europeu de Investimento para apoiar as empresas em dificuldades, especialmente as pequenas e médias empresas.
A questão que continua a dividir os Estados-membros é a forma como apoiar os Estados, já que países como Alemanha e Holanda continuam irredutíveis na sua oposição à solução de emissão conjunta de dívida -- os 'coronabonds' ou 'eurobonds', defendidos por Itália, Espanha e Portugal, entre outros -, e mesmo a solução que parece mais próxima de colher unanimidade, as linhas de crédito do Mecanismo Europeu de Estabilidade (MEE), continua a provocar divergências, designadamente sobre as condições que penderão sobre estes empréstimos, e encontra muita resistência por parte de Itália.
Os ministros das Finanças estão então 'obrigados' a chegar a um compromisso sobre o apoio aos Estados-membros, pois foi essa a missão que lhes foi confiada pelos chefes de Estado e de Governo da UE na última cimeira, por videoconferência, realizada em 26 de março.
No final desse Conselho Europeu também marcado por divergências e fortes tensões, os líderes solicitaram ao Eurogrupo que apresentasse propostas concretas no prazo de duas semanas, prazo esse que 'expira' precisamente hoje.
A videoconferência do Eurogrupo será retomada às 16h00 de Lisboa, 17h00 de Bruxelas.
LEIA TUDO SOBRE A PANDEMIA DE COVID-19",0.9646357051555177,0.9280809565036006,0.9686674216685542,0.970499243570348,0.9668425018839487,"Random Forests
('ranger' package, R 3.5.3.)
Wright MN, Ziegler A (2017). “ranger: A Fast Implementation of Random Forests for High Dimensional Data in C++ and R.” Journal of Statistical Software, 77(1), 1–17. doi: 10.18637/jss.v077.i01.",5479,0.4347048300536673,204,500,20,gini,classification,2020-04-05
1,"Newsweek: ""Alguma vez voltaremos para o escritório?""",Os jornais e revistas internacionais de hoje contados na TSF.,Global Media Group,2020-04-09 13:15:29,2020-04-09 09:57:00,"© Reprodução Newsweek
Por Ricardo Alexandre 09 Abril, 2020 • 07:57 Partilhar este artigo Facebook
Facebook Twitter
Twitter WhatsApp
WhatsApp E-mail
E-mail Partilhar
Um dia de sol, uma praia deserta, um mar azul... Acredito que seja o suficiente para sair de casa a correr e procurar a praia mais próxima mas estes não são dias para sair de casa e a descrição feita é apenas a da capa do diário espanhol ABC que assim ilustra a manchete. ""Governo prepara-se para fechar as fronteiras ao turismo no verão"". Teme uma segunda onda de contágios depois das férias e estuda também restrições de movimento ao turismo nacional. O setor prevê perdas de 17 mil milhões e exige a Pedro Sanchez ajudas para evitar o desaparecimento de milhares de empregos.
O jornal económico Cinco Dias, que faz menção à desistência de Bernie Sanders da corrida presidencial americana sem lhe mencionar o nome, dizendo ""Biden disputará com Trump a presidência dos Estados Unidos, o Cinco Dias na manchete fala em Recessão global: a OCDE deteta um retrocesso da atividade económica, sem precedentes, em março. Na capa, também o Eurogrupo à procura de um acordo e as divisões que ameaçam deixar a UE sem uma posição conjunta. Os patrões em Espanha fazem as contas e preveem que o PIB espanhol caia entre 5 e 9% este ano.
No El País, o bloqueio na União Europeia para conseguir um pacto ameaça a a sua economia: Berlim e Paris procuram forçar hoje no Eurogrupo um acordo de mínimos perante o confronto entre Itália e Holanda e a agudização da crise. Também na primeira do El País, Wuhan volta às ruas com jubilo depois de dois meses e meio de isolamento. E ainda: Sanders retira-se e deixa via livre a Biden como rival de Trump. Sem lavar as mãos da história, o El pais traz uma biografia que promete luz e rompe mitos sobre Pôncio Pilato.
Na La Razón, a manchete é ""Governo aprovará amanhã uma moratória de impostos para autónomos... entenda-se trabalhadores independentes - e PMEs, pequenas e médias empresas... há números que foram tornados públicos ontem e que estão na primeira do La Razón: 4 mil falecidos em lares de idosos de Madrid deram teste positivo ao novo coronavírus. 4 mil! Lá como cá, está na capa, do La Razón, uma operação Páscoa, para travar a ""grande evasão"". As principais estradas espanholas registaram engarrafamentos por causa da maior vigilância.
Em França, no Les Echos, o assunto forte é a cloroquina: as promessas e as questões... a eficácia no tratamento à Covid-19 suscita vivos debates, as alternativas à cloroquina e outros tratamentos E há números na primeira do Les Echos num gráfico que ilustra o título: cinco anos de crescimento apagados.
No Figaro, rastreamento digital, o plano para dominar a epidemia.
O presidente francês sobre um fundo vermelho faz a capa da revista L""Express: Macron, Ano Zero.
Na revista Le Point, há um inquérito sobre um choque económico histórico... chama-lhe A Crise do Século. Na capa do Le Point, há um Mário Vargas Llosa que diz que a Covid-19 ""delicia os inimigos da liberdade"" e um Kamel Daoud, escritor e jornalista argelino, editor do diário Oran, que aparece também na capa do Le Point e a referência é ao próprio jornal que edita: Oran na hora da nova peste. Na crise do século, o Le Point promete na capa que lá dentro podemos ler o pensamento de gente como Thomas Friedman e Francis Fukuyaman... gente das crises do século passado.
Outra revista disponível nas bancas é o Guardian Weekly... já tem data de 10 de abril, e fala em ""Air Race"", corrida aérea... o empurrão global para o fabrico de ventiladores. Pergunta também na capa se isto é o fim do petróleo? O que vem a seguir? E fala também na batalha de Boris Johnson... pela vida. Os sinais ontem era de que estava a melhorar.
No USA Today, o receio pelas eleições de novembro e a democracia no Wisconcin que teve primárias ontem: para votar tenho de arriscar a minha vida. Na foto, uma fila enorme de gente para votar, quase todos com máscara. Diz este jornal americano que as agências estatais falharam nos primeiros sinais de alarme.
O génio criativo da ilustração enquanto género jornalístico está na capa da revista Newsweek... a Estátua da Liberdade mudou de sítio... está sentada, pernas cruzadas, portátil no colo, chávena de café na mão daquelas que dizem I love New York com o coração a vermelho, roupão branco vestido. O título é ""trabalhar de casa-nação"". A Newsweek diz que a crise do coronavírus acabará um dia. Mas pergunta: alguma vez voltaremos para o escritório?",https://www.tsf.pt/mundo/newsweek-alguma-vez-voltaremos-para-o-escritorio-12050591.html,Newsweek : ″ Alguma vez voltaremos para o escritório ?″ ,https://www.tsf.pt/mundo/newsweek-alguma-vez-voltaremos-para-o-escritorio-12050591.html,artlist,PO,,100 minutes,FALSE,250,https://api.gdeltproject.org/api/v2/doc/doc?query=%20sourcecountry:po&sourcelang:por&mode=artlist&format=json&timespan=100&maxrecords=250&sort=datedesc,https://www.tsf.pt/mundo/amp/newsweek-alguma-vez-voltaremos-para-o-escritorio-12050591.html,2020-04-09T08:45:00Z,https://static.globalnoticias.pt/tsf/image.aspx?brand=TSF&type=generate&guid=37b4ecb0-c48b-474a-bbf9-b2b5d8ee74ad&watermark=true&t=20200409075700,tsf.pt,Portuguese,Portugal,"© Reprodução Newsweek
Por Ricardo Alexandre 09 Abril, 2020 • 07:57 Partilhar este artigo Facebook
Facebook Twitter
Twitter WhatsApp
WhatsApp E-mail
E-mail Partilhar
Um dia de sol, uma praia deserta, um mar azul... Acredito que seja o suficiente para sair de casa a correr e procurar a praia mais próxima mas estes não são dias para sair de casa e a descrição feita é apenas a da capa do diário espanhol ABC que assim ilustra a manchete. ""Governo prepara-se para fechar as fronteiras ao turismo no verão"". Teme uma segunda onda de contágios depois das férias e estuda também restrições de movimento ao turismo nacional. O setor prevê perdas de 17 mil milhões e exige a Pedro Sanchez ajudas para evitar o desaparecimento de milhares de empregos.
O jornal económico Cinco Dias, que faz menção à desistência de Bernie Sanders da corrida presidencial americana sem lhe mencionar o nome, dizendo ""Biden disputará com Trump a presidência dos Estados Unidos, o Cinco Dias na manchete fala em Recessão global: a OCDE deteta um retrocesso da atividade económica, sem precedentes, em março. Na capa, também o Eurogrupo à procura de um acordo e as divisões que ameaçam deixar a UE sem uma posição conjunta. Os patrões em Espanha fazem as contas e preveem que o PIB espanhol caia entre 5 e 9% este ano.
No El País, o bloqueio na União Europeia para conseguir um pacto ameaça a a sua economia: Berlim e Paris procuram forçar hoje no Eurogrupo um acordo de mínimos perante o confronto entre Itália e Holanda e a agudização da crise. Também na primeira do El País, Wuhan volta às ruas com jubilo depois de dois meses e meio de isolamento. E ainda: Sanders retira-se e deixa via livre a Biden como rival de Trump. Sem lavar as mãos da história, o El pais traz uma biografia que promete luz e rompe mitos sobre Pôncio Pilato.
Na La Razón, a manchete é ""Governo aprovará amanhã uma moratória de impostos para autónomos... entenda-se trabalhadores independentes - e PMEs, pequenas e médias empresas... há números que foram tornados públicos ontem e que estão na primeira do La Razón: 4 mil falecidos em lares de idosos de Madrid deram teste positivo ao novo coronavírus. 4 mil! Lá como cá, está na capa, do La Razón, uma operação Páscoa, para travar a ""grande evasão"". As principais estradas espanholas registaram engarrafamentos por causa da maior vigilância.
Em França, no Les Echos, o assunto forte é a cloroquina: as promessas e as questões... a eficácia no tratamento à Covid-19 suscita vivos debates, as alternativas à cloroquina e outros tratamentos E há números na primeira do Les Echos num gráfico que ilustra o título: cinco anos de crescimento apagados.
No Figaro, rastreamento digital, o plano para dominar a epidemia.
O presidente francês sobre um fundo vermelho faz a capa da revista L""Express: Macron, Ano Zero.
Na revista Le Point, há um inquérito sobre um choque económico histórico... chama-lhe A Crise do Século. Na capa do Le Point, há um Mário Vargas Llosa que diz que a Covid-19 ""delicia os inimigos da liberdade"" e um Kamel Daoud, escritor e jornalista argelino, editor do diário Oran, que aparece também na capa do Le Point e a referência é ao próprio jornal que edita: Oran na hora da nova peste. Na crise do século, o Le Point promete na capa que lá dentro podemos ler o pensamento de gente como Thomas Friedman e Francis Fukuyaman... gente das crises do século passado.
Outra revista disponível nas bancas é o Guardian Weekly... já tem data de 10 de abril, e fala em ""Air Race"", corrida aérea... o empurrão global para o fabrico de ventiladores. Pergunta também na capa se isto é o fim do petróleo? O que vem a seguir? E fala também na batalha de Boris Johnson... pela vida. Os sinais ontem era de que estava a melhorar.
No USA Today, o receio pelas eleições de novembro e a democracia no Wisconcin que teve primárias ontem: para votar tenho de arriscar a minha vida. Na foto, uma fila enorme de gente para votar, quase todos com máscara. Diz este jornal americano que as agências estatais falharam nos primeiros sinais de alarme.
O génio criativo da ilustração enquanto género jornalístico está na capa da revista Newsweek... a Estátua da Liberdade mudou de sítio... está sentada, pernas cruzadas, portátil no colo, chávena de café na mão daquelas que dizem I love New York com o coração a vermelho, roupão branco vestido. O título é ""trabalhar de casa-nação"". A Newsweek diz que a crise do coronavírus acabará um dia. Mas pergunta: alguma vez voltaremos para o escritório?",0.9646357051555177,0.9280809565036006,0.9686674216685542,0.970499243570348,0.9668425018839487,"Random Forests
('ranger' package, R 3.5.3.)
Wright MN, Ziegler A (2017). “ranger: A Fast Implementation of Random Forests for High Dimensional Data in C++ and R.” Journal of Statistical Software, 77(1), 1–17. doi: 10.18637/jss.v077.i01.",5479,0.4347048300536673,204,500,20,gini,classification,2020-04-05
