prediction_covid_topic,title,description,authors,date_download,maintext,url,gdelt_title,gdelt_url,date_publish,modeSearch,sourcecountrySearch,termSearch,periodtimeSearch,isOR,countMaximumRecords,urlGDELTV2FTAPI,urlArticleMobile,datetimeArticle,urlImage,domainArticle,languageArticle,countryArticle,pred_input,model_accuracy,model_kappa,model_f1,model_precision,model_recall,model,sample_size,train_prop_covid,mtry,n_tree,min_node_size,splitrule,model_type,fitted_on
1,"Hart, a ""ilha da morte"" onde estão a ser enterradas as vítimas de Covid-19","Um cemitério público onde só se chega de barco. Um território imenso, carregado de história e de gente que não mereceu um adeus. Há mais de um século que Hart é a última morada dos indigentes, dos anónimos, dos não reclamados. E agora, também das vítimas da Covid-19.",Global Media Group,2020-04-14 06:19:09,"Sara Gerivaz Ontem às 22:11 Facebook
Twitter
Partilhar
Um cemitério público onde só se chega de barco. Um território imenso, carregado de história e de gente que não mereceu um adeus. Há mais de um século que Hart é a última morada dos indigentes, dos anónimos, dos não reclamados. E agora, também das vítimas da Covid-19.
Uma ""ilha da morte"" onde não há despedidas. Hart é desde 1868 um cemitério que não conhece afetos. Ao longo de mais de 150 anos, o terreno com cerca de 40 hectares junto à costa de Bronx, em Nova Iorque, tem sepultado milhares de corpos. Funcionou também como um campo de prisioneiros durante a Guerra Civil, um hospital psiquiátrico, um centro de tratamento de álcool e drogas. Passou pela Gripe Espanhola e pela epidemia de VIH e serviu de local para quarentena de vítimas de febre amarela e tuberculose.
Durante décadas, o trabalho duro era feito pelos reclusos de uma das prisões da ilha de Rikers, mas a pandemia de Covid-19 mudou as regras. Foi contratada uma equipa de dez trabalhadores para tratar dos enterros em Hart.
Covid-19 voltou a abrir a ferida sobre a Ilha de Hart
Nova Iorque está no olho do furacão da Covid-19 e é de longe o Estado dos EUA mais afetado pelo novo coronavírus, tendo já ultrapassado a barreira dos 10 mil óbitos. Por isso, o maior cemitério público do país voltou a ser necessário. Desde a semana passada que os mortos não reclamados no espaço de duas semanas estão a ser levados para a ilha de Hart. Antes da pandemia, os corpos ficavam meses nas morgues à espera que um familiar surgisse.
As imagens das valas comuns são impressionantes. No terreno lamacento, abrem-se trincheiras para onde vão os caixões de madeira despidos de flores. Não há luto. Não há despedida.
Cerca de 25 pessoas são levadas para Hart todos os dias, tantas quantas eram ali enterradas todas as semanas antes da Covid-19, de acordo com o Departamento de Correção de Nova Iorque, que administra os enterros na ilha.
Utilizar o cemitério público da cidade em caso de pandemia já tinha sido equacionado há mais de uma década num plano de contingência redigido pelo médico legista da cidade da altura, explicou Mark D. Levine, vereador da Saúde.
Mas o número de mortes registadas na cidade de Nova Iorque pode obrigar a que não sejam apenas os mortos não reclamados a ir para a ilha de Hart. De acordo com o ""The New York Times"", as agências funerárias estão a ficar sem espaço para guardar os corpos e temem ter que dar más notícias às famílias. Ser enterrado em Hart é duro para os nova-iorquinos.
""O número devastador de mortes a que estamos a assistir significa que, infelizmente, estamos a perder muitas pessoas sem família ou amigos para enterrá-las. Essas pessoas serão enterradas na Ilha de Hart, com todo respeito e dignidade que Nova Iorque pode oferecer"", escreveu o autarca de Nova Iorque, Bill de Blassio, na semana passada, no Twitter, onde lamentou as fotografias ""devastadoras"" que estão a correr o mundo. ""Lembrem-se, são seres humanos. São vizinhos que perdemos"".
As publicações mereceram resposta de Melinda Hunt, fundadora de uma associação sem fins lucrativos ligada à história da ilha. Também pelo Twitter, Hunt sublinhou que ""os enterros na ilha de Hart não são desrespeitosos agora que o trabalho dos presos terminou"". E, em declarações ao ""The New York Times"", defendeu que os enterros em Hart podem ser a alternativa mais segura e organizada durante a pandemia de Covid-19: ""Este é um sistema de enterro experimentado e testado, usado pela cidade durante a epidemia de gripe de 1918."" Hunt explicou ainda que há uma grande capacidade de recuperar os corpos posteriormente, para enterros particulares ou cremações.
Honrar a memória dos anónimos com cemitério interativo
Identificar os mortos, dar-lhes um nome e um rosto. Honrá-los. O ""Hart Island Project"" foi criado em 2011 para apoiar as famílias dos enterrados e criou uma base de dados sobre os milhares de desconhecidos da ilha. A ideia de Melinda Hunt foi enaltecer a história dos anónimos e torná-los menos anónimos. Por isso, o ""Travelling Cloud Museum"" funciona como um cemitério online, interativo, onde é permitido acrescentar informações sobre mortos ou procurar alguém que tenha sido ali sepultado.
Em 2018, a instituição de caridade mapeou toda a ilha com a ajuda de um drone e de ""geotiffs"" (metadados de localização) de mais de 68 mil enterrados.
Em condições normais, Nova Iorque enterra cerca de mil corpos por ano, incluindo pessoas em situação de sem-abrigo, bebés mortos à nascença e pessoas cujas famílias não têm dinheiro para custear o funeral.",https://www.jn.pt/mundo/hart-a-ilha-da-morte-onde-estao-a-ser-enterradas-as-vitimas-de-covid-19-12064709.html,"Hart , a ″ ilha da morte ″ onde estão a ser enterradas as vítimas de Covid - 19",https://www.jn.pt/mundo/hart-a-ilha-da-morte-onde-estao-a-ser-enterradas-as-vitimas-de-covid-19-12064709.html,2020-04-14 00:11:00,artlist,PO,,240 minutes,FALSE,250,https://api.gdeltproject.org/api/v2/doc/doc?query=%20sourcecountry:po&sourcelang:por&mode=artlist&format=json&timespan=240&maxrecords=250&sort=datedesc,https://www.jn.pt/mundo/amp/hart-a-ilha-da-morte-onde-estao-a-ser-enterradas-as-vitimas-de-covid-19-12064709.html,2020-04-13T23:00:00Z,https://static.globalnoticias.pt/jn/image.aspx?brand=JN&type=generate&guid=58765d68-fa7c-4f15-b337-7fb9f15a9341&watermark=true&t=20200413221100,jn.pt,Portuguese,Portugal,"Sara Gerivaz Ontem às 22:11 Facebook
Twitter
Partilhar
Um cemitério público onde só se chega de barco. Um território imenso, carregado de história e de gente que não mereceu um adeus. Há mais de um século que Hart é a última morada dos indigentes, dos anónimos, dos não reclamados. E agora, também das vítimas da Covid-19.
Uma ""ilha da morte"" onde não há despedidas. Hart é desde 1868 um cemitério que não conhece afetos. Ao longo de mais de 150 anos, o terreno com cerca de 40 hectares junto à costa de Bronx, em Nova Iorque, tem sepultado milhares de corpos. Funcionou também como um campo de prisioneiros durante a Guerra Civil, um hospital psiquiátrico, um centro de tratamento de álcool e drogas. Passou pela Gripe Espanhola e pela epidemia de VIH e serviu de local para quarentena de vítimas de febre amarela e tuberculose.
Durante décadas, o trabalho duro era feito pelos reclusos de uma das prisões da ilha de Rikers, mas a pandemia de Covid-19 mudou as regras. Foi contratada uma equipa de dez trabalhadores para tratar dos enterros em Hart.
Covid-19 voltou a abrir a ferida sobre a Ilha de Hart
Nova Iorque está no olho do furacão da Covid-19 e é de longe o Estado dos EUA mais afetado pelo novo coronavírus, tendo já ultrapassado a barreira dos 10 mil óbitos. Por isso, o maior cemitério público do país voltou a ser necessário. Desde a semana passada que os mortos não reclamados no espaço de duas semanas estão a ser levados para a ilha de Hart. Antes da pandemia, os corpos ficavam meses nas morgues à espera que um familiar surgisse.
As imagens das valas comuns são impressionantes. No terreno lamacento, abrem-se trincheiras para onde vão os caixões de madeira despidos de flores. Não há luto. Não há despedida.
Cerca de 25 pessoas são levadas para Hart todos os dias, tantas quantas eram ali enterradas todas as semanas antes da Covid-19, de acordo com o Departamento de Correção de Nova Iorque, que administra os enterros na ilha.
Utilizar o cemitério público da cidade em caso de pandemia já tinha sido equacionado há mais de uma década num plano de contingência redigido pelo médico legista da cidade da altura, explicou Mark D. Levine, vereador da Saúde.
Mas o número de mortes registadas na cidade de Nova Iorque pode obrigar a que não sejam apenas os mortos não reclamados a ir para a ilha de Hart. De acordo com o ""The New York Times"", as agências funerárias estão a ficar sem espaço para guardar os corpos e temem ter que dar más notícias às famílias. Ser enterrado em Hart é duro para os nova-iorquinos.
""O número devastador de mortes a que estamos a assistir significa que, infelizmente, estamos a perder muitas pessoas sem família ou amigos para enterrá-las. Essas pessoas serão enterradas na Ilha de Hart, com todo respeito e dignidade que Nova Iorque pode oferecer"", escreveu o autarca de Nova Iorque, Bill de Blassio, na semana passada, no Twitter, onde lamentou as fotografias ""devastadoras"" que estão a correr o mundo. ""Lembrem-se, são seres humanos. São vizinhos que perdemos"".
As publicações mereceram resposta de Melinda Hunt, fundadora de uma associação sem fins lucrativos ligada à história da ilha. Também pelo Twitter, Hunt sublinhou que ""os enterros na ilha de Hart não são desrespeitosos agora que o trabalho dos presos terminou"". E, em declarações ao ""The New York Times"", defendeu que os enterros em Hart podem ser a alternativa mais segura e organizada durante a pandemia de Covid-19: ""Este é um sistema de enterro experimentado e testado, usado pela cidade durante a epidemia de gripe de 1918."" Hunt explicou ainda que há uma grande capacidade de recuperar os corpos posteriormente, para enterros particulares ou cremações.
Honrar a memória dos anónimos com cemitério interativo
Identificar os mortos, dar-lhes um nome e um rosto. Honrá-los. O ""Hart Island Project"" foi criado em 2011 para apoiar as famílias dos enterrados e criou uma base de dados sobre os milhares de desconhecidos da ilha. A ideia de Melinda Hunt foi enaltecer a história dos anónimos e torná-los menos anónimos. Por isso, o ""Travelling Cloud Museum"" funciona como um cemitério online, interativo, onde é permitido acrescentar informações sobre mortos ou procurar alguém que tenha sido ali sepultado.
Em 2018, a instituição de caridade mapeou toda a ilha com a ajuda de um drone e de ""geotiffs"" (metadados de localização) de mais de 68 mil enterrados.
Em condições normais, Nova Iorque enterra cerca de mil corpos por ano, incluindo pessoas em situação de sem-abrigo, bebés mortos à nascença e pessoas cujas famílias não têm dinheiro para custear o funeral.",0.9646357051555177,0.9280809565036006,0.9686674216685542,0.970499243570348,0.9668425018839487,"Random Forests
('ranger' package, R 3.5.3.)
Wright MN, Ziegler A (2017). “ranger: A Fast Implementation of Random Forests for High Dimensional Data in C++ and R.” Journal of Statistical Software, 77(1), 1–17. doi: 10.18637/jss.v077.i01.",5479,0.4347048300536673,204,500,20,gini,classification,2020-04-05
1,Alentejo com 140 casos positivos de Covid-19,"A região do Alentejo registava, às 24h00 deste domingo, 12, um total de 140 casos positivos de Covid-19, apenas mais um que no dia anterior, revela o relatório da situação epidemiológico divulgado hoje pela Direcção Geral da Saúde (DGS). De acordo com o relatório, existem em Portugal um total de 16934 pessoas com o novo coronavírus.",Correio Alentejo,2020-04-14 06:19:10,"14h14 - segunda, 13/04/2020
Alentejo com
140 casos positivos
de Covid-19
Alentejo com 140 casos positivos de Covid-19
A região do Alentejo registava, às 24h00 deste domingo, 12, um total de 140 casos positivos de Covid-19, apenas mais um que no dia anterior, revela o relatório da situação epidemiológico divulgado hoje pela Direcção Geral da Saúde (DGS). De acordo com o relatório, existem em Portugal um total de 16934 pessoas com o novo coronavírus.
O Alentejo é a região do continente com menos casos positivos, num total de 140. Por concelhos, o mais afectado é Moura, com 22 casos registados. Seguem-se Évora (21 casos), Serpa (17), Santiago do Cacém (11), Reguengos de Monsaraz (oito), Beja e Grândola (ambos com seis), Alcácer do Sal (cinco) e Sines (quatro).
Além destes, e de acordo com outras fontes, há ainda registo de casos positivos nos concelhos de Aljustrel, Almodôvar, Castro Verde, Cuba, Ferreira do Alentejo, Mértola e Odemira.
O relatório da DGS avança que a Covid-19 já causou 535 óbitos em Portugal, havendo 277 doentes recuperados. Aguardam resultado do teste laboratorial 3.264 pessoas.",http://www.correioalentejo.com/?diaria=20082,Alentejo com 140 casos positivos de Covid - 19 [ Correio Alentejo ] ,http://www.correioalentejo.com/?diaria=20082,NA,artlist,PO,,240 minutes,FALSE,250,https://api.gdeltproject.org/api/v2/doc/doc?query=%20sourcecountry:po&sourcelang:por&mode=artlist&format=json&timespan=240&maxrecords=250&sort=datedesc,NA,2020-04-13T22:45:00Z,http://www.correioalentejo.com/fotos/202004131615341.jpg,correioalentejo.com,Portuguese,Portugal,"14h14 - segunda, 13/04/2020
Alentejo com
140 casos positivos
de Covid-19
Alentejo com 140 casos positivos de Covid-19
A região do Alentejo registava, às 24h00 deste domingo, 12, um total de 140 casos positivos de Covid-19, apenas mais um que no dia anterior, revela o relatório da situação epidemiológico divulgado hoje pela Direcção Geral da Saúde (DGS). De acordo com o relatório, existem em Portugal um total de 16934 pessoas com o novo coronavírus.
O Alentejo é a região do continente com menos casos positivos, num total de 140. Por concelhos, o mais afectado é Moura, com 22 casos registados. Seguem-se Évora (21 casos), Serpa (17), Santiago do Cacém (11), Reguengos de Monsaraz (oito), Beja e Grândola (ambos com seis), Alcácer do Sal (cinco) e Sines (quatro).
Além destes, e de acordo com outras fontes, há ainda registo de casos positivos nos concelhos de Aljustrel, Almodôvar, Castro Verde, Cuba, Ferreira do Alentejo, Mértola e Odemira.
O relatório da DGS avança que a Covid-19 já causou 535 óbitos em Portugal, havendo 277 doentes recuperados. Aguardam resultado do teste laboratorial 3.264 pessoas.",0.9646357051555177,0.9280809565036006,0.9686674216685542,0.970499243570348,0.9668425018839487,"Random Forests
('ranger' package, R 3.5.3.)
Wright MN, Ziegler A (2017). “ranger: A Fast Implementation of Random Forests for High Dimensional Data in C++ and R.” Journal of Statistical Software, 77(1), 1–17. doi: 10.18637/jss.v077.i01.",5479,0.4347048300536673,204,500,20,gini,classification,2020-04-05
1,Hospital de Ponta Delgada tem 200 profissionais de saúde em quarentena,"O Hospital do Divino Espírito Santo, em Ponta Delgada, nos Açores, tem ""cerca de 200 profissionais de saúde em quarentena"". A ausência deste...",Agência Lusa,2020-04-14 06:19:11,"O Hospital do Divino Espírito Santo, em Ponta Delgada, nos Açores, tem “cerca de 200 profissionais de saúde em quarentena” e já foi forçado a encerrar um serviço de medicina, revelou esta segunda-feira a Autoridade de Saúde Regional.
“Não estamos ainda perfeitamente descansados com a situação no Hospital do Divino Espírito Santo, mas, dentro dos resultados que temos vindo a obter, conseguimos, de certa forma, travar a disseminação de um foco infecioso na instituição. Convém que nos próximos dias mantenhamos o nível de alerta”, adiantou o responsável máximo da Autoridade de Saúde Regional dos Açores.
Tiago Lopes falava no ponto de situação diário sobre a evolução do surto de Covid-19 no arquipélago, feito em Angra do Heroísmo.
Uma das cadeias de transmissão local detetadas na ilha de São Miguel, no concelho da Povoação, afetou dois profissionais de saúde que infetaram colegas e utentes do Hospital do Divino Espírito Santo.
Entre esses doentes estava uma utente do lar da Santa Casa da Misericórdia do Nordeste, que entretanto morreu, o que originou também um foco de infeção na estrutura residencial.
Desde o início do surto, já foram testados 295 profissionais de saúde nos Açores, 235 dos quais na ilha de são Miguel.
Existem atualmente 18 profissionais de saúde infetados no arquipélago, um na ilha do Faial e 17 na ilha de São Miguel, sendo que outros dois, também de São Miguel, já recuperaram.
Segundo Tiago Lopes, só do Hospital do Divino Espírito Santo estão em quarentena “cerca de 200 profissionais de saúde”, que antes de regressaram ao trabalho serão testados, mesmo que continuem “assintomáticos”.
A ausência destes profissionais de saúde obrigou ao encerramento do serviço de medicina 1, onde foi detetada a maioria dos casos de infeção no hospital, tendo os utentes sido transferidos para outras áreas.
“Nada invalida que próximos casos que possamos detetar levem à adoção de outro tipo de medidas dentro da instituição e por essa via outros constrangimentos”, acrescentou o responsável da Autoridade de Saúde Regional.
Sem revelar o número de utentes infetados no hospital, Tiago Lopes disse que as autoridades de saúde mantêm esses contactos próximos “em vigilância”, apesar de alguns já terem tido alta.
“Seria mais preocupante se tivéssemos um número superior de profissionais de saúde infetados e de utentes infetados”, frisou, alegando que dada a “celeridade” na identificação de contactos próximos foi possível “estancar uma eventual sangria de profissionais e utentes infetados dentro da unidade hospitalar”.
Os Açores detetaram já 100 casos positivos de Covid-19, 88 dos quais ativos, depois de se terem verificado quatro óbitos e oito recuperações.
São Miguel é a ilha com mais casos ativos (55), seguindo-se Pico (10), Terceira (sete), São Jorge (sete), Faial (cinco) e Graciosa (quatro).
O novo coronavírus, responsável pela pandemia da Covid-19, já provocou mais de 117 mil mortos e infetou quase 1,9 milhões de pessoas em 193 países e territórios.
Em Portugal, segundo o balanço feito esta segunda-feira pela Direção-Geral da Saúde, registam-se 535 mortos, mais 31 do que no domingo (+6,2%), e 16.934 casos de infeção confirmados, o que representa um aumento de 349 (+2,1%).",https://observador.pt/2020/04/13/hospital-de-ponta-delgada-tem-200-profissionais-de-saude-em-quarentena/,Hospital de Ponta Delgada tem 200 profissionais de saúde em quarentena,https://observador.pt/2020/04/13/hospital-de-ponta-delgada-tem-200-profissionais-de-saude-em-quarentena/,2020-04-14 04:25:00,artlist,PO,,240 minutes,FALSE,250,https://api.gdeltproject.org/api/v2/doc/doc?query=%20sourcecountry:po&sourcelang:por&mode=artlist&format=json&timespan=240&maxrecords=250&sort=datedesc,https://observador.pt/2020/04/13/hospital-de-ponta-delgada-tem-200-profissionais-de-saude-em-quarentena/amp/,2020-04-13T22:45:00Z,https://wm.observador.pt/wm/obs/l/https%3A%2F%2Fbordalo.observador.pt%2F770x403%2Cq80%2Fhttps%3A%2F%2Fs3.observador.pt%2Fwp-content%2Fuploads%2F2020%2F04%2F13210326%2F28599454_1280x720_acf_cropped_770x433_acf_cropped.jpg,observador.pt,Portuguese,Portugal,"O Hospital do Divino Espírito Santo, em Ponta Delgada, nos Açores, tem “cerca de 200 profissionais de saúde em quarentena” e já foi forçado a encerrar um serviço de medicina, revelou esta segunda-feira a Autoridade de Saúde Regional.
“Não estamos ainda perfeitamente descansados com a situação no Hospital do Divino Espírito Santo, mas, dentro dos resultados que temos vindo a obter, conseguimos, de certa forma, travar a disseminação de um foco infecioso na instituição. Convém que nos próximos dias mantenhamos o nível de alerta”, adiantou o responsável máximo da Autoridade de Saúde Regional dos Açores.
Tiago Lopes falava no ponto de situação diário sobre a evolução do surto de Covid-19 no arquipélago, feito em Angra do Heroísmo.
Uma das cadeias de transmissão local detetadas na ilha de São Miguel, no concelho da Povoação, afetou dois profissionais de saúde que infetaram colegas e utentes do Hospital do Divino Espírito Santo.
Entre esses doentes estava uma utente do lar da Santa Casa da Misericórdia do Nordeste, que entretanto morreu, o que originou também um foco de infeção na estrutura residencial.
Desde o início do surto, já foram testados 295 profissionais de saúde nos Açores, 235 dos quais na ilha de são Miguel.
Existem atualmente 18 profissionais de saúde infetados no arquipélago, um na ilha do Faial e 17 na ilha de São Miguel, sendo que outros dois, também de São Miguel, já recuperaram.
Segundo Tiago Lopes, só do Hospital do Divino Espírito Santo estão em quarentena “cerca de 200 profissionais de saúde”, que antes de regressaram ao trabalho serão testados, mesmo que continuem “assintomáticos”.
A ausência destes profissionais de saúde obrigou ao encerramento do serviço de medicina 1, onde foi detetada a maioria dos casos de infeção no hospital, tendo os utentes sido transferidos para outras áreas.
“Nada invalida que próximos casos que possamos detetar levem à adoção de outro tipo de medidas dentro da instituição e por essa via outros constrangimentos”, acrescentou o responsável da Autoridade de Saúde Regional.
Sem revelar o número de utentes infetados no hospital, Tiago Lopes disse que as autoridades de saúde mantêm esses contactos próximos “em vigilância”, apesar de alguns já terem tido alta.
“Seria mais preocupante se tivéssemos um número superior de profissionais de saúde infetados e de utentes infetados”, frisou, alegando que dada a “celeridade” na identificação de contactos próximos foi possível “estancar uma eventual sangria de profissionais e utentes infetados dentro da unidade hospitalar”.
Os Açores detetaram já 100 casos positivos de Covid-19, 88 dos quais ativos, depois de se terem verificado quatro óbitos e oito recuperações.
São Miguel é a ilha com mais casos ativos (55), seguindo-se Pico (10), Terceira (sete), São Jorge (sete), Faial (cinco) e Graciosa (quatro).
O novo coronavírus, responsável pela pandemia da Covid-19, já provocou mais de 117 mil mortos e infetou quase 1,9 milhões de pessoas em 193 países e territórios.
Em Portugal, segundo o balanço feito esta segunda-feira pela Direção-Geral da Saúde, registam-se 535 mortos, mais 31 do que no domingo (+6,2%), e 16.934 casos de infeção confirmados, o que representa um aumento de 349 (+2,1%).",0.9646357051555177,0.9280809565036006,0.9686674216685542,0.970499243570348,0.9668425018839487,"Random Forests
('ranger' package, R 3.5.3.)
Wright MN, Ziegler A (2017). “ranger: A Fast Implementation of Random Forests for High Dimensional Data in C++ and R.” Journal of Statistical Software, 77(1), 1–17. doi: 10.18637/jss.v077.i01.",5479,0.4347048300536673,204,500,20,gini,classification,2020-04-05
