prediction_covid_topic,title,description,authors,date_download,date_publish,maintext,url,gdelt_title,gdelt_url,modeSearch,sourcecountrySearch,termSearch,periodtimeSearch,isOR,countMaximumRecords,urlGDELTV2FTAPI,urlArticleMobile,datetimeArticle,urlImage,domainArticle,languageArticle,countryArticle,pred_input,model_accuracy,model_kappa,model_f1,model_precision,model_recall,model,sample_size,train_prop_covid,mtry,n_tree,min_node_size,splitrule,model_type,fitted_on
1,O Verão do nosso descontentamento,"No fim da crise, à semelhança do que sempre acontece em períodos de grande disrupção, vamos ter uma economia muito diferente. Os hábitos das pessoas v...",Fernando Alexandre,2020-04-08 09:15:22,2020-08-04 02:15:00,"Todos queremos saber quando é que isto acaba. Assustados com o que se via em Itália, os que podiam, ficaram em casa, ainda antes de o Governo impor a quarentena. O Estado fechou as escolas e uma grande parte da população ficou fechada em casa. O Estado de emergência determinou o encerramento de muitas actividades económicas cuja realização exige grande proximidade social. Os que estão em modo de teletrabalho, e mantêm os seus rendimentos, podem até apreciar algumas vantagens no confinamento.
O teletrabalho será comum entre os comentadores das redes sociais. Não o é para a maioria da população. Em Fevereiro, o Sr. António, que em Fevereiro montou uma caldeira nova em minha casa. Nessa altura estava assoberbado de trabalho. Ligou-me na semana passada. Queria saber se a caldeira estava a funcionar. Entre os dias 12 e 14 de Março, viu cancelados 95% dos trabalhos previstos até ao final do mês. E é essa a situação de todos os seus colegas. Vai pedir o apoio previsto para os empresários em nome individual e recorrer ao ‘saco das poupanças’ para se aguentar.
Por quanto tempo se aguentará o Sr. António? As famílias de rendimentos mais baixos são as que têm menos poupanças. Com quebras abruptas no rendimento, vão ter grandes dificuldades em manter níveis de vida aceitáveis.
O Governo tem sido lesto a apresentar medidas e a adequá-las à realidade. Facilitou e alargou o acesso aos apoios. No início desta semana, mais de um milhão de trabalhadores independentes tinham apresentado pedidos de apoio à Segurança Social. Mais de 500 mil trabalhadores estão já em processo de lay-off.
Dissipador durante décadas, acumulando uma das dívidas mais elevadas do mundo em percentagem do PIB, o Estado português não tem condições para garantir rendimento às famílias durante muito tempo.
Numa entrevista, em ‘O país que se segue’ da FFMS, Pedro Santos Guerreiro perguntou-me quanto tempo mais aguenta a economia portuguesa esta quarentena? Dois meses, respondi. Ou seja, até ao final de Maio.
Porquê dois meses?
Com a chegada do Verão, a situação pode complicar-se. Em condições normais, entre Junho e Setembro, o turismo é o motor da economia portuguesa. Representa mais de 10% do PIB e cerca de 50% das exportações de serviços. Este ano não vamos poder contar com este motor. A mobilidade internacional e nacional das pessoas deverá continuar sob fortes restrições. As pessoas terão receio de viajar, dados os riscos de contágio ou de retenção nas fronteiras.
A falência de empresas e os despedimentos no sector do turismo poderão atingir valores estratosféricos. Neste contexto, é importante lembrar que mais de 20% dos contratos de trabalho por conta de outrem não são contratos permanentes. Sem perspectivas de recuperação, os contratos de trabalho que atingirem o seu termo, provavelmente não serão renovados. Miguel Faria e Castro da Reserva Federal de St. Louis, no jornal ECO, aventa a hipótese, num cenário catastrófico, da destruição de mais de um milhão de empregos.
Podemos não ter uma data como pediu João Miguel Tavares. Mas temos de ter uma estratégia para pôr a economia a funcionar novamente até ao Verão. Se os restantes sectores não compensarem a cratera aberta pela ausência de turistas, vamos ter o pior Verão das nossas vidas. E a nossa saúde não vai aguentar o próximo Inverno.
A perspectiva de aplanamento da curva de infectados com covid-19 tem levado alguns países europeus a anunciar ou a preparar o levantamento das medidas de confinamento. Os especialistas têm elencado quatro condições para a retoma da actividade económica. Primeira, garantir que os hospitais estão devidamente equipados e com os recursos humanos reforçados. Segunda, testar todas as pessoas com sintomas, para que possam regressar à sua actividade sem riscos para a saúde pública. Terceira, monitorizar as pessoas infectadas e as suas relações, de forma a evitar novas vagas de contágio. Finalmente, dado o período de incubação, é necessário que se tenha registado uma redução sustentada dos novos casos nos últimos 14 dias.
Em todos os países, o levantamento das medidas de quarentena será faseado. Temos de definir uma estratégia nacional para esse faseamento – por faixas etárias, regiões, sectores económicos, etc. Um desafio das empresas portuguesas, que é também uma oportunidade, é responder às necessidades de bens na área da saúde – kits de testes, equipamentos de protecção pessoal, desinfectantes, ventiladores. Estes bens são essenciais para a saúde, não apenas da população portuguesa, mas também da população mundial. Muitos industriais referem como vantagem competitiva a rapidez de resposta das nossas empresas às necessidades dos clientes. Não haverá melhor oportunidade para o comprovar.
A reactivação de grandes cadeias de produção global como a do sector automóvel, exigirá uma forte coordenação internacional. Por exemplo, não servirá de nada os trabalhadores da AutoEuropa voltarem ao trabalho se permanecerem em quarentena os trabalhadores das centenas de empresas, de dezenas de países, que a fornecem. Esta interconectividade que caracteriza a economia global aumenta a incerteza sobre a forma como decorrerá a recuperação económica.
Muitos têm proposto a estratégia de ‘congelar’ a economia. De acordo com essa estratégia devemos preservar a estrutura existente no início da covid-19. Essa seria a melhor forma para a economia estar preparada para aproveitar a recuperação. Discordo desta estratégia. No final desta crise, à semelhança do que sempre acontece em períodos de grande disrupção, vamos ter uma economia muito diferente. Os hábitos das pessoas vão alterar-se. O modo de trabalhar vai alterar-se. As cadeias de produção e distribuição poderão sofrer profundas recomposições.
Não podemos ficar à espera sentados a ver como vai ficar a economia depois da pandemia. Até porque não temos uma data para o seu fim. As nossas empresas têm de acompanhar as mudanças. Para aproveitar as oportunidades que vão surgir têm de agir desde já.
Este vai ser o Verão do nosso descontentamento. Temos de nos preparar. O Inverno pode ser ainda mais duro.",https://observador.pt/opiniao/o-verao-do-nosso-descontentamento/,O Verão do nosso descontentamento,https://observador.pt/opiniao/o-verao-do-nosso-descontentamento/,artlist,PO,,100 minutes,FALSE,250,https://api.gdeltproject.org/api/v2/doc/doc?query=%20sourcecountry:po&sourcelang:por&mode=artlist&format=json&timespan=100&maxrecords=250&sort=datedesc,NA,2020-04-08T04:45:00Z,https://wm.observador.pt/wm-op/wide-circle/https%3A%2F%2Fbordalo.observador.pt%2F467x467%2Cq80%2Fhttps%3A%2F%2Fs3.observador.pt%2Fwp-content%2Fuploads%2F2019%2F09%2F17224842%2F002_467x467_acf_cropped.jpg,observador.pt,Portuguese,Portugal,"Todos queremos saber quando é que isto acaba. Assustados com o que se via em Itália, os que podiam, ficaram em casa, ainda antes de o Governo impor a quarentena. O Estado fechou as escolas e uma grande parte da população ficou fechada em casa. O Estado de emergência determinou o encerramento de muitas actividades económicas cuja realização exige grande proximidade social. Os que estão em modo de teletrabalho, e mantêm os seus rendimentos, podem até apreciar algumas vantagens no confinamento.
O teletrabalho será comum entre os comentadores das redes sociais. Não o é para a maioria da população. Em Fevereiro, o Sr. António, que em Fevereiro montou uma caldeira nova em minha casa. Nessa altura estava assoberbado de trabalho. Ligou-me na semana passada. Queria saber se a caldeira estava a funcionar. Entre os dias 12 e 14 de Março, viu cancelados 95% dos trabalhos previstos até ao final do mês. E é essa a situação de todos os seus colegas. Vai pedir o apoio previsto para os empresários em nome individual e recorrer ao ‘saco das poupanças’ para se aguentar.
Por quanto tempo se aguentará o Sr. António? As famílias de rendimentos mais baixos são as que têm menos poupanças. Com quebras abruptas no rendimento, vão ter grandes dificuldades em manter níveis de vida aceitáveis.
O Governo tem sido lesto a apresentar medidas e a adequá-las à realidade. Facilitou e alargou o acesso aos apoios. No início desta semana, mais de um milhão de trabalhadores independentes tinham apresentado pedidos de apoio à Segurança Social. Mais de 500 mil trabalhadores estão já em processo de lay-off.
Dissipador durante décadas, acumulando uma das dívidas mais elevadas do mundo em percentagem do PIB, o Estado português não tem condições para garantir rendimento às famílias durante muito tempo.
Numa entrevista, em ‘O país que se segue’ da FFMS, Pedro Santos Guerreiro perguntou-me quanto tempo mais aguenta a economia portuguesa esta quarentena? Dois meses, respondi. Ou seja, até ao final de Maio.
Porquê dois meses?
Com a chegada do Verão, a situação pode complicar-se. Em condições normais, entre Junho e Setembro, o turismo é o motor da economia portuguesa. Representa mais de 10% do PIB e cerca de 50% das exportações de serviços. Este ano não vamos poder contar com este motor. A mobilidade internacional e nacional das pessoas deverá continuar sob fortes restrições. As pessoas terão receio de viajar, dados os riscos de contágio ou de retenção nas fronteiras.
A falência de empresas e os despedimentos no sector do turismo poderão atingir valores estratosféricos. Neste contexto, é importante lembrar que mais de 20% dos contratos de trabalho por conta de outrem não são contratos permanentes. Sem perspectivas de recuperação, os contratos de trabalho que atingirem o seu termo, provavelmente não serão renovados. Miguel Faria e Castro da Reserva Federal de St. Louis, no jornal ECO, aventa a hipótese, num cenário catastrófico, da destruição de mais de um milhão de empregos.
Podemos não ter uma data como pediu João Miguel Tavares. Mas temos de ter uma estratégia para pôr a economia a funcionar novamente até ao Verão. Se os restantes sectores não compensarem a cratera aberta pela ausência de turistas, vamos ter o pior Verão das nossas vidas. E a nossa saúde não vai aguentar o próximo Inverno.
A perspectiva de aplanamento da curva de infectados com covid-19 tem levado alguns países europeus a anunciar ou a preparar o levantamento das medidas de confinamento. Os especialistas têm elencado quatro condições para a retoma da actividade económica. Primeira, garantir que os hospitais estão devidamente equipados e com os recursos humanos reforçados. Segunda, testar todas as pessoas com sintomas, para que possam regressar à sua actividade sem riscos para a saúde pública. Terceira, monitorizar as pessoas infectadas e as suas relações, de forma a evitar novas vagas de contágio. Finalmente, dado o período de incubação, é necessário que se tenha registado uma redução sustentada dos novos casos nos últimos 14 dias.
Em todos os países, o levantamento das medidas de quarentena será faseado. Temos de definir uma estratégia nacional para esse faseamento – por faixas etárias, regiões, sectores económicos, etc. Um desafio das empresas portuguesas, que é também uma oportunidade, é responder às necessidades de bens na área da saúde – kits de testes, equipamentos de protecção pessoal, desinfectantes, ventiladores. Estes bens são essenciais para a saúde, não apenas da população portuguesa, mas também da população mundial. Muitos industriais referem como vantagem competitiva a rapidez de resposta das nossas empresas às necessidades dos clientes. Não haverá melhor oportunidade para o comprovar.
A reactivação de grandes cadeias de produção global como a do sector automóvel, exigirá uma forte coordenação internacional. Por exemplo, não servirá de nada os trabalhadores da AutoEuropa voltarem ao trabalho se permanecerem em quarentena os trabalhadores das centenas de empresas, de dezenas de países, que a fornecem. Esta interconectividade que caracteriza a economia global aumenta a incerteza sobre a forma como decorrerá a recuperação económica.
Muitos têm proposto a estratégia de ‘congelar’ a economia. De acordo com essa estratégia devemos preservar a estrutura existente no início da covid-19. Essa seria a melhor forma para a economia estar preparada para aproveitar a recuperação. Discordo desta estratégia. No final desta crise, à semelhança do que sempre acontece em períodos de grande disrupção, vamos ter uma economia muito diferente. Os hábitos das pessoas vão alterar-se. O modo de trabalhar vai alterar-se. As cadeias de produção e distribuição poderão sofrer profundas recomposições.
Não podemos ficar à espera sentados a ver como vai ficar a economia depois da pandemia. Até porque não temos uma data para o seu fim. As nossas empresas têm de acompanhar as mudanças. Para aproveitar as oportunidades que vão surgir têm de agir desde já.
Este vai ser o Verão do nosso descontentamento. Temos de nos preparar. O Inverno pode ser ainda mais duro.",0.9646357051555177,0.9280809565036006,0.9686674216685542,0.970499243570348,0.9668425018839487,"Random Forests
('ranger' package, R 3.5.3.)
Wright MN, Ziegler A (2017). “ranger: A Fast Implementation of Random Forests for High Dimensional Data in C++ and R.” Journal of Statistical Software, 77(1), 1–17. doi: 10.18637/jss.v077.i01.",5479,0.4347048300536673,204,500,20,gini,classification,2020-04-05
1,Este Stefan Löfven é uma besta!,Na Suécia a estratégia de combate ao coronavírus resultou numa taxa de mortalidade escassas nove vezes superior à da vizinha Finlândia. Mas como Stefa...,Tiago Dores,2020-04-08 09:15:24,2020-07-05 00:17:00,"Ora aqui está uma acusação que jamais será proferida, ou sequer insinuada, num telejornal português. E porquê? É simples. Porque Stefan Löfven não se chama Donald Trump. Stefan Löfven é o primeiro-ministro sueco e está, por estes dias, a ponderar fechar escolas, bares e restaurantes. Isto porque, na Suécia, a estratégia de combate ao coronavírus resultou numa taxa de mortalidade escassas nove vezes superior à da vizinha Finlândia. Ui, e recordar o banzé que foi quando Trump disse, por exemplo, que gostava de ter a América de volta ao trabalho na Páscoa. Acaba por ser bem feito, para lembrar ao presidente norte-americano no que dá não ser um social-democrata nórdico, alto e louro, mas antes um fascista ianque, alto e cor-de-laranja.
Já no nosso Portugal, tudo é paz e harmonia. Que sossego bestial, pá. O PS a não ter de prestar contas de nada a ninguém, mesmo tendo-nos cativos muito por culpa das cativações de Costa e Centeno no SNS. Rui Rio a poder, enfim, fazer passar os seus achaques de autoritarismo por profundíssimo sentido de estado. Os partidos de extrema-esquerda a usarem máscara, não tanto por causa do coronavírus, mas mais para conterem a salivação provocada pela perspectiva de nacionalizações em barda. E mesmo aquela inquietação que há, em todo o lado, por não se saber como vai ser o futuro, tem solução fácil em Portugal. Basta ir rever o que Manuela Ferreira Leite andou a desejar em 2009. Sim porque, em 2008, a então líder do PSD aludiu à suspensão da democracia durante seis meses e veja-se onde estamos uma dúzia de anos volvidos.
A única nuvem neste céu límpido, típico dos climas de salvação nacional, é a polémica em torno da eventual libertação de presos. Eu concordo com a medida. E não é tanto porque a sobrelotação das cadeias possa provocar um contágio em massa, como aconteceu nos lares de idosos. É mais por ser urgente arranjar bastante espaço para encarcerar esses bandidos que andam a furar as regras do estado de emergência porque lhes apetece ir dar uma volta de carro, às vezes até com os vidros abertos, imaginem, a pulverizarem vírus por essas estradas fora.
Agora, confesso que me tem repugnado o silêncio do PAN. Numa altura em que, por todo o mundo, cientistas testam novas vacinas contra a Covid-19, eu faço uma pequena ideia das toneladas de ratinhos de laboratório que andam por aí a ser dizimados. É que devem ser carradas e carradas de fofinhos roedores. E, no entanto, da parte do PAN, há um silêncio ensurdecedor sobre este verdadeiro ratinhocídio. Creio estarmos perante um daqueles casos a que se aplica o clássico ditado: “Quando a febre sobe e a tosse é seca e funda, os militantes do PAN são os primeiros a abandonar o barco.”
Mas, felizmente, a epidemia parece mais controlada. E penso termos condições para continuar assim. Desde que não oiçamos as recomendações da Direcção Geral da Saúde quanto ao uso de máscaras de protecção, claro. Com esta dança do “Tire a máscara”, “Afinal ponha a máscara”, “Espere, não use a máscara”, “Coloque já a máscara”, claro que uma pessoa acaba por tocar com os dedos, quiçá infectados, na própria cara! Mais que não seja porque é mesmo difícil, perante a catadupa de trapalhadas, não sentir aquela vergonha alheia que nos leva a, por instinto, tapar a face com a mão.
Enquanto isso, o Ministério da Educação está a preparar o arranque da teleescola, método de ensino que me levanta imensas reservas. Por um lado, é verdade que torna impossível aos gazeteiros baldarem-se às aulas e irem fumar para trás do pavilhão de Educação Física. Por outro, é muitíssimo provável que faltem à mesma, mas desta vez porque farão zapping para o Sexy Hot. Mas mesmo com os alunos mais estudiosos, é provável que a tele-escola não funcione bem. Está-se mesmo a ver o típico choninhas: “Hum. Ver televisão? Vou antes ler um livro, pois considero o livro um veículo muito mais efectivo no que à aquisição das valências fundamentais ao desenvolvimento do meu pensamento crítico diz respeito.” Sacana do marrão. A tua sorte é a escola estar fechada, se não já estavas a enfardar uns valentes calduços.",https://observador.pt/opiniao/este-stefan-lofven-e-uma-besta/,Este Stefan Löfven é uma besta ! ,https://observador.pt/opiniao/este-stefan-lofven-e-uma-besta/,artlist,PO,,100 minutes,FALSE,250,https://api.gdeltproject.org/api/v2/doc/doc?query=%20sourcecountry:po&sourcelang:por&mode=artlist&format=json&timespan=100&maxrecords=250&sort=datedesc,NA,2020-04-08T04:45:00Z,https://wm.observador.pt/wm-op/wide-circle/https%3A%2F%2Fbordalo.observador.pt%2F467x467%2Cq80%2Fhttps%3A%2F%2Fs3.observador.pt%2Fwp-content%2Fuploads%2F2018%2F12%2F17175557%2Fdores_perfil5_467x467_acf_cropped.jpg,observador.pt,Portuguese,Portugal,"Ora aqui está uma acusação que jamais será proferida, ou sequer insinuada, num telejornal português. E porquê? É simples. Porque Stefan Löfven não se chama Donald Trump. Stefan Löfven é o primeiro-ministro sueco e está, por estes dias, a ponderar fechar escolas, bares e restaurantes. Isto porque, na Suécia, a estratégia de combate ao coronavírus resultou numa taxa de mortalidade escassas nove vezes superior à da vizinha Finlândia. Ui, e recordar o banzé que foi quando Trump disse, por exemplo, que gostava de ter a América de volta ao trabalho na Páscoa. Acaba por ser bem feito, para lembrar ao presidente norte-americano no que dá não ser um social-democrata nórdico, alto e louro, mas antes um fascista ianque, alto e cor-de-laranja.
Já no nosso Portugal, tudo é paz e harmonia. Que sossego bestial, pá. O PS a não ter de prestar contas de nada a ninguém, mesmo tendo-nos cativos muito por culpa das cativações de Costa e Centeno no SNS. Rui Rio a poder, enfim, fazer passar os seus achaques de autoritarismo por profundíssimo sentido de estado. Os partidos de extrema-esquerda a usarem máscara, não tanto por causa do coronavírus, mas mais para conterem a salivação provocada pela perspectiva de nacionalizações em barda. E mesmo aquela inquietação que há, em todo o lado, por não se saber como vai ser o futuro, tem solução fácil em Portugal. Basta ir rever o que Manuela Ferreira Leite andou a desejar em 2009. Sim porque, em 2008, a então líder do PSD aludiu à suspensão da democracia durante seis meses e veja-se onde estamos uma dúzia de anos volvidos.
A única nuvem neste céu límpido, típico dos climas de salvação nacional, é a polémica em torno da eventual libertação de presos. Eu concordo com a medida. E não é tanto porque a sobrelotação das cadeias possa provocar um contágio em massa, como aconteceu nos lares de idosos. É mais por ser urgente arranjar bastante espaço para encarcerar esses bandidos que andam a furar as regras do estado de emergência porque lhes apetece ir dar uma volta de carro, às vezes até com os vidros abertos, imaginem, a pulverizarem vírus por essas estradas fora.
Agora, confesso que me tem repugnado o silêncio do PAN. Numa altura em que, por todo o mundo, cientistas testam novas vacinas contra a Covid-19, eu faço uma pequena ideia das toneladas de ratinhos de laboratório que andam por aí a ser dizimados. É que devem ser carradas e carradas de fofinhos roedores. E, no entanto, da parte do PAN, há um silêncio ensurdecedor sobre este verdadeiro ratinhocídio. Creio estarmos perante um daqueles casos a que se aplica o clássico ditado: “Quando a febre sobe e a tosse é seca e funda, os militantes do PAN são os primeiros a abandonar o barco.”
Mas, felizmente, a epidemia parece mais controlada. E penso termos condições para continuar assim. Desde que não oiçamos as recomendações da Direcção Geral da Saúde quanto ao uso de máscaras de protecção, claro. Com esta dança do “Tire a máscara”, “Afinal ponha a máscara”, “Espere, não use a máscara”, “Coloque já a máscara”, claro que uma pessoa acaba por tocar com os dedos, quiçá infectados, na própria cara! Mais que não seja porque é mesmo difícil, perante a catadupa de trapalhadas, não sentir aquela vergonha alheia que nos leva a, por instinto, tapar a face com a mão.
Enquanto isso, o Ministério da Educação está a preparar o arranque da teleescola, método de ensino que me levanta imensas reservas. Por um lado, é verdade que torna impossível aos gazeteiros baldarem-se às aulas e irem fumar para trás do pavilhão de Educação Física. Por outro, é muitíssimo provável que faltem à mesma, mas desta vez porque farão zapping para o Sexy Hot. Mas mesmo com os alunos mais estudiosos, é provável que a tele-escola não funcione bem. Está-se mesmo a ver o típico choninhas: “Hum. Ver televisão? Vou antes ler um livro, pois considero o livro um veículo muito mais efectivo no que à aquisição das valências fundamentais ao desenvolvimento do meu pensamento crítico diz respeito.” Sacana do marrão. A tua sorte é a escola estar fechada, se não já estavas a enfardar uns valentes calduços.",0.9646357051555177,0.9280809565036006,0.9686674216685542,0.970499243570348,0.9668425018839487,"Random Forests
('ranger' package, R 3.5.3.)
Wright MN, Ziegler A (2017). “ranger: A Fast Implementation of Random Forests for High Dimensional Data in C++ and R.” Journal of Statistical Software, 77(1), 1–17. doi: 10.18637/jss.v077.i01.",5479,0.4347048300536673,204,500,20,gini,classification,2020-04-05
