prediction_covid_topic,title,description,authors,date_download,maintext,url,gdelt_title,gdelt_url,date_publish,modeSearch,sourcecountrySearch,termSearch,periodtimeSearch,isOR,countMaximumRecords,urlGDELTV2FTAPI,urlArticleMobile,datetimeArticle,urlImage,domainArticle,languageArticle,countryArticle,pred_input,model_accuracy,model_kappa,model_f1,model_precision,model_recall,model,sample_size,train_prop_covid,mtry,n_tree,min_node_size,splitrule,model_type,fitted_on
1,PM timorense retira pedido de demissão apresentado a 22 de fevereiro,"As últimas notícias e reportagens sobre Portugal e o Mundo. Actualidade, Globo, Desporto, Fama e TV, Arte e Lazer. Passatempos. Todas as fotos e videos em destak.pt",Destak,2020-04-08 13:15:18,"Covid-19
O primeiro-ministro timorense, Taur Matan Ruak, retirou hoje o seu pedido de demissão do cargo, que apresentou ao chefe de Estado no dia 22 de fevereiro, devido à pandemia, anunciou o próprio aos jornalistas.
Taur Matan Ruak, que falava depois da sua reunião semanal com o Presidente da República, explicou que tomou a decisão de recuar no pedido de demissão tendo em conta a situação de emergência que se vive no país por causa da pandemia de covid-19.",http://www.destak.pt/artigo/413621-pm-timorense-retira-pedido-de-demissao-apresentado-a-22-de-fevereiro,Destak . pt | Covid - 19 : PM timorense retira pedido de demissão apresentado a 22 de fevereiro,http://www.destak.pt/artigo/413621-pm-timorense-retira-pedido-de-demissao-apresentado-a-22-de-fevereiro,NA,artlist,PO,,100 minutes,FALSE,250,https://api.gdeltproject.org/api/v2/doc/doc?query=%20sourcecountry:po&sourcelang:por&mode=artlist&format=json&timespan=100&maxrecords=250&sort=datedesc,NA,2020-04-08T08:45:00Z,http://www.destak.pt/images/newsletter_no_img.jpg,destak.pt,Portuguese,Portugal,"Covid-19
O primeiro-ministro timorense, Taur Matan Ruak, retirou hoje o seu pedido de demissão do cargo, que apresentou ao chefe de Estado no dia 22 de fevereiro, devido à pandemia, anunciou o próprio aos jornalistas.
Taur Matan Ruak, que falava depois da sua reunião semanal com o Presidente da República, explicou que tomou a decisão de recuar no pedido de demissão tendo em conta a situação de emergência que se vive no país por causa da pandemia de covid-19.",0.9646357051555177,0.9280809565036006,0.9686674216685542,0.970499243570348,0.9668425018839487,"Random Forests
('ranger' package, R 3.5.3.)
Wright MN, Ziegler A (2017). “ranger: A Fast Implementation of Random Forests for High Dimensional Data in C++ and R.” Journal of Statistical Software, 77(1), 1–17. doi: 10.18637/jss.v077.i01.",5479,0.4347048300536673,204,500,20,gini,classification,2020-04-05
1,Estados Unidos com o pior recorde mundial diário na pandemia,Quase duas mil pessoas perderam a vida na terça-feira.,Global Media Group,2020-04-08 13:15:21,"Quase duas mil pessoas perderam a vida na terça-feira.
Os Estados Unidos registaram na terça-feira 1.939 mortes causadas pela covid-19 em 24 horas, o pior recorde mundial diário, de acordo com a contagem da Universidade Johns Hopkins.
O número total de mortes desde o início do surto nos Estados Unidos é agora de mais de 12.700.
Os Estados Unidos também são, de longe, o país do mundo com o maior número de casos confirmados: cerca de 396.000 pessoas infetadas no país, de acordo com a universidade norte-americana, que atualiza continuamente os dados.
A Espanha é o segundo país com maior número de mortes, registando 13.798 mortos, entre 140.510 casos de infeção confirmados.
A China, sem contar com os territórios de Hong Kong e Macau, conta com 81.740 casos e regista 3.331 mortes. As autoridades chinesas anunciaram 32 novos casos, todos oriundos do exterior, e pela primeira vez desde janeiro não reportou mortes.
Além de Itália, Espanha, Estados Unidos e China, os países mais afetados são França, com 10.328 mortos (78.167 casos), Reino Unido, 6.159 mortos (55.242 casos), Irão, com 3.603 mortos (58.226 casos), e Alemanha, com 1.607 mortes (99.225 casos).",https://www.ojogo.pt/covid-19/estados-unidos-com-o-pior-recorde-mundial-diario-na-pandemia-12045043.html,Estados Unidos com o pior recorde mundial diário na pandemia,https://www.ojogo.pt/covid-19/estados-unidos-com-o-pior-recorde-mundial-diario-na-pandemia-12045043.html,2020-04-08 10:10:00,artlist,PO,,100 minutes,FALSE,250,https://api.gdeltproject.org/api/v2/doc/doc?query=%20sourcecountry:po&sourcelang:por&mode=artlist&format=json&timespan=100&maxrecords=250&sort=datedesc,https://www.ojogo.pt/covid-19/amp/estados-unidos-com-o-pior-recorde-mundial-diario-na-pandemia-12045043.html,2020-04-08T08:45:00Z,https://static.globalnoticias.pt/oj/image.aspx?brand=OJ&type=generate&guid=079a9ffe-dbed-435c-a93c-b7127b6e96c9&watermark=true&t=20200408081000,ojogo.pt,Portuguese,Portugal,"Quase duas mil pessoas perderam a vida na terça-feira.
Os Estados Unidos registaram na terça-feira 1.939 mortes causadas pela covid-19 em 24 horas, o pior recorde mundial diário, de acordo com a contagem da Universidade Johns Hopkins.
O número total de mortes desde o início do surto nos Estados Unidos é agora de mais de 12.700.
Os Estados Unidos também são, de longe, o país do mundo com o maior número de casos confirmados: cerca de 396.000 pessoas infetadas no país, de acordo com a universidade norte-americana, que atualiza continuamente os dados.
A Espanha é o segundo país com maior número de mortes, registando 13.798 mortos, entre 140.510 casos de infeção confirmados.
A China, sem contar com os territórios de Hong Kong e Macau, conta com 81.740 casos e regista 3.331 mortes. As autoridades chinesas anunciaram 32 novos casos, todos oriundos do exterior, e pela primeira vez desde janeiro não reportou mortes.
Além de Itália, Espanha, Estados Unidos e China, os países mais afetados são França, com 10.328 mortos (78.167 casos), Reino Unido, 6.159 mortos (55.242 casos), Irão, com 3.603 mortos (58.226 casos), e Alemanha, com 1.607 mortes (99.225 casos).",0.9646357051555177,0.9280809565036006,0.9686674216685542,0.970499243570348,0.9668425018839487,"Random Forests
('ranger' package, R 3.5.3.)
Wright MN, Ziegler A (2017). “ranger: A Fast Implementation of Random Forests for High Dimensional Data in C++ and R.” Journal of Statistical Software, 77(1), 1–17. doi: 10.18637/jss.v077.i01.",5479,0.4347048300536673,204,500,20,gini,classification,2020-04-05
1,Alemanha regista 4.003 novos contágios nas últimas 24 horas,"As últimas notícias e reportagens sobre Portugal e o Mundo. Actualidade, Globo, Desporto, Fama e TV, Arte e Lazer. Passatempos. Todas as fotos e videos em destak.pt",Destak,2020-04-08 13:15:24,"Covid-19
A Alemanha registou 4.003 novos contágios de coronavírus (covid-19) nas últimas 24 horas, elevando o número total para os 103.228 casos, e contabilizou 254 mortos num dia, alcançando as 1.861 vítimas, de acordo com as autoridades sanitárias.
Os números do Instituto Robert Koch (RKI), o centro de epidemiologia da Alemanha, atualizados às 08:10 (06:10 em Lisboa) continuam abaixo dos dados da Universidade Johns Hopkins - que utiliza um método de recolha de dados mais dinâmico - e que indica que o número de mortos é de 2.016.
A Alemanha é o quinto país em termos de contágios, atrás dos Estados Unidos (396.223), Espanha (141.942), Itália (135.586) e França (110.065) e à frente da República Popular da China (82.718), de acordo com a instituição universitária norte-americana.",http://www.destak.pt/artigo/413624-alemanha-regista-4.003-novos-contagios-nas-ultimas-24-horas,Destak . pt | Covid - 19 : Alemanha regista 4 . 003 novos contágios nas últimas 24 horas,http://www.destak.pt/artigo/413624-alemanha-regista-4.003-novos-contagios-nas-ultimas-24-horas,NA,artlist,PO,,100 minutes,FALSE,250,https://api.gdeltproject.org/api/v2/doc/doc?query=%20sourcecountry:po&sourcelang:por&mode=artlist&format=json&timespan=100&maxrecords=250&sort=datedesc,NA,2020-04-08T08:45:00Z,http://www.destak.pt/images/newsletter_no_img.jpg,destak.pt,Portuguese,Portugal,"Covid-19
A Alemanha registou 4.003 novos contágios de coronavírus (covid-19) nas últimas 24 horas, elevando o número total para os 103.228 casos, e contabilizou 254 mortos num dia, alcançando as 1.861 vítimas, de acordo com as autoridades sanitárias.
Os números do Instituto Robert Koch (RKI), o centro de epidemiologia da Alemanha, atualizados às 08:10 (06:10 em Lisboa) continuam abaixo dos dados da Universidade Johns Hopkins - que utiliza um método de recolha de dados mais dinâmico - e que indica que o número de mortos é de 2.016.
A Alemanha é o quinto país em termos de contágios, atrás dos Estados Unidos (396.223), Espanha (141.942), Itália (135.586) e França (110.065) e à frente da República Popular da China (82.718), de acordo com a instituição universitária norte-americana.",0.9646357051555177,0.9280809565036006,0.9686674216685542,0.970499243570348,0.9668425018839487,"Random Forests
('ranger' package, R 3.5.3.)
Wright MN, Ziegler A (2017). “ranger: A Fast Implementation of Random Forests for High Dimensional Data in C++ and R.” Journal of Statistical Software, 77(1), 1–17. doi: 10.18637/jss.v077.i01.",5479,0.4347048300536673,204,500,20,gini,classification,2020-04-05
1,Sem acordo. Reunião do Eurogrupo suspensa após 16 horas de discussão,"A reunião do Eurogrupo foi suspensa esta madrugada após 16 horas de discussões sem consenso para um compromisso político sobre a resposta económica da Europa à crise provocada pela pandemia covid-19, sendo retomada na quinta-feira, foi anunciado esta quarta-feira.",Global Media Group,2020-04-08 13:15:25,"Reunião do Eurogrupo. Uma ""maratona"" que vai mesmo prolongar-se noite dentro
EUA registam 2 mil mortos em 24 horas, um novo máximo a nível mundial. Boris Johnson passa segunda noite nos cuidados intensivos
""Após 16 horas de discussões, chegámos perto de um acordo, mas ainda não estamos lá"", pelo que ""suspendi o Eurogrupo e [a discussão] continua amanhã, quinta-feira"", informa através da rede social Twitter o presidente do fórum de ministros das Finanças da zona euro, o português Mário Centeno.
O responsável garante que, ainda assim, o seu objetivo para a resposta europeia à crise ""permanece"" o mesmo, visando criar a consenso para ""uma forte rede de segurança da União Europeia contra as consequências da covid-19, protegendo trabalhadores, empresas e países, e compromissos com um plano significativo de recuperação"".
Também através daquela rede social, o porta-voz do Eurogrupo, Luís Rego, informou que, devido à suspensão dos trabalhos, a conferência de imprensa marcada para esta manhã foi adiada. ""Mais detalhes serão anunciados posteriormente"", adianta.
Fechar Subscreva as newsletters Diário de Notícias e receba as informações em primeira mão. Subscrever
A videoconferência desta quarta-feira do Eurogrupo, conduzida desde Lisboa por Mário Centeno, começou na terça-feira já com um atraso de uma hora, às 15:00 de Lisboa, tendo sido interrompida cerca das 18:00 para uma pausa de uma hora.
Porém, essa interrupção -- durante a qual são feitos os tradicionais contactos bilaterais para tentar alcançar consensos -- foi sendo prolongada até às 22:00 de Lisboa, até ao anúncio de que os trabalhos iriam entrar noite dentro.
Ministro holandês das finanças abre a porta à disponibilização de fundos
O ministro holandês das finanças, Wopke Hoekstra, que recentemente defendeu que a Comissão Europeia devia investigar países como Espanha, que dizem não ter margem orçamental para responder ao impacto da crise provocada pelo covid-19 - declarações consideradas ""repugnantes"" por António Costa"", disse esta quarta-feira que ""é importante que a Europa disponibilze fundos"".
""Reunião de Eurogrupo muito longa, intensa e tampém construtiva sobre a crise do coronavírus que nos afeta a todos. Estamos a lidar principalmente com uma crise de saúde e é importante que a Europa disponibilze fundos. Também concordamos com o apoio do Banco Europeu de Investimento às empresas e empreendedores em dificuldades"", escreveu no Twitter.
""Devido à atual crise, precisamos de abrir uma exceção e o Mecanismo Europeu de Estabilidade deverá ser utilizado incondicionalmente para cobrir custos médicos. Para o apoio económico de longo prazo, achamos que seria sensato acordar a utiilização do Mecanismo Europeu de Estabilidade mediante certas condições económicas. Continuaremos as discussões sobre como lidar com esta crise"", acrescentou.
Comissão Europeia pede ""sentido de responsabilidade""
O comissário europeu da Economia apelou esta quarta-feira ao ""sentido de responsabilidade"" do Eurogrupo, por os ministros das Finanças da zona euro não terem ainda chegado a acordo sobre a resposta económica da Europa à crise gerada pela covid-19.
""A Comissão Europeia apela ao sentido de responsabilidade necessário numa crise como esta"", vinca o responsável europeu pela pasta da Economia, Paolo Gentiloni, numa publicação na rede social Twitter, dando conta da suspensão dos trabalhos após 16 horas de negociações.
Aquele que é o representante do executivo comunitário nas discussões do Eurogrupo sobre a crise gerada pela pandemia covid-19, adianta: ""Amanhã é outro dia"".
A reunião do Eurogrupo foi suspensa esta madrugada após 16 horas de discussões sem consenso para um compromisso político sobre a resposta económica da Europa à crise provocada pela pandemia covid-19, e será retomada na quinta-feira.
Também através do Twitter, o ministro francês da Economia e Finanças, Bruno Le Maire, e o seu homólogo alemão, Olaf Scholz, exortam ""todos os Estados europeus a derrubar os desafios excecionais para chegar a um acordo ambicioso"" no Eurogrupo, numa publicação conjunta (e publicada pelo primeiro).
Já Olaf Scholz, numa publicação também assinada com Bruno Le Maire, vinca na sua conta do Twitter que, ""nesta hora difícil, a Europa deve permanecer unida"". ""Apelamos a que todos os países do euro não se recusem a resolver estas questões financeiras difíceis e que possibilitem um bom compromisso para todos os cidadãos"", refere a mesma mensagem.
Antes da reunião, Centeno disse esperar que os ministros das Finanças europeus cheguem a acordo sobre um pacote financeiro de emergência robusto para trabalhadores, empresas e países, e que se comprometam claramente com um plano de recuperação de grande envergadura.
Contudo, o compromisso a que os ministros das Finanças estão obrigados a chegar está a revelar-se difícil de fechar, pois o ponto mais controverso da resposta, o financiamento para os Estados-membros, que Centeno defende que deve ser garantido através de linhas de crédito do Mecanismo Europeu de Estabilidade (MEE), por ser a opção mais prática e ""consensual"", continua a dividir os Estados-membros.
De um lado, vários países, encabeçados por Itália, defendem antes a emissão conjunta de dívida - os chamados eurobonds ou coronabonds - e o primeiro-ministro italiano, Giuseppe Conte, já reafirmou a sua oposição à solução em forma de empréstimos do fundo de resgate da zona euro. Do outro, um conjunto de países, com Holanda à cabeça, rejeita liminarmente a mutualização da dívida, e, mesmo em relação às linhas de crédito do MEE, quer impor condições.
Mais pacíficas serão as duas outras vertentes do pacote de emergência que o presidente do Eurogrupo espera fechar nesta reunião, para apresentar aos chefes de Estado e de Governo da UE: o programa de 100 mil milhões de euros proposto pela Comissão Europeia para financiar regimes de proteção de emprego e uma garantia de 200 mil milhões de euros do Banco Europeu de Investimento para apoiar as empresas em dificuldades, especialmente as pequenas e médias empresas.
Em pouco mais de um mês, esta é a quarta reunião por videoconferência dos ministros das Finanças europeus para tentar acordar uma resposta comum à crise do novo coronavírus, sendo que desta feita é-lhes exigido um compromisso, para ser apresentado aos líderes europeus.
No último Conselho Europeu por videoconferência, realizado em 26 de março, os chefes de Estado e de Governo da União Europeia, após uma longa e tensa discussão, mandataram o Eurogrupo para apresentar, no prazo de duas semanas, propostas concretas sobre como enfrentar as consequências socioeconómicas da pandemia, que ""tenham em conta a natureza sem precedentes do choque de covid-19"", que afeta as economias de todos os Estados-membros.",https://www.dn.pt/poder/reuniao-do-eurogrupo-suspensa-apos-16-horas-de-discussao-sem-acordo-12045015.html,Sem acordo . Reunião do Eurogrupo suspensa após 16 horas de discussão,https://www.dn.pt/poder/reuniao-do-eurogrupo-suspensa-apos-16-horas-de-discussao-sem-acordo-12045015.html,2020-04-08 10:06:00,artlist,PO,,100 minutes,FALSE,250,https://api.gdeltproject.org/api/v2/doc/doc?query=%20sourcecountry:po&sourcelang:por&mode=artlist&format=json&timespan=100&maxrecords=250&sort=datedesc,https://www.dn.pt/poder/amp/reuniao-do-eurogrupo-suspensa-apos-16-horas-de-discussao-sem-acordo-12045015.html,2020-04-08T08:45:00Z,https://static.globalnoticias.pt/dn/image.aspx?brand=DN&type=generate&guid=2976f30c-5814-4cee-8232-9aec99969448&watermark=true&t=20200408080600,dn.pt,Portuguese,Portugal,"Reunião do Eurogrupo. Uma ""maratona"" que vai mesmo prolongar-se noite dentro
EUA registam 2 mil mortos em 24 horas, um novo máximo a nível mundial. Boris Johnson passa segunda noite nos cuidados intensivos
""Após 16 horas de discussões, chegámos perto de um acordo, mas ainda não estamos lá"", pelo que ""suspendi o Eurogrupo e [a discussão] continua amanhã, quinta-feira"", informa através da rede social Twitter o presidente do fórum de ministros das Finanças da zona euro, o português Mário Centeno.
O responsável garante que, ainda assim, o seu objetivo para a resposta europeia à crise ""permanece"" o mesmo, visando criar a consenso para ""uma forte rede de segurança da União Europeia contra as consequências da covid-19, protegendo trabalhadores, empresas e países, e compromissos com um plano significativo de recuperação"".
Também através daquela rede social, o porta-voz do Eurogrupo, Luís Rego, informou que, devido à suspensão dos trabalhos, a conferência de imprensa marcada para esta manhã foi adiada. ""Mais detalhes serão anunciados posteriormente"", adianta.
Fechar Subscreva as newsletters Diário de Notícias e receba as informações em primeira mão. Subscrever
A videoconferência desta quarta-feira do Eurogrupo, conduzida desde Lisboa por Mário Centeno, começou na terça-feira já com um atraso de uma hora, às 15:00 de Lisboa, tendo sido interrompida cerca das 18:00 para uma pausa de uma hora.
Porém, essa interrupção -- durante a qual são feitos os tradicionais contactos bilaterais para tentar alcançar consensos -- foi sendo prolongada até às 22:00 de Lisboa, até ao anúncio de que os trabalhos iriam entrar noite dentro.
Ministro holandês das finanças abre a porta à disponibilização de fundos
O ministro holandês das finanças, Wopke Hoekstra, que recentemente defendeu que a Comissão Europeia devia investigar países como Espanha, que dizem não ter margem orçamental para responder ao impacto da crise provocada pelo covid-19 - declarações consideradas ""repugnantes"" por António Costa"", disse esta quarta-feira que ""é importante que a Europa disponibilze fundos"".
""Reunião de Eurogrupo muito longa, intensa e tampém construtiva sobre a crise do coronavírus que nos afeta a todos. Estamos a lidar principalmente com uma crise de saúde e é importante que a Europa disponibilze fundos. Também concordamos com o apoio do Banco Europeu de Investimento às empresas e empreendedores em dificuldades"", escreveu no Twitter.
""Devido à atual crise, precisamos de abrir uma exceção e o Mecanismo Europeu de Estabilidade deverá ser utilizado incondicionalmente para cobrir custos médicos. Para o apoio económico de longo prazo, achamos que seria sensato acordar a utiilização do Mecanismo Europeu de Estabilidade mediante certas condições económicas. Continuaremos as discussões sobre como lidar com esta crise"", acrescentou.
Comissão Europeia pede ""sentido de responsabilidade""
O comissário europeu da Economia apelou esta quarta-feira ao ""sentido de responsabilidade"" do Eurogrupo, por os ministros das Finanças da zona euro não terem ainda chegado a acordo sobre a resposta económica da Europa à crise gerada pela covid-19.
""A Comissão Europeia apela ao sentido de responsabilidade necessário numa crise como esta"", vinca o responsável europeu pela pasta da Economia, Paolo Gentiloni, numa publicação na rede social Twitter, dando conta da suspensão dos trabalhos após 16 horas de negociações.
Aquele que é o representante do executivo comunitário nas discussões do Eurogrupo sobre a crise gerada pela pandemia covid-19, adianta: ""Amanhã é outro dia"".
A reunião do Eurogrupo foi suspensa esta madrugada após 16 horas de discussões sem consenso para um compromisso político sobre a resposta económica da Europa à crise provocada pela pandemia covid-19, e será retomada na quinta-feira.
Também através do Twitter, o ministro francês da Economia e Finanças, Bruno Le Maire, e o seu homólogo alemão, Olaf Scholz, exortam ""todos os Estados europeus a derrubar os desafios excecionais para chegar a um acordo ambicioso"" no Eurogrupo, numa publicação conjunta (e publicada pelo primeiro).
Já Olaf Scholz, numa publicação também assinada com Bruno Le Maire, vinca na sua conta do Twitter que, ""nesta hora difícil, a Europa deve permanecer unida"". ""Apelamos a que todos os países do euro não se recusem a resolver estas questões financeiras difíceis e que possibilitem um bom compromisso para todos os cidadãos"", refere a mesma mensagem.
Antes da reunião, Centeno disse esperar que os ministros das Finanças europeus cheguem a acordo sobre um pacote financeiro de emergência robusto para trabalhadores, empresas e países, e que se comprometam claramente com um plano de recuperação de grande envergadura.
Contudo, o compromisso a que os ministros das Finanças estão obrigados a chegar está a revelar-se difícil de fechar, pois o ponto mais controverso da resposta, o financiamento para os Estados-membros, que Centeno defende que deve ser garantido através de linhas de crédito do Mecanismo Europeu de Estabilidade (MEE), por ser a opção mais prática e ""consensual"", continua a dividir os Estados-membros.
De um lado, vários países, encabeçados por Itália, defendem antes a emissão conjunta de dívida - os chamados eurobonds ou coronabonds - e o primeiro-ministro italiano, Giuseppe Conte, já reafirmou a sua oposição à solução em forma de empréstimos do fundo de resgate da zona euro. Do outro, um conjunto de países, com Holanda à cabeça, rejeita liminarmente a mutualização da dívida, e, mesmo em relação às linhas de crédito do MEE, quer impor condições.
Mais pacíficas serão as duas outras vertentes do pacote de emergência que o presidente do Eurogrupo espera fechar nesta reunião, para apresentar aos chefes de Estado e de Governo da UE: o programa de 100 mil milhões de euros proposto pela Comissão Europeia para financiar regimes de proteção de emprego e uma garantia de 200 mil milhões de euros do Banco Europeu de Investimento para apoiar as empresas em dificuldades, especialmente as pequenas e médias empresas.
Em pouco mais de um mês, esta é a quarta reunião por videoconferência dos ministros das Finanças europeus para tentar acordar uma resposta comum à crise do novo coronavírus, sendo que desta feita é-lhes exigido um compromisso, para ser apresentado aos líderes europeus.
No último Conselho Europeu por videoconferência, realizado em 26 de março, os chefes de Estado e de Governo da União Europeia, após uma longa e tensa discussão, mandataram o Eurogrupo para apresentar, no prazo de duas semanas, propostas concretas sobre como enfrentar as consequências socioeconómicas da pandemia, que ""tenham em conta a natureza sem precedentes do choque de covid-19"", que afeta as economias de todos os Estados-membros.",0.9646357051555177,0.9280809565036006,0.9686674216685542,0.970499243570348,0.9668425018839487,"Random Forests
('ranger' package, R 3.5.3.)
Wright MN, Ziegler A (2017). “ranger: A Fast Implementation of Random Forests for High Dimensional Data in C++ and R.” Journal of Statistical Software, 77(1), 1–17. doi: 10.18637/jss.v077.i01.",5479,0.4347048300536673,204,500,20,gini,classification,2020-04-05
