prediction_covid_topic,title,description,authors,date_download,maintext,url,gdelt_title,gdelt_url,date_publish,modeSearch,sourcecountrySearch,termSearch,periodtimeSearch,isOR,countMaximumRecords,urlGDELTV2FTAPI,urlArticleMobile,datetimeArticle,urlImage,domainArticle,languageArticle,countryArticle,pred_input,model_accuracy,model_kappa,model_f1,model_precision,model_recall,model,sample_size,train_prop_covid,mtry,n_tree,min_node_size,splitrule,model_type,fitted_on
1,Camponeses moçambicanos reinventam-se perante mudanças climáticas e pandemia,"As últimas notícias e reportagens sobre Portugal e o Mundo. Actualidade, Globo, Desporto, Fama e TV, Arte e Lazer. Passatempos. Todas as fotos e videos em destak.pt",Destak,2020-05-17 10:15:14,"Covid-19
Milhares de camponeses reinventaram-se nas práticas agrícolas para responder, em simultâneo, às mudanças climáticas e à pandemia de covid-19, sem baixar a produção em aldeias do interior de Manica, centro de Moçambique.
Aqui, garantir a segurança alimentar é crucial, porque a pobreza e implacável e a fome está à espreita.
Usam técnicas de conservação nos seus campos de cultivos, que incluem rotação de terras, gestão de culturas, compostagem e uso de pesticidas orgânicos, no âmbito dos conselhos ministrados para resistir às mudanças climáticas.",http://www.destak.pt/artigo/421371-camponeses-mocambicanos-reinventam-se-perante-mudancas-climaticas-e-pandemia,Destak . pt | Covid - 19 : Camponeses moçambicanos reinventam - se perante mudanças climáticas e pandemia,http://www.destak.pt/artigo/421371-camponeses-mocambicanos-reinventam-se-perante-mudancas-climaticas-e-pandemia,NA,artlist,PO,,100 minutes,FALSE,250,https://api.gdeltproject.org/api/v2/doc/doc?query=%20sourcecountry:po&sourcelang:por&mode=artlist&format=json&timespan=100&maxrecords=250&sort=datedesc,NA,2020-05-17T05:45:00Z,http://www.destak.pt/images/newsletter_no_img.jpg,destak.pt,Portuguese,Portugal,"Covid-19
Milhares de camponeses reinventaram-se nas práticas agrícolas para responder, em simultâneo, às mudanças climáticas e à pandemia de covid-19, sem baixar a produção em aldeias do interior de Manica, centro de Moçambique.
Aqui, garantir a segurança alimentar é crucial, porque a pobreza e implacável e a fome está à espreita.
Usam técnicas de conservação nos seus campos de cultivos, que incluem rotação de terras, gestão de culturas, compostagem e uso de pesticidas orgânicos, no âmbito dos conselhos ministrados para resistir às mudanças climáticas.",0.9646357051555177,0.9280809565036006,0.9686674216685542,0.970499243570348,0.9668425018839487,"Random Forests
('ranger' package, R 3.5.3.)
Wright MN, Ziegler A (2017). “ranger: A Fast Implementation of Random Forests for High Dimensional Data in C++ and R.” Journal of Statistical Software, 77(1), 1–17. doi: 10.18637/jss.v077.i01.",5479,0.4347048300536673,204,500,20,gini,classification,2020-04-05
1,Covid-19. Brasil com mais de 15 mil mortos e com 233.142 casos confirmados,"O Brasil totaliza 15.633 óbitos e 233.142 pessoas diagnosticados com covid-19 desde o início da pandemia, tendo registado nas últimas 24 horas 816 mortos e 14.919 novos infetados, informou o executivo.",Rádio E Televisão De Portugal,2020-05-17 10:15:16,"O Ministério da Saúde indicou ainda que está a ser investigada a eventual relação de 2.304 óbitos com a doença provocada pelo novo coronavírus.No total, o país sul-americano já registou a recuperação de 89.672 pacientes de covid-19, sendo que 127.837 continuam sob acompanhamento.O aumento no número de mortes no Brasil foi de 5,5%, passando de 14.817 na sexta-feira para 15.633 no sábado. Face ao número de infetados, o crescimento foi de 6,8%, passando de 218.223 para 233.142 casos confirmados de infeção.
São Paulo o estado mais afetado
São Paulo, epicentro da doença no país, contabiliza oficialmente 61.183 pessoas diagnosticadas com covid-19 e 4.688 mortes, seguido pelo Ceará, que conta com 23.795 casos confirmados e 1.614 óbitos.O Rio de Janeiro, terceiro estado com maior número de casos confirmados, tem 21.601 casos de infeção e 2.614 vítimas mortais.Apenas duas das 27 unidades federativas do Brasil ainda não ultrapassaram os mil casos da covid-19: Mato Grosso e Mato Grosso do Sul.
Após o oncologista Nelson Teich ter pedido a demissão na sexta-feira do cargo de ministro da Saúde, o governo liderado pelo presidente Jair Bolsonaro anunciou, no sábado, que o secretário executivo da pasta, general Eduardo Pazuello, assumirá interinamente o comando do ministério.",https://www.rtp.pt/noticias/mundo/covid-19-brasil-com-mais-de-15-mil-mortos-e-com-233142-casos-confirmados_n1229506,Covid - 19 . Brasil com mais de 15 mil mortos e com 233 . 142 casos confirmados,https://www.rtp.pt/noticias/mundo/covid-19-brasil-com-mais-de-15-mil-mortos-e-com-233142-casos-confirmados_n1229506,2020-05-17 07:32:58,artlist,PO,,100 minutes,FALSE,250,https://api.gdeltproject.org/api/v2/doc/doc?query=%20sourcecountry:po&sourcelang:por&mode=artlist&format=json&timespan=100&maxrecords=250&sort=datedesc,NA,2020-05-17T05:45:00Z,"https://cdn-images.rtp.pt/icm/noticias/images/21/21b2dfd1d39f0d3327d36f222dce7024?&q=90&rect=0,57,1086,595&auto=format",rtp.pt,Portuguese,Portugal,"O Ministério da Saúde indicou ainda que está a ser investigada a eventual relação de 2.304 óbitos com a doença provocada pelo novo coronavírus.No total, o país sul-americano já registou a recuperação de 89.672 pacientes de covid-19, sendo que 127.837 continuam sob acompanhamento.O aumento no número de mortes no Brasil foi de 5,5%, passando de 14.817 na sexta-feira para 15.633 no sábado. Face ao número de infetados, o crescimento foi de 6,8%, passando de 218.223 para 233.142 casos confirmados de infeção.
São Paulo o estado mais afetado
São Paulo, epicentro da doença no país, contabiliza oficialmente 61.183 pessoas diagnosticadas com covid-19 e 4.688 mortes, seguido pelo Ceará, que conta com 23.795 casos confirmados e 1.614 óbitos.O Rio de Janeiro, terceiro estado com maior número de casos confirmados, tem 21.601 casos de infeção e 2.614 vítimas mortais.Apenas duas das 27 unidades federativas do Brasil ainda não ultrapassaram os mil casos da covid-19: Mato Grosso e Mato Grosso do Sul.
Após o oncologista Nelson Teich ter pedido a demissão na sexta-feira do cargo de ministro da Saúde, o governo liderado pelo presidente Jair Bolsonaro anunciou, no sábado, que o secretário executivo da pasta, general Eduardo Pazuello, assumirá interinamente o comando do ministério.",0.9646357051555177,0.9280809565036006,0.9686674216685542,0.970499243570348,0.9668425018839487,"Random Forests
('ranger' package, R 3.5.3.)
Wright MN, Ziegler A (2017). “ranger: A Fast Implementation of Random Forests for High Dimensional Data in C++ and R.” Journal of Statistical Software, 77(1), 1–17. doi: 10.18637/jss.v077.i01.",5479,0.4347048300536673,204,500,20,gini,classification,2020-04-05
1,China regista mais cinco casos em tempo de desconfinamento,"A China registou cinco casos de infeção com o novo coronavírus nas últimas 24 horas, no momento em que a cidade de Xangai anunciou o reinício de algumas aulas e as companhias aéreas retomaram voos.",Rádio E Televisão De Portugal,2020-05-17 10:15:16,"Dos novos casos, dois foram importados e três foram identificados na província de Jilin, no nordeste do país.Nenhuma nova morte foi registada no último mês, mas as autoridades de Jilin somaram retroativamente um óbito à contabilidade, elevando o total de fatalidades na China para 4.634, entre os 82.947 casos registados desde que o surto foi detetado pela primeira vez em Wuhan no final de 2019.Apenas 86 pessoas permanecem hospitalizadas, enquanto outras 519 estão em isolamento após mostrarem sinais da presença do vírus ou terem resultado positivo ainda que não apresentem sintomas.
Ações denunciam regresso à normalidade
A China agora tem capacidade para realizar 1,5 milhão de testes de ácido nucleico por dia, disse a Comissão Nacional de Saúde, que está a colocar uma nova ênfase na biossegurança, gestão de laboratórios e formação de pessoal.Já o número de voos domésticos regressou a 60% dos níveis pré-surto, excedendo dez mil por dia pela primeira vez desde 1 de fevereiro, informou o órgão regulador da aviação civil do país.Com as férias de verão a aproximarem-se, vários locais turísticos foram reabertos, incluindo o famoso palácio da Cidade Proibida de Pequim e a Disneylândia de Xangai, embora ainda existam medidas estritas de distanciamento social.Tal como em Pequim e outras cidades, Xangai já reiniciou as aulas para alunos do ensino secundário que se preparam para os exames.Em Xangai, os alunos mantêm a opção de continuar a frequentar as aulas ""online"", em vez de enfrentarem testes de vírus e medidas de distanciamento social nas escolas.",https://www.rtp.pt/noticias/mundo/china-regista-mais-cinco-casos-em-tempo-de-desconfinamento_n1229509,China regista mais cinco casos em tempo de desconfinamento,https://www.rtp.pt/noticias/mundo/china-regista-mais-cinco-casos-em-tempo-de-desconfinamento_n1229509,2020-05-17 08:01:40,artlist,PO,,100 minutes,FALSE,250,https://api.gdeltproject.org/api/v2/doc/doc?query=%20sourcecountry:po&sourcelang:por&mode=artlist&format=json&timespan=100&maxrecords=250&sort=datedesc,NA,2020-05-17T05:45:00Z,"https://cdn-images.rtp.pt/icm/noticias/images/70/70ae93b22c81bd091682ec8815abf3d4?&q=90&rect=0,10,1440,789&auto=format",rtp.pt,Portuguese,Portugal,"Dos novos casos, dois foram importados e três foram identificados na província de Jilin, no nordeste do país.Nenhuma nova morte foi registada no último mês, mas as autoridades de Jilin somaram retroativamente um óbito à contabilidade, elevando o total de fatalidades na China para 4.634, entre os 82.947 casos registados desde que o surto foi detetado pela primeira vez em Wuhan no final de 2019.Apenas 86 pessoas permanecem hospitalizadas, enquanto outras 519 estão em isolamento após mostrarem sinais da presença do vírus ou terem resultado positivo ainda que não apresentem sintomas.
Ações denunciam regresso à normalidade
A China agora tem capacidade para realizar 1,5 milhão de testes de ácido nucleico por dia, disse a Comissão Nacional de Saúde, que está a colocar uma nova ênfase na biossegurança, gestão de laboratórios e formação de pessoal.Já o número de voos domésticos regressou a 60% dos níveis pré-surto, excedendo dez mil por dia pela primeira vez desde 1 de fevereiro, informou o órgão regulador da aviação civil do país.Com as férias de verão a aproximarem-se, vários locais turísticos foram reabertos, incluindo o famoso palácio da Cidade Proibida de Pequim e a Disneylândia de Xangai, embora ainda existam medidas estritas de distanciamento social.Tal como em Pequim e outras cidades, Xangai já reiniciou as aulas para alunos do ensino secundário que se preparam para os exames.Em Xangai, os alunos mantêm a opção de continuar a frequentar as aulas ""online"", em vez de enfrentarem testes de vírus e medidas de distanciamento social nas escolas.",0.9646357051555177,0.9280809565036006,0.9686674216685542,0.970499243570348,0.9668425018839487,"Random Forests
('ranger' package, R 3.5.3.)
Wright MN, Ziegler A (2017). “ranger: A Fast Implementation of Random Forests for High Dimensional Data in C++ and R.” Journal of Statistical Software, 77(1), 1–17. doi: 10.18637/jss.v077.i01.",5479,0.4347048300536673,204,500,20,gini,classification,2020-04-05
1,Covid-19. Obama lança críticas indiretas a Trump em cerimónia virtual,"O ex-presidente dos Estados Unidos da América (EUA), Barack Obama, dirigiu-se a estudantes numa cerimónia virtual de diploma, numa rara intervenção pública desde o início da pandemia da covid-19, e criticou indiretamente a gestão do seu sucessor.",Rádio E Televisão De Portugal,2020-05-17 10:15:16,"Obama não tem por hábito criticar em público Donald Trump, mas já emitiu de forma velada diversas observações contrárias à atual administração da Casa Branca.No decurso de uma mensagem de felicitações difundida para os diplomas da rede das universidades historicamente negras (HBCU), o ex-presidente optou por evocar as consequências da pandemia provocada pelo novo coronavírus."", disse Obama."", acrescentou.O ex-presidente e membro do Partido Democrata sublinhou igualmente que a crise sanitária é reveladora das desigualdades que afetam os negros norte-americanos e aparentemente indignou-se, mas sem referência explícita, com a morte de Ahmaud Arbery, 25 anos, abatido em 23 de fevereiro quando fazia ""jogging"" num bairro residencial de Brunswick, cidade da Geórgia, um estado do sul do país."", afirmou Barack Obama.E prosseguiu: """".
Críticas duras em privado
Em privado, e segundo os media norte-americanos, Barack Obama já qualificou mais explicitamente a gestão da pandemia por Donald Trump de """", durante contactos com antigos colaboradores em 8 de maio.Na ocasião assegurou que vai despender ""o tempo que for necessário para fazer campanha o mais intensamente possível por Joe Biden"", a quem concedeu o seu apoio oficial, em 14 de abril, numa longa mensagem vídeo, na perspetiva das presidenciais de novembro próximo.Contra Donald Trump, que evocou a existência de uma conspiração contra si designada ""Obamagate"", o ex-presidente respondeu na semana passada com uma palavra na rede social o Twitter: ""Votai"".",https://www.rtp.pt/noticias/mundo/covid-19-obama-lanca-criticas-indiretas-a-trump-em-cerimonia-virtual_n1229507,Covid - 19 . Obama lança críticas indiretas a Trump em cerimónia virtual,https://www.rtp.pt/noticias/mundo/covid-19-obama-lanca-criticas-indiretas-a-trump-em-cerimonia-virtual_n1229507,2020-05-17 07:44:37,artlist,PO,,100 minutes,FALSE,250,https://api.gdeltproject.org/api/v2/doc/doc?query=%20sourcecountry:po&sourcelang:por&mode=artlist&format=json&timespan=100&maxrecords=250&sort=datedesc,NA,2020-05-17T05:45:00Z,"https://cdn-images.rtp.pt/icm/noticias/images/1b/1be81921c9f3f164e313fe37c0f0b7e7?&q=90&rect=0,4,1131,620&auto=format",rtp.pt,Portuguese,Portugal,"Obama não tem por hábito criticar em público Donald Trump, mas já emitiu de forma velada diversas observações contrárias à atual administração da Casa Branca.No decurso de uma mensagem de felicitações difundida para os diplomas da rede das universidades historicamente negras (HBCU), o ex-presidente optou por evocar as consequências da pandemia provocada pelo novo coronavírus."", disse Obama."", acrescentou.O ex-presidente e membro do Partido Democrata sublinhou igualmente que a crise sanitária é reveladora das desigualdades que afetam os negros norte-americanos e aparentemente indignou-se, mas sem referência explícita, com a morte de Ahmaud Arbery, 25 anos, abatido em 23 de fevereiro quando fazia ""jogging"" num bairro residencial de Brunswick, cidade da Geórgia, um estado do sul do país."", afirmou Barack Obama.E prosseguiu: """".
Críticas duras em privado
Em privado, e segundo os media norte-americanos, Barack Obama já qualificou mais explicitamente a gestão da pandemia por Donald Trump de """", durante contactos com antigos colaboradores em 8 de maio.Na ocasião assegurou que vai despender ""o tempo que for necessário para fazer campanha o mais intensamente possível por Joe Biden"", a quem concedeu o seu apoio oficial, em 14 de abril, numa longa mensagem vídeo, na perspetiva das presidenciais de novembro próximo.Contra Donald Trump, que evocou a existência de uma conspiração contra si designada ""Obamagate"", o ex-presidente respondeu na semana passada com uma palavra na rede social o Twitter: ""Votai"".",0.9646357051555177,0.9280809565036006,0.9686674216685542,0.970499243570348,0.9668425018839487,"Random Forests
('ranger' package, R 3.5.3.)
Wright MN, Ziegler A (2017). “ranger: A Fast Implementation of Random Forests for High Dimensional Data in C++ and R.” Journal of Statistical Software, 77(1), 1–17. doi: 10.18637/jss.v077.i01.",5479,0.4347048300536673,204,500,20,gini,classification,2020-04-05
