prediction_covid_topic,title,description,authors,date_download,date_publish,maintext,url,gdelt_title,gdelt_url,modeSearch,sourcecountrySearch,termSearch,periodtimeSearch,isOR,countMaximumRecords,urlGDELTV2FTAPI,urlArticleMobile,datetimeArticle,urlImage,domainArticle,languageArticle,countryArticle,pred_input,model_accuracy,model_kappa,model_f1,model_precision,model_recall,model,sample_size,train_prop_covid,mtry,n_tree,min_node_size,splitrule,model_type,fitted_on
1,Bolsas europeias com ganhos em dia de Eurogrupo e OPEP+,"O principal índice de Portugal, o PSI-20, segue a ganhar 2,2% pelas 9h, com o BCP a subir 3,5%. Petróleo está perto dos 34 dólares por barril.",Luís Villalobos,2020-04-09 18:15:27,2020-04-09 10:55:34,"As principais bolsas europeias abriram esta quinta-feira as sessões com ganhos, ainda com o impulso das bolsas norte-americanas de ontem (o índice norte-americano S&P 500 subiu 3,4%, colocando o ganho semanal em quase 11%, com as notícias do abrandamento do surto do novo coronavírus).
No caso de Portugal, pouco depois d arranque o PSI 20 seguia a ganhar 2,2%, com o BCP no topo a subir 3,5%. Entre todas as empresas reunidas neste índice apenas a Jerónimo Martins registava perdas (-0,4%). Na Alemanha, o Dax subia 2,2%, em França o CAC 40 crescia 1,84%, em Espanha o Ibex 35 ganhava 1,68% e no Reino Unido o Footsie 100 subia 2,21%.
Conforme assinalou ao Financial Times um analista de mercado, os investidores concentram-se actualmente nas curvas que registam as taxas de evolução do surto da covid-19 e que se tornaram no novo barómetro de risco.
Esta quinta-feira, os ministros das Finanças da zona euro voltam a reunir-se, após uma primeira tentativa, de modo a tentar um consenso sobre um conjunto de medidas económicas de combate aos efeitos do novo coronavírus. As taxas de juro implícitas de dívida pública de alguns países estão a ser pressionadas, com as obrigações a dez anos de Itália a situarem-se nos 1,7%, contra os -o,3% da Alemanha.
Já ao nível do petróleo, deverá realizar-se esta quinta-feira uma reunião dos países membros da OPEP + (ou seja, incluindo países como a Arábia Saudita mas também a Rússia), numa tentativa de acordo de cortes de produção para fazer subir os preços desta matéria-prima. A ideia é incluir também os EUA num acordo alargado. Na sexta-feira será a vez de se reunirem os ministros do G20 ligados ao petróleo e energia. O preço do barril (brent) subiu à boleia das notícias de cortes de produção, situando-se agora nos 33,9 dólares.",https://www.publico.pt/2020/04/09/economia/noticia/bolsas-europeias-ganhos-dia-eurogrupo-opep-1911657,Bolsas europeias com ganhos em dia de Eurogrupo e OPEP+,https://www.publico.pt/2020/04/09/economia/noticia/bolsas-europeias-ganhos-dia-eurogrupo-opep-1911657,artlist,PO,,100 minutes,FALSE,250,https://api.gdeltproject.org/api/v2/doc/doc?query=%20sourcecountry:po&sourcelang:por&mode=artlist&format=json&timespan=100&maxrecords=250&sort=datedesc,https://www.publico.pt/2020/04/09/economia/noticia/bolsas-europeias-ganhos-dia-eurogrupo-opep-1911657/amp,2020-04-09T13:30:00Z,NA,publico.pt,Portuguese,Portugal,"As principais bolsas europeias abriram esta quinta-feira as sessões com ganhos, ainda com o impulso das bolsas norte-americanas de ontem (o índice norte-americano S&P 500 subiu 3,4%, colocando o ganho semanal em quase 11%, com as notícias do abrandamento do surto do novo coronavírus).
No caso de Portugal, pouco depois d arranque o PSI 20 seguia a ganhar 2,2%, com o BCP no topo a subir 3,5%. Entre todas as empresas reunidas neste índice apenas a Jerónimo Martins registava perdas (-0,4%). Na Alemanha, o Dax subia 2,2%, em França o CAC 40 crescia 1,84%, em Espanha o Ibex 35 ganhava 1,68% e no Reino Unido o Footsie 100 subia 2,21%.
Conforme assinalou ao Financial Times um analista de mercado, os investidores concentram-se actualmente nas curvas que registam as taxas de evolução do surto da covid-19 e que se tornaram no novo barómetro de risco.
Esta quinta-feira, os ministros das Finanças da zona euro voltam a reunir-se, após uma primeira tentativa, de modo a tentar um consenso sobre um conjunto de medidas económicas de combate aos efeitos do novo coronavírus. As taxas de juro implícitas de dívida pública de alguns países estão a ser pressionadas, com as obrigações a dez anos de Itália a situarem-se nos 1,7%, contra os -o,3% da Alemanha.
Já ao nível do petróleo, deverá realizar-se esta quinta-feira uma reunião dos países membros da OPEP + (ou seja, incluindo países como a Arábia Saudita mas também a Rússia), numa tentativa de acordo de cortes de produção para fazer subir os preços desta matéria-prima. A ideia é incluir também os EUA num acordo alargado. Na sexta-feira será a vez de se reunirem os ministros do G20 ligados ao petróleo e energia. O preço do barril (brent) subiu à boleia das notícias de cortes de produção, situando-se agora nos 33,9 dólares.",0.9646357051555177,0.9280809565036006,0.9686674216685542,0.970499243570348,0.9668425018839487,"Random Forests
('ranger' package, R 3.5.3.)
Wright MN, Ziegler A (2017). “ranger: A Fast Implementation of Random Forests for High Dimensional Data in C++ and R.” Journal of Statistical Software, 77(1), 1–17. doi: 10.18637/jss.v077.i01.",5479,0.4347048300536673,204,500,20,gini,classification,2020-04-05
1,Várias associações querem ajudar DGS a melhorar divulgação de dados da Covid-19,"Várias entidades enviaram, na terça-feira, uma carta aberta à Direção Geral de Saúde (DGS) a ofereceram ajuda técnica para melhorar a divulgação de informação sobre a Covid-19.",Global Media Group,2020-04-09 18:15:31,2020-04-09 16:01:00,"Sofia Cristino Hoje às 14:01 Facebook
Twitter
Partilhar
Várias entidades enviaram, na terça-feira, uma carta aberta à Direção Geral de Saúde (DGS) a ofereceram ajuda técnica para melhorar a divulgação de informação sobre a Covid-19.
Na missiva, alertam para ""a importância da transparência das autoridades de saúde sobre a evolução da epidemia"" e das consequências da má informação ""ao nível da perceção pública e evolução da epidemia""
A Associação Portuguesa de Ciência de Dados para o Bem Social, a Associação Nacional de Médicos de Saúde Pública, o Centro de Investigação em Tecnologias e Serviços de Saúde, a Faculdade de Medicina da Universidade do Porto e o movimento Tech4Covid19 querem ajudar a DGS a melhorar a divulgação de dados sobre a Covid-19.
Lembram que a ""publicação atempada e facilmente consumível"" da informação poderá ""controlar fenómenos especulativos"" e garantir que todos estão a par das ""fragilidades"" do Sistema Nacional de Saúde (SNS) ""em tempo real"".
""Embora o trabalho de divulgação e disponibilização de dados por parte da DGS tenha melhorado ao longo da epidemia, ainda se verificam muitos atrasos, retrocessos, inconsistências e más práticas de partilha de dados"", criticam na carta aberta.
A ""constante mudança dos indicadores apresentados, a presença de inconsistências pontuais e a paragem da atualização de plataformas de dados como a Vigilância de Mortalidade da DGS"" são algumas das falhas apontadas. ""Algumas dever-se-ão a erros humanos - totalmente compreensíveis - de quadros clínicos sob grande pressão e elevadas cargas de trabalho"", mas outras ""resultam da ausência de um verdadeiro sistema de informação integrado no SNS, com consequências ao nível da perceção pública da atuação da DGS e evolução da epidemia"", dizem ainda.
O exemplo de outros países, lê-se ainda na carta, ""mostra a importância da transparência das autoridades de saúde relativamente à evolução da epidemia e à sua atuação sobre a mesma, através da publicação frequente de dados detalhados e de fácil processamento, como por exemplo, o repositório de dados da Proteção Civil Italiana ou o dashboard da epidemia em Singapura"".
""A análise à atuação da DGS foi feita com base na experiência de todas as entidades signatárias. Desta análise, emerge a falta clara de uma cultura de dados dentro da entidade"", concluem.",https://www.jn.pt/nacional/varias-associacoes-querem-ajudar-dgs-a-melhorar-divulgacao-de-dados-da-covid-19-12052212.html,Várias associaes querem ajudar DGS a melhorar divulgao de dados da Covid - 19,https://www.jn.pt/nacional/varias-associacoes-querem-ajudar-dgs-a-melhorar-divulgacao-de-dados-da-covid-19-12052212.html,artlist,PO,,100 minutes,FALSE,250,https://api.gdeltproject.org/api/v2/doc/doc?query=%20sourcecountry:po&sourcelang:por&mode=artlist&format=json&timespan=100&maxrecords=250&sort=datedesc,https://www.jn.pt/nacional/amp/varias-associacoes-querem-ajudar-dgs-a-melhorar-divulgacao-de-dados-da-covid-19-12052212.html,2020-04-09T13:30:00Z,https://static.globalnoticias.pt/jn/image.aspx?brand=JN&type=generate&guid=c1fe94b0-0939-4314-80fb-9ce4fa4f19cd&watermark=true&t=20200409140100,jn.pt,Portuguese,Portugal,"Sofia Cristino Hoje às 14:01 Facebook
Twitter
Partilhar
Várias entidades enviaram, na terça-feira, uma carta aberta à Direção Geral de Saúde (DGS) a ofereceram ajuda técnica para melhorar a divulgação de informação sobre a Covid-19.
Na missiva, alertam para ""a importância da transparência das autoridades de saúde sobre a evolução da epidemia"" e das consequências da má informação ""ao nível da perceção pública e evolução da epidemia""
A Associação Portuguesa de Ciência de Dados para o Bem Social, a Associação Nacional de Médicos de Saúde Pública, o Centro de Investigação em Tecnologias e Serviços de Saúde, a Faculdade de Medicina da Universidade do Porto e o movimento Tech4Covid19 querem ajudar a DGS a melhorar a divulgação de dados sobre a Covid-19.
Lembram que a ""publicação atempada e facilmente consumível"" da informação poderá ""controlar fenómenos especulativos"" e garantir que todos estão a par das ""fragilidades"" do Sistema Nacional de Saúde (SNS) ""em tempo real"".
""Embora o trabalho de divulgação e disponibilização de dados por parte da DGS tenha melhorado ao longo da epidemia, ainda se verificam muitos atrasos, retrocessos, inconsistências e más práticas de partilha de dados"", criticam na carta aberta.
A ""constante mudança dos indicadores apresentados, a presença de inconsistências pontuais e a paragem da atualização de plataformas de dados como a Vigilância de Mortalidade da DGS"" são algumas das falhas apontadas. ""Algumas dever-se-ão a erros humanos - totalmente compreensíveis - de quadros clínicos sob grande pressão e elevadas cargas de trabalho"", mas outras ""resultam da ausência de um verdadeiro sistema de informação integrado no SNS, com consequências ao nível da perceção pública da atuação da DGS e evolução da epidemia"", dizem ainda.
O exemplo de outros países, lê-se ainda na carta, ""mostra a importância da transparência das autoridades de saúde relativamente à evolução da epidemia e à sua atuação sobre a mesma, através da publicação frequente de dados detalhados e de fácil processamento, como por exemplo, o repositório de dados da Proteção Civil Italiana ou o dashboard da epidemia em Singapura"".
""A análise à atuação da DGS foi feita com base na experiência de todas as entidades signatárias. Desta análise, emerge a falta clara de uma cultura de dados dentro da entidade"", concluem.",0.9646357051555177,0.9280809565036006,0.9686674216685542,0.970499243570348,0.9668425018839487,"Random Forests
('ranger' package, R 3.5.3.)
Wright MN, Ziegler A (2017). “ranger: A Fast Implementation of Random Forests for High Dimensional Data in C++ and R.” Journal of Statistical Software, 77(1), 1–17. doi: 10.18637/jss.v077.i01.",5479,0.4347048300536673,204,500,20,gini,classification,2020-04-05
1,Espanha chega às 15 mil mortes mas número de óbitos diários volta a cair,"Espanha eleva para 15.238 e 152.446‬ o total de mortes e casos confirmados, respetivamente",Global Media Group,2020-04-09 18:15:32,2020-04-09 13:00:00,"Mais 757 mortes em Espanha. Número de óbitos sobe pelo segundo dia seguido
""Está a ser equacionado cerco sanitário a Castro Daire"". Testes de imunidade no final de abril
Espanha registou esta quarta-feira mais 683 mortes e 5 756 casos confirmados de infeção por covid-19, anunciou o Ministério da Saúde daquele país.
No total, registam-se 15 238 mortes e 152 446 casos confirmados em solo espanhol. Na véspera, Espanha tinha registado 757 mortes e 6180 casos de covid-19.
Entre as pessoas infetadas, 52 165 já recuperaram. Mais 4144‬ recuperaram nas últimas 24 horas.
Fechar Subscreva as newsletters Diário de Notícias e receba as informações em primeira mão. Subscrever
Espanha é o segundo país com mais casos confirmados, sendo apenas superado pelos Estados Unidos (435 mil), e também o segundo com mais mortes, sendo apenas superado por Itália (17 mil).
Parlamento vota esta quinta-feira prolongamento do estado de emergência
Os deputados espanhóis votam esta quinta-feira a proposta do governo para prolongar por mais duas semanas, até 25 deste mês, o estado de emergência em vigor desde 15 de março, com o objetivo e lutar contra o novo coronavírus.
Na sessão, tudo indicando existir uma maioria confortável de formações políticas que apoiam a iniciativa do Governo socialista, incluindo a maior da oposição, o Partido Popular, de direita.
Sábado passado, o primeiro-ministro espanhol, Pedro Sánchez, anunciou o prolongamento do estado de emergência até à meia-noite de 25 de abril, para travar a covid-19 numa altura em que, tudo indica, está ""superado o pico"" desta pandemia.
Na altura, o chefe do Governo avançou que as medidas de contenção que incluem o confinamento em casa para todos, salvo os que trabalham em serviços essenciais, iriam continuar, mas que estava a estudar a possibilidade de, a partir de segunda-feira 13 de abril, ser autorizado o regresso ao trabalho daqueles que não podiam fazê-lo a partir de casa.
O estado de emergência começou em 15 de março e impôs uma série de restrições à mobilidade dos cidadãos, que foram depois alargadas, com medidas adicionais, como o controlo nas fronteiras ou o fecho provisório de atividades económicas não essenciais.
O confinamento foi inicialmente aprovado por duas semanas, às quais foram acrescentadas mais duas, a partir de 29 de março e até 11 deste mês.
Apesar do agravamento da evolução nos últimos dois dias, as autoridades sanitárias espanholas estão convencidas de que o pico da pandemia foi alcançado, mas alertam para a necessidade de consolidar a tendência detetada.
Pedro Sánchez quer oposição à imagem de... Rui Rio
O primeiro-ministro espanhol pediu esta quinta-feira à oposição de direita para seguir o exemplo de Portugal, onde o presidente do PSD, Rui Rio, fez um ""discurso emotivo"" a desejar ""boa sorte"" e a oferecer a sua colaboração na luta contra a covid-19.
""Peço-vos humildemente unidade e lealdade"" institucional, repetiu Pedro Sánchez dirigindo-se ao líder do Partido Popular (PP, direita) durante o debate esta manhã no parlamento espanhol que deverá hoje aprovar o prolongamento do ""estado de emergência"".
O chefe do Governo espanhol afirmou estranhar que Espanha seja diferente da maior parte dos países no mundo em que os vários partidos políticos estão unidos na luta contra o novo coronavírus.
Pedro Sánchez começou por dar o exemplo do que se passa em Portugal e do líder do principal partido da oposição, Rui Rio do PSD, que fez um ""discurso emotivo"" na semana passada na Assembleia da República a desejar ""boa sorte"" ao Governo liderado pelo primeiro-ministro socialista, António Costa, e a oferecer o seu apoio na luta contra a pandemia.
As palavras do chefe do Governo receberam o aplauso dos poucos deputados presentes dos partidos que apoiam o executivo num parlamento em que a maioria dos membros estava a participar na sessão a partir de casa através de meios telemáticos.
Pedro Sánchez referiu ainda o caso do Reino Unido, em que o líder do Partido Trabalhista também se colocou ao lado do primeiro-ministro, Boris Johnson, na luta contra a pandemia.
O presidente do PP, Pablo Casado, respondeu, em seguida, que ""os espanhóis merecem um Governo que não lhes minta"" e considerou que a ""autoridade moral"" de Sánchez para pedir ""unidade e lealdade"" era ""nula"".
Casado atacou a gestão feita pelo executivo espanhol da crise do coronavírus e pediu-lhe para ""dizer a verdade"" sobre a situação real da doença no país, que declarasse luto nacional e que garantisse o envio de material de proteção a todos os trabalhadores nos serviços de saúde.
Apesar destas cítica, o PP deverá apoiar o prolongamento do ""estado de emergência"" por mais duas semanas, até as 24:00 de 25 de abril próximo.
O primeiro-ministro espanhol também apelou a todos os partidos políticos para que, na próxima semana, se inicie o diálogo para se chegar a um grande acordo económico e social para a reconstrução do país após a crise do coronavírus.
""O que proponho é um grande acordo nacional para a reconstrução económica e social, no qual participem todas as forças dispostas a colaborar, os partidos políticos, evidentemente, mas também empresários e sindicatos, e, claro, as comunidades autónomas. Proponho um grande pacto para a reconstrução económica e social de Espanha"", disse Pedro Sánchez.
A Espanha é um dos países mais atingido pelo novo coronavírus, responsável pela pandemia da covid-19, que já infetou mais de 1,4 milhões de pessoas em todo o mundo, das quais morreram mais de 82.000, tendo saído curados cerca de 260 mil.
Depois de surgir na China, em dezembro de 2019, o surto espalhou-se por todo o mundo, o que levou a Organização Mundial da Saúde (OMS) a declarar uma situação de pandemia.
Leia mais sobre o coronavírus aqui",https://www.dn.pt/mundo/mais-683-mortes-em-espanha-numero-de-obitos-volta-a-cair-12050926.html,Espanha chega às 15 mil mortes mas número de óbitos diários volta a cair,https://www.dn.pt/mundo/mais-683-mortes-em-espanha-numero-de-obitos-volta-a-cair-12050926.html,artlist,PO,,100 minutes,FALSE,250,https://api.gdeltproject.org/api/v2/doc/doc?query=%20sourcecountry:po&sourcelang:por&mode=artlist&format=json&timespan=100&maxrecords=250&sort=datedesc,https://www.dn.pt/mundo/amp/mais-683-mortes-em-espanha-numero-de-obitos-volta-a-cair-12050926.html,2020-04-09T13:30:00Z,https://static.globalnoticias.pt/dn/image.aspx?brand=DN&type=generate&guid=4edb6e89-b212-41d0-8cea-b60ca27aa6fb&watermark=true&t=20200409110000,dn.pt,Portuguese,Portugal,"Mais 757 mortes em Espanha. Número de óbitos sobe pelo segundo dia seguido
""Está a ser equacionado cerco sanitário a Castro Daire"". Testes de imunidade no final de abril
Espanha registou esta quarta-feira mais 683 mortes e 5 756 casos confirmados de infeção por covid-19, anunciou o Ministério da Saúde daquele país.
No total, registam-se 15 238 mortes e 152 446 casos confirmados em solo espanhol. Na véspera, Espanha tinha registado 757 mortes e 6180 casos de covid-19.
Entre as pessoas infetadas, 52 165 já recuperaram. Mais 4144‬ recuperaram nas últimas 24 horas.
Fechar Subscreva as newsletters Diário de Notícias e receba as informações em primeira mão. Subscrever
Espanha é o segundo país com mais casos confirmados, sendo apenas superado pelos Estados Unidos (435 mil), e também o segundo com mais mortes, sendo apenas superado por Itália (17 mil).
Parlamento vota esta quinta-feira prolongamento do estado de emergência
Os deputados espanhóis votam esta quinta-feira a proposta do governo para prolongar por mais duas semanas, até 25 deste mês, o estado de emergência em vigor desde 15 de março, com o objetivo e lutar contra o novo coronavírus.
Na sessão, tudo indicando existir uma maioria confortável de formações políticas que apoiam a iniciativa do Governo socialista, incluindo a maior da oposição, o Partido Popular, de direita.
Sábado passado, o primeiro-ministro espanhol, Pedro Sánchez, anunciou o prolongamento do estado de emergência até à meia-noite de 25 de abril, para travar a covid-19 numa altura em que, tudo indica, está ""superado o pico"" desta pandemia.
Na altura, o chefe do Governo avançou que as medidas de contenção que incluem o confinamento em casa para todos, salvo os que trabalham em serviços essenciais, iriam continuar, mas que estava a estudar a possibilidade de, a partir de segunda-feira 13 de abril, ser autorizado o regresso ao trabalho daqueles que não podiam fazê-lo a partir de casa.
O estado de emergência começou em 15 de março e impôs uma série de restrições à mobilidade dos cidadãos, que foram depois alargadas, com medidas adicionais, como o controlo nas fronteiras ou o fecho provisório de atividades económicas não essenciais.
O confinamento foi inicialmente aprovado por duas semanas, às quais foram acrescentadas mais duas, a partir de 29 de março e até 11 deste mês.
Apesar do agravamento da evolução nos últimos dois dias, as autoridades sanitárias espanholas estão convencidas de que o pico da pandemia foi alcançado, mas alertam para a necessidade de consolidar a tendência detetada.
Pedro Sánchez quer oposição à imagem de... Rui Rio
O primeiro-ministro espanhol pediu esta quinta-feira à oposição de direita para seguir o exemplo de Portugal, onde o presidente do PSD, Rui Rio, fez um ""discurso emotivo"" a desejar ""boa sorte"" e a oferecer a sua colaboração na luta contra a covid-19.
""Peço-vos humildemente unidade e lealdade"" institucional, repetiu Pedro Sánchez dirigindo-se ao líder do Partido Popular (PP, direita) durante o debate esta manhã no parlamento espanhol que deverá hoje aprovar o prolongamento do ""estado de emergência"".
O chefe do Governo espanhol afirmou estranhar que Espanha seja diferente da maior parte dos países no mundo em que os vários partidos políticos estão unidos na luta contra o novo coronavírus.
Pedro Sánchez começou por dar o exemplo do que se passa em Portugal e do líder do principal partido da oposição, Rui Rio do PSD, que fez um ""discurso emotivo"" na semana passada na Assembleia da República a desejar ""boa sorte"" ao Governo liderado pelo primeiro-ministro socialista, António Costa, e a oferecer o seu apoio na luta contra a pandemia.
As palavras do chefe do Governo receberam o aplauso dos poucos deputados presentes dos partidos que apoiam o executivo num parlamento em que a maioria dos membros estava a participar na sessão a partir de casa através de meios telemáticos.
Pedro Sánchez referiu ainda o caso do Reino Unido, em que o líder do Partido Trabalhista também se colocou ao lado do primeiro-ministro, Boris Johnson, na luta contra a pandemia.
O presidente do PP, Pablo Casado, respondeu, em seguida, que ""os espanhóis merecem um Governo que não lhes minta"" e considerou que a ""autoridade moral"" de Sánchez para pedir ""unidade e lealdade"" era ""nula"".
Casado atacou a gestão feita pelo executivo espanhol da crise do coronavírus e pediu-lhe para ""dizer a verdade"" sobre a situação real da doença no país, que declarasse luto nacional e que garantisse o envio de material de proteção a todos os trabalhadores nos serviços de saúde.
Apesar destas cítica, o PP deverá apoiar o prolongamento do ""estado de emergência"" por mais duas semanas, até as 24:00 de 25 de abril próximo.
O primeiro-ministro espanhol também apelou a todos os partidos políticos para que, na próxima semana, se inicie o diálogo para se chegar a um grande acordo económico e social para a reconstrução do país após a crise do coronavírus.
""O que proponho é um grande acordo nacional para a reconstrução económica e social, no qual participem todas as forças dispostas a colaborar, os partidos políticos, evidentemente, mas também empresários e sindicatos, e, claro, as comunidades autónomas. Proponho um grande pacto para a reconstrução económica e social de Espanha"", disse Pedro Sánchez.
A Espanha é um dos países mais atingido pelo novo coronavírus, responsável pela pandemia da covid-19, que já infetou mais de 1,4 milhões de pessoas em todo o mundo, das quais morreram mais de 82.000, tendo saído curados cerca de 260 mil.
Depois de surgir na China, em dezembro de 2019, o surto espalhou-se por todo o mundo, o que levou a Organização Mundial da Saúde (OMS) a declarar uma situação de pandemia.
Leia mais sobre o coronavírus aqui",0.9646357051555177,0.9280809565036006,0.9686674216685542,0.970499243570348,0.9668425018839487,"Random Forests
('ranger' package, R 3.5.3.)
Wright MN, Ziegler A (2017). “ranger: A Fast Implementation of Random Forests for High Dimensional Data in C++ and R.” Journal of Statistical Software, 77(1), 1–17. doi: 10.18637/jss.v077.i01.",5479,0.4347048300536673,204,500,20,gini,classification,2020-04-05
