prediction_covid_topic,title,description,authors,date_download,date_publish,maintext,url,gdelt_title,gdelt_url,modeSearch,sourcecountrySearch,termSearch,periodtimeSearch,isOR,countMaximumRecords,urlGDELTV2FTAPI,urlArticleMobile,datetimeArticle,urlImage,domainArticle,languageArticle,countryArticle,pred_input,model_accuracy,model_kappa,model_f1,model_precision,model_recall,model,sample_size,train_prop_covid,mtry,n_tree,min_node_size,splitrule,model_type,fitted_on
1,Três vacinas contra coronavírus testadas em humanos,"Há um total de 70 vacinas em testes, segundo Organização Mundial da Saúde. China e Estados Unidos lideram investigação.",Global Media Group,2020-04-13 14:15:23,2020-04-13 11:14:00,"Já há uma vacina a ser testada em humanos?
Ministra da Saúde diz que medidas de contenção serão necessárias até haver vacina
Três das 70 vacinas que estão a ser desenvolvidas contra o novo coronavírus já estão a ser testadas em humanos. A informação foi revelada pela Organização Mundial da Saúde, que publicou um documento sobre os laboratórios que estão a investigar formas de travar esta pandemia.
Segundo a informação citada pela agência Bloomberg , China e Estados Unidos estão na linha da frente da investigação.
No caso da China, a vacina desenvolvida pelo consórcio entre o Instituto de Biotecnologia de Pequim e a empresa CanSino Biologics já tem autorização para os ensaios clínicos.
Fechar Subscreva as newsletters Diário de Notícias e receba as informações em primeira mão. Subscrever
No caso dos Estados Unidos, as farmacêuticas Moderna e Inovio, de forma separada, já estão a testar o tratamento em humanos.
Em fase de pré-ensaios clínicos encontram-se as vacinas desenvolvidas pelos norte-americanos da Pfizer e os franceses da Sanofi.
Todos os laboratórios estão atualmente numa luta contra o tempo para encontrar uma vacina que trave a pandemia contra a Covid-19. Habitualmente, uma vacina demora entre 10 a 15 anos a chegar ao mercado após a fase de investigação. Só que as farmacêuticas contam ter uma solução pronta já em 2021.
Leia mais em Dinheiro Vivo a sua marca de economia",https://www.dn.pt/dinheiro/tres-vacinas-contra-coronavirus-testadas-em-humanos-12062783.html,Três vacinas contra coronavírus testadas em humanos,https://www.dn.pt/dinheiro/tres-vacinas-contra-coronavirus-testadas-em-humanos-12062783.html,artlist,PO,,100 minutes,FALSE,250,https://api.gdeltproject.org/api/v2/doc/doc?query=%20sourcecountry:po&sourcelang:por&mode=artlist&format=json&timespan=100&maxrecords=250&sort=datedesc,https://www.dn.pt/dinheiro/amp/tres-vacinas-contra-coronavirus-testadas-em-humanos-12062783.html,2020-04-13T09:45:00Z,https://static.globalnoticias.pt/dn/image.aspx?brand=DN&type=generate&guid=e77c596a-6fc8-4a95-8131-3441dd021c7a&watermark=true&t=20200413091400,dn.pt,Portuguese,Portugal,"Já há uma vacina a ser testada em humanos?
Ministra da Saúde diz que medidas de contenção serão necessárias até haver vacina
Três das 70 vacinas que estão a ser desenvolvidas contra o novo coronavírus já estão a ser testadas em humanos. A informação foi revelada pela Organização Mundial da Saúde, que publicou um documento sobre os laboratórios que estão a investigar formas de travar esta pandemia.
Segundo a informação citada pela agência Bloomberg , China e Estados Unidos estão na linha da frente da investigação.
No caso da China, a vacina desenvolvida pelo consórcio entre o Instituto de Biotecnologia de Pequim e a empresa CanSino Biologics já tem autorização para os ensaios clínicos.
Fechar Subscreva as newsletters Diário de Notícias e receba as informações em primeira mão. Subscrever
No caso dos Estados Unidos, as farmacêuticas Moderna e Inovio, de forma separada, já estão a testar o tratamento em humanos.
Em fase de pré-ensaios clínicos encontram-se as vacinas desenvolvidas pelos norte-americanos da Pfizer e os franceses da Sanofi.
Todos os laboratórios estão atualmente numa luta contra o tempo para encontrar uma vacina que trave a pandemia contra a Covid-19. Habitualmente, uma vacina demora entre 10 a 15 anos a chegar ao mercado após a fase de investigação. Só que as farmacêuticas contam ter uma solução pronta já em 2021.
Leia mais em Dinheiro Vivo a sua marca de economia",0.9646357051555177,0.9280809565036006,0.9686674216685542,0.970499243570348,0.9668425018839487,"Random Forests
('ranger' package, R 3.5.3.)
Wright MN, Ziegler A (2017). “ranger: A Fast Implementation of Random Forests for High Dimensional Data in C++ and R.” Journal of Statistical Software, 77(1), 1–17. doi: 10.18637/jss.v077.i01.",5479,0.4347048300536673,204,500,20,gini,classification,2020-04-05
1,"Portugal terá cinco vezes mais infetados do que os casos confirmados, estima Imperial College","Estimativa dos epidemiologistas do Imperial College apontam para que 80% dos infetados em Portugal estejam com sintomas ligeiros ou assintomáticos, pe...",Edgar Caetano,2020-04-13 14:15:31,2020-04-13 12:49:00,"O número real de infetados com o novo coronavírus em Portugal será cerca de cinco vezes mais do que o número de confirmações oficiais, já que cerca de 80% dos infetados em Portugal estarão com sintomas ligeiros ou, mesmo, nenhuns sintomas, pelo que não são diagnosticados (embora possam ser agentes de transmissão do vírus). A estimativa é dos epidemiologistas do britânico Imperial College, que criaram um tracker semanal para a evolução do vírus cuja última atualização é citada pelo Jornal de Negócios esta segunda-feira.
O trabalho dos epidemiologistas, que recorre a modelos científicos para estimar o número de infetados em vários países europeus, adianta que, na semana terminada a 4 de abril, em vez dos 5.354 casos que tinham sido confirmados em Portugal até essa altura havia, na realidade, mais de 26 mil pessoas infetadas. Ou, juntando alguns dados mais atualizados até essa altura, o modelo estimava quase 39 mil infetados em Portugal.
Esse valor corresponderia a mais do que o dobro do número total de confirmações avançadas no boletim da DGS divulgado este domingo, 12 de abril. Convidado pelo Negócios a extrapolar o mesmo modelo para os números oficiais mais atualizados em Portugal, Ruy Ribeiro, epidemiologista da Faculdade de Medicina da Universidade de Lisboa, acredita que podemos estar a falar de 81.699 infetados em todo o país, por esta altura.",https://observador.pt/2020/04/13/portugal-tera-cinco-vezes-mais-infetados-do-que-os-casos-confirmados-estima-imperial-college/,"Portugal terá cinco vezes mais infetados do que os casos confirmados , estima Imperial College",https://observador.pt/2020/04/13/portugal-tera-cinco-vezes-mais-infetados-do-que-os-casos-confirmados-estima-imperial-college/,artlist,PO,,100 minutes,FALSE,250,https://api.gdeltproject.org/api/v2/doc/doc?query=%20sourcecountry:po&sourcelang:por&mode=artlist&format=json&timespan=100&maxrecords=250&sort=datedesc,https://observador.pt/2020/04/13/portugal-tera-cinco-vezes-mais-infetados-do-que-os-casos-confirmados-estima-imperial-college/amp/,2020-04-13T09:30:00Z,https://wm.observador.pt/wm/obs/l/https%3A%2F%2Fbordalo.observador.pt%2F770x403%2Cq80%2Fhttps%3A%2F%2Fs3.observador.pt%2Fwp-content%2Fuploads%2F2020%2F04%2F13074235%2F1738450_770x433_acf_cropped.jpg,observador.pt,Portuguese,Portugal,"O número real de infetados com o novo coronavírus em Portugal será cerca de cinco vezes mais do que o número de confirmações oficiais, já que cerca de 80% dos infetados em Portugal estarão com sintomas ligeiros ou, mesmo, nenhuns sintomas, pelo que não são diagnosticados (embora possam ser agentes de transmissão do vírus). A estimativa é dos epidemiologistas do britânico Imperial College, que criaram um tracker semanal para a evolução do vírus cuja última atualização é citada pelo Jornal de Negócios esta segunda-feira.
O trabalho dos epidemiologistas, que recorre a modelos científicos para estimar o número de infetados em vários países europeus, adianta que, na semana terminada a 4 de abril, em vez dos 5.354 casos que tinham sido confirmados em Portugal até essa altura havia, na realidade, mais de 26 mil pessoas infetadas. Ou, juntando alguns dados mais atualizados até essa altura, o modelo estimava quase 39 mil infetados em Portugal.
Esse valor corresponderia a mais do que o dobro do número total de confirmações avançadas no boletim da DGS divulgado este domingo, 12 de abril. Convidado pelo Negócios a extrapolar o mesmo modelo para os números oficiais mais atualizados em Portugal, Ruy Ribeiro, epidemiologista da Faculdade de Medicina da Universidade de Lisboa, acredita que podemos estar a falar de 81.699 infetados em todo o país, por esta altura.",0.9646357051555177,0.9280809565036006,0.9686674216685542,0.970499243570348,0.9668425018839487,"Random Forests
('ranger' package, R 3.5.3.)
Wright MN, Ziegler A (2017). “ranger: A Fast Implementation of Random Forests for High Dimensional Data in C++ and R.” Journal of Statistical Software, 77(1), 1–17. doi: 10.18637/jss.v077.i01.",5479,0.4347048300536673,204,500,20,gini,classification,2020-04-05
