prediction_covid_topic,title,description,authors,date_download,date_publish,maintext,url,gdelt_title,gdelt_url,modeSearch,sourcecountrySearch,termSearch,periodtimeSearch,isOR,countMaximumRecords,urlGDELTV2FTAPI,urlArticleMobile,datetimeArticle,urlImage,domainArticle,languageArticle,countryArticle,pred_input,model_accuracy,model_kappa,model_f1,model_precision,model_recall,model,sample_size,train_prop_covid,mtry,n_tree,min_node_size,splitrule,model_type,fitted_on
1,"Mudam-se os tempos, mantêm-se as vontades","Não está a haver relação transatlântica na crise provocada pelo novo coronavírus. Os Estados Unidos e a Europa deixaram um espaço de cooperação, privi...",Diana Soller,2020-05-08 09:16:12,2020-08-05 07:16:00,"Não está a haver relação transatlântica na crise provocada pelo novo coronavírus. Os Estados Unidos e a Europa, cada um se remeteu para os seus próprios problemas, deixando um espaço de cooperação, privilegiado nos últimos setenta anos, deserto. A NATO não morreu. Esvaziou-se como tantas outras organizações internacionais se têm vindo a esvaziar nos últimos anos.
A crise da Covid-19, até agora, não trouxe reviravoltas do ponto de vista internacional. Confirmou e exacerbou tendências. Vários autores falam de pandemias ou crises globais como aceleradores da história. Talvez seja o que estamos a ver. Na NATO e em, pelo menos, mais cinco elementos.
Os Estados Unidos da América abandonaram de vez a liderança internacional. Retiraram-se do seu papel organizador e de distribuidor de bens comuns internacionais e fecharam-se numa política externa cujo principal objetivo é enfraquecer a China como potência internacional. O resto do mundo não tem muito significado.
A Europa, sem os Estados Unidos, não tem capacidade de liderança. E está profundamente dependente de outros estados. De Washington para garantir a sua segurança, de Pequim para obter bens transformados industrialmente. Até agora não deu grandes contributos científicos no combate à pandemia, demonstrando que, até nessa área, não está a conseguir acompanhar outros estados.
A China tornou-se uma potência incontornável no sistema internacional com impacto profundo no espaço transatlântico. Enquanto nos Estados Unidos há um consenso bipartidário, suportado pela opinião pública, de que Pequim é o adversário com o qual os Estados Unidos têm que competir, mais agora que a China foi responsável pela propagação internacional da pandemia, na Europa as posições para com Pequim são mais duras do que antes desta crise, mas suficientemente ambíguas para que o regime de Xi Jiping continue a pressioná-la e a obter dividendos. São públicas as notícias de que a diplomacia chinesa tem tido sucesso no enfraquecimento das posições europeias anti chinesas. Ainda ontem foi publicada uma carta assinada pelos embaixadores da UE na China e da China na UE a reiterar a importância da relação. Ainda que os estados europeus estejam cada vez mais preocupados com a dependência, com os ativos empresariais estratégicos adquiridos pela China em território europeu e a pressão diplomática pouco discreta vinda da Ásia.
A União Europeia está num impasse. Ainda que já se saiba que vai haver fundos avultados de apoio, a forma como esse dinheiro vai ser distribuído terá profunda influência no futuro da União. Por agora, as populações olham para os seus próprios estados que tentam gerir a crise sanitária (a UE não tem competências nessa área), o que está a criar laços nacionais que muito facilmente se podem tornar nacionalistas – com a ressalva que nem todo o nacionalismo é exclusivista, invejoso ou antieuropeu – caso a inércia europeia se estenda à fase da retoma económica e às arrecuas nas democracias de alguns estados membros.
Ou seja, nada mudou consideravelmente. Adensou-se. Mas esta aceleração vai obrigar a que se definam posições num prazo mais curto do que se previa. Vai a União Europeia recuperar o sentido de solidariedade? Vai a Europa definir posições em relação à China abrindo uma nova possibilidade de reavivar a relação transatlântica (que será mais fácil se Joe Biden for eleito)? Voltarão os Estados Unidos a retomar, mesmo que parcialmente, a liderança internacional? Estas perguntas não têm resposta nem o futuro está escrito. Mas o novo coronavírus vai forçar a que se defina muito do que vai influenciar o mundo nas próximas décadas.",https://observador.pt/opiniao/mudam-se-os-tempos-mantem-se-as-vontades/,"Mudam - se os tempos , mantêm - se as vontades",https://observador.pt/opiniao/mudam-se-os-tempos-mantem-se-as-vontades/,artlist,PO,,100 minutes,FALSE,250,https://api.gdeltproject.org/api/v2/doc/doc?query=%20sourcecountry:po&sourcelang:por&mode=artlist&format=json&timespan=100&maxrecords=250&sort=datedesc,NA,2020-05-08T03:45:00Z,https://wm.observador.pt/wm-op/wide-circle/https%3A%2F%2Fbordalo.observador.pt%2F467x467%2Cq80%2Fhttps%3A%2F%2Fs3.observador.pt%2Fwp-content%2Fuploads%2F2017%2F10%2F20121022%2Fcolunista_dsoller_4673.png,observador.pt,Portuguese,Portugal,"Não está a haver relação transatlântica na crise provocada pelo novo coronavírus. Os Estados Unidos e a Europa, cada um se remeteu para os seus próprios problemas, deixando um espaço de cooperação, privilegiado nos últimos setenta anos, deserto. A NATO não morreu. Esvaziou-se como tantas outras organizações internacionais se têm vindo a esvaziar nos últimos anos.
A crise da Covid-19, até agora, não trouxe reviravoltas do ponto de vista internacional. Confirmou e exacerbou tendências. Vários autores falam de pandemias ou crises globais como aceleradores da história. Talvez seja o que estamos a ver. Na NATO e em, pelo menos, mais cinco elementos.
Os Estados Unidos da América abandonaram de vez a liderança internacional. Retiraram-se do seu papel organizador e de distribuidor de bens comuns internacionais e fecharam-se numa política externa cujo principal objetivo é enfraquecer a China como potência internacional. O resto do mundo não tem muito significado.
A Europa, sem os Estados Unidos, não tem capacidade de liderança. E está profundamente dependente de outros estados. De Washington para garantir a sua segurança, de Pequim para obter bens transformados industrialmente. Até agora não deu grandes contributos científicos no combate à pandemia, demonstrando que, até nessa área, não está a conseguir acompanhar outros estados.
A China tornou-se uma potência incontornável no sistema internacional com impacto profundo no espaço transatlântico. Enquanto nos Estados Unidos há um consenso bipartidário, suportado pela opinião pública, de que Pequim é o adversário com o qual os Estados Unidos têm que competir, mais agora que a China foi responsável pela propagação internacional da pandemia, na Europa as posições para com Pequim são mais duras do que antes desta crise, mas suficientemente ambíguas para que o regime de Xi Jiping continue a pressioná-la e a obter dividendos. São públicas as notícias de que a diplomacia chinesa tem tido sucesso no enfraquecimento das posições europeias anti chinesas. Ainda ontem foi publicada uma carta assinada pelos embaixadores da UE na China e da China na UE a reiterar a importância da relação. Ainda que os estados europeus estejam cada vez mais preocupados com a dependência, com os ativos empresariais estratégicos adquiridos pela China em território europeu e a pressão diplomática pouco discreta vinda da Ásia.
A União Europeia está num impasse. Ainda que já se saiba que vai haver fundos avultados de apoio, a forma como esse dinheiro vai ser distribuído terá profunda influência no futuro da União. Por agora, as populações olham para os seus próprios estados que tentam gerir a crise sanitária (a UE não tem competências nessa área), o que está a criar laços nacionais que muito facilmente se podem tornar nacionalistas – com a ressalva que nem todo o nacionalismo é exclusivista, invejoso ou antieuropeu – caso a inércia europeia se estenda à fase da retoma económica e às arrecuas nas democracias de alguns estados membros.
Ou seja, nada mudou consideravelmente. Adensou-se. Mas esta aceleração vai obrigar a que se definam posições num prazo mais curto do que se previa. Vai a União Europeia recuperar o sentido de solidariedade? Vai a Europa definir posições em relação à China abrindo uma nova possibilidade de reavivar a relação transatlântica (que será mais fácil se Joe Biden for eleito)? Voltarão os Estados Unidos a retomar, mesmo que parcialmente, a liderança internacional? Estas perguntas não têm resposta nem o futuro está escrito. Mas o novo coronavírus vai forçar a que se defina muito do que vai influenciar o mundo nas próximas décadas.",0.9646357051555177,0.9280809565036006,0.9686674216685542,0.970499243570348,0.9668425018839487,"Random Forests
('ranger' package, R 3.5.3.)
Wright MN, Ziegler A (2017). “ranger: A Fast Implementation of Random Forests for High Dimensional Data in C++ and R.” Journal of Statistical Software, 77(1), 1–17. doi: 10.18637/jss.v077.i01.",5479,0.4347048300536673,204,500,20,gini,classification,2020-04-05
