prediction_covid_topic,title,description,authors,date_download,maintext,url,gdelt_title,gdelt_url,date_publish,modeSearch,sourcecountrySearch,termSearch,periodtimeSearch,isOR,countMaximumRecords,urlGDELTV2FTAPI,urlArticleMobile,datetimeArticle,urlImage,domainArticle,languageArticle,countryArticle,pred_input,model_accuracy,model_kappa,model_f1,model_precision,model_recall,model,sample_size,train_prop_covid,mtry,n_tree,min_node_size,splitrule,model_type,fitted_on
1,Mário Centeno espera que economia possa voltar à situação de 2019 em dois anos,NA,Notícias De Coimbra,2020-04-14 06:15:19,"O ministro das Finanças , Mário Centeno, admitiu hoje que a economia portuguesa poderá voltar à situação registada em 2019 dentro de dois anos, se a crise provocada pela covid-19 for contida no segundo trimestre.
Em entrevista no ‘Jornal da Noite’ da TVI, o ministro das Finanças referiu que, se for possível conter a crise sanitária neste segundo trimestre, “provavelmente” ao fim de “dois anos” a economia estará a voltar a “números não muito longe dos de 2019”, ano em que, pela primeira vez nos últimos 40 anos, o país fechou as contas públicas com excedente orçamental.
Antes, Mário Centeno tinha referido que as estimativas do Governo apontam para uma queda de 6,5% do PIB anual por cada 30 dias úteis em que a economia esteja paralisada devido à covid-19.
“As estimativas que existem e apresentaremos brevemente números nesse sentido estão enquadradas em factos que vão desde 6,5% do PIB anual por cada 30 dias úteis em que a economia esteja, como ela está hoje em Portugal”, disse, avisando que este impacto dos 30 dias úteis no PIB (Produto Interno Bruto) “não é linear” e vai-se deteriorando à medida que o tempo passa.
Relativamente à dimensão do défice em 2020 afirmou não ter ainda números para avançar com essa projeção. “Pensamos que os estabilizadores automáticos possam representar, juntamente com as medidas de apoio ao emprego, números próximos dos 6,7 mil milhões de euros”, referiu.
Aquele valor tem, assim, em conta quer o aumento da despesa com as medidas de apoio ao emprego – como o ‘lay-off’ simplificado – ou com o subsídio de desemprego e também a queda da receita que irá resultar do aumento esperado do desemprego na sequência da quebra de atividade que as medidas de contenção do surto de covid-18 impuseram.
Mário Centeno reiterou que o país está mais preparado agora para enfrentar esta situação do que estava em 2011, quando teve de avançar para um resgate financeiro, e acentuou que a situação que teremos em 2020 não será muito diferente da de ouros países europeus.
Tal como o primeiro-ministro referiu em entrevista à agência Lusa, também Mário Centeno afastou o cenário de medidas de austeridade. “O que temos de garantir é que há dinheiro para acudir à fase aguda da crise”, referiu, acentuando que esta é uma crise temporária, que não é estrutural.",https://www.noticiasdecoimbra.pt/mario-centeno-espera-que-economia-possa-voltar-a-situacao-de-2019-em-dois-anos/,Mário Centeno espera que economia possa voltar à situao de 2019 em dois anos,https://www.noticiasdecoimbra.pt/mario-centeno-espera-que-economia-possa-voltar-a-situacao-de-2019-em-dois-anos/,NA,artlist,PO,,240 minutes,FALSE,250,https://api.gdeltproject.org/api/v2/doc/doc?query=%20sourcecountry:po&sourcelang:por&mode=artlist&format=json&timespan=240&maxrecords=250&sort=datedesc,NA,2020-04-14T01:30:00Z,https://www.noticiasdecoimbra.pt/wp-content/uploads/2018/01/mario-centeno.jpg?x75216,noticiasdecoimbra.pt,Portuguese,Portugal,"O ministro das Finanças , Mário Centeno, admitiu hoje que a economia portuguesa poderá voltar à situação registada em 2019 dentro de dois anos, se a crise provocada pela covid-19 for contida no segundo trimestre.
Em entrevista no ‘Jornal da Noite’ da TVI, o ministro das Finanças referiu que, se for possível conter a crise sanitária neste segundo trimestre, “provavelmente” ao fim de “dois anos” a economia estará a voltar a “números não muito longe dos de 2019”, ano em que, pela primeira vez nos últimos 40 anos, o país fechou as contas públicas com excedente orçamental.
Antes, Mário Centeno tinha referido que as estimativas do Governo apontam para uma queda de 6,5% do PIB anual por cada 30 dias úteis em que a economia esteja paralisada devido à covid-19.
“As estimativas que existem e apresentaremos brevemente números nesse sentido estão enquadradas em factos que vão desde 6,5% do PIB anual por cada 30 dias úteis em que a economia esteja, como ela está hoje em Portugal”, disse, avisando que este impacto dos 30 dias úteis no PIB (Produto Interno Bruto) “não é linear” e vai-se deteriorando à medida que o tempo passa.
Relativamente à dimensão do défice em 2020 afirmou não ter ainda números para avançar com essa projeção. “Pensamos que os estabilizadores automáticos possam representar, juntamente com as medidas de apoio ao emprego, números próximos dos 6,7 mil milhões de euros”, referiu.
Aquele valor tem, assim, em conta quer o aumento da despesa com as medidas de apoio ao emprego – como o ‘lay-off’ simplificado – ou com o subsídio de desemprego e também a queda da receita que irá resultar do aumento esperado do desemprego na sequência da quebra de atividade que as medidas de contenção do surto de covid-18 impuseram.
Mário Centeno reiterou que o país está mais preparado agora para enfrentar esta situação do que estava em 2011, quando teve de avançar para um resgate financeiro, e acentuou que a situação que teremos em 2020 não será muito diferente da de ouros países europeus.
Tal como o primeiro-ministro referiu em entrevista à agência Lusa, também Mário Centeno afastou o cenário de medidas de austeridade. “O que temos de garantir é que há dinheiro para acudir à fase aguda da crise”, referiu, acentuando que esta é uma crise temporária, que não é estrutural.",0.9646357051555177,0.9280809565036006,0.9686674216685542,0.970499243570348,0.9668425018839487,"Random Forests
('ranger' package, R 3.5.3.)
Wright MN, Ziegler A (2017). “ranger: A Fast Implementation of Random Forests for High Dimensional Data in C++ and R.” Journal of Statistical Software, 77(1), 1–17. doi: 10.18637/jss.v077.i01.",5479,0.4347048300536673,204,500,20,gini,classification,2020-04-05
1,Moratória sobre crédito à habitação vai ser alargada aos emigrantes,Medida será fechada nos próximos dias.,Global Media Group,2020-04-14 06:15:20,"Faria de Oliveira declarou também que, muito em breve, vai avançar a moratória aos créditos ao consumo
Por TSF 14 Abril, 2020 • 01:45 Partilhar este artigo Facebook
Facebook Twitter
Twitter WhatsApp
WhatsApp E-mail
E-mail Partilhar
A moratória sobre o crédito à habitação vai ser alargada aos emigrantes. A medida será fechada nos próximos dias, correspondendo à reivindicação dos portugueses que trabalham no estrangeiro mas que têm empréstimos junto da banca para o pagamento de casas em Portugal.
Foi uma das novidades dadas esta segunda-feira à noite pelo presidente da Associação Portuguesa de Bancos. Faria de Oliveira declarou também que, muito em breve, vai avançar a moratória aos créditos ao consumo.
No entanto, o presidente da Associação Portuguesa de Bancos portugueses admite que nem tudo tem funcionado bem no financiamento às empresas, no âmbito das linhas de crédito que o Governo acertou com a banca. Faria de Oliveira reconheceu que é preciso agilizar esses procedimentos.
""Inicialmente houve algumas dificuldades de natureza processual e burocrática. Nas novas linhas que vão ser anunciadas em breve espero que este tipo de problemas seja facilitado. Os bancos estão a levar cerca de dois, três dias a fazer a sua aprovação inicial, o que é muito bom"", reconheceu o presidente da Associação Portuguesa de Bancos.
Nesta entrevista, Faria de Oliveira também foi questionado sobre a possibilidade de os bancos virem a fechar o ano com lucros e vem, a propósito, lembrar que Rui Rio declarou que, se isso acontecesse, seria uma vergonha. Na sua opinião dificilmente o setor terá margem para gerar dividendos.
""Neste momento vivemos uma situação única, isto é muito mais que uma recessão. Ter, como tivemos nestes três meses, uma queda de 20% do produto é praticamente inimaginável, é algo de novo, uma bomba. Portanto, não pode deixar de afetar o sistema bancário"", afirmou Faria de Oliveira.
Faria de Oliveira respondeu ainda à iniciativa do PCP, que esta segunda-feira deu entrada na Assembleia da República a um projeto de lei que proíbe a aplicação de juros, spreads e outros encargos às linhas de apoio à economia lançadas pelo Governo para responder à pandemia de Covid-19. O representante do setor bancário considera que os comunistas desejam criar o que será uma redundância.
""Compreendo que a taxa de juro possa parecer alta, mas corresponde à cobertura de custos pelo sistema bancário com o acréscimo da garantia mútua concedida pela sociedade. É absolutamente marginal para o sistema bancário. A marginalidade é na ordem de 0,1 ou 0,2%, é completamente marginal"", acrescentou o presidente da Associação Portuguesa de Bancos.",https://www.tsf.pt/portugal/economia/moratoria-sobre-credito-a-habitacao-vai-ser-alargada-aos-emigrantes-12066258.html,Moratória sobre crédito à habitao vai ser alargada aos emigrantes,https://www.tsf.pt/portugal/economia/moratoria-sobre-credito-a-habitacao-vai-ser-alargada-aos-emigrantes-12066258.html,2020-04-14 03:45:00,artlist,PO,,240 minutes,FALSE,250,https://api.gdeltproject.org/api/v2/doc/doc?query=%20sourcecountry:po&sourcelang:por&mode=artlist&format=json&timespan=240&maxrecords=250&sort=datedesc,https://www.tsf.pt/portugal/economia/amp/moratoria-sobre-credito-a-habitacao-vai-ser-alargada-aos-emigrantes-12066258.html,2020-04-14T01:30:00Z,https://static.globalnoticias.pt/tsf/image.aspx?brand=TSF&type=generate&guid=0d68a09a-f7a1-4cdb-a125-6c5084f7cfc9&watermark=true&t=20200414014500,tsf.pt,Portuguese,Portugal,"Faria de Oliveira declarou também que, muito em breve, vai avançar a moratória aos créditos ao consumo
Por TSF 14 Abril, 2020 • 01:45 Partilhar este artigo Facebook
Facebook Twitter
Twitter WhatsApp
WhatsApp E-mail
E-mail Partilhar
A moratória sobre o crédito à habitação vai ser alargada aos emigrantes. A medida será fechada nos próximos dias, correspondendo à reivindicação dos portugueses que trabalham no estrangeiro mas que têm empréstimos junto da banca para o pagamento de casas em Portugal.
Foi uma das novidades dadas esta segunda-feira à noite pelo presidente da Associação Portuguesa de Bancos. Faria de Oliveira declarou também que, muito em breve, vai avançar a moratória aos créditos ao consumo.
No entanto, o presidente da Associação Portuguesa de Bancos portugueses admite que nem tudo tem funcionado bem no financiamento às empresas, no âmbito das linhas de crédito que o Governo acertou com a banca. Faria de Oliveira reconheceu que é preciso agilizar esses procedimentos.
""Inicialmente houve algumas dificuldades de natureza processual e burocrática. Nas novas linhas que vão ser anunciadas em breve espero que este tipo de problemas seja facilitado. Os bancos estão a levar cerca de dois, três dias a fazer a sua aprovação inicial, o que é muito bom"", reconheceu o presidente da Associação Portuguesa de Bancos.
Nesta entrevista, Faria de Oliveira também foi questionado sobre a possibilidade de os bancos virem a fechar o ano com lucros e vem, a propósito, lembrar que Rui Rio declarou que, se isso acontecesse, seria uma vergonha. Na sua opinião dificilmente o setor terá margem para gerar dividendos.
""Neste momento vivemos uma situação única, isto é muito mais que uma recessão. Ter, como tivemos nestes três meses, uma queda de 20% do produto é praticamente inimaginável, é algo de novo, uma bomba. Portanto, não pode deixar de afetar o sistema bancário"", afirmou Faria de Oliveira.
Faria de Oliveira respondeu ainda à iniciativa do PCP, que esta segunda-feira deu entrada na Assembleia da República a um projeto de lei que proíbe a aplicação de juros, spreads e outros encargos às linhas de apoio à economia lançadas pelo Governo para responder à pandemia de Covid-19. O representante do setor bancário considera que os comunistas desejam criar o que será uma redundância.
""Compreendo que a taxa de juro possa parecer alta, mas corresponde à cobertura de custos pelo sistema bancário com o acréscimo da garantia mútua concedida pela sociedade. É absolutamente marginal para o sistema bancário. A marginalidade é na ordem de 0,1 ou 0,2%, é completamente marginal"", acrescentou o presidente da Associação Portuguesa de Bancos.",0.9646357051555177,0.9280809565036006,0.9686674216685542,0.970499243570348,0.9668425018839487,"Random Forests
('ranger' package, R 3.5.3.)
Wright MN, Ziegler A (2017). “ranger: A Fast Implementation of Random Forests for High Dimensional Data in C++ and R.” Journal of Statistical Software, 77(1), 1–17. doi: 10.18637/jss.v077.i01.",5479,0.4347048300536673,204,500,20,gini,classification,2020-04-05
1,Enfermeiro Luís: salva-nos do vírus de dizermos mal de nós,"Vai por aí muita conversa de confinados, públicas e privadas, sobre o Luís, enfermeiro, de perto do Porto. Luís Pitarma, que é de Aveiro, surgiu como notícia porque Boris Johnson agradeceu publicamente a quem o salvou do coronavírus. Elogios gerais ao hospital e em especial a dois enfermeiros: ""São a Jenny da Nova Zelândia, Invercargill, na Ilha Sul, para ser exato, e Luís, de Portugal, perto do Porto.""",Ferreira Fernandes,2020-04-14 06:15:23,"Vai por aí muita conversa de confinados, públicas e privadas, sobre o Luís, enfermeiro, de perto do Porto. Luís Pitarma, que é de Aveiro, surgiu como notícia porque Boris Johnson agradeceu publicamente a quem o salvou do coronavírus. Elogios gerais ao hospital e em especial a dois enfermeiros: ""São a Jenny da Nova Zelândia, Invercargill, na Ilha Sul, para ser exato, e Luís, de Portugal, perto do Porto.""
O Presidente Marcelo logo saltou a saudar o Luís. Coisa tão habitual nele, o acenar, que às vezes me parece exagerar. Mas sobre isso, tenho duas coisas a dizer. A primeira, é que eu estou atento ao mundo. Por isso prefiro um presidente que gosta dos seus concidadãos.
Ainda há dias vi e ouvi outro presidente, na tevê, falar de 200 mil mortos previstos para os Estados Unidos por um ""modelo"" matemático. E, na mesma frase!, falou das ""modelos"" que, sublinhou ele, conhecia melhor. Para que não se perdesse a graçola, entre as duas palavras, ""model"" [matemático] e ""models"" [gajas boas], Trump fez gestos de mão, amplos sobre mamas, estreitou na cintura e voltou a ser gloriosos nas coxas, tudo inspirado na ideia inicial de milhares de urnas dos seus concidadãos. Sim, prefiro um presidente afetivo.
Fechar Subscreva as newsletters Diário de Notícias e receba as informações em primeira mão. Subscrever
A segunda coisa é que o tal Luís foi saudado por Boris Johnson por uma razão não despicienda. De Cristiano Ronaldo, Boris podia ter dito que tinha belos penteados, e isso valeria só como anedota. E de Cristiano, ainda, podia dizer que ele era um futebolista fantástico, o que seria só uma banalidade, boa de conversa embora com o cuidado de não pensarmos que o talento do conterrâneo nos salpica. Ora os elogios de Boris Johnson ao enfermeiro Luís Pitarma são outra coisa e justificáveis de maior atenção.
Os elogios foram dirigidos ao trabalho - competente e que salva vidas - do Luís. Dão direito a orgulho dele e ao dos seus, e a mais ninguém - mas a nós também deram qualquer coisa. É que estamos a falar da talvez maior das palavras boas, trabalho, e a que mais efeito tem nas relações entre os homens.
Acontece que o assunto decorreu durante uma tragédia mundial, foi exposto (e com altifalantes!) por um dos homens mais poderosos do mundo e foi protagonizado por um imigrante português, num dos países onde a nossa imigração é das mais qualificadas e num momento em que um dos debates da Europa é uma falácia: há uns que trabalham e outros, não.
Ontem, um leitor gentil, antigo tradutor na União Europeia, mandou-me um ensinamento. Bizarro, útil, profundo? Fiquem com os factos: em quase todas as línguas, das latinas às escandinavas, chinês, russo inglês, há palavras diferentes para ""dívida"" e para ""culpa"". Mas a palavra é a mesma, igual e única, para os dois conceitos - no alemão (Schuld) e no holandês (schuld). Falam quase todos de dívida ou de culpa, segundo eles querem referir-se a uma ou outra ideia; e os outros dois dizerem sempre ""Schuld"" ou ""schuld"", não distinguindo. Segundo o gentil leitor, as conversas podem tornar-se ""um perpétuo e inútil mal-entendido.""
Resumindo, o mundo está perigoso, como a dívida e/ou a culpa nos alertam. Seria, pois, de elementar prudência não termos a soberba de sacudir o Luís dos nossos interesses.
O Luís é-nos precioso. Somos poucos e, ainda por cima, somos muitos e bons a menosprezarmo-nos. No sábado passado, o The New York Times publicava extenso artigo intitulado assim: ""Há 500 anos, este porto ligava o Oriente e o Ocidente"". E era apresentado assim: ""Malaca deu origem à noção de fusão asiática, séculos antes disto se tornar uma moda culinária.""
Ora, o que se seguiu, em cada linha do longo texto, era sobre os portugueses. Os portugueses no lugar que eles ocuparam na História, certamente por se saberem sempre poucos mas metidos num destino grandioso: os portugueses entre os outros. ""Malaca, possessão portuguesa no século XVI, porto no estreito de Malaca, ligando os oceanos Pacífico e o Índico, construiu a sua confusa herança multicultural, influenciada pela multidão de chineses, árabes, indianos, persas, turcos, portugueses, holandeses e gente do Sião"".
Os portugueses entre os outros, suficientemente úteis, competentes e salvadores para justificarem que a sua passagem seja lembrada pelo The New York Times, 500 anos depois.
Leiam o artigo e notem como ele estranharia por cá. Então não se fala da espada assassina do Afonso de Albuquerque? E era verdade. O artigo não falava de Afonso de Albuquerque, e verdade era que a espada dele era terrível e muitas vezes assassina. Mas invalida isso o que fizeram aqueles portugueses, e até o admirável que fez Afonso de Albuquerque, entre persas e gente do Sião, construindo um centro do mundo, num mundo misturado?
Volto ao enfermeiro Luís. ""Que saloiice!"", foi a ideia que surfou contra os que falaram do português elogiado por Boris Johnson. O jornal El País, ontem, titulou: ""Luís, el enfermero portugués que salvó a Boris Johnson."" Por maior proximidade (que é um dos critérios para se medir a importância de uma notícia), Luís Pitarma ainda deveria ser mais notícia por cá. E acresce, à razão jornalística, uma urgência sanitária: começa a ser tempo de combater a curva exponencial de parvos para quem o que é português é mau.",https://www.dn.pt/edicao-do-dia/14-abr-2020/enfermeiro-luis-salva-nos-do-virus-de-dizermos-mal-de-nos-12066178.html,Enfermeiro Luís :  salva - nos do vírus de dizermos mal de nós,https://www.dn.pt/edicao-do-dia/14-abr-2020/enfermeiro-luis-salva-nos-do-virus-de-dizermos-mal-de-nos-12066178.html,2020-04-14 02:07:00,artlist,PO,,240 minutes,FALSE,250,https://api.gdeltproject.org/api/v2/doc/doc?query=%20sourcecountry:po&sourcelang:por&mode=artlist&format=json&timespan=240&maxrecords=250&sort=datedesc,https://www.dn.pt/edicao-do-dia/14-abr-2020/amp/enfermeiro-luis-salva-nos-do-virus-de-dizermos-mal-de-nos-12066178.html,2020-04-14T01:15:00Z,https://static.globalnoticias.pt/dn/image.aspx?brand=DN&type=opiniao&name=ferreira_fernandes_norm,dn.pt,Portuguese,Portugal,"Vai por aí muita conversa de confinados, públicas e privadas, sobre o Luís, enfermeiro, de perto do Porto. Luís Pitarma, que é de Aveiro, surgiu como notícia porque Boris Johnson agradeceu publicamente a quem o salvou do coronavírus. Elogios gerais ao hospital e em especial a dois enfermeiros: ""São a Jenny da Nova Zelândia, Invercargill, na Ilha Sul, para ser exato, e Luís, de Portugal, perto do Porto.""
O Presidente Marcelo logo saltou a saudar o Luís. Coisa tão habitual nele, o acenar, que às vezes me parece exagerar. Mas sobre isso, tenho duas coisas a dizer. A primeira, é que eu estou atento ao mundo. Por isso prefiro um presidente que gosta dos seus concidadãos.
Ainda há dias vi e ouvi outro presidente, na tevê, falar de 200 mil mortos previstos para os Estados Unidos por um ""modelo"" matemático. E, na mesma frase!, falou das ""modelos"" que, sublinhou ele, conhecia melhor. Para que não se perdesse a graçola, entre as duas palavras, ""model"" [matemático] e ""models"" [gajas boas], Trump fez gestos de mão, amplos sobre mamas, estreitou na cintura e voltou a ser gloriosos nas coxas, tudo inspirado na ideia inicial de milhares de urnas dos seus concidadãos. Sim, prefiro um presidente afetivo.
Fechar Subscreva as newsletters Diário de Notícias e receba as informações em primeira mão. Subscrever
A segunda coisa é que o tal Luís foi saudado por Boris Johnson por uma razão não despicienda. De Cristiano Ronaldo, Boris podia ter dito que tinha belos penteados, e isso valeria só como anedota. E de Cristiano, ainda, podia dizer que ele era um futebolista fantástico, o que seria só uma banalidade, boa de conversa embora com o cuidado de não pensarmos que o talento do conterrâneo nos salpica. Ora os elogios de Boris Johnson ao enfermeiro Luís Pitarma são outra coisa e justificáveis de maior atenção.
Os elogios foram dirigidos ao trabalho - competente e que salva vidas - do Luís. Dão direito a orgulho dele e ao dos seus, e a mais ninguém - mas a nós também deram qualquer coisa. É que estamos a falar da talvez maior das palavras boas, trabalho, e a que mais efeito tem nas relações entre os homens.
Acontece que o assunto decorreu durante uma tragédia mundial, foi exposto (e com altifalantes!) por um dos homens mais poderosos do mundo e foi protagonizado por um imigrante português, num dos países onde a nossa imigração é das mais qualificadas e num momento em que um dos debates da Europa é uma falácia: há uns que trabalham e outros, não.
Ontem, um leitor gentil, antigo tradutor na União Europeia, mandou-me um ensinamento. Bizarro, útil, profundo? Fiquem com os factos: em quase todas as línguas, das latinas às escandinavas, chinês, russo inglês, há palavras diferentes para ""dívida"" e para ""culpa"". Mas a palavra é a mesma, igual e única, para os dois conceitos - no alemão (Schuld) e no holandês (schuld). Falam quase todos de dívida ou de culpa, segundo eles querem referir-se a uma ou outra ideia; e os outros dois dizerem sempre ""Schuld"" ou ""schuld"", não distinguindo. Segundo o gentil leitor, as conversas podem tornar-se ""um perpétuo e inútil mal-entendido.""
Resumindo, o mundo está perigoso, como a dívida e/ou a culpa nos alertam. Seria, pois, de elementar prudência não termos a soberba de sacudir o Luís dos nossos interesses.
O Luís é-nos precioso. Somos poucos e, ainda por cima, somos muitos e bons a menosprezarmo-nos. No sábado passado, o The New York Times publicava extenso artigo intitulado assim: ""Há 500 anos, este porto ligava o Oriente e o Ocidente"". E era apresentado assim: ""Malaca deu origem à noção de fusão asiática, séculos antes disto se tornar uma moda culinária.""
Ora, o que se seguiu, em cada linha do longo texto, era sobre os portugueses. Os portugueses no lugar que eles ocuparam na História, certamente por se saberem sempre poucos mas metidos num destino grandioso: os portugueses entre os outros. ""Malaca, possessão portuguesa no século XVI, porto no estreito de Malaca, ligando os oceanos Pacífico e o Índico, construiu a sua confusa herança multicultural, influenciada pela multidão de chineses, árabes, indianos, persas, turcos, portugueses, holandeses e gente do Sião"".
Os portugueses entre os outros, suficientemente úteis, competentes e salvadores para justificarem que a sua passagem seja lembrada pelo The New York Times, 500 anos depois.
Leiam o artigo e notem como ele estranharia por cá. Então não se fala da espada assassina do Afonso de Albuquerque? E era verdade. O artigo não falava de Afonso de Albuquerque, e verdade era que a espada dele era terrível e muitas vezes assassina. Mas invalida isso o que fizeram aqueles portugueses, e até o admirável que fez Afonso de Albuquerque, entre persas e gente do Sião, construindo um centro do mundo, num mundo misturado?
Volto ao enfermeiro Luís. ""Que saloiice!"", foi a ideia que surfou contra os que falaram do português elogiado por Boris Johnson. O jornal El País, ontem, titulou: ""Luís, el enfermero portugués que salvó a Boris Johnson."" Por maior proximidade (que é um dos critérios para se medir a importância de uma notícia), Luís Pitarma ainda deveria ser mais notícia por cá. E acresce, à razão jornalística, uma urgência sanitária: começa a ser tempo de combater a curva exponencial de parvos para quem o que é português é mau.",0.9646357051555177,0.9280809565036006,0.9686674216685542,0.970499243570348,0.9668425018839487,"Random Forests
('ranger' package, R 3.5.3.)
Wright MN, Ziegler A (2017). “ranger: A Fast Implementation of Random Forests for High Dimensional Data in C++ and R.” Journal of Statistical Software, 77(1), 1–17. doi: 10.18637/jss.v077.i01.",5479,0.4347048300536673,204,500,20,gini,classification,2020-04-05
