prediction_covid_topic,title,description,authors,date_download,maintext,url,gdelt_title,gdelt_url,date_publish,modeSearch,sourcecountrySearch,termSearch,periodtimeSearch,isOR,countMaximumRecords,urlGDELTV2FTAPI,urlArticleMobile,datetimeArticle,urlImage,domainArticle,languageArticle,countryArticle,pred_input,model_accuracy,model_kappa,model_f1,model_precision,model_recall,model,sample_size,train_prop_covid,mtry,n_tree,min_node_size,splitrule,model_type,fitted_on
1,Bebé de 7 meses morre infetado com o novo coronavírus em São Paulo,Brasil já conta com mais de quatro mil vítimas mortais devido à Covid-19.,Notícias Ao Minuto,2020-04-26 06:15:58,"O governo estadual de São Paulo, no Brasil, confirmou este sábado que um bebé de apenas sete meses, com doenças subjacentes, morreu infetado com o novo coronavírus. É o primeiro óbito na faixa etária entre 0 e 10 anos.
O estado de São Paulo, o mais afetado por este vírus, registou neste sábado 155 novas mortes provocadas pela Covid-19, aumentando para 1.667 desde o início da pandemia. 20.004 pessoas testaram positivas nestes estado brasileiro.
Nas últimas 24 horas, foram contabilizados mais mil pacientes internados, o que aumentou para 7.452 o número de suspeitos e confirmados em hospitais de São Paulo - 2.906 pacientes em unidades de cuidados intensivos e 4.546 em enfermarias.
Ao todo, o Brasil, e segundo os dados mais recentes do Ministério da Saúde, já soma mais de 4 mil óbitos e 58 mil infetados.
Leia Também: AO MINUTO: Madeira sem novos casos; Brasil com mais de 4 mil mortes
Recomendados para si",https://www.noticiasaominuto.com/mundo/1465584/bebe-de-7-meses-morre-infetado-com-o-novo-coronavirus-em-sao-paulo,Bebé de 7 meses morre infetado com o novo coronavírus em São Paulo,https://www.noticiasaominuto.com/mundo/1465584/bebe-de-7-meses-morre-infetado-com-o-novo-coronavirus-em-sao-paulo,2020-04-26 01:29:00,artlist,PO,,240 minutes,FALSE,250,https://api.gdeltproject.org/api/v2/doc/doc?query=%20sourcecountry:po&sourcelang:por&mode=artlist&format=json&timespan=240&maxrecords=250&sort=datedesc,NA,2020-04-26T00:30:00Z,https://media-manager.noticiasaominuto.com/1280/naom_5a79b16cc861d.jpg,noticiasaominuto.com,Portuguese,Portugal,"O governo estadual de São Paulo, no Brasil, confirmou este sábado que um bebé de apenas sete meses, com doenças subjacentes, morreu infetado com o novo coronavírus. É o primeiro óbito na faixa etária entre 0 e 10 anos.
O estado de São Paulo, o mais afetado por este vírus, registou neste sábado 155 novas mortes provocadas pela Covid-19, aumentando para 1.667 desde o início da pandemia. 20.004 pessoas testaram positivas nestes estado brasileiro.
Nas últimas 24 horas, foram contabilizados mais mil pacientes internados, o que aumentou para 7.452 o número de suspeitos e confirmados em hospitais de São Paulo - 2.906 pacientes em unidades de cuidados intensivos e 4.546 em enfermarias.
Ao todo, o Brasil, e segundo os dados mais recentes do Ministério da Saúde, já soma mais de 4 mil óbitos e 58 mil infetados.
Leia Também: AO MINUTO: Madeira sem novos casos; Brasil com mais de 4 mil mortes
Recomendados para si",0.9646357051555177,0.9280809565036006,0.9686674216685542,0.970499243570348,0.9668425018839487,"Random Forests
('ranger' package, R 3.5.3.)
Wright MN, Ziegler A (2017). “ranger: A Fast Implementation of Random Forests for High Dimensional Data in C++ and R.” Journal of Statistical Software, 77(1), 1–17. doi: 10.18637/jss.v077.i01.",5479,0.4347048300536673,204,500,20,gini,classification,2020-04-05
1,Tesla: Piloto automático já interpreta semáforos e sinais STOP,"A empresa de Elon Musk melhorou a navegação do piloto automático, há já algum tempo, e agora disponibilizou a todos os clientes.",Pedro Pinto,2020-04-26 06:16:16,"Não haverá no mundo carros mais inteligentes que os Tesla! O piloto automático é uma das funcionalidades mais bem conseguidas da marca, mas há novidades nesta área. Com a última atualização, o piloto automático passou a conseguir interpretar semáforos e sinais STOP.
Esta funcionalidade já está disponível para todos.
Uma das funcionalidades que muitos proprietários esperavam chegou finalmente! A empresa de Elon Musk melhorou a navegação do piloto automático, há já algum tempo, e agora disponibilizou a todos os clientes. Com as melhorias, o piloto automático passa a reconhecer semáforos e sinais de STOP.
De acordo com alguns proprietários portugueses, de facto o piloto automático consegue interpretar a sinalética, mas não “reage” à mesma (espera-se que para breve). Tais funcionalidades chegaram com a atualização software 2020.12.6.
Veja como funciona as novidades do piloto automático
A nota de atualização refere que a funcionalidade ainda está na versão beta, mas dará aos veículos da Tesla o poder de reconhecer semáforos mesmo quando estão desligados e desacelerar automaticamente nos cruzamentos.
O mundo parece meio parado e a economia vai precisar de muito “oxigénio” por causa da COVID-19. É verdade que ninguém sabe o que nos espera, mas há segmentos que se mantêm em crescimento. No entanto, relativamente ao primeiro trimestre de 2020 a liderança mantém-se na Tesla que vendeu 2630 carros elétricos. Segue-se a Nissan com 2271 carros vendidos. A Renault encontra-se na terceira posição com 1595 carros elétricos vendidos. Ao todo foram vendidos no primeiro trimestre 9936 veículos elétricos – saber mais aqui.
Leia também…",https://pplware.sapo.pt/motores/tesla-piloto-automatico-ja-interpreta-semaforos-e-sinais-stop/,Tesla : Piloto automático já interpreta semáforos e sinais STOP,https://pplware.sapo.pt/motores/tesla-piloto-automatico-ja-interpreta-semaforos-e-sinais-stop/,2020-04-26 00:06:04,artlist,PO,,240 minutes,FALSE,250,https://api.gdeltproject.org/api/v2/doc/doc?query=%20sourcecountry:po&sourcelang:por&mode=artlist&format=json&timespan=240&maxrecords=250&sort=datedesc,https://pplware.sapo.pt/motores/tesla-piloto-automatico-ja-interpreta-semaforos-e-sinais-stop/amp/,2020-04-26T00:15:00Z,https://pplware.sapo.pt/wp-content/uploads/2019/05/tesla_autopilot00-720x420.jpg,pplware.sapo.pt,Portuguese,Portugal,"Não haverá no mundo carros mais inteligentes que os Tesla! O piloto automático é uma das funcionalidades mais bem conseguidas da marca, mas há novidades nesta área. Com a última atualização, o piloto automático passou a conseguir interpretar semáforos e sinais STOP.
Esta funcionalidade já está disponível para todos.
Uma das funcionalidades que muitos proprietários esperavam chegou finalmente! A empresa de Elon Musk melhorou a navegação do piloto automático, há já algum tempo, e agora disponibilizou a todos os clientes. Com as melhorias, o piloto automático passa a reconhecer semáforos e sinais de STOP.
De acordo com alguns proprietários portugueses, de facto o piloto automático consegue interpretar a sinalética, mas não “reage” à mesma (espera-se que para breve). Tais funcionalidades chegaram com a atualização software 2020.12.6.
Veja como funciona as novidades do piloto automático
A nota de atualização refere que a funcionalidade ainda está na versão beta, mas dará aos veículos da Tesla o poder de reconhecer semáforos mesmo quando estão desligados e desacelerar automaticamente nos cruzamentos.
O mundo parece meio parado e a economia vai precisar de muito “oxigénio” por causa da COVID-19. É verdade que ninguém sabe o que nos espera, mas há segmentos que se mantêm em crescimento. No entanto, relativamente ao primeiro trimestre de 2020 a liderança mantém-se na Tesla que vendeu 2630 carros elétricos. Segue-se a Nissan com 2271 carros vendidos. A Renault encontra-se na terceira posição com 1595 carros elétricos vendidos. Ao todo foram vendidos no primeiro trimestre 9936 veículos elétricos – saber mais aqui.
Leia também…",0.9646357051555177,0.9280809565036006,0.9686674216685542,0.970499243570348,0.9668425018839487,"Random Forests
('ranger' package, R 3.5.3.)
Wright MN, Ziegler A (2017). “ranger: A Fast Implementation of Random Forests for High Dimensional Data in C++ and R.” Journal of Statistical Software, 77(1), 1–17. doi: 10.18637/jss.v077.i01.",5479,0.4347048300536673,204,500,20,gini,classification,2020-04-05
1,Brasil regista 346 mortos e número recorde de 5.514 infetados em 24 horas,"As últimas notícias e reportagens sobre Portugal e o Mundo. Actualidade, Globo, Desporto, Fama e TV, Arte e Lazer. Passatempos. Todas as fotos e videos em destak.pt",Destak,2020-04-26 06:17:48,"Covid-19
O Brasil registou nas últimas 24 horas 346 mortos e 5.514 novos casos de infeção pelo novo coronavírus, um novo recorde diário de infetados desde o início da pandemia, anunciou hoje o executivo.
No total, o país sul-americano já registou 4.016 óbitos e 58.509 casos confirmados da covid-19.
Segundo o balanço divulgado pelo Ministério da Saúde, o aumento no número de mortes foi de 9,4%, passando de 3.670 na sexta-feira para 4.016 hoje. Em relação ao número de infetados, o crescimento foi de 10,4%, de 52.995 para 58.509 casos confirmados.",http://www.destak.pt/artigo/417007-brasil-regista-346-mortos-e-numero-recorde-de-5.514-infetados-em-24-horas,Destak . pt | Covid - 19 : Brasil regista 346 mortos e número recorde de 5 . 514 infetados em 24 horas,http://www.destak.pt/artigo/417007-brasil-regista-346-mortos-e-numero-recorde-de-5.514-infetados-em-24-horas,NA,artlist,PO,,240 minutes,FALSE,250,https://api.gdeltproject.org/api/v2/doc/doc?query=%20sourcecountry:po&sourcelang:por&mode=artlist&format=json&timespan=240&maxrecords=250&sort=datedesc,NA,2020-04-25T23:45:00Z,http://www.destak.pt/images/newsletter_no_img.jpg,destak.pt,Portuguese,Portugal,"Covid-19
O Brasil registou nas últimas 24 horas 346 mortos e 5.514 novos casos de infeção pelo novo coronavírus, um novo recorde diário de infetados desde o início da pandemia, anunciou hoje o executivo.
No total, o país sul-americano já registou 4.016 óbitos e 58.509 casos confirmados da covid-19.
Segundo o balanço divulgado pelo Ministério da Saúde, o aumento no número de mortes foi de 9,4%, passando de 3.670 na sexta-feira para 4.016 hoje. Em relação ao número de infetados, o crescimento foi de 10,4%, de 52.995 para 58.509 casos confirmados.",0.9646357051555177,0.9280809565036006,0.9686674216685542,0.970499243570348,0.9668425018839487,"Random Forests
('ranger' package, R 3.5.3.)
Wright MN, Ziegler A (2017). “ranger: A Fast Implementation of Random Forests for High Dimensional Data in C++ and R.” Journal of Statistical Software, 77(1), 1–17. doi: 10.18637/jss.v077.i01.",5479,0.4347048300536673,204,500,20,gini,classification,2020-04-05
1,"Líder da CGTP diz que 25 Abril assume ""significado maior"" durante pandemia","""O 25 de Abril assume um significado ainda maior"" em tempo de pandemia, referiu a líder da CGT, acrescentando que os trabalhadores e os port...",Agência Lusa,2020-04-26 06:17:48,"A secretária-geral da CGTP, Isabel Camarinha, disse este sábado em Lisboa que o 25 de Abril assume um significado maior, durante o período de pandemia da covid-19, alertando que há quem não queira celebrar a liberdade.
A líder da Intersindical falava aos jornalistas à porta da sede da entidade, após ter cantado a “Grândola, Vila Morena”, de José Afonso, e o hino nacional, pelas 15h, na varanda do edifício, na Rua Vítor Cordon.
“O 25 de Abril assume naturalmente um significado ainda maior [em tempo de pandemia]”, referiu a sindicalista, acrescentando que os trabalhadores e os portugueses “precisam de ter a salvaguarda da sua vida e dos seus direitos”. Para Isabel Camarinha, os valores da liberdade devem continuar a ser cumpridos, porque há quem tente retirá-los. “Precisamos que os valores de Abril continuem despertos e que continuemos a querer cumpri-los. Há quem queira que não se celebre o 25 de Abril”, disse.
Indicando o facto de as pessoas estarem confinadas em casa, por causa da covid-19, a sindicalista realçou a “manifestação”, que este ano aconteceu nas varandas e nas janelas dos portugueses, devido às medidas de contingência. “Estou certa de que os portugueses estão em casa defender a sua saúde, a protegerem-se deste vírus”, anotou, referindo que cantar a “Grândola, Vila Morena” e o hino nacional “foi um momento de grande unidade de todos aqueles que defendem a liberdade”.
Sem poder fazer a marcha anual das comemorações do 25 de Abril, Isabel Camarinha perspetivou também as várias concentrações que CGTP vai realizar no Dia do Trabalhador, em 01 de maio, nas cidades do Porto e Lisboa. “[Na sexta-feira] vamos representar todos os milhões de portugueses que estão neste momento com situações de ‘lay-off’, com situações de desemprego, com situações de assistência à família”, realçou.
De acordo com a líder da CGTP, foi em Abril que os portugueses conseguiram festejar Maio em liberdade. “Nós festejamos sempre Abril em Maio. No 1.º de Maio, o 25 de Abril está sempre presente”, sublinhou.",https://observador.pt/2020/04/25/lider-da-cgtp-diz-que-25-abril-assume-significado-maior-durante-pandemia/,Líder da CGTP diz que 25 Abril assume  significado maior  durante pandemia,https://observador.pt/2020/04/25/lider-da-cgtp-diz-que-25-abril-assume-significado-maior-durante-pandemia/,2020-04-26 03:11:00,artlist,PO,,240 minutes,FALSE,250,https://api.gdeltproject.org/api/v2/doc/doc?query=%20sourcecountry:po&sourcelang:por&mode=artlist&format=json&timespan=240&maxrecords=250&sort=datedesc,https://observador.pt/2020/04/25/lider-da-cgtp-diz-que-25-abril-assume-significado-maior-durante-pandemia/amp/,2020-04-25T23:45:00Z,https://wm.observador.pt/wm/obs/l/https%3A%2F%2Fbordalo.observador.pt%2F770x403%2Cq80%2Fhttps%3A%2F%2Fs3.observador.pt%2Fwp-content%2Fuploads%2F2020%2F04%2F25205321%2F28706529_770x433_acf_cropped.jpg,observador.pt,Portuguese,Portugal,"A secretária-geral da CGTP, Isabel Camarinha, disse este sábado em Lisboa que o 25 de Abril assume um significado maior, durante o período de pandemia da covid-19, alertando que há quem não queira celebrar a liberdade.
A líder da Intersindical falava aos jornalistas à porta da sede da entidade, após ter cantado a “Grândola, Vila Morena”, de José Afonso, e o hino nacional, pelas 15h, na varanda do edifício, na Rua Vítor Cordon.
“O 25 de Abril assume naturalmente um significado ainda maior [em tempo de pandemia]”, referiu a sindicalista, acrescentando que os trabalhadores e os portugueses “precisam de ter a salvaguarda da sua vida e dos seus direitos”. Para Isabel Camarinha, os valores da liberdade devem continuar a ser cumpridos, porque há quem tente retirá-los. “Precisamos que os valores de Abril continuem despertos e que continuemos a querer cumpri-los. Há quem queira que não se celebre o 25 de Abril”, disse.
Indicando o facto de as pessoas estarem confinadas em casa, por causa da covid-19, a sindicalista realçou a “manifestação”, que este ano aconteceu nas varandas e nas janelas dos portugueses, devido às medidas de contingência. “Estou certa de que os portugueses estão em casa defender a sua saúde, a protegerem-se deste vírus”, anotou, referindo que cantar a “Grândola, Vila Morena” e o hino nacional “foi um momento de grande unidade de todos aqueles que defendem a liberdade”.
Sem poder fazer a marcha anual das comemorações do 25 de Abril, Isabel Camarinha perspetivou também as várias concentrações que CGTP vai realizar no Dia do Trabalhador, em 01 de maio, nas cidades do Porto e Lisboa. “[Na sexta-feira] vamos representar todos os milhões de portugueses que estão neste momento com situações de ‘lay-off’, com situações de desemprego, com situações de assistência à família”, realçou.
De acordo com a líder da CGTP, foi em Abril que os portugueses conseguiram festejar Maio em liberdade. “Nós festejamos sempre Abril em Maio. No 1.º de Maio, o 25 de Abril está sempre presente”, sublinhou.",0.9646357051555177,0.9280809565036006,0.9686674216685542,0.970499243570348,0.9668425018839487,"Random Forests
('ranger' package, R 3.5.3.)
Wright MN, Ziegler A (2017). “ranger: A Fast Implementation of Random Forests for High Dimensional Data in C++ and R.” Journal of Statistical Software, 77(1), 1–17. doi: 10.18637/jss.v077.i01.",5479,0.4347048300536673,204,500,20,gini,classification,2020-04-05
1,Covid-19. Requerentes de asilo em Portugal começaram a fazer testes de despistagem,"Os requerentes de asilo em Portugal começaram a fazer testes de despistagem à infeção pelo novo coronavírus, tendo já sido testadas cerca de 30 pessoa...",Agência Lusa,2020-04-26 06:17:49,"Os requerentes de asilo em Portugal começaram este sábado a fazer testes de despistagem à infeção pelo novo coronavírus, tendo já sido testadas cerca de 30 pessoas, disse à Lusa o delegado de saúde de Lisboa e Vale do Tejo.
Segundo Mário Durval, os testes irão continuar a ser feitos, mas não adiantou se existe algum prazo definido para a sua conclusão.
Ainda de acordo com o delegado de saúde de Lisboa e Vale do Tejo, não há para já resultados dos testes, uma vez que apenas começaram a ser feitos apenas este sábado.
Na segunda-feira, a presidente do Conselho Português para os Refugiados (CPR), Mónica Farinha, disse à Lusa que o organismo está a acompanhar atualmente 950 requerentes de proteção, dos quais cerca de 800 se encontram em alojamentos externos aos serviços, em hostels na cidade de Lisboa.
No dia anterior, um hostel localizado na Rua Morais Soares, na freguesia de Arroios, foi evacuado devido a um caso positivo da doença.
A unidade, que foi entretanto desinfetada, albergava perto de 200 pessoas em cerca de 40 quartos, segundo as autoridades.
Posteriormente, os 171 migrantes que estavam hospedados no hostel foram transportados para a Base Aérea da Ota, em Alenquer.
Destes requerentes de asilo, 136 testaram positivo à presença do novo coronavírus (SARS-CoV-2), sete com resultados inconclusivos e 26 com testes negativos.
No entanto, quando foram realizados os testes à Covid-19 aos migrantes alojados no hostel, 25 não estavam presentes.
A pedido das autoridades sanitárias, o Serviço de Estrangeiros e Fronteiras (SEF) realizou várias averiguações e, na quarta-feira, anunciou que tinha detetado 19 dos 25 cidadãos estrangeiros.
Dos seis desaparecidos, um foi localizado no Reino Unido, tendo o SEF precisado que terá saído de Portugal antes de ser detetado o caso de Covid-19 no hostel.
Na sexta-feira, fonte do SEF indicou que continuam a ser feitas diligências para localizar os outros cinco migrantes desaparecidos.
De acordo com os dados do CPR, no ano passado pediram asilo perto de 70 nacionalidades diferentes.
De acordo com a legislação em vigor, os requerentes de proteção internacional estão, durante todo o procedimento, em situação regular em Portugal.
De acordo com a Lei do Asilo, o apoio social e de alojamento é assegurado apenas àqueles que se encontram em situação de carência económica, podendo este apoio cessar a qualquer momento, assim que se deixe de verificar os pressupostos dessa situação.
A nível global, segundo um balanço da agência de notícias AFP, a pandemia de Covid-19 já provocou mais de 200 mil mortos e infetou mais de 2,8 milhões de pessoas em 193 países e territórios. Mais de 766 mil doentes foram considerados curados.
Segundo o boletim diário da Direção-Geral da Saúde sobre a pandemia divulgado hoje, Portugal contabiliza 880 mortos associados à Covid-19 em 23.392 casos confirmados de infeção e há 1.277 casos recuperados.
A doença é transmitida por um novo coronavírus detetado no final de dezembro, em Wuhan, uma cidade do centro da China.",https://observador.pt/2020/04/25/covid-19-requerentes-de-asilo-em-portugal-comecaram-a-fazer-testes-de-despistagem/,Covid - 19 . Requerentes de asilo em Portugal começaram a fazer testes de despistagem,https://observador.pt/2020/04/25/covid-19-requerentes-de-asilo-em-portugal-comecaram-a-fazer-testes-de-despistagem/,2020-04-26 04:07:00,artlist,PO,,240 minutes,FALSE,250,https://api.gdeltproject.org/api/v2/doc/doc?query=%20sourcecountry:po&sourcelang:por&mode=artlist&format=json&timespan=240&maxrecords=250&sort=datedesc,https://observador.pt/2020/04/25/covid-19-requerentes-de-asilo-em-portugal-comecaram-a-fazer-testes-de-despistagem/amp/,2020-04-25T23:45:00Z,https://wm.observador.pt/wm/obs/l/https%3A%2F%2Fbordalo.observador.pt%2F770x403%2Cq80%2Fhttps%3A%2F%2Fs3.observador.pt%2Fwp-content%2Fuploads%2F2020%2F04%2F25215216%2Fjporfirio_hostel_covid-19_21_04_14-scaled_770x433_acf_cropped.jpg,observador.pt,Portuguese,Portugal,"Os requerentes de asilo em Portugal começaram este sábado a fazer testes de despistagem à infeção pelo novo coronavírus, tendo já sido testadas cerca de 30 pessoas, disse à Lusa o delegado de saúde de Lisboa e Vale do Tejo.
Segundo Mário Durval, os testes irão continuar a ser feitos, mas não adiantou se existe algum prazo definido para a sua conclusão.
Ainda de acordo com o delegado de saúde de Lisboa e Vale do Tejo, não há para já resultados dos testes, uma vez que apenas começaram a ser feitos apenas este sábado.
Na segunda-feira, a presidente do Conselho Português para os Refugiados (CPR), Mónica Farinha, disse à Lusa que o organismo está a acompanhar atualmente 950 requerentes de proteção, dos quais cerca de 800 se encontram em alojamentos externos aos serviços, em hostels na cidade de Lisboa.
No dia anterior, um hostel localizado na Rua Morais Soares, na freguesia de Arroios, foi evacuado devido a um caso positivo da doença.
A unidade, que foi entretanto desinfetada, albergava perto de 200 pessoas em cerca de 40 quartos, segundo as autoridades.
Posteriormente, os 171 migrantes que estavam hospedados no hostel foram transportados para a Base Aérea da Ota, em Alenquer.
Destes requerentes de asilo, 136 testaram positivo à presença do novo coronavírus (SARS-CoV-2), sete com resultados inconclusivos e 26 com testes negativos.
No entanto, quando foram realizados os testes à Covid-19 aos migrantes alojados no hostel, 25 não estavam presentes.
A pedido das autoridades sanitárias, o Serviço de Estrangeiros e Fronteiras (SEF) realizou várias averiguações e, na quarta-feira, anunciou que tinha detetado 19 dos 25 cidadãos estrangeiros.
Dos seis desaparecidos, um foi localizado no Reino Unido, tendo o SEF precisado que terá saído de Portugal antes de ser detetado o caso de Covid-19 no hostel.
Na sexta-feira, fonte do SEF indicou que continuam a ser feitas diligências para localizar os outros cinco migrantes desaparecidos.
De acordo com os dados do CPR, no ano passado pediram asilo perto de 70 nacionalidades diferentes.
De acordo com a legislação em vigor, os requerentes de proteção internacional estão, durante todo o procedimento, em situação regular em Portugal.
De acordo com a Lei do Asilo, o apoio social e de alojamento é assegurado apenas àqueles que se encontram em situação de carência económica, podendo este apoio cessar a qualquer momento, assim que se deixe de verificar os pressupostos dessa situação.
A nível global, segundo um balanço da agência de notícias AFP, a pandemia de Covid-19 já provocou mais de 200 mil mortos e infetou mais de 2,8 milhões de pessoas em 193 países e territórios. Mais de 766 mil doentes foram considerados curados.
Segundo o boletim diário da Direção-Geral da Saúde sobre a pandemia divulgado hoje, Portugal contabiliza 880 mortos associados à Covid-19 em 23.392 casos confirmados de infeção e há 1.277 casos recuperados.
A doença é transmitida por um novo coronavírus detetado no final de dezembro, em Wuhan, uma cidade do centro da China.",0.9646357051555177,0.9280809565036006,0.9686674216685542,0.970499243570348,0.9668425018839487,"Random Forests
('ranger' package, R 3.5.3.)
Wright MN, Ziegler A (2017). “ranger: A Fast Implementation of Random Forests for High Dimensional Data in C++ and R.” Journal of Statistical Software, 77(1), 1–17. doi: 10.18637/jss.v077.i01.",5479,0.4347048300536673,204,500,20,gini,classification,2020-04-05
