prediction_covid_topic,title,description,authors,date_download,date_publish,maintext,url,gdelt_title,gdelt_url,modeSearch,sourcecountrySearch,termSearch,periodtimeSearch,isOR,countMaximumRecords,urlGDELTV2FTAPI,urlArticleMobile,datetimeArticle,urlImage,domainArticle,languageArticle,countryArticle,pred_input,model_accuracy,model_kappa,model_f1,model_precision,model_recall,model,sample_size,train_prop_covid,mtry,n_tree,min_node_size,splitrule,model_type,fitted_on
1,Covid-19. Ministro da Saúde do Brasil não prevê a data do pico da pandemia,"O ministro brasileiro da Saúde, Nelson Teich, disse não saber quando ocorrerá o pico da pandemia do novo coronavírus no país, acrescentando que existe uma ""possibilidade real"" de uma segunda vaga da doença.",Rádio E Televisão De Portugal,2020-04-30 10:15:52,2020-04-30 07:43:14,""", afirmou o novo responsável pela Tutela da Saúde, numa audiência virtual do Senado.Segundo as estimativas do anterior ministro da Saúde, Luiz Henrique Mandetta, exonerado este mês pelo presidente, Jair Bolsonaro, após divergências na questão do isolamento social, o país teria uma subida aguda no número de casos no corrente mês de abril, permanecendo em alta em maio e junho, sendo esse o período mais preocupante.A partir de julho, o então ministro previu o início da desaceleração e, em agosto, um movimento de queda.Efetivamente, o país tem registado números recorde de mortes e novos casos nas últimas semanas.Na terça-feira, o país já tinha contabilizado o maior número de mortos (474) num único dia.No total, o país sul-americano regista 5.466 óbitos e 78.162 casos confirmados de infeção pelo novo coronavírus.Na audiência com senadores, Nelson Teich afirmou ser ""real"" a possibilidade de uma segunda vaga da covid-19 no país, acrescentando não haver dados suficientes que garantam que a mesma pessoa não possa ser infetada pelo mesmo vírus mais do que uma vez."", afirmou o ministro, frisando que não há garantias de que sejam criados anticorpos após a primeira infeção.
Data do regresso às aulas desconhecida
Teich disse ainda que não há uma recomendação do governo para o regresso às aulas, frisando que a orientação original do ministério, de manter o distanciamento social, nunca foi mudada.
"", indicou o governante."", concluiu.",https://www.rtp.pt/noticias/mundo/covid-19-ministro-da-saude-do-brasil-nao-preve-a-data-do-pico-da-pandemia-no-pais_n1224903,Covid - 19 . Ministro da Saúde do Brasil não prevê a data do pico da pandemia no país,https://www.rtp.pt/noticias/mundo/covid-19-ministro-da-saude-do-brasil-nao-preve-a-data-do-pico-da-pandemia-no-pais_n1224903,artlist,PO,,100 minutes,FALSE,250,https://api.gdeltproject.org/api/v2/doc/doc?query=%20sourcecountry:po&sourcelang:por&mode=artlist&format=json&timespan=100&maxrecords=250&sort=datedesc,NA,2020-04-30T05:30:00Z,"https://cdn-images.rtp.pt/icm/noticias/images/7f/7f414338c02bf5588032bb4b524c6aa7?&q=90&rect=0,0,1086,595&auto=format",rtp.pt,Portuguese,Portugal,""", afirmou o novo responsável pela Tutela da Saúde, numa audiência virtual do Senado.Segundo as estimativas do anterior ministro da Saúde, Luiz Henrique Mandetta, exonerado este mês pelo presidente, Jair Bolsonaro, após divergências na questão do isolamento social, o país teria uma subida aguda no número de casos no corrente mês de abril, permanecendo em alta em maio e junho, sendo esse o período mais preocupante.A partir de julho, o então ministro previu o início da desaceleração e, em agosto, um movimento de queda.Efetivamente, o país tem registado números recorde de mortes e novos casos nas últimas semanas.Na terça-feira, o país já tinha contabilizado o maior número de mortos (474) num único dia.No total, o país sul-americano regista 5.466 óbitos e 78.162 casos confirmados de infeção pelo novo coronavírus.Na audiência com senadores, Nelson Teich afirmou ser ""real"" a possibilidade de uma segunda vaga da covid-19 no país, acrescentando não haver dados suficientes que garantam que a mesma pessoa não possa ser infetada pelo mesmo vírus mais do que uma vez."", afirmou o ministro, frisando que não há garantias de que sejam criados anticorpos após a primeira infeção.
Data do regresso às aulas desconhecida
Teich disse ainda que não há uma recomendação do governo para o regresso às aulas, frisando que a orientação original do ministério, de manter o distanciamento social, nunca foi mudada.
"", indicou o governante."", concluiu.",0.9646357051555177,0.9280809565036006,0.9686674216685542,0.970499243570348,0.9668425018839487,"Random Forests
('ranger' package, R 3.5.3.)
Wright MN, Ziegler A (2017). “ranger: A Fast Implementation of Random Forests for High Dimensional Data in C++ and R.” Journal of Statistical Software, 77(1), 1–17. doi: 10.18637/jss.v077.i01.",5479,0.4347048300536673,204,500,20,gini,classification,2020-04-05
1,Covid-19. Ministro da Saúde do Brasil não prevê a data do pico da pandemia,"O ministro brasileiro da Saúde, Nelson Teich, disse não saber quando ocorrerá o pico da pandemia do novo coronavírus no país, acrescentando que existe uma ""possibilidade real"" de uma segunda vaga da doença.",Rádio E Televisão De Portugal,2020-04-30 10:15:53,2020-04-30 07:43:14,""", afirmou o novo responsável pela Tutela da Saúde, numa audiência virtual do Senado.Segundo as estimativas do anterior ministro da Saúde, Luiz Henrique Mandetta, exonerado este mês pelo presidente, Jair Bolsonaro, após divergências na questão do isolamento social, o país teria uma subida aguda no número de casos no corrente mês de abril, permanecendo em alta em maio e junho, sendo esse o período mais preocupante.A partir de julho, o então ministro previu o início da desaceleração e, em agosto, um movimento de queda.Efetivamente, o país tem registado números recorde de mortes e novos casos nas últimas semanas.Na terça-feira, o país já tinha contabilizado o maior número de mortos (474) num único dia.No total, o país sul-americano regista 5.466 óbitos e 78.162 casos confirmados de infeção pelo novo coronavírus.Na audiência com senadores, Nelson Teich afirmou ser ""real"" a possibilidade de uma segunda vaga da covid-19 no país, acrescentando não haver dados suficientes que garantam que a mesma pessoa não possa ser infetada pelo mesmo vírus mais do que uma vez."", afirmou o ministro, frisando que não há garantias de que sejam criados anticorpos após a primeira infeção.
Data do regresso às aulas desconhecida
Teich disse ainda que não há uma recomendação do governo para o regresso às aulas, frisando que a orientação original do ministério, de manter o distanciamento social, nunca foi mudada.
"", indicou o governante."", concluiu.",https://www.rtp.pt/noticias/covid-19/covid-19-ministro-da-saude-do-brasil-nao-preve-a-data-do-pico-da-pandemia-no-pais_n1224903,Covid - 19 . Ministro da Saúde do Brasil não prevê a data do pico da pandemia no país,https://www.rtp.pt/noticias/covid-19/covid-19-ministro-da-saude-do-brasil-nao-preve-a-data-do-pico-da-pandemia-no-pais_n1224903,artlist,PO,,100 minutes,FALSE,250,https://api.gdeltproject.org/api/v2/doc/doc?query=%20sourcecountry:po&sourcelang:por&mode=artlist&format=json&timespan=100&maxrecords=250&sort=datedesc,NA,2020-04-30T05:15:00Z,"https://cdn-images.rtp.pt/icm/noticias/images/7f/7f414338c02bf5588032bb4b524c6aa7?&q=90&rect=0,0,1086,595&auto=format",rtp.pt,Portuguese,Portugal,""", afirmou o novo responsável pela Tutela da Saúde, numa audiência virtual do Senado.Segundo as estimativas do anterior ministro da Saúde, Luiz Henrique Mandetta, exonerado este mês pelo presidente, Jair Bolsonaro, após divergências na questão do isolamento social, o país teria uma subida aguda no número de casos no corrente mês de abril, permanecendo em alta em maio e junho, sendo esse o período mais preocupante.A partir de julho, o então ministro previu o início da desaceleração e, em agosto, um movimento de queda.Efetivamente, o país tem registado números recorde de mortes e novos casos nas últimas semanas.Na terça-feira, o país já tinha contabilizado o maior número de mortos (474) num único dia.No total, o país sul-americano regista 5.466 óbitos e 78.162 casos confirmados de infeção pelo novo coronavírus.Na audiência com senadores, Nelson Teich afirmou ser ""real"" a possibilidade de uma segunda vaga da covid-19 no país, acrescentando não haver dados suficientes que garantam que a mesma pessoa não possa ser infetada pelo mesmo vírus mais do que uma vez."", afirmou o ministro, frisando que não há garantias de que sejam criados anticorpos após a primeira infeção.
Data do regresso às aulas desconhecida
Teich disse ainda que não há uma recomendação do governo para o regresso às aulas, frisando que a orientação original do ministério, de manter o distanciamento social, nunca foi mudada.
"", indicou o governante."", concluiu.",0.9646357051555177,0.9280809565036006,0.9686674216685542,0.970499243570348,0.9668425018839487,"Random Forests
('ranger' package, R 3.5.3.)
Wright MN, Ziegler A (2017). “ranger: A Fast Implementation of Random Forests for High Dimensional Data in C++ and R.” Journal of Statistical Software, 77(1), 1–17. doi: 10.18637/jss.v077.i01.",5479,0.4347048300536673,204,500,20,gini,classification,2020-04-05
1,Sistema de saúde brasileiro lança ataque a Bolsonaro,"O Conselho Nacional de Saúde (CNS), órgão vinculado ao Ministério da Saúde brasileiro, classificou de ""irresponsáveis, criminosas e genocidas"" as ações do chefe de Estado, Jair Bolsonaro, face à pandemia da Covid-19.",Rádio E Televisão De Portugal,2020-04-30 10:15:58,2020-04-30 07:17:59,"Numa carta aberta difundida na própria página da internet, o CNS, instância deliberativa do Sistema Único de Saúde (SUS) do país, apelou ainda a que a população brasileira mantenha o isolamento social como medida preventiva contra a Covid-19, ao contrário do defendido por Jair Bolsonaro."", acusou o órgão.O Conselho considerou que a cedência de recursos para o combate à Covid-19 tem sido pequena, quer para ações de Saúde, quer para medidas económicas, pedindo a revogação permanente do teto de gastos e a aplicação imediata de dinheiro no sistema público de saúde."", salientou.O CNS denunciou ainda uma ""falta de transparência das informações"" em relação à pandemia, relatando um colapso na oferta de camas do SUS.""O número de mortes no Brasil, em média, está a dobrar a cada cinco dias e, em vários lugares, os sistemas de sepultamentos já estão, também, em colapso"", acrescentou.
Apelo aos políticos
Além de Bolsonaro e Paulo Guedes, o órgão dirigiu os seus apelos ao novo ministro da Saúde, Nelson Teich, indicando que o governante não pode ""compactuar com qualquer tipo de sabotagem ao combate à doença e à economia popular"".
"", diz a carta aberta.O órgão concluiu a carta pedindo ainda a aplicação imediata de novas verbas nas universidades, centros de investigação e laboratórios, ""preferencialmente públicos"", assim como a aprovação de um projeto de lei que ampare e auxilie os dependentes de profissionais de saúde que morreram e os que vierem a morrer no exercício de suas funções, em decorrência da Covid-19.O Brasil registou 449 mortos e 6276 novos casos do novo coronavírus nas últimas 24 horas, atingindo um novo recorde diário de infetados desde o início da pandemia no país, informou o Ministério da Saúde.",https://www.rtp.pt/noticias/mundo/sistema-de-saude-brasileiro-lanca-ataque-a-bolsonaro_n1224898,Sistema de saúde brasileiro lança ataque a Bolsonaro,https://www.rtp.pt/noticias/mundo/sistema-de-saude-brasileiro-lanca-ataque-a-bolsonaro_n1224898,artlist,PO,,100 minutes,FALSE,250,https://api.gdeltproject.org/api/v2/doc/doc?query=%20sourcecountry:po&sourcelang:por&mode=artlist&format=json&timespan=100&maxrecords=250&sort=datedesc,NA,2020-04-30T05:15:00Z,"https://cdn-images.rtp.pt/icm/noticias/images/45/45ec9066c4db419332f2753d6cc0cb1f?&q=90&rect=78,0,1094,600&auto=format",rtp.pt,Portuguese,Portugal,"Numa carta aberta difundida na própria página da internet, o CNS, instância deliberativa do Sistema Único de Saúde (SUS) do país, apelou ainda a que a população brasileira mantenha o isolamento social como medida preventiva contra a Covid-19, ao contrário do defendido por Jair Bolsonaro."", acusou o órgão.O Conselho considerou que a cedência de recursos para o combate à Covid-19 tem sido pequena, quer para ações de Saúde, quer para medidas económicas, pedindo a revogação permanente do teto de gastos e a aplicação imediata de dinheiro no sistema público de saúde."", salientou.O CNS denunciou ainda uma ""falta de transparência das informações"" em relação à pandemia, relatando um colapso na oferta de camas do SUS.""O número de mortes no Brasil, em média, está a dobrar a cada cinco dias e, em vários lugares, os sistemas de sepultamentos já estão, também, em colapso"", acrescentou.
Apelo aos políticos
Além de Bolsonaro e Paulo Guedes, o órgão dirigiu os seus apelos ao novo ministro da Saúde, Nelson Teich, indicando que o governante não pode ""compactuar com qualquer tipo de sabotagem ao combate à doença e à economia popular"".
"", diz a carta aberta.O órgão concluiu a carta pedindo ainda a aplicação imediata de novas verbas nas universidades, centros de investigação e laboratórios, ""preferencialmente públicos"", assim como a aprovação de um projeto de lei que ampare e auxilie os dependentes de profissionais de saúde que morreram e os que vierem a morrer no exercício de suas funções, em decorrência da Covid-19.O Brasil registou 449 mortos e 6276 novos casos do novo coronavírus nas últimas 24 horas, atingindo um novo recorde diário de infetados desde o início da pandemia no país, informou o Ministério da Saúde.",0.9646357051555177,0.9280809565036006,0.9686674216685542,0.970499243570348,0.9668425018839487,"Random Forests
('ranger' package, R 3.5.3.)
Wright MN, Ziegler A (2017). “ranger: A Fast Implementation of Random Forests for High Dimensional Data in C++ and R.” Journal of Statistical Software, 77(1), 1–17. doi: 10.18637/jss.v077.i01.",5479,0.4347048300536673,204,500,20,gini,classification,2020-04-05
