prediction_covid_topic,title,description,authors,date_download,date_publish,maintext,url,gdelt_title,gdelt_url,modeSearch,sourcecountrySearch,termSearch,periodtimeSearch,isOR,countMaximumRecords,urlGDELTV2FTAPI,urlArticleMobile,datetimeArticle,urlImage,domainArticle,languageArticle,countryArticle,pred_input,model_accuracy,model_kappa,model_f1,model_precision,model_recall,model,sample_size,train_prop_covid,mtry,n_tree,min_node_size,splitrule,model_type,fitted_on
1,Mais de 900 mortes e 23864 casos de covid-19 em Portugal. Casos sobem 2%,"Nas últimas 24 horas, o país registou mais 23 vitimas mortais e 472 casos confirmados com o novo coronavírus. Novos casos subiram 2% e total de internados voltou a baixar. Mas todo o cuidado é pouco, insiste a ministra da saúde, Marta Temido.",Rita Rato Nunes,2020-04-26 18:17:33,2020-04-26 14:57:00,"Em Portugal, nas últimas 24 horas, morreram mais 23 pessoas e foram confirmados mais 472 casos de covid-19. Segundo o boletim epidemiológico da Direção-Geral da Saúde (DGS), deste domingo (26 de abril), há agora no país 23 864 infetados, 903 vítimas mortais e 1329 recuperados (mais 52).
Estão internadas 1005 pessoas (menos 35 que este sábado), destas 182 encontram-se nos cuidados intensivos (menos quatro). O que significa que 86% dos doentes estão a ser tratados em casa. Aguardam resultados laboratoriais 4673 pessoas e estão em vigilância pelas autoridades de saúde mais de 30 mil.
Fechar Subscreva as newsletters Diário de Notícias e receba as informações em primeira mão. Subscrever
Apesar dos números continuarem a mostrar sinais positivos, a ministra da Saúde, Marta Temido, voltou a frisar, durante a conferência de imprensa diária de apresentação do boletim da DGS, que os portugueses devem continuar manter todos os cuidados para evitar a progressão da pandemia. Aproveitando para vincar quatro mensagens essenciais: a covid-19 não está ultrapassada, em Portugal; as medidas de saúde pública são para manter - ""o distanciamento social é necessário, a higienização, a etiqueta respiratória e o uso de máscara social quando nos encontramos em espaços fechados e com um número significativo de pessoas""; as medidas de combate à pandemia estão em constante atualização; e ""não haverá um regresso à normalidade tal como a conhecíamos e temos de aprender a viver com a doença até que uma vacina ou um tratamento sejam identificados"".
Questionada sobre se é uma hipótese monitorizar os portugueses, através de plataformas móveis, para traçar estratégias de combate à covid, a ministra da Saúde respondeu que ""todas as formas de acompanhamento do que possa ser regresso possível à normalidade estão a ser pensadas, avaliadas"". Os mecanismos serão usados ""em modos a definir"" e ""em termos combinados com outras medidas"".
Ministra da Saúde, Marta Temido, durante a conferência de imprensa deste domingo. © TIAGO PETINGA/Lusa
Neste altura, a taxa de letalidade geral do país (a diferença entre o número de mortes e de infetados) é de 3,8%, sendo que a maioria das vitimas mortais dizem respeito a pessoas com mais de 70 anos. O número de mortes é idêntico entre homens (448) e mulheres (455). Quando mais de metade dos infetados (59,2%) são do sexo feminino.
A maioria das vitimas mortais continua a ter localidade de residência a norte do país, onde há agora 519 vitimas mortais (mais 17 que ontem) e 14386 doentes. Segue-se a região centro com 188 óbitos (o mesmo número de ontem) e 3232 infetados.
Na região de Lisboa e Vale do Tejo morreram, nas últimas 24 horas, mais 5 pessoas (há 175 óbitos, 5531 casos). No Algarve, foi declarado mais um óbito; são agora 12 e 322 infetados. Açores (oito mortes e 120 casos), o Alentejo (1, 187) e a Madeira (única região do país sem óbitos e com 86 casos) não aumentaram o registo de mortes.
Lisboa (1206 - mais 60 que ontem), Vila Nova de Gaia (1263 - mais 83) e o Porto (1211 - mais 91) respetivamente continuam a ser os únicos municípios com mais de mil casos, de acordo com os dados da plataforma Sinave, que integra informação sobre 84% dos casos confirmados.
Morreram mais de 200 mil pessoas no mundo
O novo coronavírus já infetou 2 934 639 pessoas no mundo inteiro, até este domingo às 10:46, segundo dados oficiais. Morreram 203 683 e há 840 763 recuperados.
Os Estados Unidos da América são o país com a maior concentração de casos (960 896) e de mortes (54 265). Seguidos de Espanha, a segunda nação com mais infetados (207 634) e a terceira com mais vitimas mortais (23 190). Nas últimas 24 horas, o país registou mais 288 mortos - o menor aumento do último mês, o que fez com que o primeiro-ministro, Pedro Sanchez, falasse ""numa forte descida"" e em números que ""convidam à esperança"". ""Estamos a dobrar a curva"", antecipa.
Itália é o terceiro país com mais casos (195 351) e o segundo com mais óbitos (26 384). Seguem-se a França, a Alemanha, o Reino Unido e a Turquia, todos com mais de cem mil casos. Portugal surge em 18.º lugar nesta tabela.
A China - onde o surto começou, no final do ano passado - é, neste momento, o nono país com mais casos. Tem 82 827 infetados e 4 632 mortes. Este domingo, é o 11.º dia consecutivo em não há registo de nenhum vitima mortal. Somam-se, segundo as autoridades de saúde chinesas, apenas 11 casos.
Recomendações da DGS
Para que seja possível conter ao máximo a propagação da pandemia, a Direção-Geral da Saúde continua a reforçar os conselhos relativos à prevenção: evite o contacto próximo com pessoas que demonstrem sinais de infeção respiratória aguda, lave frequentemente as mãos (pelo menos durante 20 segundos), mantenha a distância em relação aos animais e tape o nariz e a boca quando espirrar ou tossir (de seguida lave novamente as mãos). E acima de tudo: fique em casa.
Em caso de apresentar sintomas coincidentes com os do vírus (febre superior a 38º, tosse persistente, dificuldade respiratória), as autoridades de saúde pedem que não se desloque às urgências, mas sim para ligar para a Linha SNS 24 (808 24 24 24) ou para a unidade de cuidados primários mais próxima.",https://www.dn.pt/pais/903-mortes-e-23864-casos-de-covid-19-em-portugal-casos-sobem-2-12118645.html,Mais de 900 mortes e 23864 casos de covid - 19 em Portugal . Casos sobem 2 % ,https://www.dn.pt/pais/903-mortes-e-23864-casos-de-covid-19-em-portugal-casos-sobem-2-12118645.html,artlist,PO,,100 minutes,FALSE,250,https://api.gdeltproject.org/api/v2/doc/doc?query=%20sourcecountry:po&sourcelang:por&mode=artlist&format=json&timespan=100&maxrecords=250&sort=datedesc,https://www.dn.pt/pais/amp/903-mortes-e-23864-casos-de-covid-19-em-portugal-casos-sobem-2-12118645.html,2020-04-26T13:15:00Z,https://static.globalnoticias.pt/dn/image.aspx?brand=DN&type=generate&guid=b4839e0b-6e87-4bac-8165-62bf338c52b1&watermark=true&t=20200426125700,dn.pt,Portuguese,Portugal,"Em Portugal, nas últimas 24 horas, morreram mais 23 pessoas e foram confirmados mais 472 casos de covid-19. Segundo o boletim epidemiológico da Direção-Geral da Saúde (DGS), deste domingo (26 de abril), há agora no país 23 864 infetados, 903 vítimas mortais e 1329 recuperados (mais 52).
Estão internadas 1005 pessoas (menos 35 que este sábado), destas 182 encontram-se nos cuidados intensivos (menos quatro). O que significa que 86% dos doentes estão a ser tratados em casa. Aguardam resultados laboratoriais 4673 pessoas e estão em vigilância pelas autoridades de saúde mais de 30 mil.
Fechar Subscreva as newsletters Diário de Notícias e receba as informações em primeira mão. Subscrever
Apesar dos números continuarem a mostrar sinais positivos, a ministra da Saúde, Marta Temido, voltou a frisar, durante a conferência de imprensa diária de apresentação do boletim da DGS, que os portugueses devem continuar manter todos os cuidados para evitar a progressão da pandemia. Aproveitando para vincar quatro mensagens essenciais: a covid-19 não está ultrapassada, em Portugal; as medidas de saúde pública são para manter - ""o distanciamento social é necessário, a higienização, a etiqueta respiratória e o uso de máscara social quando nos encontramos em espaços fechados e com um número significativo de pessoas""; as medidas de combate à pandemia estão em constante atualização; e ""não haverá um regresso à normalidade tal como a conhecíamos e temos de aprender a viver com a doença até que uma vacina ou um tratamento sejam identificados"".
Questionada sobre se é uma hipótese monitorizar os portugueses, através de plataformas móveis, para traçar estratégias de combate à covid, a ministra da Saúde respondeu que ""todas as formas de acompanhamento do que possa ser regresso possível à normalidade estão a ser pensadas, avaliadas"". Os mecanismos serão usados ""em modos a definir"" e ""em termos combinados com outras medidas"".
Ministra da Saúde, Marta Temido, durante a conferência de imprensa deste domingo. © TIAGO PETINGA/Lusa
Neste altura, a taxa de letalidade geral do país (a diferença entre o número de mortes e de infetados) é de 3,8%, sendo que a maioria das vitimas mortais dizem respeito a pessoas com mais de 70 anos. O número de mortes é idêntico entre homens (448) e mulheres (455). Quando mais de metade dos infetados (59,2%) são do sexo feminino.
A maioria das vitimas mortais continua a ter localidade de residência a norte do país, onde há agora 519 vitimas mortais (mais 17 que ontem) e 14386 doentes. Segue-se a região centro com 188 óbitos (o mesmo número de ontem) e 3232 infetados.
Na região de Lisboa e Vale do Tejo morreram, nas últimas 24 horas, mais 5 pessoas (há 175 óbitos, 5531 casos). No Algarve, foi declarado mais um óbito; são agora 12 e 322 infetados. Açores (oito mortes e 120 casos), o Alentejo (1, 187) e a Madeira (única região do país sem óbitos e com 86 casos) não aumentaram o registo de mortes.
Lisboa (1206 - mais 60 que ontem), Vila Nova de Gaia (1263 - mais 83) e o Porto (1211 - mais 91) respetivamente continuam a ser os únicos municípios com mais de mil casos, de acordo com os dados da plataforma Sinave, que integra informação sobre 84% dos casos confirmados.
Morreram mais de 200 mil pessoas no mundo
O novo coronavírus já infetou 2 934 639 pessoas no mundo inteiro, até este domingo às 10:46, segundo dados oficiais. Morreram 203 683 e há 840 763 recuperados.
Os Estados Unidos da América são o país com a maior concentração de casos (960 896) e de mortes (54 265). Seguidos de Espanha, a segunda nação com mais infetados (207 634) e a terceira com mais vitimas mortais (23 190). Nas últimas 24 horas, o país registou mais 288 mortos - o menor aumento do último mês, o que fez com que o primeiro-ministro, Pedro Sanchez, falasse ""numa forte descida"" e em números que ""convidam à esperança"". ""Estamos a dobrar a curva"", antecipa.
Itália é o terceiro país com mais casos (195 351) e o segundo com mais óbitos (26 384). Seguem-se a França, a Alemanha, o Reino Unido e a Turquia, todos com mais de cem mil casos. Portugal surge em 18.º lugar nesta tabela.
A China - onde o surto começou, no final do ano passado - é, neste momento, o nono país com mais casos. Tem 82 827 infetados e 4 632 mortes. Este domingo, é o 11.º dia consecutivo em não há registo de nenhum vitima mortal. Somam-se, segundo as autoridades de saúde chinesas, apenas 11 casos.
Recomendações da DGS
Para que seja possível conter ao máximo a propagação da pandemia, a Direção-Geral da Saúde continua a reforçar os conselhos relativos à prevenção: evite o contacto próximo com pessoas que demonstrem sinais de infeção respiratória aguda, lave frequentemente as mãos (pelo menos durante 20 segundos), mantenha a distância em relação aos animais e tape o nariz e a boca quando espirrar ou tossir (de seguida lave novamente as mãos). E acima de tudo: fique em casa.
Em caso de apresentar sintomas coincidentes com os do vírus (febre superior a 38º, tosse persistente, dificuldade respiratória), as autoridades de saúde pedem que não se desloque às urgências, mas sim para ligar para a Linha SNS 24 (808 24 24 24) ou para a unidade de cuidados primários mais próxima.",0.9646357051555177,0.9280809565036006,0.9686674216685542,0.970499243570348,0.9668425018839487,"Random Forests
('ranger' package, R 3.5.3.)
Wright MN, Ziegler A (2017). “ranger: A Fast Implementation of Random Forests for High Dimensional Data in C++ and R.” Journal of Statistical Software, 77(1), 1–17. doi: 10.18637/jss.v077.i01.",5479,0.4347048300536673,204,500,20,gini,classification,2020-04-05
1,"Covid-19. ""Coabitação"" é ""principal contexto de transmissão"" em Portugal","Marta Temido e Graça Freitas fizeram, este domingo, o mais recente balanço do novo coronavírus no nosso país.",Notícias Ao Minuto,2020-04-26 18:17:37,2020-04-26 15:08:00,"Na conferência diária de atualização de incidência da Covid-19 em Portugal, deste domingo, Marta Temido começou por explicar que ""estamos num momento em que todos nos interrogamos sobre as condições para o alívio das medidas de contenção e é importante destacar que a Organização Mundial de Saúde (OMS) e a Comissão Europeia têm sublinhado a importância dos critérios epidemiológicos que mostrem que a infeção se encontra controlada"".
O número médio de contágios causados por cada pessoa infetada ""é um dos indicadores mais comummente considerados"", referiu ainda a ministra. ""No nosso caso, o cálculo do R0 [...] situa-o, agora, nos 2.08"". ""Continuamos a estimar que o máximo da incidência da infeção tenha ocorrido entre os dias 23 e 25 de março"", considerou.
Outro dos indicadores levados em conta é ""o número médio de casos secundários resultante de um caso infetado, medido em função do tempo, o designado RT"". Este valor, ""que mede a transmissão ao longo do tempo, posiciona-nos, agora, com os números que de dispomos - entre os dias 16 e 20 de abril - no 1.04, variando entre 0.99 na região Norte e 1.2 na Região de Lisboa e Vale do Tejo"". Estes números mostram, frisa Marta Temido, que ""o máximo da incidência da infeção já terá ocorrido"" e que o número médio de casos secundários está pouco acima de 1.
A ministra da Saúde reforçou, em seguida, quatro mensagens: ""A doença não está, obviamente, ultrapassada"", que ""se mantém a necessidade do cumprimento escrupuloso e disciplinado de todas as medidas de saúde pública que aprendemos"", ""as medidas de combate à pandemia são permanentemente reavaliadas e modificadas em avaliação das circunstâncias"" e ""não haverá um regresso à normalidade tal como a conhecíamos e temos que aprender a viver com a doença até que uma vacina ou um tratamento eficaz sejam identificados"".
'Coabitação' é o principal contexto em que pessoas se infetam
Para que ""as medidas que adotamos sejam aquelas que respondem adequada e proporcionalmente à contenção da infeção, temos de saber mais informação sobre as pessoas que adoecem e as condições em que infetam"", sublinhou Marta Temido, acrescentando que ""tem sido feito um esforço significativo no sentido de perceber melhor esta evolução"".
""A amostra que conseguimos reunir envolve 2.958 casos confirmados, do total de 4.370 casos confirmados entre os dias 18 e 24 de abril"". Destes confirmados, ""44% dos registos tinham informação sobre o registo de transmissão"".
Os valores mostravam que ""o local 'coabitação' continuava a ser o principal contexto de transmissão, representando cerca de 30% dos casos"". ""Isto mostra-nos a particular necessidade de ter em atenção que quem está em domicílio continua a ter necessidade de cuidados especiais"".
Marta Temido revelou que 25% dos casos correspondiam a situações de surto ""em instituições coletivas"", como lares, hostels e empresa. Já 9% dos casos confirmados referiam ""casos de transmissão social"", amigos ou não coabitantes.
Vacina? Porquê?
""Porque é que a humanidade quer tanto uma vacina? Porque estas fazem uma simulação da doença sem que se tenha a doença. Portanto, evitam a infeção"". Por isso, quando há uma ameaça à saúde ""todos queremos uma vacina"", afirmou Graça Freitas.
Mas, acrescentou a diretora-geral da Saúde, ""temos de pensar nas vacinas que já temos"" e que são ""bastante eficazes, bastante seguras e com bastante qualidade"", frisando a importância do Programa Nacional de Vacinação. Os anos de 2018 e 2019 foram ""extraordinariamente bons"" em relação à vacinação em Portugal, ""até em contraciclo com o que se passa noutros países"".
Questionada, Graça Freitas destacou que em março houve ""13% de quebra"" na vacinação, ""que está a ser recuperada durante abril"".
Medição da temperatura aos trabalhadores
""Temos procurado sempre referir que qualquer medida é particularmente útil no contexto de uma combinação de atuações. Nenhuma medida isolada garante toda a proteção que gostávamos de ter"", destacou Marta Temido, acrescentando que ""parece muito importante sublinhar que se as pessoas sentirem que têm temperatura, devem abster-se de ir trabalhar"".
""Um trabalhador deve ter o cuidado de medir duas vezes ao dia a sua temperatura"" e deve alertar a entidade patronal caso registe alguma alteração, afirmou.
""Independentemente deste aspeto"", a ministra da Saúde disse que, ""em termos legais, há vários aspetos em que nos devemos ater quando trabalhamos este tipo de dados e um deles é o consentimento expresso do trabalhador"" e ""a questão de este controlo ser realizado por um profissional de saúde ou outra pessoa sujeita ao dever de confidencialidade"".
Veja aqui a conferência deste domingo:
[Notícia atualizada às 13h51]
Leia Também: AO MINUTO: Cem migrantes testados por cá; Boris Johnson retoma comando
Recomendados para si",https://www.noticiasaominuto.com/pais/1465703/covid-19-acompanhe-aqui-a-conferencia-diaria-da-dgs,Covid - 19 .  Coabitao  é  principal contexto de transmissão  em Portugal,https://www.noticiasaominuto.com/pais/1465703/covid-19-acompanhe-aqui-a-conferencia-diaria-da-dgs,artlist,PO,,100 minutes,FALSE,250,https://api.gdeltproject.org/api/v2/doc/doc?query=%20sourcecountry:po&sourcelang:por&mode=artlist&format=json&timespan=100&maxrecords=250&sort=datedesc,NA,2020-04-26T13:15:00Z,https://media-manager.noticiasaominuto.com/1280/naom_5c24bd692a400.jpg,noticiasaominuto.com,Portuguese,Portugal,"Na conferência diária de atualização de incidência da Covid-19 em Portugal, deste domingo, Marta Temido começou por explicar que ""estamos num momento em que todos nos interrogamos sobre as condições para o alívio das medidas de contenção e é importante destacar que a Organização Mundial de Saúde (OMS) e a Comissão Europeia têm sublinhado a importância dos critérios epidemiológicos que mostrem que a infeção se encontra controlada"".
O número médio de contágios causados por cada pessoa infetada ""é um dos indicadores mais comummente considerados"", referiu ainda a ministra. ""No nosso caso, o cálculo do R0 [...] situa-o, agora, nos 2.08"". ""Continuamos a estimar que o máximo da incidência da infeção tenha ocorrido entre os dias 23 e 25 de março"", considerou.
Outro dos indicadores levados em conta é ""o número médio de casos secundários resultante de um caso infetado, medido em função do tempo, o designado RT"". Este valor, ""que mede a transmissão ao longo do tempo, posiciona-nos, agora, com os números que de dispomos - entre os dias 16 e 20 de abril - no 1.04, variando entre 0.99 na região Norte e 1.2 na Região de Lisboa e Vale do Tejo"". Estes números mostram, frisa Marta Temido, que ""o máximo da incidência da infeção já terá ocorrido"" e que o número médio de casos secundários está pouco acima de 1.
A ministra da Saúde reforçou, em seguida, quatro mensagens: ""A doença não está, obviamente, ultrapassada"", que ""se mantém a necessidade do cumprimento escrupuloso e disciplinado de todas as medidas de saúde pública que aprendemos"", ""as medidas de combate à pandemia são permanentemente reavaliadas e modificadas em avaliação das circunstâncias"" e ""não haverá um regresso à normalidade tal como a conhecíamos e temos que aprender a viver com a doença até que uma vacina ou um tratamento eficaz sejam identificados"".
'Coabitação' é o principal contexto em que pessoas se infetam
Para que ""as medidas que adotamos sejam aquelas que respondem adequada e proporcionalmente à contenção da infeção, temos de saber mais informação sobre as pessoas que adoecem e as condições em que infetam"", sublinhou Marta Temido, acrescentando que ""tem sido feito um esforço significativo no sentido de perceber melhor esta evolução"".
""A amostra que conseguimos reunir envolve 2.958 casos confirmados, do total de 4.370 casos confirmados entre os dias 18 e 24 de abril"". Destes confirmados, ""44% dos registos tinham informação sobre o registo de transmissão"".
Os valores mostravam que ""o local 'coabitação' continuava a ser o principal contexto de transmissão, representando cerca de 30% dos casos"". ""Isto mostra-nos a particular necessidade de ter em atenção que quem está em domicílio continua a ter necessidade de cuidados especiais"".
Marta Temido revelou que 25% dos casos correspondiam a situações de surto ""em instituições coletivas"", como lares, hostels e empresa. Já 9% dos casos confirmados referiam ""casos de transmissão social"", amigos ou não coabitantes.
Vacina? Porquê?
""Porque é que a humanidade quer tanto uma vacina? Porque estas fazem uma simulação da doença sem que se tenha a doença. Portanto, evitam a infeção"". Por isso, quando há uma ameaça à saúde ""todos queremos uma vacina"", afirmou Graça Freitas.
Mas, acrescentou a diretora-geral da Saúde, ""temos de pensar nas vacinas que já temos"" e que são ""bastante eficazes, bastante seguras e com bastante qualidade"", frisando a importância do Programa Nacional de Vacinação. Os anos de 2018 e 2019 foram ""extraordinariamente bons"" em relação à vacinação em Portugal, ""até em contraciclo com o que se passa noutros países"".
Questionada, Graça Freitas destacou que em março houve ""13% de quebra"" na vacinação, ""que está a ser recuperada durante abril"".
Medição da temperatura aos trabalhadores
""Temos procurado sempre referir que qualquer medida é particularmente útil no contexto de uma combinação de atuações. Nenhuma medida isolada garante toda a proteção que gostávamos de ter"", destacou Marta Temido, acrescentando que ""parece muito importante sublinhar que se as pessoas sentirem que têm temperatura, devem abster-se de ir trabalhar"".
""Um trabalhador deve ter o cuidado de medir duas vezes ao dia a sua temperatura"" e deve alertar a entidade patronal caso registe alguma alteração, afirmou.
""Independentemente deste aspeto"", a ministra da Saúde disse que, ""em termos legais, há vários aspetos em que nos devemos ater quando trabalhamos este tipo de dados e um deles é o consentimento expresso do trabalhador"" e ""a questão de este controlo ser realizado por um profissional de saúde ou outra pessoa sujeita ao dever de confidencialidade"".
Veja aqui a conferência deste domingo:
[Notícia atualizada às 13h51]
Leia Também: AO MINUTO: Cem migrantes testados por cá; Boris Johnson retoma comando
Recomendados para si",0.9646357051555177,0.9280809565036006,0.9686674216685542,0.970499243570348,0.9668425018839487,"Random Forests
('ranger' package, R 3.5.3.)
Wright MN, Ziegler A (2017). “ranger: A Fast Implementation of Random Forests for High Dimensional Data in C++ and R.” Journal of Statistical Software, 77(1), 1–17. doi: 10.18637/jss.v077.i01.",5479,0.4347048300536673,204,500,20,gini,classification,2020-04-05
