prediction_covid_topic,title,description,authors,date_download,date_publish,maintext,url,gdelt_title,gdelt_url,modeSearch,sourcecountrySearch,termSearch,periodtimeSearch,isOR,countMaximumRecords,urlGDELTV2FTAPI,urlArticleMobile,datetimeArticle,urlImage,domainArticle,languageArticle,countryArticle,pred_input,model_accuracy,model_kappa,model_f1,model_precision,model_recall,model,sample_size,train_prop_covid,mtry,n_tree,min_node_size,splitrule,model_type,fitted_on
1,Governo francês admite preocupação com síndrome em crianças,"O ministro da Saúde de França, Olivier Véran, garantiu hoje levar ""muito a sério"" o aparecimento no país de casos de crianças com doença inflamatória grave, mas sublinhou não haver ainda provas que a associem ao novo coronavírus.",Rádio E Televisão De Portugal,2020-04-29 15:17:10,2020-04-29 12:57:41,"As autoridades de saúde britânicas lançaram na segunda-feira um alerta sobre um aumento do número de crianças com sintomas semelhantes à doença de Kawasaki, uma síndrome vascular que afeta crianças pequenas, cuja causa permanece desconhecida.
Foram também registados casos em Itália, Espanha e Suíça, disse Olivier Véran, referindo ter recebido o alerta de Paris, onde foram detetadas cerca de 15 crianças, de todas as idades, com sintomas da doença.
""Têm febre, distúrbios digestivos e inflamação vascular generalizada que pode causar insuficiência cardíaca [mas] que eu saiba, felizmente nenhuma criança morreu dessas doenças raras"", afirmou o ministro.
Algumas dessas crianças ""em França e em Inglaterra, mas não todas, provaram ser portadoras do coronavírus"", admitiu Olivier Véran, reconhecendo que isso causa ""uma certa preocupação e obriga a alguma vigilância"".
""Eu levo isso muito, muito a sério. Não temos absolutamente nenhuma explicação médica neste momento. Será que se trata de uma reação inflamatória que desencadeia uma doença preexistente em crianças infetadas com o vírus ou outra doença infecciosa? Há muitas perguntas"" no ar.
""Quero mobilizar a comunidade científica e de saúde em França e no estrangeiro para obter o máximo de dados possível que permitam verificar se há motivos para estabelecer uma ligação entre o coronavírus e esta condição"" que surge em algumas crianças.
O ministro confirmou ainda a reabertura das escolas em França, agendada para 11 de maio, lembrando ainda que, desde o início da pandemia, a covid-19 teve pouco impacto nas crianças e que casos graves só se desenvolveram em crianças com doenças subjacentes.
Na terça-feira, as associações de pediatria do Reino Unido, da Itália e de Espanha pediram aos médicos do setor para estarem atentos a crianças que apresentem uma condição inflamatória rara porque a doença pode estar ligada ao novo coronavírus.
O primeiro alerta partiu, no início da semana, da Associação de Pediatras de Cuidados Intensivos do Reino Unido, mas foi, entretanto, secundada pela Associação Espanhola de Pediatria e pela Sociedade Italiana de Pediatras.
Segundo as autoridades do Reino Unido, ""nas últimas três semanas houve um aumento aparente, em Londres e também em outras regiões do Reino Unido, do número de crianças de todas as idades com um estado inflamatório multissistémico que requer cuidados intensivos"".
Segundo a Sociedade Britânica de Cuidados Intensivos Pediátricos, há ""uma preocupação crescente"" de que uma síndrome relacionada com a covid-19 esteja a surgir em crianças, consideradas, até agora, menos vulneráveis ao risco de desenvolver complicações ligadas ao novo coronavírus.
A nível global, segundo um balanço da agência de notícias AFP, a pandemia de covid-19 já provocou mais de 215 mil mortos e infetou mais de três milhões de pessoas em 193 países e territórios.
Mais de 840 mil doentes foram considerados curados.
A doença é transmitida por um novo coronavírus detetado no final de dezembro, em Wuhan, uma cidade do centro da China.
Para combater a pandemia, os governos mandaram para casa 4,5 mil milhões de pessoas (mais de metade da população do planeta), encerraram o comércio não essencial e reduziram drasticamente o tráfego aéreo, paralisando setores inteiros da economia mundial.
Face a uma diminuição de novos doentes em cuidados intensivos e de contágios, alguns países começaram, entretanto, a desenvolver planos de redução do confinamento e em alguns casos, como Dinamarca, Áustria, Espanha ou Alemanha, a aliviar algumas das medidas.
Os Estados Unidos são o país com mais mortos (58.351) e mais casos de infeção confirmados (mais de um milhão).
Seguem-se Itália (27.359 mortos, mais de 201 mil casos), Espanha (23.822 mortos, perto de 211 mil casos), França (23.660 mortos, cerca de 169 mil casos) e Reino Unido (21.678 mortos, mais de 161 mil casos).",https://www.rtp.pt/noticias/covid-19/governo-frances-admite-preocupacao-com-sindrome-em-criancas_n1224633,Governo francês admite preocupao com síndrome em crianças,https://www.rtp.pt/noticias/covid-19/governo-frances-admite-preocupacao-com-sindrome-em-criancas_n1224633,artlist,PO,,100 minutes,FALSE,250,https://api.gdeltproject.org/api/v2/doc/doc?query=%20sourcecountry:po&sourcelang:por&mode=artlist&format=json&timespan=100&maxrecords=250&sort=datedesc,NA,2020-04-29T10:30:00Z,"https://cdn-images.rtp.pt/icm/noticias/images/51/51f07b76cd52bb4d4361660f544f4206?&q=90&rect=0,14,980,537&auto=format",rtp.pt,Portuguese,Portugal,"As autoridades de saúde britânicas lançaram na segunda-feira um alerta sobre um aumento do número de crianças com sintomas semelhantes à doença de Kawasaki, uma síndrome vascular que afeta crianças pequenas, cuja causa permanece desconhecida.
Foram também registados casos em Itália, Espanha e Suíça, disse Olivier Véran, referindo ter recebido o alerta de Paris, onde foram detetadas cerca de 15 crianças, de todas as idades, com sintomas da doença.
""Têm febre, distúrbios digestivos e inflamação vascular generalizada que pode causar insuficiência cardíaca [mas] que eu saiba, felizmente nenhuma criança morreu dessas doenças raras"", afirmou o ministro.
Algumas dessas crianças ""em França e em Inglaterra, mas não todas, provaram ser portadoras do coronavírus"", admitiu Olivier Véran, reconhecendo que isso causa ""uma certa preocupação e obriga a alguma vigilância"".
""Eu levo isso muito, muito a sério. Não temos absolutamente nenhuma explicação médica neste momento. Será que se trata de uma reação inflamatória que desencadeia uma doença preexistente em crianças infetadas com o vírus ou outra doença infecciosa? Há muitas perguntas"" no ar.
""Quero mobilizar a comunidade científica e de saúde em França e no estrangeiro para obter o máximo de dados possível que permitam verificar se há motivos para estabelecer uma ligação entre o coronavírus e esta condição"" que surge em algumas crianças.
O ministro confirmou ainda a reabertura das escolas em França, agendada para 11 de maio, lembrando ainda que, desde o início da pandemia, a covid-19 teve pouco impacto nas crianças e que casos graves só se desenvolveram em crianças com doenças subjacentes.
Na terça-feira, as associações de pediatria do Reino Unido, da Itália e de Espanha pediram aos médicos do setor para estarem atentos a crianças que apresentem uma condição inflamatória rara porque a doença pode estar ligada ao novo coronavírus.
O primeiro alerta partiu, no início da semana, da Associação de Pediatras de Cuidados Intensivos do Reino Unido, mas foi, entretanto, secundada pela Associação Espanhola de Pediatria e pela Sociedade Italiana de Pediatras.
Segundo as autoridades do Reino Unido, ""nas últimas três semanas houve um aumento aparente, em Londres e também em outras regiões do Reino Unido, do número de crianças de todas as idades com um estado inflamatório multissistémico que requer cuidados intensivos"".
Segundo a Sociedade Britânica de Cuidados Intensivos Pediátricos, há ""uma preocupação crescente"" de que uma síndrome relacionada com a covid-19 esteja a surgir em crianças, consideradas, até agora, menos vulneráveis ao risco de desenvolver complicações ligadas ao novo coronavírus.
A nível global, segundo um balanço da agência de notícias AFP, a pandemia de covid-19 já provocou mais de 215 mil mortos e infetou mais de três milhões de pessoas em 193 países e territórios.
Mais de 840 mil doentes foram considerados curados.
A doença é transmitida por um novo coronavírus detetado no final de dezembro, em Wuhan, uma cidade do centro da China.
Para combater a pandemia, os governos mandaram para casa 4,5 mil milhões de pessoas (mais de metade da população do planeta), encerraram o comércio não essencial e reduziram drasticamente o tráfego aéreo, paralisando setores inteiros da economia mundial.
Face a uma diminuição de novos doentes em cuidados intensivos e de contágios, alguns países começaram, entretanto, a desenvolver planos de redução do confinamento e em alguns casos, como Dinamarca, Áustria, Espanha ou Alemanha, a aliviar algumas das medidas.
Os Estados Unidos são o país com mais mortos (58.351) e mais casos de infeção confirmados (mais de um milhão).
Seguem-se Itália (27.359 mortos, mais de 201 mil casos), Espanha (23.822 mortos, perto de 211 mil casos), França (23.660 mortos, cerca de 169 mil casos) e Reino Unido (21.678 mortos, mais de 161 mil casos).",0.9646357051555177,0.9280809565036006,0.9686674216685542,0.970499243570348,0.9668425018839487,"Random Forests
('ranger' package, R 3.5.3.)
Wright MN, Ziegler A (2017). “ranger: A Fast Implementation of Random Forests for High Dimensional Data in C++ and R.” Journal of Statistical Software, 77(1), 1–17. doi: 10.18637/jss.v077.i01.",5479,0.4347048300536673,204,500,20,gini,classification,2020-04-05
1,Especialistas estudam possível ligação entre a Covid-19 e Síndrome rara em crianças,Especialistas do Reino Unido e de Itália estão a estudar uma possível relação entre a Covid-19 e o Síndrome inflamatório de Kawasaki em crianças.,Rádio E Televisão De Portugal,2020-04-29 15:17:25,2020-04-29 12:47:43,"Especialistas estudam possível ligação entre a Covid-19 e Síndrome rara em crianças
O Síndrome de Kawasaki afeta geralmente crianças com menos de 5 anos e está associado a febre, erupções cutâneas, inchaço das glândulas e, nos casos mais graves, inflamação das artérias do coração.
Ainda assim, os especialistas consideram que ainda é muito cedo para estabelecer um vínculo entre as duas doenças.
O alerta surgiu em Bérgamo, no norte de Itália, onde há maior incidência do novo Coronavírus.
Um hospital reportou mais de 20 casos de inflamação vascular grave em março, um número 6 vezes superior ao que seria esperado num ano.
Também no Reino Unido e em Espanha têm sido descritos casos semelhantes ao longo das últimas três semanas.
Os resultados clínicos mostram que apenas algumas das crianças com inflamação vascular tiveram um resultado positivo no teste à Covid-19, e os pediatras passam uma mensagem de tranquilidade.",https://www.rtp.pt/noticias/mundo/especialistas-estudam-possivel-ligacao-entre-a-covid-19-e-sindrome-rara-em-criancas_v1224632,Especialistas estudam possível ligao entre a Covid - 19 e Síndrome rara em crianças,https://www.rtp.pt/noticias/mundo/especialistas-estudam-possivel-ligacao-entre-a-covid-19-e-sindrome-rara-em-criancas_v1224632,artlist,PO,,100 minutes,FALSE,250,https://api.gdeltproject.org/api/v2/doc/doc?query=%20sourcecountry:po&sourcelang:por&mode=artlist&format=json&timespan=100&maxrecords=250&sort=datedesc,NA,2020-04-29T10:30:00Z,https://cdn-images.rtp.pt/icm/images/22/228af1e5fffa1d972511e14d44a8b7da_N.jpg,rtp.pt,Portuguese,Portugal,"Especialistas estudam possível ligação entre a Covid-19 e Síndrome rara em crianças
O Síndrome de Kawasaki afeta geralmente crianças com menos de 5 anos e está associado a febre, erupções cutâneas, inchaço das glândulas e, nos casos mais graves, inflamação das artérias do coração.
Ainda assim, os especialistas consideram que ainda é muito cedo para estabelecer um vínculo entre as duas doenças.
O alerta surgiu em Bérgamo, no norte de Itália, onde há maior incidência do novo Coronavírus.
Um hospital reportou mais de 20 casos de inflamação vascular grave em março, um número 6 vezes superior ao que seria esperado num ano.
Também no Reino Unido e em Espanha têm sido descritos casos semelhantes ao longo das últimas três semanas.
Os resultados clínicos mostram que apenas algumas das crianças com inflamação vascular tiveram um resultado positivo no teste à Covid-19, e os pediatras passam uma mensagem de tranquilidade.",0.9646357051555177,0.9280809565036006,0.9686674216685542,0.970499243570348,0.9668425018839487,"Random Forests
('ranger' package, R 3.5.3.)
Wright MN, Ziegler A (2017). “ranger: A Fast Implementation of Random Forests for High Dimensional Data in C++ and R.” Journal of Statistical Software, 77(1), 1–17. doi: 10.18637/jss.v077.i01.",5479,0.4347048300536673,204,500,20,gini,classification,2020-04-05
1,Covid-19. Autoridades de saúde lançam novo rastreio em pensões com migrantes,"O rastreio envolve três pensões situadas na Avenida Almirante Reis, em Lisboa. Vão ser testados à covid-19 115 migrantes que residem em pensões, onde aguardam reposta ao pedido de asilo no país. Esta operação segue-se a outra que decorreu no fim de semana, também em Lisboa.",Rádio E Televisão De Portugal,2020-04-29 15:17:33,2020-04-29 11:59:49,"As carrinhas e as ambulâncias alinham-se na avenida para dar apoio à operação de testagem de imigrantes que esta quarta-feira decorre em três pensões na Avenida Almirante Reis, com poucos metros de distância entre elas.
Em declarações à RTP, dois dos migrantes que hoje foi sujeito a um teste de rastreio à Covid-19 revelaram que não há doentes nas pensões onde estão hospedados.
São todos migrantes que estão a cargo do Conselho Português para os Refugiados, por estarem a aguardar resposta ao pedido de asilo em Portugal.
No fim de semana foi realizada uma operação idêntica que significou a testagem de 200 migrantes a residir igualmente nestas pequenas unidades hoteleiras. Tratou-se de uma ação conjunta entre o Serviço de Estrangeiros e Fronteiras (SEF), e outros serviços do MAI (Ministério da Administração Interna), o Alto Comissariado das Migrações, a Segurança Social e a Câmara Municipal de Lisboa, através dos serviços de Proteção Civil.
O Ministério da Administração Interna tinha avançado que está em curso o reforço das inspeções em todas estas unidades com migrantes.No total,e a intenção é fazer um rastreio a toda esta população.Estas operações de rastreio surgem depois de há uma semana terem sido detetados mais de uma centena de migrantes infetados com covid-19 num hostel em Lisboa.",https://www.rtp.pt/noticias/pais/covid-19-autoridades-de-saude-lancam-novo-rastreio-em-pensoes-com-migrantes_n1224608,Covid - 19 . Autoridades de saúde lançam novo rastreio em pensões com migrantes,https://www.rtp.pt/noticias/pais/covid-19-autoridades-de-saude-lancam-novo-rastreio-em-pensoes-com-migrantes_n1224608,artlist,PO,,100 minutes,FALSE,250,https://api.gdeltproject.org/api/v2/doc/doc?query=%20sourcecountry:po&sourcelang:por&mode=artlist&format=json&timespan=100&maxrecords=250&sort=datedesc,NA,2020-04-29T10:15:00Z,"https://cdn-images.rtp.pt/icm/noticias/images/6c/6c83c901ef220526fabc091e4a0d9282?&q=90&rect=0,0,1499,822&auto=format",rtp.pt,Portuguese,Portugal,"As carrinhas e as ambulâncias alinham-se na avenida para dar apoio à operação de testagem de imigrantes que esta quarta-feira decorre em três pensões na Avenida Almirante Reis, com poucos metros de distância entre elas.
Em declarações à RTP, dois dos migrantes que hoje foi sujeito a um teste de rastreio à Covid-19 revelaram que não há doentes nas pensões onde estão hospedados.
São todos migrantes que estão a cargo do Conselho Português para os Refugiados, por estarem a aguardar resposta ao pedido de asilo em Portugal.
No fim de semana foi realizada uma operação idêntica que significou a testagem de 200 migrantes a residir igualmente nestas pequenas unidades hoteleiras. Tratou-se de uma ação conjunta entre o Serviço de Estrangeiros e Fronteiras (SEF), e outros serviços do MAI (Ministério da Administração Interna), o Alto Comissariado das Migrações, a Segurança Social e a Câmara Municipal de Lisboa, através dos serviços de Proteção Civil.
O Ministério da Administração Interna tinha avançado que está em curso o reforço das inspeções em todas estas unidades com migrantes.No total,e a intenção é fazer um rastreio a toda esta população.Estas operações de rastreio surgem depois de há uma semana terem sido detetados mais de uma centena de migrantes infetados com covid-19 num hostel em Lisboa.",0.9646357051555177,0.9280809565036006,0.9686674216685542,0.970499243570348,0.9668425018839487,"Random Forests
('ranger' package, R 3.5.3.)
Wright MN, Ziegler A (2017). “ranger: A Fast Implementation of Random Forests for High Dimensional Data in C++ and R.” Journal of Statistical Software, 77(1), 1–17. doi: 10.18637/jss.v077.i01.",5479,0.4347048300536673,204,500,20,gini,classification,2020-04-05
1,Sete formas de matar o novo coronavírus e acabar com a pandemia,Líderes governamentais e cientistas de todo o mundo têm tentado encontrar formas de desenvolverem tratamentos rápidos e uma possível vacina contra a Covid-19. O esforço global pretende sobretudo recorrer ao uso de fármacos que já existem para tratar outras doenças e dar-lhes um novo propósito na luta contra o novo coronavírus.,Liliana Lopes Monteiro,2020-04-29 15:17:33,2020-04-29 12:12:00,"O novo coronavírus, também conhecido por SARS-CoV-2, associa-se às células humanas. A infeção ocorre quando este interage com a proteína ACE2, comummente encontrada nos pulmões e no intestino delgado, explica a revista WIRED.
Os cientistas acreditam que prevenir que se estabeleça essa ligação entre o vírus e a célula é fundamental de modo a evitar a propagação da Covid-19. Felizmente, já existem certos métodos que provaram ser eficazes na inibição desse comportamento do SARS-CoV-2 e outros que ainda estão a ser estudados.
Eis, segundo a publicação Medical Daily, sete métodos preventivos com potencialidade de inativar o vírus:
Vacina
A primeira opção é o desenvolvimento de uma vacina. Esta opção seria capaz de acarretar imunidade a longo prazo e é a mais eficaz para bloquear a disseminação de qualquer infeção viral.
Leia Também: Duas razões por que algumas pessoas não têm sintomas (mesmo se infetadas)
Terapia à base de plasma
Outro método com potencial para matar o novo coronavírus consiste no uso de plasma sanguíneo de pessoas que já recuperaram da Covid-19. Injetar esse plasma em indivíduos recentemente infetados ou em risco deverá fornecer aos seus organismos anticorpos capazes de bloquearem o novo coronavírus.
Moléculas sintéticas
Se métodos formulados com o intuito de evitarem a entrada do novo coronavírus nas células falharem, alguns cientistas sugerem que enviar 'engodos' ou moléculas sintéticas que se assemelhem ao ACE2 poderá ajudar a travar a Covid-19. Desse modo as moléculas poderiam 'enganar' o vírus de forma a que este se associasse a essas substâncias ao invés de proteínas, o que por sua vez deixaria os pulmões livres de perigo.
Alterar o processo natural
Vírus provocam infeções sobretudo ao 'raptarem' a célula hospedeira, replicando-a de dentro para fora. Como tal, os cientistas acreditam que alterar a forma como a célula hospedeira opera poderia confundir o vírus invasor e impedir que danificasse células saudáveis.
Alguns estudos atuais estão a focar a sua investigação na análise de fármacos que já existem. Esses medicamentos mostraram ser eficazes ao provocarem alterações nas células cuja função é proteger o corpo.
Fosfato de cloraquina
A droga foi originalmente formulada para tratar a malária, ao alterar o nível de pH das células humanas. Esta medicação torna as células menos acídicas e menos recetivas ao novo coronavírus.
Inibidores da protease
Esta classe de fármacos que ajuda a gerir doenças como o VIH e a hepatite C, trabalha ao reduzir a presença de proteases (enzimas que provocam o desdobramento das proteínas em aminoácidos) e daí diminuir a chance do SARS-CoV-2 se replicar.
Remdesivir e Favipiravir
Estas drogas farmacológicas atacam a enzima denomina de polimerase, que permite que o vírus replique o seu material genético no interior da célula hospedeira. O remdesivir foi concebido para combater o Ébola, enquanto que o favipiravir é usado pelos médicos contra a gripe comum.
Leia Também: Coronavírus permanece no ar de espaços fechados durante horas
Recomendados para si",https://www.noticiasaominuto.com/lifestyle/1467790/sete-formas-de-matar-o-novo-coronavirus-e-acabar-com-a-pandemia,Sete formas de matar o novo coronavírus e acabar com a pandemia,https://www.noticiasaominuto.com/lifestyle/1467790/sete-formas-de-matar-o-novo-coronavirus-e-acabar-com-a-pandemia,artlist,PO,,100 minutes,FALSE,250,https://api.gdeltproject.org/api/v2/doc/doc?query=%20sourcecountry:po&sourcelang:por&mode=artlist&format=json&timespan=100&maxrecords=250&sort=datedesc,NA,2020-04-29T10:15:00Z,https://media-manager.noticiasaominuto.com/1280/1588151759/naom_5ea93c30043b0.jpg?crop_params=eyJsYW5kc2NhcGUiOnsiY3JvcFdpZHRoIjoyNTM2LCJjcm9wSGVpZ2h0IjoxMzM3LCJjcm9wWCI6MCwiY3JvcFkiOjEyfSwicG9ydHJhaXQiOnsiY3JvcFdpZHRoIjo5NTUsImNyb3BIZWlnaHQiOjEzNDMsImNyb3BYIjo1ODEsImNyb3BZIjo2fX0=,noticiasaominuto.com,Portuguese,Portugal,"O novo coronavírus, também conhecido por SARS-CoV-2, associa-se às células humanas. A infeção ocorre quando este interage com a proteína ACE2, comummente encontrada nos pulmões e no intestino delgado, explica a revista WIRED.
Os cientistas acreditam que prevenir que se estabeleça essa ligação entre o vírus e a célula é fundamental de modo a evitar a propagação da Covid-19. Felizmente, já existem certos métodos que provaram ser eficazes na inibição desse comportamento do SARS-CoV-2 e outros que ainda estão a ser estudados.
Eis, segundo a publicação Medical Daily, sete métodos preventivos com potencialidade de inativar o vírus:
Vacina
A primeira opção é o desenvolvimento de uma vacina. Esta opção seria capaz de acarretar imunidade a longo prazo e é a mais eficaz para bloquear a disseminação de qualquer infeção viral.
Leia Também: Duas razões por que algumas pessoas não têm sintomas (mesmo se infetadas)
Terapia à base de plasma
Outro método com potencial para matar o novo coronavírus consiste no uso de plasma sanguíneo de pessoas que já recuperaram da Covid-19. Injetar esse plasma em indivíduos recentemente infetados ou em risco deverá fornecer aos seus organismos anticorpos capazes de bloquearem o novo coronavírus.
Moléculas sintéticas
Se métodos formulados com o intuito de evitarem a entrada do novo coronavírus nas células falharem, alguns cientistas sugerem que enviar 'engodos' ou moléculas sintéticas que se assemelhem ao ACE2 poderá ajudar a travar a Covid-19. Desse modo as moléculas poderiam 'enganar' o vírus de forma a que este se associasse a essas substâncias ao invés de proteínas, o que por sua vez deixaria os pulmões livres de perigo.
Alterar o processo natural
Vírus provocam infeções sobretudo ao 'raptarem' a célula hospedeira, replicando-a de dentro para fora. Como tal, os cientistas acreditam que alterar a forma como a célula hospedeira opera poderia confundir o vírus invasor e impedir que danificasse células saudáveis.
Alguns estudos atuais estão a focar a sua investigação na análise de fármacos que já existem. Esses medicamentos mostraram ser eficazes ao provocarem alterações nas células cuja função é proteger o corpo.
Fosfato de cloraquina
A droga foi originalmente formulada para tratar a malária, ao alterar o nível de pH das células humanas. Esta medicação torna as células menos acídicas e menos recetivas ao novo coronavírus.
Inibidores da protease
Esta classe de fármacos que ajuda a gerir doenças como o VIH e a hepatite C, trabalha ao reduzir a presença de proteases (enzimas que provocam o desdobramento das proteínas em aminoácidos) e daí diminuir a chance do SARS-CoV-2 se replicar.
Remdesivir e Favipiravir
Estas drogas farmacológicas atacam a enzima denomina de polimerase, que permite que o vírus replique o seu material genético no interior da célula hospedeira. O remdesivir foi concebido para combater o Ébola, enquanto que o favipiravir é usado pelos médicos contra a gripe comum.
Leia Também: Coronavírus permanece no ar de espaços fechados durante horas
Recomendados para si",0.9646357051555177,0.9280809565036006,0.9686674216685542,0.970499243570348,0.9668425018839487,"Random Forests
('ranger' package, R 3.5.3.)
Wright MN, Ziegler A (2017). “ranger: A Fast Implementation of Random Forests for High Dimensional Data in C++ and R.” Journal of Statistical Software, 77(1), 1–17. doi: 10.18637/jss.v077.i01.",5479,0.4347048300536673,204,500,20,gini,classification,2020-04-05
