prediction_covid_topic,title,description,authors,date_download,maintext,url,gdelt_title,gdelt_url,date_publish,modeSearch,sourcecountrySearch,termSearch,periodtimeSearch,isOR,countMaximumRecords,urlGDELTV2FTAPI,urlArticleMobile,datetimeArticle,urlImage,domainArticle,languageArticle,countryArticle,pred_input,model_accuracy,model_kappa,model_f1,model_precision,model_recall,model,sample_size,train_prop_covid,mtry,n_tree,min_node_size,splitrule,model_type,fitted_on
1,Moçambique regista mais três casos de infeção e sobe total para 20,"As últimas notícias e reportagens sobre Portugal e o Mundo. Actualidade, Globo, Desporto, Fama e TV, Arte e Lazer. Passatempos. Todas as fotos e videos em destak.pt",Destak,2020-04-10 20:15:19,"Covid-19
O número de casos registados oficialmente de infeção pelo novo coronavírus em Moçambique subiu de 17 para 20, anunciou hoje o Ministério da Saúde.
""Dos 54 casos suspeitos testados nas últimas 24 horas, 51 revelaram-se negativos para a covid-19 e três foram positivos. Portanto, temos um total de 20 casos positivos"", disse Rosa Marlene, diretora nacional de Saúde Pública, falando durante a conferência de imprensa de atualização de dados no Ministério da Saúde em Maputo.
Segundo o Ministério da Saúde, do total de 20 casos registados desde o primeiro caso no país, a 11 de março, 12 são de transmissão local e oito são importados.",http://www.destak.pt/artigo/414310-mocambique-regista-mais-tres-casos-de-infecao-e-sobe-total-para-20,Destak . pt | Covid - 19 : Moçambique regista mais três casos de infeo e sobe total para 20,http://www.destak.pt/artigo/414310-mocambique-regista-mais-tres-casos-de-infecao-e-sobe-total-para-20,NA,artlist,PO,,100 minutes,FALSE,250,https://api.gdeltproject.org/api/v2/doc/doc?query=%20sourcecountry:po&sourcelang:por&mode=artlist&format=json&timespan=100&maxrecords=250&sort=datedesc,NA,2020-04-10T15:45:00Z,http://www.destak.pt/images/newsletter_no_img.jpg,destak.pt,Portuguese,Portugal,"Covid-19
O número de casos registados oficialmente de infeção pelo novo coronavírus em Moçambique subiu de 17 para 20, anunciou hoje o Ministério da Saúde.
""Dos 54 casos suspeitos testados nas últimas 24 horas, 51 revelaram-se negativos para a covid-19 e três foram positivos. Portanto, temos um total de 20 casos positivos"", disse Rosa Marlene, diretora nacional de Saúde Pública, falando durante a conferência de imprensa de atualização de dados no Ministério da Saúde em Maputo.
Segundo o Ministério da Saúde, do total de 20 casos registados desde o primeiro caso no país, a 11 de março, 12 são de transmissão local e oito são importados.",0.9646357051555177,0.9280809565036006,0.9686674216685542,0.970499243570348,0.9668425018839487,"Random Forests
('ranger' package, R 3.5.3.)
Wright MN, Ziegler A (2017). “ranger: A Fast Implementation of Random Forests for High Dimensional Data in C++ and R.” Journal of Statistical Software, 77(1), 1–17. doi: 10.18637/jss.v077.i01.",5479,0.4347048300536673,204,500,20,gini,classification,2020-04-05
1,Autarca de Castro Daire surpreendido com anúncio sobre cordão sanitário,"As últimas notícias e reportagens sobre Portugal e o Mundo. Actualidade, Globo, Desporto, Fama e TV, Arte e Lazer. Passatempos. Todas as fotos e videos em destak.pt",Destak,2020-04-10 20:15:20,"Covid-19
O presidente da Câmara de Castro Daire, Paulo Almeida, disse ter ouvido ""com surpresa"" a diretora-geral da Saúde afirmar hoje que não se justifica um cordão sanitário no concelho e frisou estar a aguardar ""orientações"" sobre as medidas a aplicar.
O autarca de Castro Daire, no distrito de Viseu, afirmou, em declarações à agência Lusa, não ter ""nenhuma informação objetiva daquilo que serão as medidas a serem decretadas"" no município, pelo que não pôde ""comentar as breves palavras"" de Graça Freitas na conferência de imprensa diária de acompanhamento da pandemia da covid-19.
""Não sei quais as medidas que se pretendem tomar relativamente à nossa situação. Estou na expectativa de saber o que resulta da avaliação feita pelas entidades máximas da saúde quanto à situação epidemiológica no nosso concelho"", referiu Paulo Almeida.",http://www.destak.pt/artigo/414309-autarca-de-castro-daire-surpreendido-com-anuncio-sobre-cordao-sanitario,Destak . pt | Covid - 19 : Autarca de Castro Daire surpreendido com anúncio sobre cordão sanitário,http://www.destak.pt/artigo/414309-autarca-de-castro-daire-surpreendido-com-anuncio-sobre-cordao-sanitario,NA,artlist,PO,,100 minutes,FALSE,250,https://api.gdeltproject.org/api/v2/doc/doc?query=%20sourcecountry:po&sourcelang:por&mode=artlist&format=json&timespan=100&maxrecords=250&sort=datedesc,NA,2020-04-10T15:45:00Z,http://www.destak.pt/images/newsletter_no_img.jpg,destak.pt,Portuguese,Portugal,"Covid-19
O presidente da Câmara de Castro Daire, Paulo Almeida, disse ter ouvido ""com surpresa"" a diretora-geral da Saúde afirmar hoje que não se justifica um cordão sanitário no concelho e frisou estar a aguardar ""orientações"" sobre as medidas a aplicar.
O autarca de Castro Daire, no distrito de Viseu, afirmou, em declarações à agência Lusa, não ter ""nenhuma informação objetiva daquilo que serão as medidas a serem decretadas"" no município, pelo que não pôde ""comentar as breves palavras"" de Graça Freitas na conferência de imprensa diária de acompanhamento da pandemia da covid-19.
""Não sei quais as medidas que se pretendem tomar relativamente à nossa situação. Estou na expectativa de saber o que resulta da avaliação feita pelas entidades máximas da saúde quanto à situação epidemiológica no nosso concelho"", referiu Paulo Almeida.",0.9646357051555177,0.9280809565036006,0.9686674216685542,0.970499243570348,0.9668425018839487,"Random Forests
('ranger' package, R 3.5.3.)
Wright MN, Ziegler A (2017). “ranger: A Fast Implementation of Random Forests for High Dimensional Data in C++ and R.” Journal of Statistical Software, 77(1), 1–17. doi: 10.18637/jss.v077.i01.",5479,0.4347048300536673,204,500,20,gini,classification,2020-04-05
1,GNR reforça fiscalização de circulação em Castro Daire,"As últimas notícias e reportagens sobre Portugal e o Mundo. Actualidade, Globo, Desporto, Fama e TV, Arte e Lazer. Passatempos. Todas as fotos e videos em destak.pt",Destak,2020-04-10 20:15:40,"Covid-19
O ministro da Administração Interna disse hoje que foi reforçada a fiscalização da circulação no concelho de Castro Daire, distrito de Aveiro, e desinfetados dos dois lares, devido ao número de casos de infeção pelo novo coronavírus.
""A avaliação que foi feita, quer pela autoridade de saúde quer pelas forças de segurança em Castro Daire, foi que seria necessária uma intervenção nos lares onde se verificavam situações de infeção, e o reforço dos mecanismos de fiscalização"", afirmou Eduardo Cabrita em declarações à RTP.
Segundo o ministro, após uma conversa que teve com o presidente da câmara, foi decidido redobrar a atenção à limitação da circulação de pessoas no concelho, fiscalização a cargo da GNR.",http://www.destak.pt/artigo/414305-gnr-reforca-fiscalizacao-de-circulacao-em-castro-daire,Destak . pt | Covid - 19 : GNR reforça fiscalizao de circulao em Castro Daire,http://www.destak.pt/artigo/414305-gnr-reforca-fiscalizacao-de-circulacao-em-castro-daire,NA,artlist,PO,,100 minutes,FALSE,250,https://api.gdeltproject.org/api/v2/doc/doc?query=%20sourcecountry:po&sourcelang:por&mode=artlist&format=json&timespan=100&maxrecords=250&sort=datedesc,NA,2020-04-10T15:45:00Z,http://www.destak.pt/images/newsletter_no_img.jpg,destak.pt,Portuguese,Portugal,"Covid-19
O ministro da Administração Interna disse hoje que foi reforçada a fiscalização da circulação no concelho de Castro Daire, distrito de Aveiro, e desinfetados dos dois lares, devido ao número de casos de infeção pelo novo coronavírus.
""A avaliação que foi feita, quer pela autoridade de saúde quer pelas forças de segurança em Castro Daire, foi que seria necessária uma intervenção nos lares onde se verificavam situações de infeção, e o reforço dos mecanismos de fiscalização"", afirmou Eduardo Cabrita em declarações à RTP.
Segundo o ministro, após uma conversa que teve com o presidente da câmara, foi decidido redobrar a atenção à limitação da circulação de pessoas no concelho, fiscalização a cargo da GNR.",0.9646357051555177,0.9280809565036006,0.9686674216685542,0.970499243570348,0.9668425018839487,"Random Forests
('ranger' package, R 3.5.3.)
Wright MN, Ziegler A (2017). “ranger: A Fast Implementation of Random Forests for High Dimensional Data in C++ and R.” Journal of Statistical Software, 77(1), 1–17. doi: 10.18637/jss.v077.i01.",5479,0.4347048300536673,204,500,20,gini,classification,2020-04-05
1,Ministério da Saúde quer espaços livres de covid-19 durante pandemia,"A secretária de Estado Jamila Madeira disse que só a evolução da pandemia permitirá antecipar cenários, mas defende que o objetivo é garantir espaços sem covid-19.",Global Media Group,2020-04-10 20:15:58,"Jamila Madeira, secretária de Estado Adjunta e da Saúde, afirmou esta sexta-feira que a intenção da tutela é assegurar a existência de ""espaços livres"" do covid-19 durante a pandemia, admitindo que a evolução da situação o possa dificultar.
""É nossa intenção, no cenário que temos atualmente presente, manter espaços livres de serem afetados por esta doença"", adiantou Jamila Madeira durante a conferência de imprensa diária de acompanhamento da pandemia.
A secretária de Estado defendeu esta intenção em resposta a uma questão sobre a transferência do Centro Hepato-bilio-pancreático e de Transplante (CHBPT) do Hospital Curry Cabral para o Hospital de Santa Marta, ambos em Lisboa, e sobre as declarações do médico cirurgião Eduardo Barroso, que em entrevista à Lusa defendeu que ""não vai haver no mundo um hospital livre de covid"".
Fechar Subscreva as newsletters Diário de Notícias e receba as informações em primeira mão. Subscrever
Jamila Madeira admitiu que a evolução da pandemia é que permitirá ""antecipar cenários mais dramáticos ou menos dramáticos"", mas defendeu que, para já, o objetivo do Ministério da Saúde é garantir a disponibilidade desses espaços.
Na segunda-feira, o Centro Hospitalar Universitário de Lisboa Central esclareceu que a transferência do transplante hepático do hospital Curry Cabral para Santa Marta decorre da necessidade de garantir aos doentes ""a máxima segurança"" durante a pandemia covid-19.
O Santa Marta será ""um hospital livre de covid-19, de forma a nele concentrar os doentes, que, como os transplantados, exigem cuidados especiais"", afirma o Centro Hospitalar Universitário de Lisboa Central num esclarecimento enviado à agência Lusa, recordando que este ""é o único centro no país a realizar transplante pulmonar"" e onde ocorre também transplante cardíaco.
Na terça-feira, em entrevista à Lusa, Eduardo Barroso, que dirigiu o CHBPT, disse que transformar o Hospital Curry Cabral, em Lisboa, é um erro trágico, afirmando que ""o facto de haver um hospital só dedicado ao covid não quer dizer que os outros fiquem livres de covid"".
Em Portugal, segundo o balanço feito hoje pela Direção-Geral da Saúde, registaram-se 435 mortos, mais 29 do que na véspera (+6,4%), e 15.472 casos de infeções confirmadas, o que representa um aumento de 1.516 em relação a quarta-feira (+10,9%), o maior à data.
Dos infetados, 1.179 estão internados, 226 dos quais em unidades de cuidados intensivos, e há 233 doentes que já recuperaram.
Portugal, onde os primeiros casos confirmados foram registados no dia 2 de março, encontra-se em estado de emergência desde as 00.00 horas de 19 de março e até ao final do dia 17 de abril, depois do prolongamento aprovado no dia 2 de abril na Assembleia da República.",https://www.dn.pt/pais/ministerio-da-saude-quer-espacos-livres-de-covid-19-durante-pandemia--12056934.html,Ministério da Saúde quer espaços livres de covid - 19 durante pandemia,https://www.dn.pt/pais/ministerio-da-saude-quer-espacos-livres-de-covid-19-durante-pandemia--12056934.html,2020-04-10 17:49:00,artlist,PO,,100 minutes,FALSE,250,https://api.gdeltproject.org/api/v2/doc/doc?query=%20sourcecountry:po&sourcelang:por&mode=artlist&format=json&timespan=100&maxrecords=250&sort=datedesc,https://www.dn.pt/pais/amp/ministerio-da-saude-quer-espacos-livres-de-covid-19-durante-pandemia--12056934.html,2020-04-10T15:30:00Z,https://static.globalnoticias.pt/dn/image.aspx?brand=DN&type=generate&guid=b59aded7-24a0-42a8-ae77-52207f11d0bc&watermark=true&t=20200410154900,dn.pt,Portuguese,Portugal,"Jamila Madeira, secretária de Estado Adjunta e da Saúde, afirmou esta sexta-feira que a intenção da tutela é assegurar a existência de ""espaços livres"" do covid-19 durante a pandemia, admitindo que a evolução da situação o possa dificultar.
""É nossa intenção, no cenário que temos atualmente presente, manter espaços livres de serem afetados por esta doença"", adiantou Jamila Madeira durante a conferência de imprensa diária de acompanhamento da pandemia.
A secretária de Estado defendeu esta intenção em resposta a uma questão sobre a transferência do Centro Hepato-bilio-pancreático e de Transplante (CHBPT) do Hospital Curry Cabral para o Hospital de Santa Marta, ambos em Lisboa, e sobre as declarações do médico cirurgião Eduardo Barroso, que em entrevista à Lusa defendeu que ""não vai haver no mundo um hospital livre de covid"".
Fechar Subscreva as newsletters Diário de Notícias e receba as informações em primeira mão. Subscrever
Jamila Madeira admitiu que a evolução da pandemia é que permitirá ""antecipar cenários mais dramáticos ou menos dramáticos"", mas defendeu que, para já, o objetivo do Ministério da Saúde é garantir a disponibilidade desses espaços.
Na segunda-feira, o Centro Hospitalar Universitário de Lisboa Central esclareceu que a transferência do transplante hepático do hospital Curry Cabral para Santa Marta decorre da necessidade de garantir aos doentes ""a máxima segurança"" durante a pandemia covid-19.
O Santa Marta será ""um hospital livre de covid-19, de forma a nele concentrar os doentes, que, como os transplantados, exigem cuidados especiais"", afirma o Centro Hospitalar Universitário de Lisboa Central num esclarecimento enviado à agência Lusa, recordando que este ""é o único centro no país a realizar transplante pulmonar"" e onde ocorre também transplante cardíaco.
Na terça-feira, em entrevista à Lusa, Eduardo Barroso, que dirigiu o CHBPT, disse que transformar o Hospital Curry Cabral, em Lisboa, é um erro trágico, afirmando que ""o facto de haver um hospital só dedicado ao covid não quer dizer que os outros fiquem livres de covid"".
Em Portugal, segundo o balanço feito hoje pela Direção-Geral da Saúde, registaram-se 435 mortos, mais 29 do que na véspera (+6,4%), e 15.472 casos de infeções confirmadas, o que representa um aumento de 1.516 em relação a quarta-feira (+10,9%), o maior à data.
Dos infetados, 1.179 estão internados, 226 dos quais em unidades de cuidados intensivos, e há 233 doentes que já recuperaram.
Portugal, onde os primeiros casos confirmados foram registados no dia 2 de março, encontra-se em estado de emergência desde as 00.00 horas de 19 de março e até ao final do dia 17 de abril, depois do prolongamento aprovado no dia 2 de abril na Assembleia da República.",0.9646357051555177,0.9280809565036006,0.9686674216685542,0.970499243570348,0.9668425018839487,"Random Forests
('ranger' package, R 3.5.3.)
Wright MN, Ziegler A (2017). “ranger: A Fast Implementation of Random Forests for High Dimensional Data in C++ and R.” Journal of Statistical Software, 77(1), 1–17. doi: 10.18637/jss.v077.i01.",5479,0.4347048300536673,204,500,20,gini,classification,2020-04-05
