prediction_covid_topic,title,description,authors,date_download,date_publish,maintext,url,gdelt_title,gdelt_url,modeSearch,sourcecountrySearch,termSearch,periodtimeSearch,isOR,countMaximumRecords,urlGDELTV2FTAPI,urlArticleMobile,datetimeArticle,urlImage,domainArticle,languageArticle,countryArticle,pred_input,model_accuracy,model_kappa,model_f1,model_precision,model_recall,model,sample_size,train_prop_covid,mtry,n_tree,min_node_size,splitrule,model_type,fitted_on
1,O novo fato de António Costa,A conferência de imprensa de António Costa desta quinta-feira e a entrevista ao final da noite à RTP comprovaram que o primeiro-ministro se reinventou entre os danos da crise.,Manuel Carvalho,2020-05-01 10:15:29,2020-05-01 06:30:00,"O primeiro-ministro e o Governo partiram para esta segunda fase da crise do novo coronavírus com um dilema crítico: como avançar para uma tímida reabertura da sociedade para injectar um pouco de dinamismo na actividade económica e no emprego sem afrontar os naturais receios de uma sociedade alarmada com o medo da infecção? A conferência de imprensa de António Costa desta quinta-feira e a entrevista ao final da noite à RTP fizeram luz sobre esse dilema e comprovaram que o primeiro-ministro se reinventou entre os danos da crise. Como se em causa estivesse uma espécie de revelação, vimos um chefe de Governo realista, prudente, ligado aos problemas globais sem descurar os pequenos dramas que afectam as pessoas, sempre a evitar a solução fácil ou um amanhã que canta, sem certezas absolutas nem promessas fáceis. Um anti-Costa dos tempos de Pedrógão, portanto.
Por muito paradoxal que possa parecer, é este discurso cauteloso e vagamente pessimista sobre o futuro que tem mais condições de gerar confiança entre os portugueses. Se há uma prova definitiva de maturidade colectiva do país a tirar dos últimos 45 dias, está na sua capacidade de perceber a gravidade do problema e na resposta que os portugueses lhe deram. Os mais cépticos hão-de recordar, com razão, as centenas de detidos que se escapuliram às regras do confinamento; os mais duvidosos hão-de afirmar, com toda a justiça, que essa responsabilidade colectiva resulta do medo, da proverbial falta de audácia do país ou da resposta consensual que todo o sistema político deu à crise. Há razão nestes argumentos. Mas o que fomos apreendendo dá para perceber que os portugueses agiram como agiram porque conhecem a gravidade da crise e os custos que vão ter de pagar para o vencer.
As últimas intervenções de António Costa respondem a esse reconhecimento. Pelo que é legítimo admitir que a sua mudança de registo resulta de uma aprendizagem que eliminou de vez o seu irritante optimismo, que vimos pela última vez quando negou a existência de problemas no SNS. Seja como for, não sobram dúvidas de que esta pose é a que mais instila confiança nos cidadãos. Vale muito mais um primeiro-ministro que, perante esta crise, revela dúvidas, que confirma receios sobre os passos que dá, que admite errar e recuar no erro, que adverte para as dificuldades e dá conta da sua impotência para mudar o curso da epidemia do que o contrário. Goste-se ou não do PS, de António Costa ou das suas ideias, há nesta evolução uma realidade incontornável: nunca como hoje o secretário-geral do PS vestiu tão bem o seu fato de primeiro-ministro.",https://www.publico.pt/2020/05/01/opiniao/editorial/novo-fato-antonio-costa-1914703,O novo fato de António Costa,https://www.publico.pt/2020/05/01/opiniao/editorial/novo-fato-antonio-costa-1914703,artlist,PO,,100 minutes,FALSE,250,https://api.gdeltproject.org/api/v2/doc/doc?query=%20sourcecountry:po&sourcelang:por&mode=artlist&format=json&timespan=100&maxrecords=250&sort=datedesc,https://www.publico.pt/2020/05/01/opiniao/editorial/novo-fato-antonio-costa-1914703/amp,2020-05-01T05:45:00Z,NA,publico.pt,Portuguese,Portugal,"O primeiro-ministro e o Governo partiram para esta segunda fase da crise do novo coronavírus com um dilema crítico: como avançar para uma tímida reabertura da sociedade para injectar um pouco de dinamismo na actividade económica e no emprego sem afrontar os naturais receios de uma sociedade alarmada com o medo da infecção? A conferência de imprensa de António Costa desta quinta-feira e a entrevista ao final da noite à RTP fizeram luz sobre esse dilema e comprovaram que o primeiro-ministro se reinventou entre os danos da crise. Como se em causa estivesse uma espécie de revelação, vimos um chefe de Governo realista, prudente, ligado aos problemas globais sem descurar os pequenos dramas que afectam as pessoas, sempre a evitar a solução fácil ou um amanhã que canta, sem certezas absolutas nem promessas fáceis. Um anti-Costa dos tempos de Pedrógão, portanto.
Por muito paradoxal que possa parecer, é este discurso cauteloso e vagamente pessimista sobre o futuro que tem mais condições de gerar confiança entre os portugueses. Se há uma prova definitiva de maturidade colectiva do país a tirar dos últimos 45 dias, está na sua capacidade de perceber a gravidade do problema e na resposta que os portugueses lhe deram. Os mais cépticos hão-de recordar, com razão, as centenas de detidos que se escapuliram às regras do confinamento; os mais duvidosos hão-de afirmar, com toda a justiça, que essa responsabilidade colectiva resulta do medo, da proverbial falta de audácia do país ou da resposta consensual que todo o sistema político deu à crise. Há razão nestes argumentos. Mas o que fomos apreendendo dá para perceber que os portugueses agiram como agiram porque conhecem a gravidade da crise e os custos que vão ter de pagar para o vencer.
As últimas intervenções de António Costa respondem a esse reconhecimento. Pelo que é legítimo admitir que a sua mudança de registo resulta de uma aprendizagem que eliminou de vez o seu irritante optimismo, que vimos pela última vez quando negou a existência de problemas no SNS. Seja como for, não sobram dúvidas de que esta pose é a que mais instila confiança nos cidadãos. Vale muito mais um primeiro-ministro que, perante esta crise, revela dúvidas, que confirma receios sobre os passos que dá, que admite errar e recuar no erro, que adverte para as dificuldades e dá conta da sua impotência para mudar o curso da epidemia do que o contrário. Goste-se ou não do PS, de António Costa ou das suas ideias, há nesta evolução uma realidade incontornável: nunca como hoje o secretário-geral do PS vestiu tão bem o seu fato de primeiro-ministro.",0.9646357051555177,0.9280809565036006,0.9686674216685542,0.970499243570348,0.9668425018839487,"Random Forests
('ranger' package, R 3.5.3.)
Wright MN, Ziegler A (2017). “ranger: A Fast Implementation of Random Forests for High Dimensional Data in C++ and R.” Journal of Statistical Software, 77(1), 1–17. doi: 10.18637/jss.v077.i01.",5479,0.4347048300536673,204,500,20,gini,classification,2020-04-05
