prediction_covid_topic,title,description,authors,date_download,date_publish,maintext,url,gdelt_title,gdelt_url,modeSearch,sourcecountrySearch,termSearch,periodtimeSearch,isOR,countMaximumRecords,urlGDELTV2FTAPI,urlArticleMobile,datetimeArticle,urlImage,domainArticle,languageArticle,countryArticle,pred_input,model_accuracy,model_kappa,model_f1,model_precision,model_recall,model,sample_size,train_prop_covid,mtry,n_tree,min_node_size,splitrule,model_type,fitted_on
1,País Basco e Galiza convocam eleições para 12 de julho,"Eleições autonómicas nas duas regiões estavam previstas para 5 de abril, mas foram adiadas por causa do novo coronavírus.",Global Media Group,2020-05-18 16:15:18,2020-05-18 13:46:00,"Os presidente do governo basco, Iñigo Urkullu, e galego, Alberto Núñez Feijóo, vão anunciar esta segunda-feira a convocação de eleições autonómicas para o dia 12 de julho. As eleições, inicialmente previstas para 5 de abril, foram suspensas e adiadas por causa da pandemia de coronavírus, que já matou mais de duas mil pessoas nas duas comunidades, num total de 27 650 óbitos em Espanha.
Urkullu, do Partido Nacionalista Basco que governa atualmente com o apoio dos socialistas, vai reunir com os membros do seu executivo ao princípio da tarde, fazendo depois uma conferência de imprensa onde vai justificar a sua posição. A reunião do governo estava só prevista para amanhã, mas o lehendakari resolveu antecipá-la, para garantir o prazo de 54 dias necessário entre a convocação dos comícios e a votação.
O líder do governo basco tem defendido a realização das eleições o mais rapidamente possível, com os nacionalistas a argumentar que a pandemia está numa fase descendente, mas que os especialistas temem uma segunda vaga no outono, quando poderá coincidir com a época da gripe.
Fechar Subscreva as newsletters Diário de Notícias e receba as informações em primeira mão. Subscrever
Na semana passada, Urkullu apresentou um plano para a realização das eleições em segurança, que passam por aumentar mais o voto por correio e até a abertura de mesas eleitorais em lares de idosos. A campanha, fora dos moldes normais, também só deve durar uma semana.
Também Feijóo, do Partido Popular, vai reunir hoje o seu governo e dar uma conferência de imprensa. Ao que tudo indica, irá também marcar as eleições autonómicas para a mesma data, 12 de julho, mas neste caso não há ainda confirmação oficial. A convocação das eleições tem que ser confirmada ainda hoje, para ser publicada amanhã no Diário Oficial da Galiza. Caso contrário, o escrutínio terá que ser no fim de semana seguinte.
Tanto Urkullu, lehendakari desde 2012, como Feijóo, presidente do governo galego desde 2009, são os favoritos à vitória.
Torra diz que não é hora de eleições
Já o presidente do governo catalão, Quim Torra, que em finais de janeiro tinha anunciado que iria antecipar as eleições na Catalunha (previstas inicialmente apenas em 2021), afasta agora essa possibilidade.
Num artigo publicado este domingo no La Vanguardia, Torra indicou que não é o momento de realizar essas eleições, alegando que estas iriam converter o que tem que ser um ""momento de solidariedade"" para lidar com o coronavírus, ""numa competição descarnada entre partidos"".
Em finais de janeiro Torra tinha dito que anunciaria a data das eleições após a aprovação do orçamento para a Catalunha.
A Catalunha registou 5944 mortes por covid-19.",https://www.dn.pt/mundo/pais-basco-e-galiza-convocam-eleicoes-para-12-de-julho-12207365.html,País Basco e Galiza convocam eleies para 12 de julho,https://www.dn.pt/mundo/pais-basco-e-galiza-convocam-eleicoes-para-12-de-julho-12207365.html,artlist,PO,,100 minutes,FALSE,250,https://api.gdeltproject.org/api/v2/doc/doc?query=%20sourcecountry:po&sourcelang:por&mode=artlist&format=json&timespan=100&maxrecords=250&sort=datedesc,https://www.dn.pt/mundo/amp/pais-basco-e-galiza-convocam-eleicoes-para-12-de-julho-12207365.html,2020-05-18T11:45:00Z,https://static.globalnoticias.pt/dn/image.aspx?brand=DN&type=generate&guid=702f3284-0100-492d-81f3-4523f721c7ab&watermark=true&t=20200518114600,dn.pt,Portuguese,Portugal,"Os presidente do governo basco, Iñigo Urkullu, e galego, Alberto Núñez Feijóo, vão anunciar esta segunda-feira a convocação de eleições autonómicas para o dia 12 de julho. As eleições, inicialmente previstas para 5 de abril, foram suspensas e adiadas por causa da pandemia de coronavírus, que já matou mais de duas mil pessoas nas duas comunidades, num total de 27 650 óbitos em Espanha.
Urkullu, do Partido Nacionalista Basco que governa atualmente com o apoio dos socialistas, vai reunir com os membros do seu executivo ao princípio da tarde, fazendo depois uma conferência de imprensa onde vai justificar a sua posição. A reunião do governo estava só prevista para amanhã, mas o lehendakari resolveu antecipá-la, para garantir o prazo de 54 dias necessário entre a convocação dos comícios e a votação.
O líder do governo basco tem defendido a realização das eleições o mais rapidamente possível, com os nacionalistas a argumentar que a pandemia está numa fase descendente, mas que os especialistas temem uma segunda vaga no outono, quando poderá coincidir com a época da gripe.
Fechar Subscreva as newsletters Diário de Notícias e receba as informações em primeira mão. Subscrever
Na semana passada, Urkullu apresentou um plano para a realização das eleições em segurança, que passam por aumentar mais o voto por correio e até a abertura de mesas eleitorais em lares de idosos. A campanha, fora dos moldes normais, também só deve durar uma semana.
Também Feijóo, do Partido Popular, vai reunir hoje o seu governo e dar uma conferência de imprensa. Ao que tudo indica, irá também marcar as eleições autonómicas para a mesma data, 12 de julho, mas neste caso não há ainda confirmação oficial. A convocação das eleições tem que ser confirmada ainda hoje, para ser publicada amanhã no Diário Oficial da Galiza. Caso contrário, o escrutínio terá que ser no fim de semana seguinte.
Tanto Urkullu, lehendakari desde 2012, como Feijóo, presidente do governo galego desde 2009, são os favoritos à vitória.
Torra diz que não é hora de eleições
Já o presidente do governo catalão, Quim Torra, que em finais de janeiro tinha anunciado que iria antecipar as eleições na Catalunha (previstas inicialmente apenas em 2021), afasta agora essa possibilidade.
Num artigo publicado este domingo no La Vanguardia, Torra indicou que não é o momento de realizar essas eleições, alegando que estas iriam converter o que tem que ser um ""momento de solidariedade"" para lidar com o coronavírus, ""numa competição descarnada entre partidos"".
Em finais de janeiro Torra tinha dito que anunciaria a data das eleições após a aprovação do orçamento para a Catalunha.
A Catalunha registou 5944 mortes por covid-19.",0.9646357051555177,0.9280809565036006,0.9686674216685542,0.970499243570348,0.9668425018839487,"Random Forests
('ranger' package, R 3.5.3.)
Wright MN, Ziegler A (2017). “ranger: A Fast Implementation of Random Forests for High Dimensional Data in C++ and R.” Journal of Statistical Software, 77(1), 1–17. doi: 10.18637/jss.v077.i01.",5479,0.4347048300536673,204,500,20,gini,classification,2020-04-05
1,"Ministro da Educação no regresso à escola assegura que há sensação de ""segurança e compromisso""","Na escola secundária de Santa Maria, em Sintra, 900 alunos regressaram às aulas, distribuídos por quatro turmas, duas no período da manhã e duas no período da tarde. O ministro da Educação fala de exemplo de ″compromisso″ de alunos e professores.",Global Media Group,2020-05-18 16:15:25,2020-05-18 13:43:00,"Tiago Brandão Rodrigues © Paulo Jorge Magalhães / Global Imagens
Por Tiago Santos 18 Maio, 2020 • 11:43 Partilhar este artigo Facebook
Facebook Twitter
Twitter WhatsApp
WhatsApp E-mail
E-mail Partilhar
O ministro da Educação fala de sensação de ""segurança"" e de uma passo importante na retoma da normalidade do dia-a-dia, no dia da reabertura das escolas para aulas presenciais do 11.º e 12.º anos de escolaridade. Numa visita à Escola Secundária de Santa Maria, em Sintra, Tiago Brandão Rodrigues respondeu ainda às criticas de Mário Nogueira, dizendo que a FENPROF deveria visitar as escolas que agora reabriram.
""Era importante que a FENPROF fosse às nossas escolas, visse o trabalhos dos nossos docentes. Que visse o trabalho das direções das escolas, dos corpos docentes e dos funcionários, a forma como se foram adaptando"", considerou Tiago Brandão Rodrigues. ""Os portugueses entendem que é importante dar este passo"", disse, em declarações registadas pela RTP.
O líder da FENPROF tem criticado a opção do Governo sobre o regresso dos alunos às escolas falando em a falta de recursos humanos para garantir as condições de segurança necessárias.
""É importante que vejam também como os alunos e professores responderam hoje, dizendo um pouco por todo o que, melhor que o ensino à distância funcione, não há nada como o ensino presencial"", nota o ministro da Educação,
Na Escola Secundária de Santa Maria, 900 alunos, distribuídas por quatro turmas, duas no período da manhã, duas no período da tarde, no dia em que os alunos.
""Pudemos ver, em cada uma das salas onde entramos, a forma como os alunos e os professores mostraram como é importante voltarem a estar juntos. ""É um compromisso"", diz o ministro.
""Todos temos de nos adaptar. A escola tem feito um grande esforço. Foi isso que hoje vimos aqui, mas também uma grande confiança"", assinala Tiago Brandão Rodrigues.
LEIA AQUI TUDO SOBRE A COVID-19",https://www.tsf.pt/portugal/sociedade/ministro-da-educacao-e-a-sensacao-de-seguranca-e-compromisso-nas-escolas-12207622.html,Ministro da Educao no regresso à escola assegura que há sensao de ″ segurança e compromisso ″ ,https://www.tsf.pt/portugal/sociedade/ministro-da-educacao-e-a-sensacao-de-seguranca-e-compromisso-nas-escolas-12207622.html,artlist,PO,,100 minutes,FALSE,250,https://api.gdeltproject.org/api/v2/doc/doc?query=%20sourcecountry:po&sourcelang:por&mode=artlist&format=json&timespan=100&maxrecords=250&sort=datedesc,https://www.tsf.pt/portugal/sociedade/amp/ministro-da-educacao-e-a-sensacao-de-seguranca-e-compromisso-nas-escolas-12207622.html,2020-05-18T11:45:00Z,https://static.globalnoticias.pt/tsf/image.aspx?brand=TSF&type=generate&guid=d57a4796-c38d-4431-ba28-2ecdc729851d&watermark=true&t=20200518114300,tsf.pt,Portuguese,Portugal,"Tiago Brandão Rodrigues © Paulo Jorge Magalhães / Global Imagens
Por Tiago Santos 18 Maio, 2020 • 11:43 Partilhar este artigo Facebook
Facebook Twitter
Twitter WhatsApp
WhatsApp E-mail
E-mail Partilhar
O ministro da Educação fala de sensação de ""segurança"" e de uma passo importante na retoma da normalidade do dia-a-dia, no dia da reabertura das escolas para aulas presenciais do 11.º e 12.º anos de escolaridade. Numa visita à Escola Secundária de Santa Maria, em Sintra, Tiago Brandão Rodrigues respondeu ainda às criticas de Mário Nogueira, dizendo que a FENPROF deveria visitar as escolas que agora reabriram.
""Era importante que a FENPROF fosse às nossas escolas, visse o trabalhos dos nossos docentes. Que visse o trabalho das direções das escolas, dos corpos docentes e dos funcionários, a forma como se foram adaptando"", considerou Tiago Brandão Rodrigues. ""Os portugueses entendem que é importante dar este passo"", disse, em declarações registadas pela RTP.
O líder da FENPROF tem criticado a opção do Governo sobre o regresso dos alunos às escolas falando em a falta de recursos humanos para garantir as condições de segurança necessárias.
""É importante que vejam também como os alunos e professores responderam hoje, dizendo um pouco por todo o que, melhor que o ensino à distância funcione, não há nada como o ensino presencial"", nota o ministro da Educação,
Na Escola Secundária de Santa Maria, 900 alunos, distribuídas por quatro turmas, duas no período da manhã, duas no período da tarde, no dia em que os alunos.
""Pudemos ver, em cada uma das salas onde entramos, a forma como os alunos e os professores mostraram como é importante voltarem a estar juntos. ""É um compromisso"", diz o ministro.
""Todos temos de nos adaptar. A escola tem feito um grande esforço. Foi isso que hoje vimos aqui, mas também uma grande confiança"", assinala Tiago Brandão Rodrigues.
LEIA AQUI TUDO SOBRE A COVID-19",0.9646357051555177,0.9280809565036006,0.9686674216685542,0.970499243570348,0.9668425018839487,"Random Forests
('ranger' package, R 3.5.3.)
Wright MN, Ziegler A (2017). “ranger: A Fast Implementation of Random Forests for High Dimensional Data in C++ and R.” Journal of Statistical Software, 77(1), 1–17. doi: 10.18637/jss.v077.i01.",5479,0.4347048300536673,204,500,20,gini,classification,2020-04-05
1,"""Se for necessário, iremos passar um verão sem discotecas e bares""","No primeiro dia da segunda fase de desconfinamento, após dois meses de encerramento de grande parte da economia, o primeiro-ministro foi tomar o pequeno-almoço a uma pastelaria de Benfica. Seguiu-se entrevista TSF onde afirmou que bares e discotecas podem não abrir este verão",Global Media Group,2020-05-18 16:15:28,2020-05-18 12:10:00,"Costa avisa que 3º período de aulas é essencial para preparar próximo ano letivo
""Depois de não nos termos deixado vencer pelo vírus, não nos podemos deixar-nos vencer pela cura"", afirmou António Costa aos jornalistas, esta segunda-feira, à porta de uma pastelaria em Lisboa, onde tomou um café e comeu um folhado.
No primeiro dia da segunda fase de desconfinamento, após dois meses de encerramento de grande parte da economia, Costa foi tomar pequeno-almoço a uma pastelaria que reabriu esta segunda-feira, viu as medidas de segurança, como o gel desinfetante à porta e os acrílicos sobre as mesas a separar os clientes e depois optou por ficar na esplanada, confessando que já tinha saudades de tomar um café ao ar livre.
E fez um apelo aos portugueses para que, ""com todas as cautelas"", retomem ""a sua vida em liberdade"", insistindo nas regras de lavar as mãos, usarem máscara quando estão próximos dos outros e manter o distanciamento social.
Fechar Subscreva as newsletters Diário de Notícias e receba as informações em primeira mão. Subscrever
""Se continuarmos todos parados sobrevivemos à doença, mas podemos não sobreviver à cura. É preciso ir vencendo estes receios, com confiança e sempre com cautela"", disse.
Logo a seguir, António Costa deu uma entrevista à TSF, onde falou das últimas polémicas envolvendo Mário Centeno e a recandidatura de Marcelo Rebelo de Sousa, e onde fez um balanço das decisões do governo relativas à pandemia e do que pode esperar o país no plano económico.
""Até haver uma vacina disponível, temos de recuperar a nossa liberdade mantendo a segurança necessária"", disse António Costa, acrescentando que não é tempo de falar numa segunda vaga da pandemia. ""Segunda vaga? Ainda estamos na primeira"", disse o primeiro-ministro.
""Cada passo que damos no desconfinamento aumenta o risco de transmissão"", alertou.
Costa recordou que no início da pandemia em Portugal não havia álcool, nem máscaras disponíveis.
""Estive a tomar café hoje de manhã [no Califa, em Benfica] e já havia acrílicos, e gel desinfetante: as escolas abrem hoje preparadas... o país tem-se vindo a preparar"".
O primeiro-ministro sublinhou que o Serviço Nacional de Saúde tem vindo a ser reforçado e assim continuará a ser"".
Aproveitou para revelar que os 500 ventiladores que Portugal comprou à ""finalmente estão disponíveis"".
""Ainda não faltaram em Portugal, mas é importante continuar a adquirir equipamento"", sublinhou. ,
""Portugal era dos país que tinha o menor número de camas por milhão de habitantes"", frisou o chefe do governo.
""Temos de admitir que no Outono e no inverno possa haver maior contaminação e maior pressão no SNS"".
""Essa é uma das razões pelas quais tenho insistido que estes meses de maio e junho são muito importantes para treinarmos novas rotinas e novas formas de trabalho"", disse Costa,
A escola, no Outono e no Inverno, poderá ser parecida com a escola que hoje arranca (ainda que só para os 11º e 12º anos), alertou também o primeiro-ministro.
Apoios da UE: ""Não vamos ficar ao nível da fisga""
""Não se podem acentuar as assimetrias. A Europa tem de responder nesse sentido, há uma vontade política e uma pequena minoria de bloqueio no Conselho e estamos a trabalhar nisso"", disse António Costa, na mesma entrevista à TSF.
Quanto ao valor que a União Europeia irá alocar para ajudar a economia dos países afetados pela pandemia, o primeiro-ministro disse que as estimativas apontam que ""menos de um bilião é insuficiente para as necessidades"".
""Há três ou quatro países que ainda não perceberam que só são ricos no mercado interno se todos os outros contribuírem para esse mercado interno"", diz o primeiro-ministro.
Em relação aos apoios da UE: ""Não vamos ficar ao nível da fisga"", disse, ""Mas se vamos ficar ao nível da pressão de ar ou da bazuca, ainda não sabemos"", frisou.
Tamém escusou usar o termo austeridad em relação aos tempos que aí vê, ""Não temos de acrescentar medidas de restrição económica. Esta crise precisa é de incentivos para recuperar a economia"", diz António Costa, em entrevista à TSF,
""A austeridade existe quando há uma decisão política, no corte de pensões, ou no aumento de impostos, não é o que está a acontecer"", garante o primeiro-ministro.
""Se for necessário, iremos passar um verão sem discotecas e bares""
""Ainda não está no nosso calendário. Temos de fazer a reabertura de forma gradual, começando pelas áreas onde é mais fácil cumprir normas de distanciamento""., disse o primiero-ministro, em relação à reabertura de bares e discotecas.
""Se for necessário, iremos passar um verão sem discotecas e bares abertos"", admite o primeiro-ministro.
Também ainda não está prevista a abertura de ginásios - o governo está a estudar a forma destes locais abrirem com segurança.
Sobre as polémicas com o 1º de Maio e a possível realização da Festa do Avante, António Costa frisou que ""a democracia não pode estar suspensa, mas tem de se adaptar"" e que ""cada partido tem de cumprir as regras e as normas que existem"".
""Relativamente à proibição de festivais e de eventos até 30 de setembro, há uma proposta de lei que a Assembleia da República irá ainda debater e determinar"", sublinha o primeiro-ministro.
Sobre o 1º de Maio, foi claro: ""O decreto do Estado de Emergência previa exceções"", frisou.",https://www.dn.pt/poder/se-continuarmos-parados-sobrevivemos-a-doenca-mas-podemos-nao-sobreviver-a-cura-costa-toma-pequeno-almoco-no-califa-12207100.html,"António Costa : ″ Se for necessário , iremos passar um verão sem discotecas e bares ″ ",https://www.dn.pt/poder/se-continuarmos-parados-sobrevivemos-a-doenca-mas-podemos-nao-sobreviver-a-cura-costa-toma-pequeno-almoco-no-califa-12207100.html,artlist,PO,,100 minutes,FALSE,250,https://api.gdeltproject.org/api/v2/doc/doc?query=%20sourcecountry:po&sourcelang:por&mode=artlist&format=json&timespan=100&maxrecords=250&sort=datedesc,https://www.dn.pt/poder/amp/se-continuarmos-parados-sobrevivemos-a-doenca-mas-podemos-nao-sobreviver-a-cura-costa-toma-pequeno-almoco-no-califa-12207100.html,2020-05-18T11:45:00Z,https://static.globalnoticias.pt/dn/image.aspx?brand=DN&type=generate&guid=50a8fbde-35f1-488b-8d02-45757b5d0991&watermark=true&t=20200518101000,dn.pt,Portuguese,Portugal,"Costa avisa que 3º período de aulas é essencial para preparar próximo ano letivo
""Depois de não nos termos deixado vencer pelo vírus, não nos podemos deixar-nos vencer pela cura"", afirmou António Costa aos jornalistas, esta segunda-feira, à porta de uma pastelaria em Lisboa, onde tomou um café e comeu um folhado.
No primeiro dia da segunda fase de desconfinamento, após dois meses de encerramento de grande parte da economia, Costa foi tomar pequeno-almoço a uma pastelaria que reabriu esta segunda-feira, viu as medidas de segurança, como o gel desinfetante à porta e os acrílicos sobre as mesas a separar os clientes e depois optou por ficar na esplanada, confessando que já tinha saudades de tomar um café ao ar livre.
E fez um apelo aos portugueses para que, ""com todas as cautelas"", retomem ""a sua vida em liberdade"", insistindo nas regras de lavar as mãos, usarem máscara quando estão próximos dos outros e manter o distanciamento social.
Fechar Subscreva as newsletters Diário de Notícias e receba as informações em primeira mão. Subscrever
""Se continuarmos todos parados sobrevivemos à doença, mas podemos não sobreviver à cura. É preciso ir vencendo estes receios, com confiança e sempre com cautela"", disse.
Logo a seguir, António Costa deu uma entrevista à TSF, onde falou das últimas polémicas envolvendo Mário Centeno e a recandidatura de Marcelo Rebelo de Sousa, e onde fez um balanço das decisões do governo relativas à pandemia e do que pode esperar o país no plano económico.
""Até haver uma vacina disponível, temos de recuperar a nossa liberdade mantendo a segurança necessária"", disse António Costa, acrescentando que não é tempo de falar numa segunda vaga da pandemia. ""Segunda vaga? Ainda estamos na primeira"", disse o primeiro-ministro.
""Cada passo que damos no desconfinamento aumenta o risco de transmissão"", alertou.
Costa recordou que no início da pandemia em Portugal não havia álcool, nem máscaras disponíveis.
""Estive a tomar café hoje de manhã [no Califa, em Benfica] e já havia acrílicos, e gel desinfetante: as escolas abrem hoje preparadas... o país tem-se vindo a preparar"".
O primeiro-ministro sublinhou que o Serviço Nacional de Saúde tem vindo a ser reforçado e assim continuará a ser"".
Aproveitou para revelar que os 500 ventiladores que Portugal comprou à ""finalmente estão disponíveis"".
""Ainda não faltaram em Portugal, mas é importante continuar a adquirir equipamento"", sublinhou. ,
""Portugal era dos país que tinha o menor número de camas por milhão de habitantes"", frisou o chefe do governo.
""Temos de admitir que no Outono e no inverno possa haver maior contaminação e maior pressão no SNS"".
""Essa é uma das razões pelas quais tenho insistido que estes meses de maio e junho são muito importantes para treinarmos novas rotinas e novas formas de trabalho"", disse Costa,
A escola, no Outono e no Inverno, poderá ser parecida com a escola que hoje arranca (ainda que só para os 11º e 12º anos), alertou também o primeiro-ministro.
Apoios da UE: ""Não vamos ficar ao nível da fisga""
""Não se podem acentuar as assimetrias. A Europa tem de responder nesse sentido, há uma vontade política e uma pequena minoria de bloqueio no Conselho e estamos a trabalhar nisso"", disse António Costa, na mesma entrevista à TSF.
Quanto ao valor que a União Europeia irá alocar para ajudar a economia dos países afetados pela pandemia, o primeiro-ministro disse que as estimativas apontam que ""menos de um bilião é insuficiente para as necessidades"".
""Há três ou quatro países que ainda não perceberam que só são ricos no mercado interno se todos os outros contribuírem para esse mercado interno"", diz o primeiro-ministro.
Em relação aos apoios da UE: ""Não vamos ficar ao nível da fisga"", disse, ""Mas se vamos ficar ao nível da pressão de ar ou da bazuca, ainda não sabemos"", frisou.
Tamém escusou usar o termo austeridad em relação aos tempos que aí vê, ""Não temos de acrescentar medidas de restrição económica. Esta crise precisa é de incentivos para recuperar a economia"", diz António Costa, em entrevista à TSF,
""A austeridade existe quando há uma decisão política, no corte de pensões, ou no aumento de impostos, não é o que está a acontecer"", garante o primeiro-ministro.
""Se for necessário, iremos passar um verão sem discotecas e bares""
""Ainda não está no nosso calendário. Temos de fazer a reabertura de forma gradual, começando pelas áreas onde é mais fácil cumprir normas de distanciamento""., disse o primiero-ministro, em relação à reabertura de bares e discotecas.
""Se for necessário, iremos passar um verão sem discotecas e bares abertos"", admite o primeiro-ministro.
Também ainda não está prevista a abertura de ginásios - o governo está a estudar a forma destes locais abrirem com segurança.
Sobre as polémicas com o 1º de Maio e a possível realização da Festa do Avante, António Costa frisou que ""a democracia não pode estar suspensa, mas tem de se adaptar"" e que ""cada partido tem de cumprir as regras e as normas que existem"".
""Relativamente à proibição de festivais e de eventos até 30 de setembro, há uma proposta de lei que a Assembleia da República irá ainda debater e determinar"", sublinha o primeiro-ministro.
Sobre o 1º de Maio, foi claro: ""O decreto do Estado de Emergência previa exceções"", frisou.",0.9646357051555177,0.9280809565036006,0.9686674216685542,0.970499243570348,0.9668425018839487,"Random Forests
('ranger' package, R 3.5.3.)
Wright MN, Ziegler A (2017). “ranger: A Fast Implementation of Random Forests for High Dimensional Data in C++ and R.” Journal of Statistical Software, 77(1), 1–17. doi: 10.18637/jss.v077.i01.",5479,0.4347048300536673,204,500,20,gini,classification,2020-04-05
