prediction_covid_topic,title,description,authors,date_download,date_publish,maintext,url,gdelt_title,gdelt_url,modeSearch,sourcecountrySearch,termSearch,periodtimeSearch,isOR,countMaximumRecords,urlGDELTV2FTAPI,urlArticleMobile,datetimeArticle,urlImage,domainArticle,languageArticle,countryArticle,pred_input,model_accuracy,model_kappa,model_f1,model_precision,model_recall,model,sample_size,train_prop_covid,mtry,n_tree,min_node_size,splitrule,model_type,fitted_on
1,Benfica volta a treinar no Seixal em 4 de maio após realizar testes,"O Benfica vai regressar aos treinos no centro de estágios do Seixal em 4 de maio, com trabalho individual e em grupos divididos, depois de a equipa técnica e futebolistas serem testados, informou hoje o clube.",Rádio E Televisão De Portugal,2020-04-26 18:16:24,2020-04-26 15:25:46,"""O Sport Lisboa e Benfica cumprirá assim, de forma rigorosa, o acordo de cavalheiros estabelecido por todos os clubes sob o patrocínio da Liga e dará início, desta forma, à designada fase de `Retoma`"", indica o clube no seu site oficial na internet.
O regresso será feito de forma faseada até que os jogadores voltem a pisar os relvados do Seixal, com uma estratégia que obriga à despistagem da covid-19, primeiro já na segunda-feira (27 de abril), com testes à equipa técnica liderada por Bruno Lage e à estrutura do departamento de futebol.
Na terça-feira, será então a vez dos jogadores e familiares, que serão testados nos seus domicílios.
""Após a obtenção destes resultados (sendo estes negativos), os atletas serão avaliados, nas instalações do Seixal, pelo Departamento Médico numa sala preparada para o efeito, em que qualquer dado clínico importante pode ainda ser motivo de eventual isolamento"", referiu Ricardo Antunes, médico do clube.
Ainda antes do regresso aos treinos, os jogadores irão apresentar-se no Seixal em 02 e 03 de maio, num fim de semana que será dedicado a sessões de testes físicos, depois de uma longa paragem competitiva devido à pandemia do novo coronavírus.
Quando arrancarem os treinos individuais na segunda-feira de 04 de maio, os mesmos serão igualmente antecedidos de análises clínicas e o plantel será dividido em quatro grupos, com dois a trabalharem de manhã e outros dois de tarde.
""Não haverá qualquer contacto entre companheiros de equipa. O trabalho no ginásio terá o distanciamento adequado e o trabalho (...)"", explicou o clube, adiantando a proteção de profissionais (fisioterapeutas, médicos e enfermeiros) e que o circuito nas instalações terá sentido único, para minimizar contactos.
No regresso, os jogadores continuarão a receber as refeições em casa e quando estiverem no Seixal terão quartos individuais, com casa de banho privativa, para se equiparem e tomarem banho, deixando de estarem juntos em balneário.
""O futebol do Sport Lisboa e Benfica cumpriu de forma escrupulosa -- e continuará a cumprir -- as normas e recomendações definidas pelas autoridades competentes e jamais deixará de ser parte ativa na constante campanha de pedagogia e educação social que deve perdurar"", adianta o clube.
Na informação na sua página, o campeão nacional em título frisa que o ""contexto é muito particular"", mas que o clube quer ""voltar a jogar e conquistar, em campo, 11 vitórias nos 11 jogos que faltam disputar para se encerrar a temporada 2019/20"".
A I Liga foi suspensa em 12 de março por tempo indeterminado devido à crise sanitária existente com a pandemia do novo coronavírus, num momento em que estavam cumpridas 24 jornadas, com o FC Porto na liderança, com mais um ponto do que os encarnados`.
Desde a suspensão e até hoje, com a jornada deste fim de semana incluída, não se realizaram sete dos 11 jogos que faltariam para terminar a Liga.
A nível global, segundo um balanço da agência de notícias AFP, a pandemia de covid-19 já provocou mais de 200 mil mortos e infetou mais de 2,8 milhões de pessoas em 193 países e territórios.
Perto de 800 mil doentes foram considerados curados.
Em Portugal, morreram 880 pessoas das 23.392 confirmadas como infetadas, e há 1.277 casos recuperados, de acordo com a Direção-Geral da Saúde.
A doença é transmitida por um novo coronavírus detetado no final de dezembro, em Wuhan, uma cidade do centro da China.
Para combater a pandemia, os governos mandaram para casa 4,5 mil milhões de pessoas (mais de metade da população do planeta), encerraram o comércio não essencial e reduziram drasticamente o tráfego aéreo, paralisando setores inteiros da economia mundial.
Face a uma diminuição de novos doentes em cuidados intensivos e de contágios, alguns países começaram, entretanto, a desenvolver planos de redução do confinamento e em alguns casos, como Dinamarca, Áustria, Espanha ou Alemanha, a aliviar algumas das medidas.",https://www.rtp.pt/noticias/benfica/benfica-volta-a-treinar-no-seixal-em-4-de-maio-apos-realizar-testes_d1223856,Benfica volta a treinar no Seixal em 4 de maio após realizar testes,https://www.rtp.pt/noticias/benfica/benfica-volta-a-treinar-no-seixal-em-4-de-maio-apos-realizar-testes_d1223856,artlist,PO,,100 minutes,FALSE,250,https://api.gdeltproject.org/api/v2/doc/doc?query=%20sourcecountry:po&sourcelang:por&mode=artlist&format=json&timespan=100&maxrecords=250&sort=datedesc,NA,2020-04-26T13:15:00Z,"https://cdn-images.rtp.pt/icm/noticias/images/71/71421aa4941c0975c652b3c140013d48?&q=90&rect=0,146,1233,676&auto=format",rtp.pt,Portuguese,Portugal,"""O Sport Lisboa e Benfica cumprirá assim, de forma rigorosa, o acordo de cavalheiros estabelecido por todos os clubes sob o patrocínio da Liga e dará início, desta forma, à designada fase de `Retoma`"", indica o clube no seu site oficial na internet.
O regresso será feito de forma faseada até que os jogadores voltem a pisar os relvados do Seixal, com uma estratégia que obriga à despistagem da covid-19, primeiro já na segunda-feira (27 de abril), com testes à equipa técnica liderada por Bruno Lage e à estrutura do departamento de futebol.
Na terça-feira, será então a vez dos jogadores e familiares, que serão testados nos seus domicílios.
""Após a obtenção destes resultados (sendo estes negativos), os atletas serão avaliados, nas instalações do Seixal, pelo Departamento Médico numa sala preparada para o efeito, em que qualquer dado clínico importante pode ainda ser motivo de eventual isolamento"", referiu Ricardo Antunes, médico do clube.
Ainda antes do regresso aos treinos, os jogadores irão apresentar-se no Seixal em 02 e 03 de maio, num fim de semana que será dedicado a sessões de testes físicos, depois de uma longa paragem competitiva devido à pandemia do novo coronavírus.
Quando arrancarem os treinos individuais na segunda-feira de 04 de maio, os mesmos serão igualmente antecedidos de análises clínicas e o plantel será dividido em quatro grupos, com dois a trabalharem de manhã e outros dois de tarde.
""Não haverá qualquer contacto entre companheiros de equipa. O trabalho no ginásio terá o distanciamento adequado e o trabalho (...)"", explicou o clube, adiantando a proteção de profissionais (fisioterapeutas, médicos e enfermeiros) e que o circuito nas instalações terá sentido único, para minimizar contactos.
No regresso, os jogadores continuarão a receber as refeições em casa e quando estiverem no Seixal terão quartos individuais, com casa de banho privativa, para se equiparem e tomarem banho, deixando de estarem juntos em balneário.
""O futebol do Sport Lisboa e Benfica cumpriu de forma escrupulosa -- e continuará a cumprir -- as normas e recomendações definidas pelas autoridades competentes e jamais deixará de ser parte ativa na constante campanha de pedagogia e educação social que deve perdurar"", adianta o clube.
Na informação na sua página, o campeão nacional em título frisa que o ""contexto é muito particular"", mas que o clube quer ""voltar a jogar e conquistar, em campo, 11 vitórias nos 11 jogos que faltam disputar para se encerrar a temporada 2019/20"".
A I Liga foi suspensa em 12 de março por tempo indeterminado devido à crise sanitária existente com a pandemia do novo coronavírus, num momento em que estavam cumpridas 24 jornadas, com o FC Porto na liderança, com mais um ponto do que os encarnados`.
Desde a suspensão e até hoje, com a jornada deste fim de semana incluída, não se realizaram sete dos 11 jogos que faltariam para terminar a Liga.
A nível global, segundo um balanço da agência de notícias AFP, a pandemia de covid-19 já provocou mais de 200 mil mortos e infetou mais de 2,8 milhões de pessoas em 193 países e territórios.
Perto de 800 mil doentes foram considerados curados.
Em Portugal, morreram 880 pessoas das 23.392 confirmadas como infetadas, e há 1.277 casos recuperados, de acordo com a Direção-Geral da Saúde.
A doença é transmitida por um novo coronavírus detetado no final de dezembro, em Wuhan, uma cidade do centro da China.
Para combater a pandemia, os governos mandaram para casa 4,5 mil milhões de pessoas (mais de metade da população do planeta), encerraram o comércio não essencial e reduziram drasticamente o tráfego aéreo, paralisando setores inteiros da economia mundial.
Face a uma diminuição de novos doentes em cuidados intensivos e de contágios, alguns países começaram, entretanto, a desenvolver planos de redução do confinamento e em alguns casos, como Dinamarca, Áustria, Espanha ou Alemanha, a aliviar algumas das medidas.",0.9646357051555177,0.9280809565036006,0.9686674216685542,0.970499243570348,0.9668425018839487,"Random Forests
('ranger' package, R 3.5.3.)
Wright MN, Ziegler A (2017). “ranger: A Fast Implementation of Random Forests for High Dimensional Data in C++ and R.” Journal of Statistical Software, 77(1), 1–17. doi: 10.18637/jss.v077.i01.",5479,0.4347048300536673,204,500,20,gini,classification,2020-04-05
1,"Trump diz que anda a ""perder tempo"" com conferências de imprensa diárias","Líder dos Estados Unidos fala em ""questões hostis"".",Global Media Group,2020-04-26 18:16:25,2020-04-26 14:29:00,"Líder dos Estados Unidos fala em ""questões hostis"".
O presidente dos Estados Unidos, Donald Trump, afirmou este domingo que não vale a pena ""perder tempo"" em conferências de imprensa diárias relativas à pandemia de covid-1, em que apenas são colocadas ""questões hostis"".
""Qual é o objetivo de ter conferências de imprensa na Casa Branca quando a comunicação social não faz senão questões hostis e depois não relata a verdade e os factos com precisão"", escreveu Trump na sua conta do Twitter.
""O povo americano não tem senão falsas notícias. Assim não vale o tempo nem o esforço"", acrescentou.
O tweet do presidente norte-americano surge dois dias depois de, numa conferência de imprensa, ter feito defendido que se devia investigar a possibilidade de tratar a doença injetando desinfetante no corpo. ""Considero que o desinfetante o trata [o novo coronavírus] num minuto. Será possível haver uma injeção?"", questionou.
Não Perca FC Porto ""Corona é o melhor jogador do FC Porto, uma delícia e pode chegar onde quiser"" ENTREVISTA (parte 3) - Óliver, médio do Sevilha, em exclusivo a O JOGO: 0 espanhol não acredita que faça sentido compará-lo a Uribe e destaca o papel de Sérgio Oliveira nos últimos tempos. Uma viagem por posições e uma certeza absoluta quanto a Tecatito: é incrível
Logo na sexta-feira, a Casa Branca esclareceu que o presidente foi mal interpretado e o próprio afirmou que se tinha expressado ""de forma sarcástica"", terminando a conferência de imprensa ao fim de 20 minutos sem direito a questões pelos jornalistas.
A hipótese de terminar com as conferências de imprensa surge também numa altura em que a Casa Branca prepara o plano para retomar a economia.
Depois de 50 conferências de imprensa em dois meses, no sábado não houve o habitual briefing na Casa Branca.",https://www.ojogo.pt/covid-19/trump-diz-que-anda-a-perder-tempo-com-conferencias-de-imprensa-diarias-12118739.html,Trump diz que anda a ″ perder tempo ″ com conferências de imprensa diárias,https://www.ojogo.pt/covid-19/trump-diz-que-anda-a-perder-tempo-com-conferencias-de-imprensa-diarias-12118739.html,artlist,PO,,100 minutes,FALSE,250,https://api.gdeltproject.org/api/v2/doc/doc?query=%20sourcecountry:po&sourcelang:por&mode=artlist&format=json&timespan=100&maxrecords=250&sort=datedesc,https://www.ojogo.pt/covid-19/amp/trump-diz-que-anda-a-perder-tempo-com-conferencias-de-imprensa-diarias-12118739.html,2020-04-26T13:15:00Z,https://static.globalnoticias.pt/oj/image.aspx?brand=OJ&type=generate&guid=490796ab-aab2-419f-8e10-c430c3b25033&watermark=true&t=20200426122900,ojogo.pt,Portuguese,Portugal,"Líder dos Estados Unidos fala em ""questões hostis"".
O presidente dos Estados Unidos, Donald Trump, afirmou este domingo que não vale a pena ""perder tempo"" em conferências de imprensa diárias relativas à pandemia de covid-1, em que apenas são colocadas ""questões hostis"".
""Qual é o objetivo de ter conferências de imprensa na Casa Branca quando a comunicação social não faz senão questões hostis e depois não relata a verdade e os factos com precisão"", escreveu Trump na sua conta do Twitter.
""O povo americano não tem senão falsas notícias. Assim não vale o tempo nem o esforço"", acrescentou.
O tweet do presidente norte-americano surge dois dias depois de, numa conferência de imprensa, ter feito defendido que se devia investigar a possibilidade de tratar a doença injetando desinfetante no corpo. ""Considero que o desinfetante o trata [o novo coronavírus] num minuto. Será possível haver uma injeção?"", questionou.
Não Perca FC Porto ""Corona é o melhor jogador do FC Porto, uma delícia e pode chegar onde quiser"" ENTREVISTA (parte 3) - Óliver, médio do Sevilha, em exclusivo a O JOGO: 0 espanhol não acredita que faça sentido compará-lo a Uribe e destaca o papel de Sérgio Oliveira nos últimos tempos. Uma viagem por posições e uma certeza absoluta quanto a Tecatito: é incrível
Logo na sexta-feira, a Casa Branca esclareceu que o presidente foi mal interpretado e o próprio afirmou que se tinha expressado ""de forma sarcástica"", terminando a conferência de imprensa ao fim de 20 minutos sem direito a questões pelos jornalistas.
A hipótese de terminar com as conferências de imprensa surge também numa altura em que a Casa Branca prepara o plano para retomar a economia.
Depois de 50 conferências de imprensa em dois meses, no sábado não houve o habitual briefing na Casa Branca.",0.9646357051555177,0.9280809565036006,0.9686674216685542,0.970499243570348,0.9668425018839487,"Random Forests
('ranger' package, R 3.5.3.)
Wright MN, Ziegler A (2017). “ranger: A Fast Implementation of Random Forests for High Dimensional Data in C++ and R.” Journal of Statistical Software, 77(1), 1–17. doi: 10.18637/jss.v077.i01.",5479,0.4347048300536673,204,500,20,gini,classification,2020-04-05
1,Dois refugiados em Portugal: candidatos a Tóquio'2020 e um já em arquitetura,"O COI permitiu, pela primeira vez, que uma equipa de refugiados de todo o mundo competisse no Rio'2016, desafio bem-sucedido e que se repetirá em Tóquio'2020.",Global Media Group,2020-04-26 18:16:28,2020-04-26 13:07:00,"O COI permitiu, pela primeira vez, que uma equipa de refugiados de todo o mundo competisse no Rio'2016, desafio bem-sucedido e que se repetirá em Tóquio'2020.
O pugilista afegão Farid Walizadeh e o velocista congolês Dorian Keletela são os refugiados em Portugal candidatos a competir em Tóquio2020 através do programa de Solidariedade Olímpica, sendo perfeitos exemplos de inclusão social através do desporto.
""Temos de momentos dois jovens em vias de poder participar nos Jogos Olímpicos de Tóquio'2020. Estariam ambos já nas fases de qualificação se não tivesse havido a pandemia, mas continuam no programa, segundo a informação do Comité Olímpico Internacional (COI). Continuam a integrar a possível equipa, contudo precisam de mínimos para se qualificar"", esclareceu a responsável pelo projeto do Comité Olímpico de Portugal (COP).
Maria Machado, coordenadora do projeto ""Viver o desporto, abraçar o futuro"", que o COP promove desde 2016 e que nestes anos já envolveu entre ""1.200 a 1.400 refugiados"", acredita que os dois jovens têm ""grande potencial"" para cumprirem o sonho olímpico em Tóquio2020.
O COI permitiu, pela primeira vez, que uma equipa de refugiados de todo o mundo competisse no Rio'2016, desafio bem-sucedido e que agora se repete nos Jogos Olímpicos que se irão disputar no verão de 2021.
NÃO SAIA DE CASA, LEIA O JOGO NO E-PAPER. CUIDE DE SI, CUIDE DE TODOS
Várias condicionantes impediram Portugal de ser representado nessa delegação no Brasil, no entanto, agora, há a ""grande esperança"" de que Farid Walizadeh e Dorian Keletela - que devido à covid-19 estão a treinar sozinhos, mas orientados - façam história no desporto solidário em Portugal.
Na altura em que a crise de refugiados na Europa se fez sentir de forma mais severa, o COP avançou para a ideia ""que pretende utilizar o valor social do desporto para integração dos refugiados na sociedade portuguesa"".
""O programa não se destina exclusivamente a atletas, tem a intenção da integração. Desde 2016, a ideia é que todos os refugiados, independentemente do género, idade, origem, participem. O objetivo era proporcionar-lhes atividade desportiva para se poderem integrar na comunidade portuguesa"", reforçou em declarações à agência Lusa.
Maria Machado diz que o ""Viver o desporto, abraçar o futuro"" já ajudou ""a grande maioria, 65% dos refugiados chegados a Portugal, sobretudo os mais jovens e do sexo masculino que gostam de jogar futebol"", revelando que os que ""sobressaem passam a ter uma relação diferente com o desporto"", podendo construir uma carreira a partir das suas aptidões.
O ""Viver o desporto, abraçar o futuro"" tem contado com a ajuda de federações, clubes, diversas empresas e instituições, que assim permitem aos refugiados uma melhor inclusão, que no desporto tem passado ainda pelo basquetebol, andebol, natação, taekwondo, artes marciais e kickboxing.
""A ideia não é criar equipas de refugiados, mas que estes se integrem em equipas, em colaboração com as federações, clubes, diversas instituições e parceiros"", esclareceu.
O orgulho do COP é ainda maior quanto à história do jovem afegão Farid que, depois de anos de superação face a inúmeros obstáculos de vida, chegou a Portugal sem ""arranhar"" uma única palavra da língua e neste momento já está no ensino superior a cumprir o sonho da arquitetura.
""Não sabia uma palavra de português e já está no primeiro ano na Universidade de arquitetura. É um orgulho. História de resiliência e vida incríveis. Mesmo que não vá a Tóquio'2020, já é uma história de sucesso e o desporto já tem uma quota parte importante de contributo para isso"", concluiu.",https://www.ojogo.pt/modalidades/noticias/dois-refugiados-em-portugal-candidatos-a-toquio2020-e-um-ja-em-arquitetura-12118609.html,Dois refugiados em Portugal : candidatos a Tóquio  2020 e um já em arquitetura,https://www.ojogo.pt/modalidades/noticias/dois-refugiados-em-portugal-candidatos-a-toquio2020-e-um-ja-em-arquitetura-12118609.html,artlist,PO,,100 minutes,FALSE,250,https://api.gdeltproject.org/api/v2/doc/doc?query=%20sourcecountry:po&sourcelang:por&mode=artlist&format=json&timespan=100&maxrecords=250&sort=datedesc,https://www.ojogo.pt/modalidades/noticias/amp/dois-refugiados-em-portugal-candidatos-a-toquio2020-e-um-ja-em-arquitetura-12118609.html,2020-04-26T13:15:00Z,https://static.globalnoticias.pt/oj/image.aspx?brand=OJ&type=generate&guid=e48706e5-f10a-4a34-a5a2-f4304b9f148d&watermark=true&t=20200426110700,ojogo.pt,Portuguese,Portugal,"O COI permitiu, pela primeira vez, que uma equipa de refugiados de todo o mundo competisse no Rio'2016, desafio bem-sucedido e que se repetirá em Tóquio'2020.
O pugilista afegão Farid Walizadeh e o velocista congolês Dorian Keletela são os refugiados em Portugal candidatos a competir em Tóquio2020 através do programa de Solidariedade Olímpica, sendo perfeitos exemplos de inclusão social através do desporto.
""Temos de momentos dois jovens em vias de poder participar nos Jogos Olímpicos de Tóquio'2020. Estariam ambos já nas fases de qualificação se não tivesse havido a pandemia, mas continuam no programa, segundo a informação do Comité Olímpico Internacional (COI). Continuam a integrar a possível equipa, contudo precisam de mínimos para se qualificar"", esclareceu a responsável pelo projeto do Comité Olímpico de Portugal (COP).
Maria Machado, coordenadora do projeto ""Viver o desporto, abraçar o futuro"", que o COP promove desde 2016 e que nestes anos já envolveu entre ""1.200 a 1.400 refugiados"", acredita que os dois jovens têm ""grande potencial"" para cumprirem o sonho olímpico em Tóquio2020.
O COI permitiu, pela primeira vez, que uma equipa de refugiados de todo o mundo competisse no Rio'2016, desafio bem-sucedido e que agora se repete nos Jogos Olímpicos que se irão disputar no verão de 2021.
NÃO SAIA DE CASA, LEIA O JOGO NO E-PAPER. CUIDE DE SI, CUIDE DE TODOS
Várias condicionantes impediram Portugal de ser representado nessa delegação no Brasil, no entanto, agora, há a ""grande esperança"" de que Farid Walizadeh e Dorian Keletela - que devido à covid-19 estão a treinar sozinhos, mas orientados - façam história no desporto solidário em Portugal.
Na altura em que a crise de refugiados na Europa se fez sentir de forma mais severa, o COP avançou para a ideia ""que pretende utilizar o valor social do desporto para integração dos refugiados na sociedade portuguesa"".
""O programa não se destina exclusivamente a atletas, tem a intenção da integração. Desde 2016, a ideia é que todos os refugiados, independentemente do género, idade, origem, participem. O objetivo era proporcionar-lhes atividade desportiva para se poderem integrar na comunidade portuguesa"", reforçou em declarações à agência Lusa.
Maria Machado diz que o ""Viver o desporto, abraçar o futuro"" já ajudou ""a grande maioria, 65% dos refugiados chegados a Portugal, sobretudo os mais jovens e do sexo masculino que gostam de jogar futebol"", revelando que os que ""sobressaem passam a ter uma relação diferente com o desporto"", podendo construir uma carreira a partir das suas aptidões.
O ""Viver o desporto, abraçar o futuro"" tem contado com a ajuda de federações, clubes, diversas empresas e instituições, que assim permitem aos refugiados uma melhor inclusão, que no desporto tem passado ainda pelo basquetebol, andebol, natação, taekwondo, artes marciais e kickboxing.
""A ideia não é criar equipas de refugiados, mas que estes se integrem em equipas, em colaboração com as federações, clubes, diversas instituições e parceiros"", esclareceu.
O orgulho do COP é ainda maior quanto à história do jovem afegão Farid que, depois de anos de superação face a inúmeros obstáculos de vida, chegou a Portugal sem ""arranhar"" uma única palavra da língua e neste momento já está no ensino superior a cumprir o sonho da arquitetura.
""Não sabia uma palavra de português e já está no primeiro ano na Universidade de arquitetura. É um orgulho. História de resiliência e vida incríveis. Mesmo que não vá a Tóquio'2020, já é uma história de sucesso e o desporto já tem uma quota parte importante de contributo para isso"", concluiu.",0.9646357051555177,0.9280809565036006,0.9686674216685542,0.970499243570348,0.9668425018839487,"Random Forests
('ranger' package, R 3.5.3.)
Wright MN, Ziegler A (2017). “ranger: A Fast Implementation of Random Forests for High Dimensional Data in C++ and R.” Journal of Statistical Software, 77(1), 1–17. doi: 10.18637/jss.v077.i01.",5479,0.4347048300536673,204,500,20,gini,classification,2020-04-05
