prediction_covid_topic,title,description,authors,date_download,date_publish,maintext,url,gdelt_title,gdelt_url,modeSearch,sourcecountrySearch,termSearch,periodtimeSearch,isOR,countMaximumRecords,urlGDELTV2FTAPI,urlArticleMobile,datetimeArticle,urlImage,domainArticle,languageArticle,countryArticle,pred_input,model_accuracy,model_kappa,model_f1,model_precision,model_recall,model,sample_size,train_prop_covid,mtry,n_tree,min_node_size,splitrule,model_type,fitted_on
1,"Covid-19. Regresso do futebol só com o ""sim"" dos técnicos de saúde","O primeiro-ministro salientou que a retoma das competições de futebol terá de ser sustentada ""em fundamentos técnicos de saúde"" por causa da covid-19, avisando que não se poderão correr riscos que coloquem em causa atletas e adeptos.",Rádio E Televisão De Portugal,2020-04-29 15:19:13,2020-04-29 11:46:40,"O primeiro-ministro salientou que a retoma das competições de futebol terá de ser sustentada ""em fundamentos técnicos de saúde"" por causa da covid-19, avisando que não se poderão correr riscos que coloquem em causa atletas e adeptos.
Esta mensagem foi transmitida por António Costa na sua conta pessoal da rede social Instagram, depois de ter recebido em São Bento os presidentes da Federação Portuguesa de Futebol, Fernando Gomes, da Liga Portuguesa de Futebol Profissional, Pedro Proença, do Sporting, Frederico Varandas, do FC Porto, Jorge Nuno Pinto da Costa, e do Benfica, Luís Filipe Vieira.
Segundo o primeiro-ministro, nesta reunião, em que foram analisadas as condições para um regresso das competições profissionais de futebol, houve ""uma discussão franca e aberta""."", advertiu o líder do executivo.
Na sua mensagem, o primeiro-ministro fez também uma referência à importância do futebol na sociedade portuguesa."", insistiu.A reunião, que juntou na mesma sala Pinto da Costa, Luís Filipe Vieira e Frederico Varandas, teve como tema central a ""análise aos termos em que pode ser efetuada a retoma dos campeonatos profissionais e o levantamento de restrições na área do desporto"".No que se refere ao regresso das competições de futebol profissional, a Liga Portuguesa de Futebol defende que os clubes deve garantir a higienização nos estádios após a retoma das competições e que à FPF cabe a responsabilidade por testes à covid-19 nas equipas de arbitragem.Num esboço sobre a retoma progressiva à competição elaborado pela Liga Portuguesa de Futebol Profissional (LPFP), a que a agência Lusa teve acesso, refere-se que o regresso da I e II Liga estará sempre """", prevendo-se também um conjunto de regras que os clubes devem cumprir, como a higienização de ""todos os espaços"" e a disponibilização de desinfetante nos balneários.Durante os jogos, as tribunas presidenciais deverão ter um número máximo de cinco elementos, ""com distanciamento social e uso de equipamento de proteção, nomeadamente máscaras, luvas e desinfetantes"".A principal prova do calendário nacional, cuja ronda 24 terminou em 8 de março, não tem, para já, data de regresso, sendo que está suspensa indefinidamente.Já a 24.ª jornada da II Liga terminou em 9 de março e desde então a prova também está suspensa.",https://www.rtp.pt/noticias/futebol-nacional/covid-19-regresso-do-futebol-so-com-o-sim-dos-tecnicos-de-saude_d1224614,Covid - 19 . Regresso do futebol só com o  sim  dos técnicos de saúde,https://www.rtp.pt/noticias/futebol-nacional/covid-19-regresso-do-futebol-so-com-o-sim-dos-tecnicos-de-saude_d1224614,artlist,PO,,100 minutes,FALSE,250,https://api.gdeltproject.org/api/v2/doc/doc?query=%20sourcecountry:po&sourcelang:por&mode=artlist&format=json&timespan=100&maxrecords=250&sort=datedesc,NA,2020-04-29T10:15:00Z,"https://cdn-images.rtp.pt/icm/noticias/images/f6/f63f95e04dc9bd4630e34eea6d8757f1?&q=90&rect=0,311,2623,1438&auto=format",rtp.pt,Portuguese,Portugal,"O primeiro-ministro salientou que a retoma das competições de futebol terá de ser sustentada ""em fundamentos técnicos de saúde"" por causa da covid-19, avisando que não se poderão correr riscos que coloquem em causa atletas e adeptos.
Esta mensagem foi transmitida por António Costa na sua conta pessoal da rede social Instagram, depois de ter recebido em São Bento os presidentes da Federação Portuguesa de Futebol, Fernando Gomes, da Liga Portuguesa de Futebol Profissional, Pedro Proença, do Sporting, Frederico Varandas, do FC Porto, Jorge Nuno Pinto da Costa, e do Benfica, Luís Filipe Vieira.
Segundo o primeiro-ministro, nesta reunião, em que foram analisadas as condições para um regresso das competições profissionais de futebol, houve ""uma discussão franca e aberta""."", advertiu o líder do executivo.
Na sua mensagem, o primeiro-ministro fez também uma referência à importância do futebol na sociedade portuguesa."", insistiu.A reunião, que juntou na mesma sala Pinto da Costa, Luís Filipe Vieira e Frederico Varandas, teve como tema central a ""análise aos termos em que pode ser efetuada a retoma dos campeonatos profissionais e o levantamento de restrições na área do desporto"".No que se refere ao regresso das competições de futebol profissional, a Liga Portuguesa de Futebol defende que os clubes deve garantir a higienização nos estádios após a retoma das competições e que à FPF cabe a responsabilidade por testes à covid-19 nas equipas de arbitragem.Num esboço sobre a retoma progressiva à competição elaborado pela Liga Portuguesa de Futebol Profissional (LPFP), a que a agência Lusa teve acesso, refere-se que o regresso da I e II Liga estará sempre """", prevendo-se também um conjunto de regras que os clubes devem cumprir, como a higienização de ""todos os espaços"" e a disponibilização de desinfetante nos balneários.Durante os jogos, as tribunas presidenciais deverão ter um número máximo de cinco elementos, ""com distanciamento social e uso de equipamento de proteção, nomeadamente máscaras, luvas e desinfetantes"".A principal prova do calendário nacional, cuja ronda 24 terminou em 8 de março, não tem, para já, data de regresso, sendo que está suspensa indefinidamente.Já a 24.ª jornada da II Liga terminou em 9 de março e desde então a prova também está suspensa.",0.9646357051555177,0.9280809565036006,0.9686674216685542,0.970499243570348,0.9668425018839487,"Random Forests
('ranger' package, R 3.5.3.)
Wright MN, Ziegler A (2017). “ranger: A Fast Implementation of Random Forests for High Dimensional Data in C++ and R.” Journal of Statistical Software, 77(1), 1–17. doi: 10.18637/jss.v077.i01.",5479,0.4347048300536673,204,500,20,gini,classification,2020-04-05
1,Covid-19. Como vai funcionar a app de rastreamento de contactos em Portugal?,"Está prestes a chegar a Portugal uma aplicação para o rastreamento de contactos que servirá como medida de reforço contra a Covid-19, permitindo a cada pessoa saber se esteve próxima de alguém infetado. Seguindo critérios recentemente impostos pela Comissão Europeia, esta app para smartphones deverá garantir a privacidade dos dados de todos os cidadãos e apenas será instalada por quem decidir fazê-lo. Explicamos aqui como funcionará esta nova ferramenta, que se encontra em desenvolvimento também noutros países e que poderá funcionar a nível transfronteiriço.",Rádio E Televisão De Portugal,2020-04-29 15:19:30,2020-04-29 12:43:08,"“As aplicações para telemóveis podem ajudar as autoridades de saúde a nível nacional e europeu a monitorizar e a mitigar a pandemia de Covid-19, facilitando o acompanhamento de doentes e guiando os restantes cidadãos”. Quem o defende é a Comissão Europeia, num documento no qual explica que as apps de rastreamento de contactos se têm revelado “as mais promissoras”.
Até agora, o rastreamento de contactos de cada doente com Covid-19 nos vários países tem sido feito manualmente pelas autoridades de saúde pública, que entrevistam os infetados para determinar com quem estiveram em contacto a partir das 48 horas anteriores ao aparecimento de sintomas. Para além de demorado, este processo não é 100 por cento eficaz, uma vez que depende da memória dos pacientes sobre com quem se cruzaram e durante quanto tempo.
É para melhorar este rastreamento que servem as aplicações para telemóveis. De acordo com Bruxelas, se pelo menos 50 por cento da população de cada país instalar a app, a sua utilização será “útil” para a mais rápida deteção de eventuais casos de Covid-19 e para a interrupção de cadeias de transmissão do vírus.
No entanto, o rastreamento manual de contactos continuará a desempenhar um papel fundamental, em especial para aqueles que não têm acesso ao dispositivo necessário para a instalação da app, nomeadamente idosos.
Para que todos os países europeus que se encontram atualmente a desenvolver este tipo de aplicações possam funcionar em sintonia, garantindo acima de tudo a segurança e a privacidade dos utilizadores, a Comissão Europeia lançou um guia com as diretrizes a serem seguidas para os Estados-membros. Todas as aplicações devem:
Quanto a prazos, a Comissão Europeia esclarece que até 30 de abril as autoridades de saúde pública irão avaliar a eficácia das aplicações desenvolvidas, quer a nível nacional quer a nível transfronteiriço. Cada Estado-membro deve, até 31 de maio, apresentar um relatório sobre as ações que desempenhou neste âmbito.
Quando as apps já estiverem no ativo, caberá a Bruxelas avaliar os progressos alcançados, publicando a partir de junho de 2020 e durante toda a crise relatórios periódicos com a recomendação de ações ou do levantamento de restrições que já não considere necessárias.
Como deverá funcionar a app portuguesa?
Em Portugal, o funcionamento de uma aplicação de rastreamento deverá estar para “muito em breve”, segundo declarações recentes do secretário de Estado para a Transição Digital, André de Aragão Azevedo, ao Observador. A medida também foi já admitida pelo primeiro-ministro, António Costa.
Tendo em conta as diretrizes da Comissão Europeia, é já possível prever como irá funcionar esta tecnologia, que deverá também em breve ser adotada segundo os padrões de Bruxelas em países como a Alemanha, Espanha, França, Reino Unido ou Estónia.
Em comum, estes países possuem outro fator: estão a desenvolver as suas aplicações em estreita colaboração com a iniciativa europeia Rastreamento Pan-Europeu de Proximidade e de Preservação da Privacidade (PEPP-PT), composta por grandes empresas europeias e universidades e cujo objetivo é apoiar os países que se encontram a trabalhar em aplicações que vão ao encontro dos critérios da Comissão Europeia.
As aplicações que forem desenvolvidas ao abrigo da PEPP-PT seguirão um critério obrigatório para garantir a privacidade da população: utilizarão o sistema de Bluetooth dos telemóveis, e não o de GPS. Além disso, cada smartphone emitirá um ID numérico para o utilizador, temporário e anónimo, pelo que a identidade das pessoas será sempre protegida. O sistema PEPP-PT também não permite que sejam registadas geolocalizações.
“Os eventos mais antigos do histórico de proximidade são apagados quando se tornam sem importância do ponto de vista epidemiológico”, garante a PEPP-PT no seu site oficial. Ou seja, apenas ficam guardados os contactos de proximidade “que possam ser relevantes para a transmissão do vírus”.
Como vão estar interligadas as aplicações de diferentes países?
Apps de outros países estão menos focadas na privacidade
Regresso à normalidade?
Num cenário em que se prevê a existência de uma aplicação em cada Estado-membro da UE, Bruxelas salientou a importância de que estasestejam interligadas, de modo a que um cidadão que se desloque a outro país continue informado no caso de se aproximar de alguém infetado., escreveu a Comissão Europeia no guia aos Estados-membros.A iniciativa PEPP-PT irá permitir esta interligação entre asque sejam desenvolvidas ao seu abrigo. Quando um utilizador daé diagnosticado com Covid-19 e autoriza a partilha desse diagnóstico com os utilizadores com quem esteve em proximidade (sem que nenhum dos indivíduos tenha conhecimento da identidade do outro), essa informação chega a todas as aplicações que estejam ligadas ao sistema PEPP-PT, incluindo asde países estrangeiros.Como?Assim, um utilizador da app A que esteja em contacto com um utilizador da app B será na mesma alertado se mais tarde as autoridades de saúde concluírem que o segundo estava infetado, ou vice-versa, apesar de serem cidadãos de países diferentes.Não só países europeus estão motivados no desenvolvimento de aplicações de rastreamento de contacto. A própria iniciativa PEPP-PT refere, no seuoficial, que se baseou no exemplo de sucesso de alguns países asiáticos que já têm este tipo deem funcionamento. A diferença entre esses países e os Estados-membros que colaboram com a PEPP-PT reside, fundamentalmente, na privacidade e proteção de dados que Bruxelas impõe.A Comissão Europeia explica que“O Ministério da Saúde desenvolveu uma aplicação de rastreamento de contactos [por Bluetooth] que envia uma notificação àqueles que estiveram em proximidade com pacientes infetados”, à semelhança do que se planeia agora para a UE, menciona Bruxelas.No entanto,O nome do paciente é ocultado, sendo-lhe atribuído um número.Na China, o Governo atribui a cada cidadão um código QR com uma cor específica conforme os sintomas que registaram ou as pessoas com quem estiveram em contacto: verde para quem não precisa de se isolar, amarelo para quem deve cumprir sete dias de isolamento e vermelho se forem necessários 14 dias de isolamento.para rastrear os movimentos dos doentes infetados pelo novo coronavírus e estabelecer as cadeias de transmissão.As autoridades sul-coreanas publicam ainda numdo Governo o histórico de localização de cada pessoa com Covid-19 e outros detalhes sobre os doentes, entre os quais quando saíram para trabalhar, se utilizaram máscaras nos transportes públicos, os espaços de lazer que frequentaram e os nomes das unidades de saúde onde realizaram o teste.Já nos Estados Unidos,. Vários membros do Congresso dos EUA apelaram, entretanto, a Donald Trump para que tenha em consideração a proteção da privacidade dos cidadãos.O novo coronavírus já infetou mais de três milhões de pessoas a nível global desde que surgiu pela primeira vez na China, em dezembro. As mortes superam as 200 mil em todo o mundo. Portugal, elogiado internacionalmente pela forma como tem lidado com a pandemia, encontra-se em estado de emergência até 2 de maio, data após a qual se prevê que comecem a ser gradualmente levantadas algumas das medidas impostas à população.Vários estabelecimentos comerciais deverão começar a reabrir no dia 4 de maio e muitos portugueses que estão atualmente em casa vão regressar ao trabalho, pelo quePara que esse risco de contágio seja o menor possível nesta fase de transição, torna-se necessária a implementação de medidas de segurança adicionais, sendo uma delas a utilização, pelo maior número de pessoas possível, dade rastreamento de contactos que estará disponível em breve., elucida a Comissão Europeia. “Estão a procurar unir-se no uso de ferramentas de saúde digitais que tenham um papel significativo na luta contra a pandemia. Implementarde rastreamento pela UE é um importante primeiro passo nesse sentido”.Mesmo quem não instale a aplicação beneficiará da sua existência, uma vez que quem a usar poderá levar à interrupção de cadeias de transmissão da doença que, caso contrário, permaneceriam ativas e em crescimento.Seja qual for aescolhida para acompanhar o dia-a-dia dos portugueses durante a fase de transição, uma coisa é certa: terá de estar de acordo com o regulamento europeu da proteção de dados e com os valores constitucionais, garantiu recentemente António Costa.",https://www.rtp.pt/noticias/pais/covid-19-como-vai-funcionar-a-app-de-rastreamento-de-contactos-em-portugal_es1224356,Covid - 19 . Como vai funcionar a app de rastreamento de contactos em Portugal ? ,https://www.rtp.pt/noticias/pais/covid-19-como-vai-funcionar-a-app-de-rastreamento-de-contactos-em-portugal_es1224356,artlist,PO,,100 minutes,FALSE,250,https://api.gdeltproject.org/api/v2/doc/doc?query=%20sourcecountry:po&sourcelang:por&mode=artlist&format=json&timespan=100&maxrecords=250&sort=datedesc,NA,2020-04-29T10:15:00Z,"https://cdn-images.rtp.pt/icm/noticias/images/d4/d42aceb578dc493ac300211fd1c4a9fa?&q=90&rect=0,129,2500,1111&auto=format",rtp.pt,Portuguese,Portugal,"“As aplicações para telemóveis podem ajudar as autoridades de saúde a nível nacional e europeu a monitorizar e a mitigar a pandemia de Covid-19, facilitando o acompanhamento de doentes e guiando os restantes cidadãos”. Quem o defende é a Comissão Europeia, num documento no qual explica que as apps de rastreamento de contactos se têm revelado “as mais promissoras”.
Até agora, o rastreamento de contactos de cada doente com Covid-19 nos vários países tem sido feito manualmente pelas autoridades de saúde pública, que entrevistam os infetados para determinar com quem estiveram em contacto a partir das 48 horas anteriores ao aparecimento de sintomas. Para além de demorado, este processo não é 100 por cento eficaz, uma vez que depende da memória dos pacientes sobre com quem se cruzaram e durante quanto tempo.
É para melhorar este rastreamento que servem as aplicações para telemóveis. De acordo com Bruxelas, se pelo menos 50 por cento da população de cada país instalar a app, a sua utilização será “útil” para a mais rápida deteção de eventuais casos de Covid-19 e para a interrupção de cadeias de transmissão do vírus.
No entanto, o rastreamento manual de contactos continuará a desempenhar um papel fundamental, em especial para aqueles que não têm acesso ao dispositivo necessário para a instalação da app, nomeadamente idosos.
Para que todos os países europeus que se encontram atualmente a desenvolver este tipo de aplicações possam funcionar em sintonia, garantindo acima de tudo a segurança e a privacidade dos utilizadores, a Comissão Europeia lançou um guia com as diretrizes a serem seguidas para os Estados-membros. Todas as aplicações devem:
Quanto a prazos, a Comissão Europeia esclarece que até 30 de abril as autoridades de saúde pública irão avaliar a eficácia das aplicações desenvolvidas, quer a nível nacional quer a nível transfronteiriço. Cada Estado-membro deve, até 31 de maio, apresentar um relatório sobre as ações que desempenhou neste âmbito.
Quando as apps já estiverem no ativo, caberá a Bruxelas avaliar os progressos alcançados, publicando a partir de junho de 2020 e durante toda a crise relatórios periódicos com a recomendação de ações ou do levantamento de restrições que já não considere necessárias.
Como deverá funcionar a app portuguesa?
Em Portugal, o funcionamento de uma aplicação de rastreamento deverá estar para “muito em breve”, segundo declarações recentes do secretário de Estado para a Transição Digital, André de Aragão Azevedo, ao Observador. A medida também foi já admitida pelo primeiro-ministro, António Costa.
Tendo em conta as diretrizes da Comissão Europeia, é já possível prever como irá funcionar esta tecnologia, que deverá também em breve ser adotada segundo os padrões de Bruxelas em países como a Alemanha, Espanha, França, Reino Unido ou Estónia.
Em comum, estes países possuem outro fator: estão a desenvolver as suas aplicações em estreita colaboração com a iniciativa europeia Rastreamento Pan-Europeu de Proximidade e de Preservação da Privacidade (PEPP-PT), composta por grandes empresas europeias e universidades e cujo objetivo é apoiar os países que se encontram a trabalhar em aplicações que vão ao encontro dos critérios da Comissão Europeia.
As aplicações que forem desenvolvidas ao abrigo da PEPP-PT seguirão um critério obrigatório para garantir a privacidade da população: utilizarão o sistema de Bluetooth dos telemóveis, e não o de GPS. Além disso, cada smartphone emitirá um ID numérico para o utilizador, temporário e anónimo, pelo que a identidade das pessoas será sempre protegida. O sistema PEPP-PT também não permite que sejam registadas geolocalizações.
“Os eventos mais antigos do histórico de proximidade são apagados quando se tornam sem importância do ponto de vista epidemiológico”, garante a PEPP-PT no seu site oficial. Ou seja, apenas ficam guardados os contactos de proximidade “que possam ser relevantes para a transmissão do vírus”.
Como vão estar interligadas as aplicações de diferentes países?
Apps de outros países estão menos focadas na privacidade
Regresso à normalidade?
Num cenário em que se prevê a existência de uma aplicação em cada Estado-membro da UE, Bruxelas salientou a importância de que estasestejam interligadas, de modo a que um cidadão que se desloque a outro país continue informado no caso de se aproximar de alguém infetado., escreveu a Comissão Europeia no guia aos Estados-membros.A iniciativa PEPP-PT irá permitir esta interligação entre asque sejam desenvolvidas ao seu abrigo. Quando um utilizador daé diagnosticado com Covid-19 e autoriza a partilha desse diagnóstico com os utilizadores com quem esteve em proximidade (sem que nenhum dos indivíduos tenha conhecimento da identidade do outro), essa informação chega a todas as aplicações que estejam ligadas ao sistema PEPP-PT, incluindo asde países estrangeiros.Como?Assim, um utilizador da app A que esteja em contacto com um utilizador da app B será na mesma alertado se mais tarde as autoridades de saúde concluírem que o segundo estava infetado, ou vice-versa, apesar de serem cidadãos de países diferentes.Não só países europeus estão motivados no desenvolvimento de aplicações de rastreamento de contacto. A própria iniciativa PEPP-PT refere, no seuoficial, que se baseou no exemplo de sucesso de alguns países asiáticos que já têm este tipo deem funcionamento. A diferença entre esses países e os Estados-membros que colaboram com a PEPP-PT reside, fundamentalmente, na privacidade e proteção de dados que Bruxelas impõe.A Comissão Europeia explica que“O Ministério da Saúde desenvolveu uma aplicação de rastreamento de contactos [por Bluetooth] que envia uma notificação àqueles que estiveram em proximidade com pacientes infetados”, à semelhança do que se planeia agora para a UE, menciona Bruxelas.No entanto,O nome do paciente é ocultado, sendo-lhe atribuído um número.Na China, o Governo atribui a cada cidadão um código QR com uma cor específica conforme os sintomas que registaram ou as pessoas com quem estiveram em contacto: verde para quem não precisa de se isolar, amarelo para quem deve cumprir sete dias de isolamento e vermelho se forem necessários 14 dias de isolamento.para rastrear os movimentos dos doentes infetados pelo novo coronavírus e estabelecer as cadeias de transmissão.As autoridades sul-coreanas publicam ainda numdo Governo o histórico de localização de cada pessoa com Covid-19 e outros detalhes sobre os doentes, entre os quais quando saíram para trabalhar, se utilizaram máscaras nos transportes públicos, os espaços de lazer que frequentaram e os nomes das unidades de saúde onde realizaram o teste.Já nos Estados Unidos,. Vários membros do Congresso dos EUA apelaram, entretanto, a Donald Trump para que tenha em consideração a proteção da privacidade dos cidadãos.O novo coronavírus já infetou mais de três milhões de pessoas a nível global desde que surgiu pela primeira vez na China, em dezembro. As mortes superam as 200 mil em todo o mundo. Portugal, elogiado internacionalmente pela forma como tem lidado com a pandemia, encontra-se em estado de emergência até 2 de maio, data após a qual se prevê que comecem a ser gradualmente levantadas algumas das medidas impostas à população.Vários estabelecimentos comerciais deverão começar a reabrir no dia 4 de maio e muitos portugueses que estão atualmente em casa vão regressar ao trabalho, pelo quePara que esse risco de contágio seja o menor possível nesta fase de transição, torna-se necessária a implementação de medidas de segurança adicionais, sendo uma delas a utilização, pelo maior número de pessoas possível, dade rastreamento de contactos que estará disponível em breve., elucida a Comissão Europeia. “Estão a procurar unir-se no uso de ferramentas de saúde digitais que tenham um papel significativo na luta contra a pandemia. Implementarde rastreamento pela UE é um importante primeiro passo nesse sentido”.Mesmo quem não instale a aplicação beneficiará da sua existência, uma vez que quem a usar poderá levar à interrupção de cadeias de transmissão da doença que, caso contrário, permaneceriam ativas e em crescimento.Seja qual for aescolhida para acompanhar o dia-a-dia dos portugueses durante a fase de transição, uma coisa é certa: terá de estar de acordo com o regulamento europeu da proteção de dados e com os valores constitucionais, garantiu recentemente António Costa.",0.9646357051555177,0.9280809565036006,0.9686674216685542,0.970499243570348,0.9668425018839487,"Random Forests
('ranger' package, R 3.5.3.)
Wright MN, Ziegler A (2017). “ranger: A Fast Implementation of Random Forests for High Dimensional Data in C++ and R.” Journal of Statistical Software, 77(1), 1–17. doi: 10.18637/jss.v077.i01.",5479,0.4347048300536673,204,500,20,gini,classification,2020-04-05
