prediction_covid_topic,title,description,authors,date_download,maintext,url,gdelt_title,gdelt_url,date_publish,modeSearch,sourcecountrySearch,termSearch,periodtimeSearch,isOR,countMaximumRecords,urlGDELTV2FTAPI,urlArticleMobile,datetimeArticle,urlImage,domainArticle,languageArticle,countryArticle,pred_input,model_accuracy,model_kappa,model_f1,model_precision,model_recall,model,sample_size,train_prop_covid,mtry,n_tree,min_node_size,splitrule,model_type,fitted_on
1,Estado de emergência levantado em seis ilhas cabo-verdianas na segunda-feira,"As últimas notícias e reportagens sobre Portugal e o Mundo. Actualidade, Globo, Desporto, Fama e TV, Arte e Lazer. Passatempos. Todas as fotos e videos em destak.pt",Destak,2020-04-26 06:15:18,"Covid-19
O Presidente cabo-verdiano, Jorge Carlos Fonseca, anunciou hoje que não vai prorrogar o estado de emergência nas seis ilhas sem casos confirmados de covid-19, com o ""abrandamento e encurtamento das medidas restritivas"" já a partir de segunda-feira.
Numa mensagem divulgada esta noite, o chefe de Estado anunciou que, após consultas nos últimos dias a diferentes entidades, públicas e privadas, e na sequência da avaliação feita com o Governo e autoridades de saúde, decidiu ""não prorrogar, pela segunda vez, o 'estado de emergência' constitucional"" nas ilhas do Maio, do Fogo, da Brava, de Santo Antão, de São Nicolau e do Sal.
Nestas ilhas, sem casos confirmados de covid-19, o ""estado de exceção"" terminará às 24 horas deste domingo, pelo que haverá, a partir de segunda-feira, ""um abrandamento e encurtamento das medidas restritivas de direitos, liberdades e garantias"", designadamente ""no que respeita à liberdade de circulação e ao funcionamento de serviços públicos e privados, mantendo-se as demais medidas restritivas previstas na lei"".",http://www.destak.pt/artigo/417008-estado-de-emergencia-levantado-em-seis-ilhas-cabo-verdianas-na-segunda-feira,Destak . pt | Covid - 19 : Estado de emergência levantado em seis ilhas cabo - verdianas na segunda - feira,http://www.destak.pt/artigo/417008-estado-de-emergencia-levantado-em-seis-ilhas-cabo-verdianas-na-segunda-feira,NA,artlist,PO,,240 minutes,FALSE,250,https://api.gdeltproject.org/api/v2/doc/doc?query=%20sourcecountry:po&sourcelang:por&mode=artlist&format=json&timespan=240&maxrecords=250&sort=datedesc,NA,2020-04-26T01:45:00Z,http://www.destak.pt/images/newsletter_no_img.jpg,destak.pt,Portuguese,Portugal,"Covid-19
O Presidente cabo-verdiano, Jorge Carlos Fonseca, anunciou hoje que não vai prorrogar o estado de emergência nas seis ilhas sem casos confirmados de covid-19, com o ""abrandamento e encurtamento das medidas restritivas"" já a partir de segunda-feira.
Numa mensagem divulgada esta noite, o chefe de Estado anunciou que, após consultas nos últimos dias a diferentes entidades, públicas e privadas, e na sequência da avaliação feita com o Governo e autoridades de saúde, decidiu ""não prorrogar, pela segunda vez, o 'estado de emergência' constitucional"" nas ilhas do Maio, do Fogo, da Brava, de Santo Antão, de São Nicolau e do Sal.
Nestas ilhas, sem casos confirmados de covid-19, o ""estado de exceção"" terminará às 24 horas deste domingo, pelo que haverá, a partir de segunda-feira, ""um abrandamento e encurtamento das medidas restritivas de direitos, liberdades e garantias"", designadamente ""no que respeita à liberdade de circulação e ao funcionamento de serviços públicos e privados, mantendo-se as demais medidas restritivas previstas na lei"".",0.9646357051555177,0.9280809565036006,0.9686674216685542,0.970499243570348,0.9668425018839487,"Random Forests
('ranger' package, R 3.5.3.)
Wright MN, Ziegler A (2017). “ranger: A Fast Implementation of Random Forests for High Dimensional Data in C++ and R.” Journal of Statistical Software, 77(1), 1–17. doi: 10.18637/jss.v077.i01.",5479,0.4347048300536673,204,500,20,gini,classification,2020-04-05
1,EUA registam mais 2.494 mortos nas últimas 24 horas,"As últimas notícias e reportagens sobre Portugal e o Mundo. Actualidade, Globo, Desporto, Fama e TV, Arte e Lazer. Passatempos. Todas as fotos e videos em destak.pt",Destak,2020-04-26 06:15:19,"Covid-19
Os Estados Unidos registaram 2.494 mortos nas últimas 24 horas devido à pandemia da covid-19, quase o dobro em relação ao dia anterior, de acordo com a contagem da Universidade Johns Hopkins.
No total, 53.511 pessoas morreram nos Estados Unidos. O número de infetados subiu para 936.293, com pouco mais de 96 mil pessoas a serem dadas como recuperadas.
Os Estados Unidos continuam a ser o país com registo de mais mortos e de casos confirmados.",http://www.destak.pt/artigo/417009-eua-registam-mais-2.494-mortos-nas-ultimas-24-horas,Destak . pt | Covid - 19 : EUA registam mais 2 . 494 mortos nas últimas 24 horas,http://www.destak.pt/artigo/417009-eua-registam-mais-2.494-mortos-nas-ultimas-24-horas,NA,artlist,PO,,240 minutes,FALSE,250,https://api.gdeltproject.org/api/v2/doc/doc?query=%20sourcecountry:po&sourcelang:por&mode=artlist&format=json&timespan=240&maxrecords=250&sort=datedesc,NA,2020-04-26T01:45:00Z,http://www.destak.pt/images/newsletter_no_img.jpg,destak.pt,Portuguese,Portugal,"Covid-19
Os Estados Unidos registaram 2.494 mortos nas últimas 24 horas devido à pandemia da covid-19, quase o dobro em relação ao dia anterior, de acordo com a contagem da Universidade Johns Hopkins.
No total, 53.511 pessoas morreram nos Estados Unidos. O número de infetados subiu para 936.293, com pouco mais de 96 mil pessoas a serem dadas como recuperadas.
Os Estados Unidos continuam a ser o país com registo de mais mortos e de casos confirmados.",0.9646357051555177,0.9280809565036006,0.9686674216685542,0.970499243570348,0.9668425018839487,"Random Forests
('ranger' package, R 3.5.3.)
Wright MN, Ziegler A (2017). “ranger: A Fast Implementation of Random Forests for High Dimensional Data in C++ and R.” Journal of Statistical Software, 77(1), 1–17. doi: 10.18637/jss.v077.i01.",5479,0.4347048300536673,204,500,20,gini,classification,2020-04-05
1,"""Vai ficar tudo bem” ou estamos mais perto de Munch?","Não vai ficar tudo bem nem vai ficar tudo na mesma porque ""a vida é uma sequência de encontros com o inédito"" como disse Espinoza. Estamos é...",Rui Costa,2020-04-26 06:15:21,"Nos primeiros dias de quarentena depois de levar os meus filhos a casa após o jantar habitual dei por mim a refletir o quanto era triste a rua sem pessoas. Faz-nos falta o habitual reboliço e agitação de pessoas quer seja à noite quer seja de dia.
O que se diz da democracia digo do nosso modo de viver: pode não ser perfeito mas para mim é o melhor.
Vivemos numa sociedade capitalista ou liberal ou consumista, o que quer que lhe queiram chamar, quando esse modo de vida nos falta constatamos o quão importante é e como o subvalorizamos habitualmente.
Agora até se diz que este vírus não é democrata porque há segmentos da população que sofrem mais do que outros como se as crises passadas também não tivessem criado desigualdades começando pela nossa última crise de assistência financeira em que houve claramente desigualdade entre os funcionários públicos que não perderam emprego e os funcionários das organizações privadas que encheram as estatísticas do desemprego.
Com este estado de emergência e consequente confinamento caseiro, segui uma dica de fazer umas viagens virtuais por alguns museus importantes ou mais conhecidos do mundo (os museus são todos importantes).
Dei por mim a contemplar O GRITO que é uma série de 4 pinturas de Edvard Munch, um pintor norueguês que nos deixou uma das obras mais importantes do movimento expressionista e que retrata uma figura andrógina num momento de angústia e desespero existencial (sic de Wikipedia).
Quando contemplava o quadro veio-me à cabeça a frase viral sobre a pandemia: “Vai ficar tudo bem”. Vai ficar tudo bem? Não só não vai ficar tudo bem como não está tudo bem pois o que assistimos todos os dias nos media contraria a ideia do “vai ficar tudo bem”.
Milhares de mortos e as suas famílias sem poderem despedir-se dos seus entes queridos condignamente, milhares de desempregados, milhares de empresas falidas, milhares de pessoas idosas sem poderem abraçar ou beijar os filhos ou netos, quem sabe alguns não vão ter mais oportunidades para isso.
Não vai ficar tudo bem nem vai ficar tudo na mesma porque “a vida é uma sequência de encontros com o inédito” como disse Espinoza.
Sempre houve roturas nas civilizações que as fizeram adaptar-se, inovar e criar novos procedimentos como forma de avançar e de se prepararem para novas roturas que inevitavelmente aparecerão.
Por falar em roturas é no mínimo estranho ver um Papa, que tem feito roturas na igreja católica, sozinho na praça S. Pedro como que esperando pelo Messias que irá trazer a cura para esta pandemia.
Nesta época religiosa em que os crentes deveriam estar mais perto dos anjos estamos todos mais perto de Munch, ou seja, mais angustiados e à espera de um novo normal.",https://observador.pt/opiniao/vai-ficar-tudo-bem-ou-estamos-mais-perto-de-munch/,  Vai ficar tudo bem  ou estamos mais perto de Munch ? – Observador,https://observador.pt/opiniao/vai-ficar-tudo-bem-ou-estamos-mais-perto-de-munch/,2020-04-26 04:07:00,artlist,PO,,240 minutes,FALSE,250,https://api.gdeltproject.org/api/v2/doc/doc?query=%20sourcecountry:po&sourcelang:por&mode=artlist&format=json&timespan=240&maxrecords=250&sort=datedesc,NA,2020-04-26T01:30:00Z,https://wm.observador.pt/wm-op/wide-circle/https%3A%2F%2Fbordalo.observador.pt%2F500x500%2Cq80%2Fhttps%3A%2F%2Fs3.observador.pt%2Fwp-content%2Fuploads%2F2020%2F04%2F23234254%2Funnamed-6.jpg,observador.pt,Portuguese,Portugal,"Nos primeiros dias de quarentena depois de levar os meus filhos a casa após o jantar habitual dei por mim a refletir o quanto era triste a rua sem pessoas. Faz-nos falta o habitual reboliço e agitação de pessoas quer seja à noite quer seja de dia.
O que se diz da democracia digo do nosso modo de viver: pode não ser perfeito mas para mim é o melhor.
Vivemos numa sociedade capitalista ou liberal ou consumista, o que quer que lhe queiram chamar, quando esse modo de vida nos falta constatamos o quão importante é e como o subvalorizamos habitualmente.
Agora até se diz que este vírus não é democrata porque há segmentos da população que sofrem mais do que outros como se as crises passadas também não tivessem criado desigualdades começando pela nossa última crise de assistência financeira em que houve claramente desigualdade entre os funcionários públicos que não perderam emprego e os funcionários das organizações privadas que encheram as estatísticas do desemprego.
Com este estado de emergência e consequente confinamento caseiro, segui uma dica de fazer umas viagens virtuais por alguns museus importantes ou mais conhecidos do mundo (os museus são todos importantes).
Dei por mim a contemplar O GRITO que é uma série de 4 pinturas de Edvard Munch, um pintor norueguês que nos deixou uma das obras mais importantes do movimento expressionista e que retrata uma figura andrógina num momento de angústia e desespero existencial (sic de Wikipedia).
Quando contemplava o quadro veio-me à cabeça a frase viral sobre a pandemia: “Vai ficar tudo bem”. Vai ficar tudo bem? Não só não vai ficar tudo bem como não está tudo bem pois o que assistimos todos os dias nos media contraria a ideia do “vai ficar tudo bem”.
Milhares de mortos e as suas famílias sem poderem despedir-se dos seus entes queridos condignamente, milhares de desempregados, milhares de empresas falidas, milhares de pessoas idosas sem poderem abraçar ou beijar os filhos ou netos, quem sabe alguns não vão ter mais oportunidades para isso.
Não vai ficar tudo bem nem vai ficar tudo na mesma porque “a vida é uma sequência de encontros com o inédito” como disse Espinoza.
Sempre houve roturas nas civilizações que as fizeram adaptar-se, inovar e criar novos procedimentos como forma de avançar e de se prepararem para novas roturas que inevitavelmente aparecerão.
Por falar em roturas é no mínimo estranho ver um Papa, que tem feito roturas na igreja católica, sozinho na praça S. Pedro como que esperando pelo Messias que irá trazer a cura para esta pandemia.
Nesta época religiosa em que os crentes deveriam estar mais perto dos anjos estamos todos mais perto de Munch, ou seja, mais angustiados e à espera de um novo normal.",0.9646357051555177,0.9280809565036006,0.9686674216685542,0.970499243570348,0.9668425018839487,"Random Forests
('ranger' package, R 3.5.3.)
Wright MN, Ziegler A (2017). “ranger: A Fast Implementation of Random Forests for High Dimensional Data in C++ and R.” Journal of Statistical Software, 77(1), 1–17. doi: 10.18637/jss.v077.i01.",5479,0.4347048300536673,204,500,20,gini,classification,2020-04-05
